article_number,USE,SBERT,score,keyword1,keyword2,keyword3,keyword4,keyword5,message,model,temperature,max_tokens,top_p,frequency_penalty,presence_penalty,response,content
605653,0.6963502,0.5953908,2,진옥동 회장, 신한 금융, 내부통제 책무구조도, 신한컬쳐위크, 견제와 검증,"다음 뉴스 기사를  3문장으로 요약해, 총 답변의 길이는 150자 이내로 제한한다. + content",gpt-3.5-turbo-16k,1,,1,0,0,신한금융그룹 진옥동 회장은 법률 통과 후 조기에 '내부통제 책무구조도'를 도입할 예정이라고 밝혔다. 이에 대해 그는 그룹의 지속성장을 위해 업무의 모든 과정이 철저히 견제와 검증되어야 한다고 강조했다. 이와 함께 최근 금융당국은 경영문화 개선과 소비자 보호를 위한 건전한 체계 정착을 목표로 추진하고 있다고 전했다.," 진옥동 신한금융그룹(055550) 회장이 '내부통제 책무구조도'를 법령 통과 후 조기에 도입할 예정이라고 3일 밝혔다.진 회장은 이날 하반기 그룹 문화행사인 '신한컬처위크'에서 신한라이프 임직원 대상 첫 번째 CEO 강연을 진행했다.신한금융그룹, 그룹 창업기념일 맞아 '신한컬쳐위크' 운영. ⓒ 신한금융그룹그는 내부통제 책무구조도 도입에 관해 언급하며 ""그룹의 지속성장가능성을 위해서는 철저한 내부 견제와 검증을 통해 업무의 모든 과정이 정당화돼야 한다""고 강조했다.내부통제 책무구조도란 금융사 임원 담당업무에 따른 내부통제 책무를 배분해 책임소재를 분명히 하는 지도다. 최근 금융당국은 경영문화 개선 및 건전한 소비자 보호 체계 정착을 목표로 추진을 발표한 바 있다.진 회장은 ""재무적 1등보다 고객으로부터 인정받는 것이 진정한 일류""라며 ""투자상품 사태 이후 뼈아픈 반성 속에서 한 단계 높은 내부 통제를 기반으로 고객과 사회로부터 인정받는 '일류' 신한을 위해 나아가자""고 당부했다."
605634,0.553802,0.5762471,2,우리은행, 조병규 우리은행장, 기업 금융, 조직개편, 현장경영,"다음 뉴스 기사를  3문장으로 요약해, 총 답변의 길이는 150자 이내로 제한한다. + content",gpt-3.5-turbo-16k,1,,1,0,0,우리은행 신임 은행장 조병규가 공식 취임 후 영업 중심의 조직개편을 예고했다. 조 은행장은 조직의 인사와 조직문화를 개선하고 성과를 직원들에게 돌려주기 위해 노력할 것을 강조했다. 또한 기업금융 역량 강화를 통해 우리은행의 역할을 잘 수행하고 신성장 산업에 기여할 것이라 밝혔다.,"조병규 신임 우리은행장이 3일 임시주주총회에서 공식 취임했다. ⓒ 프라임경제 편집 조병규 신임 우리은행장이 공식 취임한 뒤 영업 중심의 조직개편을 예고했다.3일 조 행장이 임시주주총회에서 우리은행장으로 공식 취임했다. 임기는 오는 2024년 12월말까지다. 조 행장은 우리은행 본점 첫 출근길에서 ""침체해 있던 인사·조직문화 등에 대해 임종룡 우리금융 회장 방향과 똑같이 생각하고 있다""고 말했다.이어 그는 ""열심히 일하는 직원들이 조직에서 인정받고 또 그런 것들이 성과로 직원들한테 돌아갈 수 있게 하겠다""며 ""임 회장과 잘 맞춰서 진행하려고 준비하고 있다""고 강조했다.조 행장은 개편 방향에 대해서도 임 화장과 동일한 방식을 언급했다. 앞서 임 회장은 지난달 30일 영업현장 중심의 인사권을 약속한 바 있다.조 행장은 ""7월초 인사를 통해 영업 중심으로 개편하고 대면채널에서도 직원들이 경쟁력을 가질 수 있도록 조직을 바꾸고 있다""며 ""현장에 모든 답이 있기에 직원들과 현장경영에 대해 소통을 강화하고 고객들 애로사항을 잘 해결하는 은행장이 되겠다""고 공언했다.아울러 조 행장은 본인의 강점인 '기업금융'을 우리은행 역량으로 강화하겠다는 의지를 표명했다.그는 ""제가 은행에서 제일 많이 했던 부분이 기업금융이고 우리은행 창립 이념이 '기업과 같이 하는 은행'이기도 하다""며 ""기업금융이 조금 약해졌는데, 최근 국가 경제가 신성장 산업으로 새로운 모멘텀을 만들려는 시점에 시중은행으로서 역할을 잘 준비하겠다""고 언급했다.한편, 조 행장은 취임 이후 첫 활동으로 오는 4일 인천 지역 영업점을 방문할 예정이다."
605628,0.5762973,0.7917994,3,카카오뱅크, 주택담보대출, 이자 절감, 중도상환해약금 면제, 낮은 금리,"다음 뉴스 기사를  3문장으로 요약해, 총 답변의 길이는 150자 이내로 제한한다. + content",gpt-3.5-turbo-16k,1,,1,0,0,카카오뱅크 대출자들의 주택담보대출 대환으로 인해 개인당 평균 321만원의 이자를 절감했다고 밝혀졌다. 대환 고객 비중이 작년 4분기에 비해 올해 2분기에 두 배로 증가한 것으로 나타났으며 대환 고객 중 90%는 카카오뱅크를 선택한 이유로 '금리가 저렴하다'고 응답했다. 앞으로 카카오뱅크는 중도상환해약금 면제를 연말까지 연장하고 다른 대출 상품에도 실질적인 혜택을 제공할 예정이다.," 대출자가 카카오뱅크(323410) 주택담보대출 대환을 통해 개인당 평균 321만원의 이자를 절감한 것으로 나타났다.3일 카카오뱅크에 따르면 주택담보대출(이하 주담대) 차주가 2월22일부터 6월30일까지 대출 갈아타기 금리 할인 혜택으로 총 252억원의 이자를 아꼈다. 카카오뱅크 주담대는 대환 시 최대 0.6%p 금리 할인 혜택을 제공한다.은행연합회 공시 기준 카카오뱅크가 지난 5월 취급한 분할상환방식 주택담보대출 평균 금리는 연3.88%로, 16개 은행 중 유일한 3%대 금리다.이러한 금리의 영향으로 전체 주택담보대출 신규 고객 중 대환 고객 비중은 작년 4분기(28%)에 비해 올해 2분기(54%) 두 배 수준으로 증가했다.카카오뱅크 주담대 대환 설문조사. ⓒ 카카오뱅크대환 고객 600여명을 대상으로 실시한 설문조사에 따르면 약 90%가 카카오뱅크 선택 이유에 관한 응답으로 '금리가 저렴하다'를 택했다. 실제 카카오뱅크 주택담보대출로 갈아탄 고객은 연 평균 약 321만원 이자 절감이 가능했던 탓이다.카카오뱅크 평균 실행금리는 연 3.8%로, 기존 대출의 평균 금리(연 5.1%) 대비 평균적으로 1.3%p 하락한 수치다.기타지방 고객이 대환대출을 통해 평균적으로 감면받은 금리는 1.38%포인트로 수도권·광역시 평균보다 높았다. 최대 2.415%포인트 낮은 금리를 적용받아 연간 약 480만원의 이자를 아낀 고객도 나타났다.또 기타지방 고객이 평균적으로 감면받은 금리는 1.38%p로 수도권·광역시 고객들의 평균 폭보다 높았다. 최대 2.415%p 낮은 금리를 적용받은 고객도 나타났다. 이는 연 약 480만원의 이자를 아꼈다는 분석이다.아울러 응답고객 중 약 77%는 '중도상환해약금이 없다'를 선택 이유로 꼽는 등 금융비용 절감에 관해 긍정적인 반응을 보였다. 앱을 통한 서류 제출의 편리함과 같은 비대면 대출의 편의성을 선택하기도 했다.이에 카카오뱅크는 중도상환해약금 면제를 연말까지 연장할 예정이다. 지지난 6월까지 중도상환해약금 면제를 통해 고객들에게 절감해준 비용은 63억원이다. 카카오뱅크는 앞으로 출시 예정인 보금자리론과 분양잔금대출 등에서도 실질적인 혜택을 적용할 방침이다."
605610,0.6661036,0.92433345,0,은행권 연체율, 금융감독원, 기업 연체율, 추세 유지, 가계대출 연체율,"다음 뉴스 기사를  3문장으로 요약해, 총 답변의 길이는 150자 이내로 제한한다. + content",gpt-3.5-turbo-16k,1,,1,0,0,국내 은행 연체율이 4월말 기준 0.37%로 32개월만에 최고 수준을 기록했다. 기업대출과 가계대출의 연체율이 상승한 것이 원인이다. 금감원은 이러한 추세가 계속될 수 있으며 건전성 관리와 손실흡수능력을 강화할 것을 약속했다. (147자),"국내 은행 연체율이 지난 4월말 기준 0.37%로 32개월만에 최고 수준을 나타냈다. ⓒ 연합사진 은행권 대출 연체율이 지난 4월말 0.37%를 기록해 32개월만에 최고치를 기록했다.3일 금융감독원이 발표한 '4월말 국내은행 원화대출 연체율 현황'에 따르면 은행권 연체율(1개월 이상 연체)은 0.37%로 전월말 대비 0.04%p 상승했다.이번 연체율은 2020년 8월(0.38%) 이후 가장 높은 수준이다. 신규연체 발생액은 1조8000억원으로 전월 대비 1000억원 증가했다. 반면 연체채권 정리규모는 9000억원으로 전월 대비 1조5000억원 감소했다.부문별로 살펴보면 기업대출 연체율은 0.39%로 전월말 대비 0.04%p 올랐다. 이는 대기업을 제외한 모든 기업 연체율이 전월말 대비 상승했기 때문이다.대기업 연체율은 0.09%로 전월말과 동일한 수준으로 나타났으나, 나머지 기업 연체율이 △중소기업(0.06%p) △중소기업대출(0.05%p) △개인사업자대출(0.04%p)순으로 모두 올랐다.가계대출 연체율은 0.34%로 전월말 대비 0.03%p 상승했다. 신용대출 등 기타대출이 가계대출 연체율 상승세를 견인했다. 주택담보대출 연체율은 0.67%로 전월말 대비 0.01%p 소폭 올랐다. 신용대출 등 기타대출 연체율은 0.67%로 전월말 대비 0.08%p 상승했다.금감원 관계자는 ""은행 연체율은 최근 경제상황 등을 반영해 당분간 현재 추세가 유지될 수 있다""며 ""연체율 추이가 금융시스템 부담으로 작용하지 않도록 상·매각 확대 등 건전성 관리 및 손실흡수능력 확충을 적극 유도하겠다""고 말했다."
605603,0.4960175,0.7868442,3,해외여행, 신용카드, 비현금 결제, 여행지, 엔데믹,"다음 뉴스 기사를  3문장으로 요약해, 총 답변의 길이는 150자 이내로 제한한다. + content",gpt-3.5-turbo-16k,1,,1,0,0,코로나19로 인해 억눌렸던 해외 여행 수요가 폭발하여 1년 이내에 해외여행을 떠날 계획이 있는 사람은 전체 응답자의 55.1%로 이전보다 8.7% 증가한 것으로 나타났다. 이에 따라 해외여행 시 결제 수단으로는 신용카드가 77.7% 현지 화폐도 61.6%로 많이 선택되었다. 또한 모바일 페이의 사용률도 증가함과 함께 여행지로는 일본 호주 베트남이 선호되는 것으로 조사되었다.," 코로나19 엔데믹 국면에 접어들면서 억눌렸던 해외여행 수요가 폭발하는 모습이다. 비대면 문화 확산 등으로 인해 결제 수단 방식과 인기 해외 여행지도 변화하고 있어 눈길을 끈다.3일 글로벌 결제기술기업 비자(Visa)가 전국 만 18세 이상 성인남녀 1000명을 대상으로 조사한 해외여행 동향 조사 결과에 따르면, 1년 이내에 해외여행을 떠날 계획이 있다고 답한 비율은 전체 응답자의 55.1%다. 지난해 응답 46.4%보다 8.7%p 증가한 수치다.코로나19 엔데믹 국면에 접어들면서 억눌렸던 해외여행 수요가 폭발하고 있다. ⓒ 연합뉴스주요 결제수단은 현지 화폐보다 신용카드를 선호하는 모습을 보였다. 1년 내 해외여행 계획이 있는 응답자들이 뽑은 '해외여행 시 사용 예정인 결제 수단'은 신용카드가 77.7%, 현지 화폐는 61.6%로 나타났다. 화폐 73%, 신용카드 62%의 응답률을 기록했던 지난해와는 대조적이다. 코로나19 이후 비현금 결제에 대한 선호도가 높아진 영향으로 풀이된다.다음으로는 △모바일 페이(18.8%) △체크카드(15.3%) △모바일 애플리케이션 카드(13.2%) △선불카드(4.2%) 순으로 높은 응답률을 보였다. 모바일 페이를 사용하겠다고 응답한 비율은 신용카드나 현지 화폐에 비해서는 낮았지만, 전년 대비 5.7%p 증가하고 순위도 한 단계 상승했다.비자는 ""신용카드 사용이 보편화됨에 따라 해외 여행지에서 현금 사용은 점차 감소할 것""이라며 ""모바일 페이 역시 향후 해외 여행지 결제 수단으로 적극 활용될 것으로 보인다""고 전망했다.항공권 및 호텔 숙박 비용을 제외한 순수 경비에 대해 질문한 결과 100만원 이상 사용하겠다고 응답한 비율은 60.8%에 달했다. 구간 별로 살펴보면 △50만~100만원(29,8%) △100만~200만원(26%) △200만~300만원(16.4%) △50만원 미만(9.4%) 순이었다.해외여행 선호 결제수단 조사 표. ⓒ 비자 코리아선호도가 높은 여행지는 △일본(26.7%) △호주(12.9%) △베트남(6.3%)으로 나타났다. 일본은 지난해와 올해 모두 한국인이 가장 선호하는 여행지로 확인됐다. 태국(5.4%), 미국(4.8%), 하와이(4.5%), 싱가포르(2.8%) 순으로 높은 선호도를 기록했다.특히 올해는 지난해 상위 10위권에 포함되지 않았던 호주가 2위를 차지한 점이 눈에 띈다.  시드니를 비롯해 △멜버른 △크레이트오션로드 △브리즈번 △퍼스 등 호주 현지에 대한 국내 인지도가 상승한 영향과, 이달 하순 FIFA 여자 월드컵 축구대회를 앞두고 있는 점 등이 영향을 끼친 것으로 분석된다.패트릭 스토리 비자 코리아 사장은 ""전 세계가 엔데믹에 접어듦에 따라 해외여행에 대한 국내 소비자들의 관심과 수요가 지난해보다도 더욱 증가하고 있다는 점을 확인할 수 있었다""고 말했다."
605589,0.3200411,0.70671254,1,보험시장, 마케팅, 프로모션, 보험 출시, 입지 확보,"다음 뉴스 기사를  3문장으로 요약해, 총 답변의 길이는 150자 이내로 제한한다. + content",gpt-3.5-turbo-16k,1,,1,0,0,보험사는 치열한 경쟁을 통해 보험 시장 내 입지를 확보하기 위해 새로운 상품과 마케팅을 쏟아내고 있다. NH농협생명은 병원비든든NH의료비보장보험 369뉴테크NH암보험 하나로든든NH연금보험을 출시했고 동양생명은 유병자 가입문턱을 낮춘 종합간편보험을 출시했다. 교보생명은 모바일 보험 가입 채널을 오픈하고 3040세대를 위한 e보험 상품 7종을 출시했다. 한화손해보험은 여성 전용보험 '한화 시그니처 여성 건강보험'을 출시하고 AXA손해보험은 운전자 할인 특약을 강화했다.,"보험 시장은 국민 대다수가 가입할 만큼 풍부한 수요를 확보했음에도, 치열한 경쟁이 펼쳐지는 '레드오션'으로 꼽힌다. 이에 보험사는 시장 내 입지 확보 차원에서 각종 새로운 상품과 마케팅과 같은 프로모션을 쏟아내고 있다. 본지는 'T·M·I(Too Much Insurance)'를 통해 보험사 정보를 들려주고자 한다.오늘의 보험 TMI 주인공 △NH농협생명 △동양생명 △교보생명 △한화손해보험 △AXA손해보험◆NH농협생명, 경쟁력 높인 신상품 3종 출시NH농협생명이 신상품 3종을 3일 출시했다. 신상품은 △병원비든든NH의료비보장보험(갱, 무) △369뉴테크NH암보험(무) △하나로든든NH연금보험(무)이다.병원비든든NH의료비보장보험(갱, 무)는 질병코드, 수술 여부에 관계없이 급여의료 본인부담금을 보장하는 건강보험이다. 보험금 지급 후 소멸되는 기존 건강보험과는 다르게 매년 보장금액이 리필돼 최초 가입시점과 동일한 기준으로 보장금액이 복원된다. 주 계약만 가입해도 모든 질병·재해로 인한 급여의료비 본인부담금을 보장한다. 치료·수술·입원·통원치료를 보장한다. 보험금은 모바일 간편 동의로 지급받을 수 있다.NH농협생명이 신상품 3종을 3일 출시했다. ⓒ NH농협생명369뉴테크NH암보험(무)은 기존 암보험과 다르게 주 계약에서 암 검사부터 수술자금까지 한 번에 보장한다. 신규 암검사비 5종(MRI·암CT·PET·암초음파·특정급여NGS유전자패널검사)을 탑재하고 암수술보험금(치료비) 중심으로 설계됐다. 보험료는 3·6·9만원으로 선택해 가입 가능하다. 8가지 특약을 구성해 필요한 보장을 선택할 수 있다.하나로든든NH연금보험(무)은 일시납 운영 하이브리드 연금보험이다. 적립액 적용이율이 가입 후 5년 이내는 3.9%의 확정이율, 가입 후 5년 초과 시 공시이율을 적용한다. 가입금액 1억원, 남자 40세 기준 5년 경과시점 환급률은 118%이다. 5년 경과시점에는 기본보험료의 2.2%를, 10년 경과시점에는 기본보험료의 2.0%를 추가 적립보너스로 지급한다. 납입은 일시납으로 연금개시나이는 45세에서 80세다.◆동양생명, 유병자 가입문턱 낮춘 보험 출시동양생명(082640)이 유병자 맞춤형 종합간편보험 '(무)수호천사NEW간편내가만드는보장보험'을 출시했다. 해당 보험은 가입자가 세분화된 특약 급부를 활용해 필요한 보장을 선택하고, 간편하게 가입할 수 있도록 개발한 상품이다.간편보험으로 가입 시 △2개월 내 입원 필요 소견, 수술 필요 소견, 추가 검사 필요 소견 여부 △N년내 입원 여부(N=0인 경우 입원 여부 질문 없음) △5년 내 질병 여부(암·협심증·심근경색·뇌졸중·간경화·심장판막증·투석 중인 만성신부전증) 등 3개 항목만 고지하면 된다. N년 이내 입원 및 수술 여부가 아닌 입원여부만 고지하게 해 가입문턱을 대폭 낮췄다.동양생명이 유병자 맞춤형 종합간편보험을 출시했다. ⓒ 동양생명상품은 사망 보장을 주 계약으로 사망 시 100만원의 사망보험금을 지급한다. 또 암·질병 및 재해·입원·수술 등 73개의 다양한 특약 가입을 통해 주요 담보를 하나의 보험으로 모두 보장받을 수 있다. 주계약 가입금액 100만원 기준이다.다양한 예방·전조 증상 및 치료 관련 특약이 특징이다. '(무)간편급여암MRI검사지원특약(갱신형)'은 암의 진단 및 치료를 목적으로 급여 MRI 검사 시 연간 1회에 한해 5만원을 지급한다. '(무)간편간암진단비특약' 및 '(무)간편위암진단비특약'은 보험기간 중 각각 간암, 위암 진단 시 최초 1회에 한해 1000만원을 보장한다. 이외에도 △(무)간편암다빈치로봇수술특약(갱신형)_암Ⅰ보장형 △(무)간편특정심장질환(기타 부정맥포함)진단특약 등 다양한 상품을 마련했다.질병입원 및 질병수술 등 의료보장특약도 한층 강화했다. ‘(무)간편의료보장(질병입원)특약’은 1~3종 질병까지는 1입원일 당 최소 2만원~최대 5만원을, 4~6종 질병은 1만원을 보장한다. 수술형은 최대 300만원까지 보장한다.아울러 계약전환제도를 운영해 보험료 납입 부담을 완화했다. 최초 계약일 이후 무사고 시 매년 고지형태를 조정해 본인의 건강상태에 맞춘 보험료를 납입할 수 있다. 가입 나이는 만 15세부터 80세까지다. 고령 유병자 보험의 사각지대를 해소했다는 설명이다.◆'3040 선택권 확대' 교보생명, e보험 상품 출시교보생명은 소비자가 직접 모바일을 통해 보험 가입을 할 수 있는 채널을 오픈하고 총 7종의 e보험 상품을 출시한다고 3일 밝혔다.이번 모바일 보험 가입 채널에서는 디지털에 익숙한 3040세대 소비자 선택권을 확대하는데 초점을 맞췄다. 소비자가 일상에서 발생하는 위험 보장은 물론 주요 질병 보장까지 각자 상황에 맞는 꼭 필요한 보장을 모바일로 직접 선택, 가입할 수 있는 점이 특징이다.교보생명이 20년 연속 KSQI 우수콜센터에 선정됐다. ⓒ 교보생명e보험 상품은 △암케어 △용종케어 △뇌·심장케어 △생활습관케어 △감염케어 △상해케어 △1년 저축보험 등 간편하게 가입할 수 있는 7종의 미니보험으로 구성됐다. 가입 고객이 남긴 가입 리뷰와 상품별 자주 묻는 질문 등을 활용해 자신에게 꼭 맞는 상품을 선택하는데 도움을 받을 수 있다.e보험에 가입한 이들에게 전화·대면 상담 등 모든 채널의 상담과 유지서비스를 지원하며 탐색-가입-유지 전반에 걸친 경험을 제공할 계획이다.교보생명은 이번 채널이 관계사 전체 협업 과정에 있어 핵심 역할을 할 것으로 보고 있다. 고객에게 개인별 맞춤형 서비스를 제공하기 위한 그룹 차원의 시너지 효과를 기대하고 있다.◆한화손보, 한화 시그니처 여성 건강보험 출시한화손해보험(000370)은 여성전용보험 '한화 시그니처 여성 건강보험' 신상품을 3일부터 판매한다. 여성 생애주기를 고려한 특약과 출산지원 및 난임 케어 등 서비스를 제공하는 것이 특징이다.상품은 지난 6월 설립한 LIFEPLUS 펨테크연구소의 1호 작품이다. 생리·임신·출산·갱년기·폐경 등 여성 고유의 생리현상을 비롯해 유방암·갑상선암·난소·자궁암 등 여성에 특화된 보장과 서비스를 담은 상품이다. △여성특화통합진단비 △출산지원패키지 △난임 케어 패키지 △무사고전환 할인제도 등 여성의 특화 위험에 포커스를 맞췄다.한화손해보험이 한화 시그니처 여성 건강보험을 출시했다. ⓒ 한화손해보험특히 업계 최초 여성특화통합진단비를 신설한 것이 특징이다. 유방·난소·자궁·갑상선 등 암 진단비는 물론 갑상선기능 항진증 등 암 전조증상 진단까지 하나의 특약으로 폭넓게 보장한다. 상품은 '50%이상후유장해 및 뇌혈관·허혈성심장질환'을 납입지원 특약 요건에 추가했다.출산지원패키지는 출산 후 휴직으로 인해 가계소득은 떨어지는 반면, 육아로 인한 당장의 생활비 증가에 부담을 느끼는 여성들의 의견을 수렴해 개발했다. 출산 후 1년은 보장보험료를 한화손해보험이 부담한다. 육아 등으로 휴직 시 1년간 보험료는 납입을 유예해 보험료 부담을 줄였다.난임케어패키지는 저출산과 여성난임 문제를 지원하기 위해 연구해 개발된 특약이다. 난임의 진단-치료-출산의 난임 치료 싸이클에 맞춰 특약을 구성했다. 난임 진단 시 최초 1회 100만원을 지급하고, 급여 인공수정치료 시 최대 300만원의 가입금액을 제공한다. 난임치료 후 출산 시 최대 400만원의 축하금을 준다. 3년·10년 만기 갱신형으로 운영한다. 가입 연령은 만15세에서 70세다.◆AXA손해보험, 운전자 할인 특약 강화AXA손해보험이 운전자 할인 특약을 강화한다. 새롭게 강화된 특약은 △티맵 안전운전 특약 △카카오내비 안전운전 특약 △블랙박스 특약 △안전장치 장착 특약 △3049 특약 총 5종이다.티맵 안전운전 특약과 카카오내비 안전운전 특약은 최근 6개월 이내 1000㎞ 이상 안전운전 점수가 일정 기준에 도달하면 5% 할인이 가능하다. 티맵 안전운전 특약은 80점 이상, 카카오내비 안전운전 특약은 70점 이상을 기준으로 하며 오는 4일부터 시행된다.AXA손해보험이 운전자 할인 특약을 강화한다. ⓒ AXA손해보험아울러 △블랙박스 특약 △안전장치 장착 특약 △3049 특약은 7월11일 가입자부터 기존보다 높은 할인율이 적용된다.블랙박스 특약은 피보험 자동차가 블랙박스를 장착하면 2.6%에서 3.5%로, 안전장치 장착 특약은 자동비상제동장치, 차선이탈경고장치가 장착돼 출고된 경우 8.9%에서 10%로 할인율을 높였다. 3049 특약은 피보험자가 만 30세 이상에서 만 49세 이하이며, 부부 또는 1인 특약을 가입한 경우 기존 평균 9%에서 평균 10.9%로 할인율을 확대했다."
