article_number,USE,SBERT,score,keyword1,keyword2,keyword3,keyword4,keyword5,message,model,temperature,max_tokens,top_p,frequency_penalty,presence_penalty,response,content
606213,0.5201662,0.71629775,3,보람상조, 플랫폼 기업, 비즈마켓, 보람라이프플랜, 업무협약,"다음 뉴스 기사를  3문장으로 요약해, 총 답변의 길이는 150자 이내로 제한한다. + content",gpt-3.5-turbo-16k,1,,1,0,0,보람상조는 플랫폼 기업 비즈마켓과 협약을 맺어 상품을 판매한다. 보람상조의 리빙 결합상품인 '보람라이프플랜'이 상조와 가전 가구 제품이 필요한 소비자들에게 매력적으로 평가받는다. 이번 협약으로 보람상조의 다양한 제휴 비즈니스가 활성화될 것으로 전망된다.," 보람상조가 플랫폼 기업과 함께 상품 판매채널을 확대한다. 더 많은 경험을 소비자에게 제공해 고객만족 경영에 한걸음 다가서기 위한 적극적인 행보로 풀이된다.7일 보람그룹에 따르면 상조계열사 보람상조플러스는 플랫폼 기업 비즈마켓(구 인터파크비즈마켓), 가구구독 기업 이해라이프스타일과 3자 간 B2B 업무협약을 맺었다. 비즈마켓이 운영하는 2000여 복지몰 및 판촉몰, 멤버십몰 플랫폼에서 '보람라이프플랜' 상품을 판매한다.보람라이프플랜은 보람상조의 리빙 결합상품이다. 장례 서비스 혜택뿐 아니라 가전, 가구제품 등을 함께 소유할 수 있는 것이 특징이다. 만기 시 납입금 전액을 환급 받을 수 있다. 상조와 가전, 가구 제품이 필요한 소비자들에게 매력적인 상품으로 평가받는다.보람상조플러스가 비즈마켓, 이해라이프스타일과 3자 간 B2B 업무협약을 체결했다. ⓒ 보람그룹정종일 보람상조플러스 대표이사는 ""이번 업무협약은 상조업계 선도기업 보람상조와 B2B전문 서비스 전문기업 비즈마켓, 그리고 가구문화 혁신을 이루고 있는 이해라이프스타일이 만나 새로운 기회와 가치를 창출하는 것""이라며 ""궁극적으로 고객에게 더 많은 경험을 제공하고 만족을 주는 토털 라이프케어 서비스 기업의 역할을 다할 수 있도록 최선을 다하겠다""고 말했다.비즈마켓은 공공기관이나 민간기업을 대상으로 △임직원 복지몰 △판촉몰 △멤버십몰 등의 서비스를 제공하는 B2B 솔루션 전문 기업이다.신한금융그룹, KB금융그룹, 현대해상 등의 국내 유수의 기업이 비즈마켓을 통해 온라인몰을 이용하고 있다. 연간 거래액은 3000억원에 달한다. 이해라이프스타일은 가구 구독 서비스인 살구, 달달구독 등을 운영하는 기업이다.허탁 비즈마켓 대표는 ""3자 간 업무협약은 각 사의 B2B 영업 활성화를 위한 새로운 시도라고 할 수 있다""며 ""B2B플랫폼의 대표주자로서 다양한 산업군에서 이룬 성과처럼 이번 협약이 성공적인 사례로 남길 기대한다""고 전했다.이번 협약은 보람상조의 다양한 제휴 비즈니스에 활력을 불어넣을 것으로 전망된다. 최근 이미지 혁신과 사업 확장을 위해 사명을 변경한 보람상조플러스는 기존의 정체성을 넘어 고품격 상조서비스를 제공하겠다는 의지를 밝힌 바 있다."
606202,0.43383372,0.7908182,1,금융위원회, 김주현 위원장, 취약계층, 규제개선, 자금지원,"다음 뉴스 기사를  3문장으로 요약해, 총 답변의 길이는 150자 이내로 제한한다. + content",gpt-3.5-turbo-16k,1,,1,0,0,김주현 금융위원회 위원장이 취임 1주년 기자간담회에서 금융시장 안전과 국내 금융 산업 혁신에 주력할 것이라 강조했다. 지금까지의 성과는 물론 위험요인에 대한 관리 금융취약계층 지원 금융산업 혁신을 위한 정책 및 제도 개선 등 6가지 정책 방향을 제시했다. 또한 해외진출 관련 애로 해결과 경제 혁신성장을 위한 종합적인 지원 방안을 발표했다.," 김주현 금융위원회 위원장이 취임 1주년을 맞아 7일 기자간담회를 개최했다. 금융시장 안전과 함께 국내 금융 산업의 혁신을 위한 제도 정비에 나서겠다고 강조했다.김주현 위원장은 서울 중구 정부서울청사에서 ""경제·금융 불안요인이 잔존하는 만큼 금융안전 및 취약계층 지원을 위한 노력을 지속하겠다""며 ""경제여건이 점차 개선될 것으로 기대되는 만큼 금융산업 혁신 및 혁신성장 지원에 박차를 가하겠다. 공정하고 안전한 금융산업·시장 조성을 위한 인프라 및 제도 정비도 차질 없이 추진해 나가겠다""고 말했다.이날 김 위원장은 △금융시장 안정유지 △금융취약계층 포용 △금융산업 혁신 △경제 혁신성장 지원 △기술발전에 대비한 금융제도·감독 보완 △불공정거래 근절이라는 6가지 정책 추진방향을 내놨다.먼저, 금융시장 안정유지를 위해 △위험요인에 대한 면밀한 관리 △부동산 PF 연착륙 △부실기업 정상화 등 누적 잠재부실에 대한 선제적 정상화 및 정리를 추진할 방침이다. 또 금융취약계층 포용을 위해 정책서민금융 공급규모 1조원 이상 확대, 선제적 채무조정 등 금융분야 민생지원 노력을 지속할 예정이다.김주현 금융위원장이 7일 정부서울청사에서 개최된 기자간담회외 참석해 발언하고 있다. = 전대현 기자금융산업과 경제의 혁신 성장을 위한 방안도 마련했다. 글로벌 금융회사를 육성하고, 딥테크 기업 성장자금 모집 확대방안도 마련하겠다는 의지를 내비쳤다. 워크아웃 기업에 대해 신규자금을 지원하는 캠코 프로그램의 대상과 규모를 확대해 부실기업을 돕는다.금융취약계층 포용을 위한 지원을 위해서는 정책서민금융 공급규모 확대하겠다고 밝혔다. 정책서민금융의 공급규모를 10조원에서 1조원 이상 확대한다.사상 최대 규모로 공급해 취약계층의 금융접근성을 제고한다. 서민금융의 안정적이고 충분한 공급을 보장할 수 있도록 '정책서민금융 효율화방안'도 금년 중에 마련한다고 약속했다.지자체·고용부·복지부 등 관계부처와의 협업 추진 등을 통해 복지 및 취업지원 등 다양한 자활지원 프로그램과의 연계도 강화할 예정이다. 자영업자·소상공인을 위한 채무조정 프로그램인 새출발기금도 지원대상도 확대한다.김 위원장은 ""저신용·저소득 취약계층 일부는 빚을 내서 투자하고 있지만, 수익을 얻기 어려워 연체율이 늘어나는 상황마저 발생하고 있다""며 ""별도 지원 없이는 정상상환이 어려워 금융채무불이행자로 전락할 위험이 있다. 이자율 인하, 분할상환 등 선제적 채무조정을 통해 이자마저 못내는 상황이 발생하지 않게끔 지원하겠다""고 했다.금융산업 혁신을 위해 금융과 비금융간 융합을 통해 새롭고 혁신적 서비스가 출시될 수 있도록 금산분리 및 업무 위·수탁규제 정비한다. 금융지주사 규제를 전면 재정비해 지주사 경쟁력을 높인다.김주현 금융위원장이 취임 1주년을 맞았다. ⓒ 금융위원회금융사의 해외진출 관련 애로서항을 청취해 규제개선을 이달 중 발표한다. 이미 현지에서 영업 중인 금융사들의 애로 해소를 위한 방안도 마련할 계획이다.김 위원장은 한국경제 잠재성장률이 1990년대 8% 수준에서 현재 2%까지 떨어진 점을 꼬집었다. 경제 기초 체력이 낮아지고 있는 만큼 경제 혁신성장 지원에 나설 계획이다. 금융위는 딥테크 등 핵심기술을 보유한 기업들이 성장 자금을 원활히 모집할 수 있도록 지원한다.이를 위해 △기술기업 특례상장제도 보완 △상장 외 자금모집 확대 방안 마련 △금융사 벤처투자 활성화 방안 검토 △성장사다리펀드 재정비 △수출금융 종합대책 마련 등의 계획을 수립했다.아울러 기술발전에 대비한 금융제도·감독을 보완하고, 불공정거래 근절을 위한 후속조치 방안도 발표했다.김 위원장은 ""금융혁신과 금융안정의 양대 가치를 균형 있게 달성할 수 있도록 근본적 제도 정비에 나설 계획""이라며 ""디지털 뱅크런 등 금융시스템 유동성 위험 대응체계를 정비하고, 금융규제체계 재편하겠다""고 약속했다.이와 함께 ""각종 불공정거래 및 범죄행위로 인해 사회정의 및 건전한 경제활동 문화가 훼손되고 있다""며 ""불법으로 쉽게 돈 벌고, 정직한 사람은 피해보는 일이 없도록 하기 위해서는 불공정·범죄행위 척결이 시급하다""고 진단했다.이에 ""국회에서도 자본시장법 및 가상자산법이 국회를 통과했는데, 법 개정을 토대로 우리 경제·금융시장에서 더 이상의 불공정 거래 및 금융범죄가 발생하지 않도록 후속조치를 빠르게 추진하겠다""고 공언했다."
606159,0.61209905,0.6576278,3,롯데카드, 횡령사고, 협력업체, 통제 부실, 100억원,"다음 뉴스 기사를  3문장으로 요약해, 총 답변의 길이는 150자 이내로 제한한다. + content",gpt-3.5-turbo-16k,1,,1,0,0,롯데카드 일부 직원들이 용역업체로부터 금품을 받은 사실이 드러나며 내부 통제 부실 논란이 일고 있다. 금액은 약 100억원으로 알려져 있다. 현재 롯데카드는 사실관계 조사를 진행 중이다. 그러나 아직 해당 사건으로 인한 책임 묻기가 어렵다.," 롯데카드 일부 직원이 용역업체로부터 금품을 수취한 것으로 알려져 충격을 주고 있다. 특히 횡령 사고가 발생한 것과 함께 내부 통제 부실 논란도 불거지고 있다.금융권에 따르면 롯데카드 내부 직원 2명이 용역업체로부터 금품을 수취했으며, 내부 직원들은 용역업체인 한 마케팅 업체와 매달 정산을 통해 부당 이익을 챙긴 것으로 전해진다. 거래 규모는 약 100억원에 달한다.롯데카드 직원 2명이 마케팅 업체로부터 금품을 수취했다. 사진은 롯데카드 본사 전경. ⓒ 롯데카드이와 관련 금융감독원 관계자는 ""횡령 사고가 발생한 것은 사실이나 조사가 진행 중인 만큼 구체적인 내용은 말하기 어렵다""며 ""조사를 마치면 필요한 조치를 취할 예정이다""라고 말했다.다만 이번 횡령 사고와 관련해 롯데카드 임원들이 책임을 질지는 미지수다.앞서 금융당국은 내부 직원 일탈이 반복적으로 일어날 경우 금융회사 최고경영자(CEO)에게 책임을 묻도록 하고 있다. 하지만, 아직 '금융회사의 지배구조에 관한 법률' 개정이 이뤄지지 않아 해당 규제 적용 대상이 아니다.한편, 롯데카드는 일부 직원의 횡령 의심 사고와 관련해 사실관계 파악 중인 것으로 알려졌다.롯데카드 관계자는 ""롯데카드 직원이 협력업체로부터 금품을 받았다는 제보를 받고 감사를 진행 중이다""라며 ""현재 명확한 사실 관계를 확인 중이며 감사 진행 중인 사항으로 구체적으로 말하기 어렵다. 결과가 나오면 말씀드리도록 하겠다""고 입장을 내놨다."
606138,0.46068078,0.71797013,4,OK금융그룹, 최윤 회장, 항저우 아시안게임, 선수단 단장, 스포츠 지원,"다음 뉴스 기사를  3문장으로 요약해, 총 답변의 길이는 150자 이내로 제한한다. + content",gpt-3.5-turbo-16k,1,,1,0,0,OK금융그룹이 최윤 회장을 '제19회 항저우 아시안게임' 대한민국 국가대표 선수단 단장으로 선임했다. 최윤 회장은 재외동포로서 역사상 첫 선수단장으로 선수단 운영 및 지원을 총괄한다. 최윤 회장은 스포츠를 통해 국민들에게 새로운 희망과 용기를 전해드릴 수 있도록 지원에 힘을 쓸 것이라고 밝혔다.," 최윤 OK금융그룹 회장이 '제19회 항저우 아시안게임' 대한민국 국가대표 선수단 단장에 공식 선임됐다.OK금융그룹은 지난 5일 대한체육회가 정기이사회에서 최윤 회장의 선수단장 선임을 비롯해 대한민국 선수단 본부임원 명단을 최종 확정했다고 6일 밝혔다.최윤 회장은 항저우 아시안게임이 개최되는 9월23일부터 10월8일까지 선수단 운영 및 지원을 총괄한다. 개·폐회식 등 공식행사 참가부터 △대회 조직위원회 주관 단장회의 및 선수단 회의 참가 △주요인사 방문 시 접견 및 환담 △선수·코치진 선수단 격려 등의 활동을 이어간다.최윤 OK금융그룹 회장. ⓒ OK금융그룹재일교포 3세인 최윤 회장은 아시안게임 역사상 첫 재외동포 출신 선수단장이다. 국내 유관 단체는 물론 △재일본대한민국민단·재일본대한체육회 △세계한상대회 '리딩 CEO' △세계한인무역협회(OKTA) △세계한인회총연합회 △재외한국학교·재외동포청 등 재외동포 네트워크의 참여와 협력으로 항저우 아시안 게임을 온 국민이 하나 되는 대축제로 만든다는 각오다.2021년 대한럭비협회 회장에 취임한 최윤 회장은 협회 안팎의 개혁을 추진한 공로로 같은 해 도쿄올림픽 선수단 부단장에 선임됐다. 코로나19 팬데믹 가운데서도 선수들의 건강과 안전을 책임지고 선수 간 단합을 성공적으로 이끌었다는 평가를 받았다.특히 도쿄 올림픽 당시 리더십으로 주목받았다. 코로나19로 해외 관중을 받지 않기로 결정한 상황에서도 일본 내 네트워킹을 적극 활용해 현지 교민들의 응원을 이끌어 냈다.올해 3월에는 'OK금융그룹 읏맨 프로배구단’에 이은 그룹의 두 번째 스포츠 구단 ‘OK금융그룹 읏맨 럭비단'을 창단했다. 한국 럭비 구단 중 처음으로 일과 럭비를 병행하는 선진국형 스포츠클럽 운영 방식을 도입했다. 선수들이 은퇴한 이후에도 럭비선수와 직장인으로서의 경험을 살려 사회에서 성공적으로 자립할 수 있는 ‘선순환 구조’ 정착이 목표다.아울러 그룹 내 장학재단을 통해 골프 장학생 프로그램 ‘세리키즈’도 운영하고 있다. 세리키즈는 방신실·이예원·박현경·임희정 선수 등 역대 세리키즈 장학생 출신 프로 선수들이 한국여자프로골프협회(KLPGA)에서 다년간 두각을 나타냈다. 골프계 슈퍼루키들의 ‘등용문’으로서 위상이 높아지고 있다는 평가다. KLPGA 1부 공식 투어인 'OK금융그룹 박세리 인비테이셔널'도 지난해까지 매년 개최했다.2010년부터 14년간 '선동열배 OK 전국농아인야구대회'를 개최하며 농아인 스포츠 지원에도 앞장서고 있다. 이 외에도 △유도(안창림 전 유도 국가대표팀 선수 후원) △필드하키(남·녀 국가대표팀 후원) △여자농구(옛 KDB생명 농구단 네이밍 스폰서십 후원) 분야도 후원하고 있다. 최근에는 리그오브레전드(푸하하)팀 '브리온'의 네이밍 스폰서로 나서며 e스포츠로까지 영역을 확대했다.최윤 OK금융그룹 회장은 ""선수단 단장이라는 책무를 맡아 진심으로 감사하고, 선수단을 건강하고 안전하게 이끌어야 할 막중한 책임감을 느낀다""며 ""우리 선수들이 국민들에게 스포츠가 주는 즐거움과 감동, 새로운 희망과 용기를 전해드릴 수 있도록 물심양면으로 지원에 힘쓸 것""이라고 말했다.이어 ""그간 스포츠를 통해 받은 감동과 은혜를 대한민국 스포츠 발전을 위해 봉사하라는 뜻으로 여기고 750만 재외동포와 5200만 국민이 하나 되는 6000만의 한민족 대축제가 될 수 있도록 힘쓰겠다""고 강조했다."
606141,0.64060616,0.7344217,4,새마을금고, 출자 특혜, 사모펀드, 류 대표, 검찰 조사,"다음 뉴스 기사를  3문장으로 요약해, 총 답변의 길이는 150자 이내로 제한한다. + content",gpt-3.5-turbo-16k,1,,1,0,0,새마을금고 중앙회의 사모펀드 출자 비리 수사가 증가하고 검찰 조사가 류 대표이사에까지 이어지고 있다. 새마을금고는 ST리더스프라이빗에쿼티와 손잡고 M캐피탈을 인수한 후 특혜 의혹이 제기되었다. 이에 검찰은 류 대표이사를 체포하고 조사를 진행하고 있다. 검찰은 48시간 이내에 구속영장을 발부받지 못하면 류 대표이사를 풀어줘야 한다.,"서울 시내 새마을금고. ⓒ 연합뉴스 새마을금고중앙회 사모펀드(PEF) 출자 비위 수사가 속도를 내고 있다. 검찰의 칼끝이 점점 새마을금고 '윗선'에 향하고 있다는 평가다.6일 검찰에 따르면 서울동부지검 형사6부(서현욱 부장검사)는 지난 5일 법원으로부터 체포영장을 발부받아 류혁 새마을금고중앙회 신용공제 대표이사의 신병을 확보했다.검찰은 류 대표가 특정 자산운용사에 펀드 출자 특혜를 줬다는 의혹을 살펴보는 것으로 알려졌다.앞서 이들은 올해 초 새마을금고중앙회와 개별금고의 프로젝트파이낸싱(PF)과 관련해 수사를 시작했다. 수사는 사모펀드 출자 사업까지 범위를 넓혀갔다.새마을금고는 국내 사모펀드 운용사인 ST리더스프라이빗에쿼티(ST리더스PE)와 손잡고 지난 2020년 말 M캐피탈을 인수했었다. 당시 새마을금고는 인수 자금 2510억원 중 59.76%를 댔다.이에 대해 검찰은 지난달 19일 최모 M캐피탈 부사장과 청탁을 받고 실제 출자를 실행한 새마을금고 최모 차장을 구속기소 했다. 하지만 팀장급 인원이 혼자 범행을 주도했겠냐는 의문과 함께 윗선 연루 의혹이 제기됐다.이제 검찰은 '윗선'급인 류 대표이사까지 체포해 조사를 벌이고 있다. 검찰은 체포한 시간부터 48시간 이내에 구속영장을 발부받지 못하면 류 대표이사의 신병을 풀어줘야 한다.새마을금고중앙회 관계자는 ""검찰과 관련된 사항에 대해서는 따로 확인 해줄 수 없다""고 말을 아꼈다."
