article_number,USE,SBERT,score,keyword1,keyword2,keyword3,keyword4,keyword5,message,model,temperature,max_tokens,top_p,frequency_penalty,presence_penalty,response,content
605313,0.8207932,0.83617866,4,후쿠시마 오염수, 금융당국, 소비자 불안감, 보험회사, 불건전 영업행위,"다음 뉴스 기사를  3문장으로 요약해, 총 답변의 길이는 150자 이내로 제한한다. + content",gpt-3.5-turbo-16k,1,,1,0,0,금융당국은 후쿠시마 오염수 방류를 근거로 암 보험 가입을 권유한 보험회사에 엄정 대응할 것이라 밝혔다. 해당 보험회사의 불건전 영업행위를 즉시 중단하도록 지시했으며 대국민 불안을 악용한 마케팅을 막기위해 내부통제를 강화할 것을 당부했다. 금융당국은 보험업계의 영업행위를 철저히 모니터링하며 위반 사항이 확인되면 엄중한 조치를 취할 것이라고 밝혔다.,"후쿠시마 원전 내에 설치된 오염수 저장 탱크. ⓒ 연합뉴스 금융위원회와 금융감독원(이하 금융당국)이 후쿠시마 오염수 방류와 관련된 비과학적 사실을 근거로 영업한 보험회사에 대해 엄정 대응하겠다고 29일 밝혔다.금융당국에 따르면 최근 일부 보험회사가 일본 후쿠시마 오염수 방류 후 국내에도 방사성 물질이 전파된다며 암 보험 가입을 권유했다. 이에 금융당국은 해당 보험회사의 불건전 영업행위를 즉시 중단토록 했다.아울러 금융당국은 지난 28일 보험회사 감사담당자 내부통제회의를 열고 대국민 불안을 악용한 마케팅이 확산하되지 않도록 내부통제를 철저히 할 것을 당부했다.금융당국 관계자는 ""소비자 불안감 조성 등을 통한 보험업계의 영업행위가 없는지 면밀히 모니터링 할 것""이라며 ""이 과정에서 금융소비자보호법 위반 사항 등이 확인될 경우 엄중 조치하겠다""고 말했다."
605282,0.58882844,0.82081777,3,롯데카드, 유동성 확보, ABCP, ESG 프레임워크, KB국민은행,"다음 뉴스 기사를  3문장으로 요약해, 총 답변의 길이는 150자 이내로 제한한다. + content",gpt-3.5-turbo-16k,1,,1,0,0,롯데카드가 3000억원 규모의 국내 ESG 자산유동화기업어음(ABCP)를 발행하였다. 이번 ABCP는 신용카드 매출채권을 기초자산으로 발행되었으며 KB국민은행이 투자자로 참여하였다. 이를 통해 롯데카드는 안전한 유동성과 국내 투자자 대상 자산유동화 시장의 활성화를 기대하고 있다.," 롯데카드가 3000억원 규모 국내 ESG 자산유동화기업어음(ABCP)를 29일 발행했다.ABCP는 유동화전문회사(SPC)가 매출채권이나 회사채 등 자산을 담보로 설정해 발행하는 기업어음이다. 이번 ABCP는 신용카드 매출채권을 기초자산으로 발행됐다. KB국민은행이 투자자로 참여한다.롯데카드가 3000억원 규모의 ABCP를 발행했다. ⓒ 롯데카드3년간 3개월 단위로 롤오버(최종 상환 시까지 차환이 지속적으로 이어짐)되고, 3년 후 최종 상환되는 구조다. KB국민은행으로부터 ABCP 매입보장을 받아 시장 변동성에 대한 안정성도 확보했다.롯데카드는 2021년 글로벌 ESG 인증기관 서스테이널리틱스(Sustainalytics)로부터 적격성 인증을 받은 'ESG 프레임워크""를 기초로 이번 ABCP를 소셜본드(Social Bond)로 발행했다.조달된 자금은 저소득층에 대한 금융서비스 지원 목적으로 사용될 예정이다. 롯데카드는 2020년부터 △저소득층 △영세·중소 가맹점 등 사회적 취약계층 지원을 위해 ESG채권을 지속적으로 발행해 오고 있다. 누적 발행액은 1조3240억원이다.롯데카드 관계자는 ""시중은행과 신용카드 자산을 기초로 한 사모 ABCP 발행에 성공해 안정적인 유동성을 확보했다""며 ""이번 발행을 시작으로 국내 투자자 대상 자산유동화 시장이 더욱 활성화 되는 계기가 되길 바란다""고 말했다."
605265,0.5101863,0.47562262,3,케이뱅크, 미성년자, 선불전자지급수단, 서비스 정지 방법, 규제 방법,"다음 뉴스 기사를  3문장으로 요약해, 총 답변의 길이는 150자 이내로 제한한다. + content",gpt-3.5-turbo-16k,1,,1,0,0,케이뱅크는 미성년자들의 부모의 자녀 서비스 해지에 대해 대면 방문을 요구하면서 지방 고객을 배려하지 않는다는 비난을 받고 있다. 케이뱅크는 비대면 정지가 불가능하다고 답변한 반면 A씨는 카카오뱅크로부터 비대면으로 해지와 부모 동의가 있을 때만 재가입을 허락받았다. 이로 인해 케이뱅크의 선불전자지급수단인 '하이틴' 서비스의 정지 방법은 혼선을 야기하고 있다. 케이뱅크는 앞선 고객 모집과 맞지 않는 모습을 보여주고 있다. (150자),"케이뱅크 본사와 고객센터는 부모의 자녀 서비스 해지에 대해 다른 답변을 내놓았다. = 장민태 기자 만 14세 이상 미성년자들의 이용이 급증하고 있는 선불전자지급수단이 미성년자 일탈에 이용돼 이에 대한 제재가 필요하다는 목소리가 높다. 특히 청소년 마약이나 도박에 부모 몰래 이용할 수 있다는 점에서 가입과 정지 등에 새로운 규제가 필요하다는 지적이다.이런 가운데 케이뱅크가 타 인터넷전문은행과 달리 정지할 경우 대면으로 서울 본사에서만 가능하다고 답변해 지방 고객을 배려하지 않는다는 비난을 받고 있다.실제 지방에 거주 중인 A씨(54세)는 자녀의 선불전자지급수단으로 최근 곤욕을 치르고 있다. 만 14세 이상의 자녀는 불법 스포츠토토 등의 도박에 빠진 상태다. 문제는 이러한 도박을 하기 위해서는 통장이 있어야 한다는 것. 이때 이용되는 것이 선불전자지급수단이다. A씨의 자녀는 카카오뱅크와 케이뱅크를 통해 통장을 만들었다. 부모 동의가 필요하지 않은 데다 비대면 가입으로 용이하다는 게 이용 이유다.이런 사실을 안 A씨는 당장 정지와 재가입을 막는 조치를 해 줄 것을 카카오뱅크와 케이뱅크에 요청했다. 카카오뱅크는 비대면으로 필요서류 제출 시 해지와 부모 동의가 있을 때만 재가입 허락 등을 받아들였다.문제는 케이뱅크다. 케이뱅크는 정지를 위해서는 서울 을지로에 있는 본사에 방문해야만 한다고 답했다. 비대면으로 정지가 안 된다는 것.이에 대해 A씨는 ""수익에만 정신이 팔려 소비자의 편의성을 전혀 고려하지 않고 있다""라고 강하게 항의했다.현재 선불전자지급수단은 '내돈내관(내 돈은 내가 관리하는)' 10대가 늘어나면서 이용자가 급증하고 있다. 인터넷전문은행과 핀테크 기업도 미성년자의 프라이버시 존중 차원에서 필요하다고 목소리를 높인다.이로 인해 인터넷전문은행들은 선불전자지급수단을 통해 미성년자에게 돈을 보관하고 이체할 수 있는 서비스를 제공 중이다. 굳이 예금이 아닌 선불전자지급수단을 통해 미성년자에게 계좌와 비슷한 서비스를 제공하는 건 법 때문이다. 인터넷전문은행은 영업점이 없기 때문에 계좌개설 업무를 비대면으로 처리한다.하지만 비대면 계좌개설은 금융실명법 등에 따라 신분증 사본을 제출해야만 제공할 수 있다. 주민등록증 발급 연령은 만 17세 이상이다. 때문에 17세 이하 미성년자의 경우 인터넷전문은행들은 선불전자지급수단을 통해 계좌와 유사한 서비스를 우회적으로 제공한다. 이 또한 비대면으로 간단하게 가입할 수 있다.문제는 케이뱅크가 비대면으로 미성년자에 대한 서비스를 운영하고 있음에도, 이에 대한 대비책은 제대로 준비하지 못했다는 점이다.더욱이 본사 고객센터 간 해당 서비스의 정지 방법에 대해서 말도 안 맞는 실정이다. 케이뱅크의 선불전자지급수단은 '하이틴'이다.케이뱅크 관계자는 ""부모가 직권으로 청소년 서비스를 해지하려면 대면으로 방문해야 한다""며 ""비대면으로 정지하는 건 미성년자 본인이 직접 모바일 애플리케이션(앱)을 통해서 해야 한다""고 설명했다.해당 관계자는 다른 기업들과 선불전자지급수단 비대면 처리 방식이 다르다는 점을 지적하자 답변을 바꿨다. 그는 ""부모가 자녀 서비스를 모바일로 정지시킬 수 없지만, 고객이 고객센터에 전화하면 비대면 방식으로 대리 정지를 할 수 있다""고 번복했다.본사 관계자의 답변을 토대로 케이뱅크 고객센터에 자녀의 '하이틴' 가입 정지를 다시 문의했다. 하지만 역시 '불가능 하다'는 답변만 돌아왔다. 케이뱅크 고객센터 관계자는 ""자녀 서비스에 대한 부모의 대리 정지 자체가 불가능하다""고 선을 그었다.결국 여전히 케이뱅크의 선불전자지급수단인 '하이틴' 서비스의 정지 방법은 오리무중이다.""청소년들이 올바른 금융소비 습관을 기르고 좋은 혜택을 누릴 수 있도록 다양한 노력을 기울이겠다""고 선언한 케이뱅크. 고객 모집할 때의 앞과 가입한 뒤의 뒷모습에서 씁쓸함을 안겨주고 있다."
605261,0.69297206,0.5919627,4,대부업, 저신용자, 금융감독원, 불법 사금융, 연체율,"다음 뉴스 기사를  3문장으로 요약해, 총 답변의 길이는 150자 이내로 제한한다. + content",gpt-3.5-turbo-16k,1,,1,0,0,대부업 이용자가 작년 말부터 7만5000명 줄어든 결과가 나왔다. 이는 저신용자들이 대부업을 이용하지 못하고 불법 사금융으로 돌아갈 것으로 예상되고 있다. 대부업 관련 대출 잔액은 86억원 감소하였고 한편 담보 대출 확대로 대부 수요는 계속해서 증가하는 추세를 보이고 있다. 대부업의 연체율도 상승하며 저신용층의 외면과 불법 사금융 증가가 우려되어 금융당국은 이에 집중적으로 해결책을 모색하고 있다.," 대부업 이용자가 지난해 말 기준 7만5000명 감소한 것으로 나타났다. 일부 저신용자가 대부업마저 이용하지 못해 불법 사금융으로 빠진 것으로 예상된다.28일 금융감독원이 발표한 '2022년 하반기 대부업 실태조사'에 따르면 지난해 말 대부업 이용자수는 98만9000명으로 6개월 전인 2분기말 대비 7만5000명 줄었다. 대부업 이용자수가 100만명 아래로 떨어진 것은 2008년 이후 약 15년만이다.금융감독원 사옥 전경. ⓒ 금융감독원대부업 대출잔액은 15조8678억원으로 2분기말 대비 86억원 감소했다. 이는 대형 대부업자의 신규대출 중단 때문이라는 게 금감원 측 설명이다.반면 대부 수요는 담보 대출 확대의 영향으로 지속적인 증가 추세를 보이고 있다. 지난해 말 대부이용자 1인당 평균 대출잔액은 1604만원으로 상반기 대비(1492만원) 112만원 늘었다.아울러 대부업 연체율은 △2020년 말 8.3% △2021년 상반기 7.3% △2021년 말 6.1%로 하락세를 지속해 왔으나 지난해 말 연체율은 7.3%로 상반기와 비교해 1.3%p 상승했다.금융당국은 ""신용이 열악한 저신용층이 대부업 시장으로부터 소외돼 불법 사금융 이용 증가로 이어질 수 있다""면서 ""대부업자가 채권 회수를 위해 불법추심을 강행할 가능성도 존재한다""고 우려를 표했다.이에 금융당국은 대부업 이용 저신용층 금융 애로 해소 및 불법사금융 피해 방지에 집중한다는 방침을 내세웠다.구체적으로는 대부업권의 저신용층 신용공급 현황 및 연체율 추이를 면밀히 모니터링하고 '서민금융 우수대부업자 제도' 내실화 등을 통해 저신용층에 대한 신용공급 확대를 유도할 계획이다.당국 관계자는 ""불법 사금융 광고를 단속 및 차단하고, 소액생계비대출 등 정책 서민금융 상품에 대한 홍보를 강화하겠다""고 덧붙였다."
605231,0.5924715,0.90513265,4,만 나이, 금감원, 보험나이, 금융불편 상담센터, 새 제도,"다음 뉴스 기사를  3문장으로 요약해, 총 답변의 길이는 150자 이내로 제한한다. + content",gpt-3.5-turbo-16k,1,,1,0,0,28일부터 시행되는 '만 나이 통일법'에 따라 전 국민의 나이가 한두 살 어려지면서 나이를 기준으로 이용에 제한을 두고 있던 서비스들을 둘러싸고 혼란이 예상되지만 은행권은 큰 불편은 없을 것으로 전망된다. 금감원은 새 제도 도입에 따른 불편을 처리하기 위해 금융불편 상담센터를 설치했다. 은행권과 카드업계는 기존부터 만 나이를 이용하고 있어 혼선이 없을 것으로 판단된다.," 윤석열 정부 국정과제로 도입 추진된 '만 나이 통일법(행정기본법 및 민법 일부개정법률)’이 28일 시행됨에 따라 전 국민 나이가 한두 살 어려진다. '청년 대출', '주류' 등 나이를 기준으로 이용에 제한을 뒀던 서비스를 둘러싸고 혼란이 예상되는 가운데 은행권은 새 제도 도입에 따른 불편은 크지 않을 전망이다.이날 금융감독원(이하 금감원)은 콜센터 내 금융불편 상담센터를 설치했다고 밝혔다.금융감독원 사옥 전경. ⓒ 금융감독원금융불편 상담센터는 만 나이 전환에 따른 금융 관련 문의사항을 처리하기 위해 마련됐다. 이 센터는 불편 사항이 접수되면 이에 대한 안내를 직접 진행하거나 금감원 소관 부서 및 금융사로 전달한다.금감원은 은행권과 카드업계에 만 나이 도입 관련 혼선은 없을 것으로 판단했다.앞서 금감원은 만 나이 사용을 명확히 규정한 민법 일부개정법률안이 국회 본회의를 통과했던 지난해 12월부터 금융법령 연령과 관련한 규제 현황을 점검한 바 있는데, 은행권·카드업계는 만 나이를 기존부터 사용하고 있어 혼란이 없을 것으로 결론 냈다.실제로 시중은행과 인터넷은행 등 은행권은 기존 상품 가입 기준에 만 나이를 적용하고 있다. 가령 청년 전세대출은 '만 34세 이하', 청년도약계좌는 '만 19세 이상∼34세 이하'와 같이 만 나이를 기준으로 가입 대상이 설정돼 있다. 아울러 은행권은 업계 지침과 규준 또한 이미 만 나이를 적용하고 있다.은행 관계자는 이와 관련 ""이전부터 모든 상품 및 서비스의 명확한 기준 성립을 위해 만 나이로 업무를 통일해 왔다""며 ""제도가 시행되더라도 큰 혼선은 없을 것""이라고 말했다.카드업계 역시 신용카드뿐 아니라 미성년자도 가입할 수 있는 체크카드를 만 나이 기준으로 발급하고 있어 별다른 조치가 필요하지 않다고 분석된다.이에 반해 보험업권은 '보험나이'라는 개념을 별도로 사용하고 있어 유의해야 한다는 게 금감원 설명이다.금감원 관계자는 ""내 나이가 줄어들었는데 왜 보험료는 줄어들지 않는지 궁금해하는 분들도 있다""며 ""생명보험·실손보험 등 생명이나 신체와 관련된 보험은 '보험 나이'라는 개념을 쓰기 때문인데, 상담센터 운영을 통해 소비자 혼란을 방지할 것""이라고 말했다."
605204,0.4035904,0.6888442,3,영상통화, 금융위원회, 보험상품, 화재보험, 보험제도,"다음 뉴스 기사를  3문장으로 요약해, 총 답변의 길이는 150자 이내로 제한한다. + content",gpt-3.5-turbo-16k,1,,1,0,0,금융위원회는 보험제도 개편으로 영상통화를 통한 보험가입이 가능해져 소비자가 편리해지며 보험사가 물품을 제공하여 사고 발생 위험을 낮출 수 있게 됐다고 밝혔다. 또한 보험상품 관련 비교·공시 항목이 개선되어 소비자들은 보다 정확한 정보를 얻을 수 있게 됐다. 하지만 외화보험 판매 시 보험사들은 환율에 따른 보험료와 해지환급금 등을 수치화하여 소비자에게 설명해야 한다.," 이르면 하반기부터 영상통화만으로 보험에 가입할 수 있게 된다. 일부 보험제도가 개편되면서 소비자 편익이 더욱 향상됐다는 평가다.28일 금융위원회는 보험업법 시행령 및 감독규정 개정안이 다음달 1일부터 시행됨에 따라 하반기부터 달라지는 보험제도를 안내했다.금융위에 따르면 하반기부터 화상통화나 '하이브리드' 방식이 보험모집 수단으로 허용된다. 하이브리드 방식이란 스마트폰으로 보험 모집인의 안내를 들으면서 동시에 화면으로 보험 설명서 등을 보는 방식을 말한다. 현재 혁신금융서비스를 신청한 일부 보험사만 이를 활용할 수 있었다. 하반기부터는 모든 보험회사가 하이브리드 방식을 쓸 수 있다.비대면으로 진행되는 전화모집은 소비자가 보험설계사의 음성만 듣고 보험상품을 이해한 뒤 청약을 진행해야 하는 어려움이 있었다. 앞으로는 소비자가 스마트폰을 통해 음성으로 설명을 들으면서 글과 이미지를 결합한 설명서를 직접 볼 수 있게 됐다. 보험가입시 상품을 보다 잘 이해할 수 있을 것으로 기대된다.금융위원회가 보험업법 시행령 및 감독규정 개정안이 다음달 1일부터 시행됨에 따라 하반기부터 달라지는 보험제도를 안내했다. ⓒ 연합뉴스소비자가 직접 설계사를 만나지 않고 사무실이나 집에서 영상통화로 설계사의 설명을 듣고 보험가입을 할 수 있게 되면서 보험가입에 필요한 시간과 비용도 절약할 수 있게 됐다.보험회사가 보험상품과 연계해 사고 발생위험을 낮추는 물품을 소비자에게 제공할 수 있는 폭도 넓어진다. 지금까지는 보험계약을 체결·모집할 때 3만원을 초과하는 물품은 보험사가 제공할 수 없었다.그러나 하반기부터는 보험상품별로 해당 사고발생 위험을 낮추는 물품의 경우 20만원 또는 연간 보험료의 10%까지 제공할 수 있게 된다. 가령 주택화재보험에 가입하는 소비자에게 가스누출탐지기나 화재감지기를 주고 반려동물보험 가입자에게는 구충제나 예방접종 등을 제공할 수 있게 되는 식이다.생명보험협회 및 손해보험협회에서 운영하고 있는 보험상품 관련 비교·공시 항목도 개선된다.현재 보험상품별로 불완전판매비율 등을 공시하고 있지만, 1년 내 단기지표라는 점에서 보험상품의 중장기적인 만족도에 대한 정보는 제공하기 어려운 측면이 있다.이에 따라 하반기부터는 보험상품 공시에 계약 '유지율'이 추가돼 체결된 계약의 1·2·3·5년간 유지 비중을 확인할 수 있게 된다.금융위는 ""소비자는 정확한 정보를 기반으로 보험상품을 선택할 수 있고 보험회사는 장기적으로 소비자 만족도가 높은 상품을 판매하려는 노력을 제고하게 될 것으로 기대한다""고 전했다.오는 하반기 보험업법 시행령 및 감독규정 개정안에 따라 보험제도가 달라진다. ⓒ 연합뉴스환율변동 위험에 노출된 상품인 외화보험 판매시 보험사의 설명의무도 강화된다. 소비자에게 외화보험 실수요 여부를 확인하고 환율변동에 따른 보험료·보험금·해지시점별 해지환급금 등을 수치화해 설명토록 한다는 것이다.실적이 낮거나 소형인 법인보험대리점에 대한 경영공시 의무는 완화딘다. 하반기부터는 반기 중 모집실적이 100만원 이하인 법인보험대리점은 경영공시 의무가 면제되며 소속 보험설계사가 100명 미만인 소형 법인보험대리점은 과태료 부과금액 상한이 현행 1000만원에서 500만원으로 낮아진다.화재보험 공동인수제도도 개선된다. 이는 화재위험이 높아 보험가입이 어려운 건물도 화재보험에 가입할 수 있도록 보험회사들이 공동으로 인수하는 제도다.현재 화재보험 공동인수제도는 담보범위가 특수건물(국·공유건물, 학교, 백화점, 도매시장, 16층 이상 아파트, 공장, 다중이용업소 등)의 대인·대물 배상 및 자기건물손해에 한정돼 있는데 하반기부터는 담보를 화재보험에 부가되는 담보 전체로 확대하고 공동주택도 인수 대상으로 확대해 화재보험가입이 쉬워질 전망이다.이밖에 새 국제회계기준인 'IFRS17' 도입과 관련해 보험회사의 조건부자본증권 발행절차 및 세부사항 규정, 보험회사 책임준비금의 계리적 가정을 검증하는 선임계리사의 역할 확대, 파생상품에 대한 자산운용 비율 규제 개선 등도 하반기 시행된다.금융위는 ""제도개선은 7월1일부터 시행되고, 화상통화를 활용한 보험모집은 7월6일부터 운영될 예정""이라며 ""화재보험 공동인수제도 개선은 한국화재보험협회의 특수건물 특약부 화재보험 공동인수 상호 협정 개정을 거쳐 3분기 중 시행될 예정""이라고 전했다."
