article_number,USE,SBERT,score,keyword1,keyword2,keyword3,keyword4,keyword5,message,model,temperature,max_tokens,top_p,frequency_penalty,presence_penalty,response,content
604957,0.7225776,0.7732758,4,DSR, 가계대출, 한국은행, 이자, 금리 인상,"다음 뉴스 기사를  3문장으로 요약해, 총 답변의 길이는 150자 이내로 제한한다. + content",gpt-3.5-turbo-16k,1,,1,0,0,가계대출 DSR이 40%를 넘어선 채로 이어지며 가계대출 부실 신호가 커지고 있고 대출 리스크 관리가 필요하다는 지적이 제기되고 있다. 현재 DSR 상승은 금리 인상으로 인해 이자 부담이 늘어난 결과라고 은행권 중론이 주장하고 있다. 가계대출 고정이하여신비율은 악화할 것으로 예측되고 가계대출 연체율도 상승세를 보이고 있다. 가계대출 리스크에 대한 금융당국의 적극적인 관리가 필요하다는 입장이다.,"가계대출 DSR이 지난해 4분기에 이어 올해 1분기에도 40%를 넘어섰다. ⓒ 연합뉴스 가계대출 총부채원리금상환비율(DSR)이 지난해 4분기에 이어 올해 1분기에도 40%를 넘어선 것으로 나타났다. 이와 함께 가계대출 부실 신호는 커지고 있어, 대출 리스크 관리가 필요하다는 지적이다.김희곤 국민의힘 의원이 한국은행에게 제출받은 자료에 따르면 올해 1분기 가계대출 DSR은 40.3%로 나타났다. 이는 지난해 4분기 DSR 40.6%에 이어 2분기 연속 40%대를 기록한 것이다.DSR은 개인의 대출 원리금(원금+이자) 상환액을 연 소득으로 나눈 비율이다. 현재 DSR 상승은 금리 인상 때문이라는 게 은행권 중론이다.은행권 한 관계자는 ""DSR 산출 시 분자 역할인 이자가 금리인상기로 인해 늘었기 때문""이라며 ""전체 DSR이 늘어났다는 건 그만큼 대출자 부담이 늘어났다는 것으로 보면 된다""고 설명했다.늘어난 이자 부담만큼 은행권 부실위험이 늘어나고 있다. 이번 자료에 따르면 가계대출 고정이하여신비율은 1분기 기준 0.24%로 집계됐다. 이는 직전분기 대비 0.05%p 올랐다. 금융연구원은 고정이하여신비율이 올해 말 0.33%까지 악화할 것으로 예측했다.아울러 은행 및 비은행금융기관의 가계대출 연체율은 1분기 기준 0.31%, 1.76%로 나타났다. 이는 지난해 3분기 대비 각각 0.12%p, 0.46%p 오른 것으로 가파른 상승세를 보였다.김희곤 의원은 ""현재 가계대출 리스크 규모가 계속 늘어나지만 상환 여력은 줄어드는 상황""이라며 ""가계대출 부실화가 급격화할 수 있는 만큼 가계대출 리스크에 대한 금융당국의 적극적인 관리가 필요하다""고 말했다."
604887,0.5415052,0.77413434,1,영상통화, 금융위원회, 화재보험, 보험상품, ,"다음 뉴스 기사를  3문장으로 요약해, 총 답변의 길이는 150자 이내로 제한한다. + content",gpt-3.5-turbo-16k,1,,1,0,0,현대카드와 비자가 전략적 비즈니스 파트너십을 맺었으며 데이터 사업을 공동으로 추진하고 데이터 분석 솔루션을 현대카드가 개발한 마케팅 플랫폼에 적용하고 있다. 이를 통해 두 기업은 글로벌 시장에서 다양한 비즈니스 기회를 찾아나갈 계획이다. 또한 두 기업은 B2B 결제와 같은 다른 분야에서도 협업을 강화하고 있으며 데이터 자산과 기술을 바탕으로 다양한 데이터 상품과 서비스를 선보일 것이다.," 현대카드는 글로벌 결제 기술 기업 비자(Visa)와 '전략적 비즈니스 파트너십'을 맺었다고 26일 밝혔다. 데이터 자산과 분석 기술을 기반으로 데이터 사업을 공동 추진하는 내용이다.미국 샌프란시스코 비자 글로벌 본사에서 지난 21일(현지시각) 열린 협약식에는 정태영 현대카드 부회장과 라이언 맥이너니 비자 CEO를 비롯해 주요 임원들이 참석했다.양사의 파트너십은 디지털 페이먼트 혁신을 최우선 과제로 생각하는 공통 철학과 전략이 기반이 됐다. 이에 따라 현대카드와 비자는 한국 및 글로벌 시장에서 다양한 비즈니스 기회를 발굴해 나갈 계획이다.현대카드가 비자와 전략적 비즈니스 파트너십을 맺었다. 사진은 정태영 현대카드 부회장, 라이언 맥이너니 비자 CEO. ⓒ 현대카드먼저 전 세계 200여국에서 사업을 벌이고 있는 비자의 글로벌 네트워크를 활용, 현대카드의 데이터 분석 솔루션을 해외에서 선보일 계획이다. 현대카드는 인공지능(AI) 엔진을 활용해 분석·가공한 데이터를 초개인화 마케팅에 활용하는 솔루션을 개발했다. 현재 현대카드 상업자 전용 신용카드(PLCC) 파트너사들에 제공하고 있다.데이터 솔루션도 개발한다. 두 회사가 그간 축적해 온 데이터 자산과 데이터 사이언스 역량을 결합한 데이터 상품 및 솔루션 개발을 추진한다.또, 비자는 이번 파트너십을 계기로 자사가 보유한 데이터와 지적 자산을 활용해 현대카드의 PLCC 파트너사의 데이터 동맹 '도메인 갤럭시(Domain Galaxy)'에도 적극 참여하기로 했다.도메인 갤럭시에 참여한 △코스트코 △스타벅스 △야놀자 등 18개 PLCC 파트너사들은 현대카드가 개발한 마케팅 플랫폼 및 데이터 분석 솔루션을 기반으로 다양한 협업을 이어 왔다. 비자의 참여로 도메인 갤럭시 사업이 더욱 성장할 것으로 전망된다.데이터 비즈니스 이외 분야에서도 협업을 강화하기로 했다. 현대카드는 해외 결제 서비스를 제공하는 여러 국제 브랜드사 중 비자를 최우선 브랜드로 운영할 계획이다. 아울러 비자가 추진하는 가상카드·수출입 결제와 같은 B2B 페이먼트 사업 등 다양한 분야의 결제 솔루션 비즈니스도 함께 해 나가기로 했다.라이언 맥이너니 비자 CEO는 ""현대카드와의 파트너십은 지급결제에 데이터 분석을 활용하는데 있어 아주 중요한 이정표가 될 것""이라며 ""고도의 데이터 기반 기술과 솔루션을 통해, 파트너사들이 보다 정보에 입각한 비즈니스 결정을 할 수 있도록 돕고자 한다""고 파트너십 체결 배경을 설명했다.정태영 현대카드 부회장은 ""현대카드는 이번 파트너십으로 글로벌 페이먼트 시장을 리드하고 있는 비자와 긴밀한 관계를 맺게 됐다""며 ""앞으로 현대카드와 비자의 정교하게 분석된 데이터 자산과 기술을 기반으로 다양한 데이터 상품·서비스를 선보일 계획""이라고 말했다."
604875,0.60033,0.85051185,3,예금보호한도, 금융위원회, 예금자보호법, 5000만원, 보험,"다음 뉴스 기사를  3문장으로 요약해, 총 답변의 길이는 150자 이내로 제한한다. + content",gpt-3.5-turbo-16k,1,,1,0,0,금융당국이 연금저축 사고보험금 중소기업퇴직연금기금에 대해 각각 5000만원의 예금보호한도를 적용하기로 했다. 이에 따라 예금자는 일반 예금과 별도로 5000만원까지 보호를 받을 수 있게 된다. 이와 함께 예금자보호법 시행령 개정안이 8월 7일까지 입법예고될 예정이다. 이를 통해 예금자 보호체계가 한층 강화되었다.," 금융당국이 연금저축, 사고보험금, 중소기업퇴직연금기금에 대해 각각 5000만원의 예금보호한도를 적용한다.26일 금융위원회에 따르면 8월7일까지 '예금자보호법 시행령 개정안'의 입법예고를 실시한다. 이에 따라 예금자는 기존 보유한 일반 예금과 별도로 5000만원까지 보호를 받을 수 있게 된다.금융위원회가 예금자보호법 시행령 개정안을 입법 예고했다. ⓒ 연합뉴스앞서 정부는 국민 노후소득 보장을 위해 2015년 2월부터 확정기여형(DC형) 및 개인형(IRP) 퇴직연금 예금에 대해서는 일반 예금과 별도로 5000만원의 보호한도를 적용해왔다.기존에는 세 항목을 합쳐 최대 5000만원을 보장해왔지만, 이번 시행령 개정안을 통해 △연금저축(신탁·보험) △사고보험금 △중소퇴직기금 각각에 대해서 5000만원씩 보장받게 됐다. 일반 예금과 분리해 별도 보장하면서 예금자 보호체계를 한층 강화했다.지난해 말 기준 적립금은 연금저축신탁 15조9000억원, 연금저축보험 113조6000억원에 달한다. 그간 예금자보호대상이 되는 은행·보험 상품과 합산해 예금보호한도가 적용돼 왔다.보험약관에서 정한 지급사유가 발생했을 때 지급되는 사고보험금도 일반보험(해약환급금)과 분리해 별도로 5000만원 보호한도를 적용받는다.전요섭 금융위원회 구조개선정책관은 ""국민 노후 설계에 중요한 연금 저축과 불의의 사고 시 지급되는 사고 보험금의 경우 사회보장적 성격이 강하다""며 ""별도 보험 한도를 적용할 경우에 예금자 보호 효과가 클 것으로 예상된다""고 말했다."
604863,0.62055993,0.8354036,2,1020, KB국민카드, 노리2 체크카드, 플레이 버전, 생활편의,"다음 뉴스 기사를  3문장으로 요약해, 총 답변의 길이는 150자 이내로 제한한다. + content",gpt-3.5-turbo-16k,1,,1,0,0,KB국민카드가 'KB국민 노리(nori)2 체크카드' 플레이 버전을 출시하여 생활편의 영역에서 월 최대 5만원의 할인을 제공한다. 커피 편의점 배달 등 10개 업종에서의 할인 혜택과 함께 PC방과 패스트푸드점에서의 추가 혜택도 제공된다. 또한 이용 실적에 따라 다양한 영역에서 부담 없이 서비스를 받을 수 있다.," KB국민카드가 'KB국민 노리(nori)2 체크카드' 플레이 버전을 출시했다. 'KB국민 노리(nori)2 체크카드는 생활편의 영역에서 월 최대 5만원의 할인을 제공하는 카드다.해당 카드는 커피·편의점·배달 등 10개 업종에서 할인 받는 '일상 혜택'을 기본으로 제공한다. 플레이형 발급 시 PC방과 패스트푸드점 할인 혜택을 추가로 제공한다.일상 혜택은 △커피(스타벅스, 커피빈) 10% △모바일(구글플레이스토어, 앱스토어) 10% △문화(인터파크티켓) 10% △뷰티(올리브영, 미용실 업종) 5% △편의점(GS25, CU) 5% △구독(넷플릭스, 유튜브프리미엄) 1000원 △배달(배달의민족, 요기요) 1000원 △이동통신(SKT, KT, LG U+, Liiv M) 2500원 △영화(CGV) 4000원 △놀이공원(에버랜드, 롯데월드) 1만5000원 할인을 제공한다.커피 영역 할인은 전월 실적 없이 제공된다. 다른 영역 혜택은 전월 이용실적 20만원 이상 시 제공돼 부담없이 다양한 영역에서 서비스를 받을 수 있다.'KB국민 노리(nori)2 체크카드' 플레이 버전. ⓒ KB국민카드플레이 혜택은 전월 이용실적 30만원 이상 충족 시 제공된다. 구체적으로 △게임(PC방) 10% 할인(월 할인한도 2천원) △푸드(패스트푸드 업종) 월 1000원 할인 서비스를 제공한다.다양한 이벤트도 진행한다. 7월31일까지 KB국민 노리(nori)2 체크카드 플레이 버전 발급 후 10만원 이상 이용한 고객이 홈페이지를 통해 ‘내가 제일 좋아하는 게임 이름’을 작성하여 응모하면 추첨을 통해 총 10명에게 게임기 구매 지원비 50만원을 캐시백으로 지급한다. 패스트푸드점 이용 시 회원별 최대 1만원 한도 내에서 이용금액의 50%를 캐시백 해준다.KB국민카드 관계자는 ""KB국민 노리2 체크카드 플레이 버전 출시를 계기로 게임뿐 아니라 1020세대의 놀이 문화와 연계한 마케팅을 펼칠 계획이다""라고 말했다."
604858,0.65243053,0.77427876,4,한덕수, 6.25전쟁 기념식, 자주국방, 한미일 안보 협력, 북한,"다음 뉴스 기사를  3문장으로 요약해, 총 답변의 길이는 150자 이내로 제한한다. + content",gpt-3.5-turbo-16k,1,,1,0,0,한덕수 국무총리는 6·25 전쟁 73주년 기념식에서 북한의 거짓 선의에 의존하는 가짜 평화가 아닌 강력한 자주국방으로 안보를 지킬 것을 선언했다. 그는 또한 한미일 안보 협력의 중요성을 강조하며 한국의 유엔안보리 진출을 통해 연대와 협력을 강화할 기회라고 말했다. 한덕수 총리는 끝으로 전쟁터에서 흘린 영웅들에게 일류 보훈으로 보답하겠다고 강조했다. (151자)," 한덕수 국무총리는 북한의 거짓 선의에 휘둘리지 않는 강력한 자주국방 의지를 표명했다.25일 한덕수 국무총리는 서울 중구 장충체육관에서 열린 '제73주년 6‧25 전쟁 기념식'에 참석했다. 개회사에서 한덕수 총리는 ""정부는 북한의 거짓된 선의에 의존하는 가짜 평화가 아니라 강력한 자주국방으로 우리의 안보를 지키겠다""고 밝혔다.한덕수 국무총리가 25일 장충체육관에서 열린 6·25 73주년 행사에 참석해 묵념을 하고 있다. ⓒ 연합뉴스한덕수 총리는 ""북한은 지금도 6‧25 전쟁 당시 헛된 망상에서 깨어나지 못하고 있다""며 ""북한의 거짓된 선의에 의존하는 가짜 평화가 아니라 강력한 자주국방으로 우리의 안보를 지키겠다""고 힘줘 말했다.한 총리는 ""자유민주주의 등 보편적 가치를 공유하는 국가들과의 연대 또한 안보의 핵심이 될 것""이라며 한미일 안보 협력의 중요성을 강조했다.이어 ""지난 4월 윤석열 대통령의 미국 국빈 방문은 70주년을 맞이한 한미동맹을 핵 기반 안보 동맹으로 강화하는 계기가 됐다""며 ""악화했던 한일관계도 미래지향적 협력 관계로 나아가고 있어 한미일 3국 간 안보 협력이 더욱 단단해질 것""이라고 내다봤다.또 ""한국의 이번 유엔안보리 비상임이사국 진출은 북한의 핵 위협에 대한 한미일 3국 간 연대와 협력을 더욱 확대할 기회""라고 덧붙였다.마지막으로 한 총리는 ""지금 우리가 누리고 있는 자유와 평화와 번영은 젊은 영웅들이 전쟁터에서 흘린 피와 땀과 눈물의 대가임을 기억해야 한다""며 ""정부는 국가가 끝까지 책임지는 일류 보훈으로 그분들의 헌신에 보답하겠다""고 강조했다."
604848,0.43580955,0.88769084,3,청년도약계좌, 중도 해지, 적금담보대출, 청년희망적금, 금융감독원,"다음 뉴스 기사를  3문장으로 요약해, 총 답변의 길이는 150자 이내로 제한한다. + content",gpt-3.5-turbo-16k,1,,1,0,0,금융당국이 최근 출시된 '청년도약계좌'의 중도 해지를 막기 위한 방안을 논의하고 있다. 청년희망적금의 중도 해지가 늘어나고 있는 상황에서 금융당국은 청년도약계좌에 대한 중도 해지 방안을 구체화하기 위해 연구 용역을 진행하고 있다. 청년들은 매달 50만원 이상을 납입해야 하는데 이를 채우지 못한 이들이 주로 중도 해지하는 것으로 나타났다.," 금융당국이 최근 출시된 '청년도약계좌'의 중도 해지를 막기 위한 방안을 논의하고 있다. 만기가 5년이기 때문에 가입자들이 긴 기간을 참지 못해 해지할 수 있다는 우려 때문이다.23일 금융권에 따르면 정부는 지난 15일 출시한 청년도약계좌의 중도 해지를 막기 위한 방안 마련에 착수했다. 이들은 또 중도 해지를 포함해 청년희망적금과 관련된 연구 용역도 진행하고 있다.금융당국이 청년도약계좌 중도 해지를 막기 위한 방안 마련에 착수했다. = 장민태 기자금융당국 관계자는 ""청년도약계좌 중도 해지 방안에 대해 지속 검토하고 있지만, 아직 상품 가입이 모두 완료된 상태도 아니기 때문에 구체화한 방안을 도출하지 못했다""며 ""연구 용역은 중도 해지 방안을 포함해 청년도약계좌 제도적인 부분에 대해서 진행하고 있다""고 말했다.중도 해지 우려는 앞서 청년층 자산형성이라는 동일한 정책목표로 출시됐던 '청년희망적금' 사례가 영향을 미친 것으로 풀이된다. 이 상품은 청년도약계좌보다 짧은 만기를 가지고 있음에도 가입자 이탈이 늘고 있다.강민국 국민의힘 의원이 금융감독원으로부터 제출받은 자료를 살펴보면, 청년희망적금 중도 해지자는 지난달말 기준 68만4878명에 달한다. 이는 최초 가입자 289만5546명 가운데 23.65%가 이탈한 셈이다.이들 중도 해지자는 지난해 6월 6.7%에 불과했지만, 올해는 3월 21.1%, 5월 23.7% 등 폭발적인 수준으로 늘어났다. 만기에 가까워질수록 가입자들이 이탈하고 있는 셈이다.해지율은 납입 금액과 연령대가 낮은 쪽에서 높게 나타났다. 10만원 미만 납입자의 중도 해지율은 49.2%로 절반에 가까웠으며, 만 19세 가입자 해지율은 27.9%를 기록했다.이에 대해 은행권 관계자는 ""사회초년생인 20대가 고물가에 의한 저축여력 하락으로 매달 돈을 납입하는 데 부담을 느낀 것으로 보인다""며 ""최대 혜택을 받기 위해서는 매달 50만원을 내야 하는데, 이를 채우지 못한 이들이 주로 해지하고 있다""고 설명했다.실제 청년희망적금 납입 한도인 50만원을 꽉 채워 납입한 청년들은 중도 해지율이 14.8%로 중도해지자들 가운데 가장 낮은 비중이다. 문제는 이번에 출시된 청년도약계좌는 만기뿐만 아니라 납입한도도 청년희망적금보다 높다는 점이다.앞서 출시된 청년희망적금은 지난달말 기준 68만4878만명이 중도 해지했다. ⓒ 연합뉴스청년도약계좌는 윤석열 정부의 청년 핵심 공약으로, 5년간 매달 70만원 한도로 납입하면 정부지원금(월 최대 2만4천원) 등을 더해 5000만원 수준을 받을 수 있도록 설계된 상품이다. 향후 중도해지가 우려될 수 밖에 없는 부분이다.이미 금융당국은 청년도약계좌 가입자가 급전 수요 등으로 해지하지 않도록 적금담보대출을 방지 장치로 마련했다. 하지만 이마저도 실효성 논란에 휩싸였다. 적금담보대출 금리가 일반 신용대출보다 높은 수준이기 때문이다.적금담보대출은 가입된 적금을 담보로 잔액의 95%까지 빌릴 수 있는 상품이다. 갑자기 돈이 필요할 때 급전을 빌리고 적금 가입은 유지할 수 있다는 게 특징이다.은행연합회 6월 공시에 따르면 6대(신한·국민·하나·우리·농협·기업) 은행의 신용대출 평균 금리는 5.73%다. 하지만 청년희망적금 적금담보대출 금리는 11개 취급기관 기준 평균 7.04%로 집계됐다.이는 금리 산정 구조에서 발생한다. 적금담보대출 금리는 적금의 기본금리와 우대금리에 가산금리를 더해 결정된다. 대출금리가 예금금리보다 낮을 경우 은행 입장에서는 역마진을 겪어야 한다.은행권 한 관계자는 ""청년희망적금 금리가 6%인데 이보다 낮은 금리로 대출을 실행하면 바로 역마진""이라며 ""이미 청년희망적금 상품 자체도 역마진 우려가 존재하는 상품인데, 이걸 취급하면서 적금담보대출 금리를 낮출 은행은 어디에도 없을 것""이라고 말했다.이어 ""적금담보대출은 간단한 대출 심사 등을 장점으로 급전이 필요할 때 유용한 상품""이라며 ""하지만 중도 해지를 완전히 막을 만한 메리트가 부족하기 때문에 당국도 추가 방안을 마련하는 것으로 보인다""고 첨언했다."
604839,0.6040699,0.77236557,3,우리금융그룹, 스타트업, 협력 프로그램, 디노랩, 선발,"다음 뉴스 기사를  3문장으로 요약해, 총 답변의 길이는 150자 이내로 제한한다. + content",gpt-3.5-turbo-16k,1,,1,0,0,우리금융그룹은 '디노랩(DINNOlab)' 4기에 14개 스타트업을 선발했다. 전북은행은 취약계층을 위해 중고 PC 전달식을 실시했고 토스뱅크는 '알유넥스트 함께 응원하기 서비스'를 선보였다. 이 서비스는 응원 메시지를 작성하고 공유할 수 있다.,23일 뱅크룸. ⓒ 프라임경제 우리금융그룹(316140)은 스타트업 기업 협력 프로그램인 '디노랩(DINNOlab)' 4기에 참여할 14개 업체를 선발했다고 23일 밝혔다. 이날 전북은행은 취약계층 디지털 정보격차 해소를 위한 중고 PC 전달식을 실시했으며 토스뱅크는 '알유넥스트 함께 응원하기 서비스'를 선보인다고 밝혔다.우리금융은 외부전문가를 포함한 총 10명의 평가를 바탕으로 디노랩 4기 참여 스타트업을 선정했다. 또 우리금융 실무자가 참여해 유망 기업을 발굴했다. 최종 선발된 기업은 △닉컴퍼니 △라이트하우스 △사이클렛저 △빅테크플러스 △엑스바엑스 등 총 14개사다. 선발 기업에게는 △1년 무상 '디노랩 제1센터' 사무공간 △우리금융 계열사 사업협력 △투자유치 기회가 제공될 예정이다.전북은행은 ESG 경영 일환으로 관내 취약계층에 중고 PC를 전달했다. 이번 전달식은 디지털 정보격차를 해소하고 가용 자원을 재활용해 환경오염 예방에 앞장서고자 마련됐다. 전달식에는 박정석 전주시자원봉사센터 센터장과 김영석 전북은행 사회공헌홍보부장 등이 참석했다. 이날 기증된 중고 PC 10대는 전주시자원봉자센터를 통해 관내 정보화 취약계층에 전달될 예정이다.토스뱅크는 걸그룹 서바이벌 프로그램 '알유넥스트(R U NEXT?)'를 응원할 수 있는 공간 '알유넥스트 함께 응원하기 서비스'를 마련했다. 이용자는 토스 애플리케이션(앱)에서 참가자를 선택해 사진과 함께 모으기 공간을 최대 22개 생성할 수 있다. 또 이용자는 저금할 때마다 응원 메시지를 작성할 수 있으며 이는 응원하기 게시판에 실시간으로 공유된다. 해당 서비스는 만 17세 이상부터 참여할 수 있다.
