605469,네이버뉴스 3차 알고리즘 검토위 발족,박지혜 기자,2023.06.30 15:15:49,"[프라임경제] 네이버(035420)는 지난 29일 '네이버 뉴스 3차 알고리즘 검토위원회'(이하 3차 알고리즘 검토위)를 발족했다고 30일 밝혔다.네이버 뉴스 3차 알고리즘 검토위원회를 발족했다. = 박지혜 기자3차 알고리즘 검토위는 △한국인공지능학회 △한국정보과학회 언어공학연구회 △한국정보과학회 인공지능소사이어티 △카이스트 인공지능 공정성 연구센터 등의 학회 및 기관에서 추천한 전문가 중 총 6인의 위원들로 구성됐다.위원장으로는 유창동 위원 카이스트 전기전자공학부 교수가 선출됐다.유창동 위원장은 ""3차 알고리즘 검토위는 지난 위원회에서 권고했던 개선 과제들이 실제로 적절하게 반영됐는지를 확인하고, 뉴스 추천, 검색 등 다양한 영역에서의 알고리즘을 전반적으로 살펴 뉴스 서비스의 투명성을 높일 수 있도록 논의하겠다""고 말했다.네이버는 2018년 국내외 포털사업자 중 최초로 외부 전문가 그룹으로 이뤄진 '뉴스 알고리즘 검토위원회'에 알고리즘을 검토 받고, 의견을 수렴해 실제 서비스에 반영하는 노력을 이어오고 있다.지난해 2차 알고리즘 검토위로부터 '저널리즘 관점에서 알고리즘, 알고리즘의 중립성, 알고리즘 평가 및 구성 과정'에 대해 중점적으로 검토 받았다. 이를 수용해 심층 기획 기사의 추천을 강화하고, 다양성을 늘릴 수 있는 지표의 개발 계획 등을 공개했다.3차 알고리즘 검토위는 추천 심층성 강화, 추천 다양성 개발 등을 주제로 '에어스'(AiRS) 뉴스 추천과 뉴스 검색 알고리즘 전반에 대한 검토를 진행할 예정이다. 해당 검토 결과를 연내 발표한다.유봉석 네이버 서비스운영총괄은 ""네이버는 투명한 뉴스 서비스를 제공하기 위해 외부 전문가들에게 주기적으로 인공지능 알고리즘을 검토 받고, 이를 통해 더욱 고도화된 서비스 운영을 위해 최선을 다하겠다""고 강조했다."
592109,"네이버, 지난해 매출 8조 돌파에도 수익성 주춤",박지혜 기자,2023.02.03 10:05:16,"[프라임경제] 네이버(035420)는 지난해 콘텐츠, 커머스 등 전 사업부문 고른 성장에 힘 입어 연간 매출 8조원을 돌파했다. 반면 영업이익은 경기침체에 따른 광고시장 정체 등의 영향으로 전년 대비 소폭 꺾였다.ⓒ 연합뉴스◆4분기 영업익 3365억…전년比 4.2%↓네이버는 작년 한 해 연결 기준 매출 8조2201억원, 영업이익 1조3047억원을 기록했다고 3일 밝혔다. 매출은 전년 대비 20.6% 증가했으나, 영업이익은 1.6% 감소했다. 네이버의 연간 영업이익 감소는 2018년 이후 처음이다.지난해 4분기 연결 기준 △매출액 2조2717억원 △영업이익 3365억원 △당기순이익 1226억원을 기록했다. 매출은 전년 동기 대비 17.8% 늘었으나, 영업이익은 4.2% 줄었다. 당기순이익은 59.1% 감소했다.ⓒ 네이버지난해 4분기 사업 부문별 매출액은 △서치플랫폼 9164억원 △커머스 4868억원 △핀테크 3199억원 △콘텐츠 4375억원 △클라우드 1111억원이다.서치플랫폼은 거시환경 긴축 등 영향 속 전년 동기 대비 2.3%, 전분기 대비 2.3% 성장한 9164억원을 기록했다. 지난해 연간 기준으로는 전년 대비 7.9% 성장한 3조5680억원으로 집계됐다. 네이버는 올해 검색 및 디스플레이 신상품 출시 등으로 매출 성장을 모색해나갈 방침이다.커머스는 브랜드스토어, 여행·예약, 크림(KREAM) 등 버티컬 서비스의 고성장과 연말 성수기 효과 등에 힘입어 전년 동기 대비 18.3%, 전분기 대비 6.2% 성장한 4868억원을 기록했다. 지난해 연간 기준 커머스 부문은 전년 대비 21.0% 성장한 1조8011억원의 매출을 기록했다. 4분기 기준 커머스 부문 전체 거래액은 전년 동기 대비 13.7% 성장한 11조2000억원을 기록했다.핀테크는 신규 결제처 연동, 예약 결제 증가 등에 힘입어 전년 동기 대비 8.4%, 전분기 대비 8.0% 성장을 기록한 3199억원을 기록했다. 지난해 연간 기준 핀테크 부문은 전년 대비 21.2% 성장한 1조1866억원의 매출을 기록했다.특히 4분기 네이버페이 결제액은 전년 동기 대비 21.0%, 전분기 대비 5.8% 성장한 13조2000억원에 달했다.콘텐츠는 일본 통합 유료 이용자가 전년 동기 대비 25% 증가하는 등 꾸준한 글로벌 성장에 힘입어 전년 동기 대비 100.1%, 전분기 대비 40.3% 성장한 4375억원을 기록했다. 지난해 연간 기준 콘텐츠 부문은 전년 대비 91.3% 성장한 1조2615억원의 매출을 기록했다.클라우드 및 기타는 전년 동기 대비 3.9%, 전분기 대비 17.1% 성장한 1111억원을 기록했다. 지난해 연간 기준으로는 전년 대비 5.3% 성장한 4029억원을 기록했다.◆""상반기 서치GPT 선보일 것""네이버는 인공지능(AI)과 기업 간 거래(B2B) 사업조직들을 네이버클라우드로 통합, 하이퍼스케일 AI 기반의 경쟁 우위를 확보해 엔터프라이즈·금융 등으로 시장을 확장해 나가겠다는 방침이다.AI 챗봇 '챗GPT'가 인기를 끌고 있는 가운데 네이버는 올 상반기 내 '서치GPT'를 선보이겠다고 밝혔다.최수연 네이버 대표는 이날 4분기 실적발표 컨퍼런스콜에서 ""최근 많은 주목을 받고 있는 생성 AI와 같은 새로운 검색 트렌드에 대한 대응책을 준비 중""이라고 말했다.그러면서 ""생성 AI의 단점으로 꼽히는 신뢰성과 최신성 부족, 영어 기반 개발 모델을 한국어로 번역하면서 발생하는 정확성 저하를 풍부한 사용자 데이터와 네이버의 기술 노하우를 접목해 해결할 수 있다고 자신한다""고 강조했다.이어 ""검색 결과의 품질과 이용자의 콘텐츠 소비 경험을 향상하기 위한 실험을 내부적으로 진행 중""이라며 ""올 상반기 내 네이버만의 업그레이드된 검색 경험 서치 GPT를 선보이는 것이 목표""라고 덧붙였다."
603063,"2023 LCK '로지텍'과 더 뜨겁게 즐기자 ""6년째 공식 후원사""",김소미 기자,2023.06.05 14:32:50,"[프라임경제] 로지텍은 '2023 리그 오브 레전드 챔피언스 코리아 서머(이하 2023 LCK 서머)'의 공식 후원사로 참여한다고 5일 발표했다.로지텍은 지난 2018년 서머 스플릿부터 6년째 공식 스폰서 자격으로 LCK 지원을 이어오고 있다. 또 공식 스폰서 자격으로 △중계 방송 내 광고 △롤파크 내 브랜드 노출 △LoL 전용 콘텐츠 제작 지원 △팬 페스타 부스 운영 등 2023 LCK 서머의 안정적인 운영을 위한 여러 활동을 진행할 계획이다.2023 LCK 서머는 오는 7일 개막전을 시작으로 앞으로 9주 간 진행되며 총 10개 팀이 경쟁한다. 이번 스플릿 플레이오프의 경우 앞선 스프링 스플릿보다 짧은 약 2주의 기간 동안 1·2라운드부터 최종 결승전까지 진행한다.로지텍은 '2023 리그 오브 레전드 챔피언스 코리아 서머(이하 2023 LCK 서머)'의 공식 후원사로 참여한다. ⓒ 로지텍로지텍 관계자는 ""서머 스플릿 성적에 따라 롤드컵 진출 여부가 결정되는 만큼, 각 팀은 우수한 성적을 기록하고, 팬들의 기대를 충족하기 위해 더욱 긴장감 넘치는 팽팽한 경기를 펼칠 것으로 기대한다""고 말했다.로지텍에 따르면 올해 9월 개최하는 항저우 아시안게임에 출전하는 리그 오브 레전드(이하 LoL) 대표 선수들의 충분한 연습량을 위한 결정이다. 특히 지난 2018년 이후 5년만에 한국에서 열리는 올해 LoL 월드 챔피언십의 개최지가 서울과 부산으로 확정됐다.조정훈 로지텍 코리아 지사장은 ""수 년간 이어지고 있는 LCK와의 관계가 이번 서머 스플릿을 통해 더욱 돈독해질 수 있을 것 같아 기쁘다""며 ""공식 후원사로써 LCK와 e스포츠에 아낌 없는 사랑과 성원을 보내주는 팬들이 만족할 만한 리그를 운영하기 위해 최선을 다하겠다""고 다짐했다.LCK 이정훈 사무총장은 ""서머 스플릿의 성적은 LoL 월드 챔피언십 진출 여부와 직결되기 때문에 매년 치열한 승부가 이어졌다""며 ""올해에는 LoL 월드 챔피언십이 한국에서 열리기 때문에 LCK 팀들의 경쟁이 더욱 뜨거울 전망이다. 그 현장을 로지텍이 함께 해주셔서 감사드린다""라고 전했다.한편 로지텍은 라이엇 게임즈와의 협업을 통해 '로지텍 G 리그 오브 레전드 컬렉션'과 같은 LoL 게이머들을 위한 공식 게이밍 기어를 출시하는 등 e스포츠 시장의 저변 확대를 위해 활동을 펼치고 있다."
539229,"네이버, 상반기 신입 개발자 모집한다",박지혜 기자,2021.04.02 15:20:49,"[프라임경제] 올해 개발자 900여명을 채용할 계획인 네이버(035420)가 상반기 신입 개발자 공개 채용을 시작한다고 2일 밝혔다.ⓒ 네이버채용 규모는 세 자릿수로, 지원 자격은 4년제 대학교 졸업 또는 2022년 2월 대학(원) 졸업 예정인 자다. 개발자로서의 성장 가능성과 잠재력을 갖춘 사람이라면 누구나 전공과 무관하게 지원 가능하다.지원을 원하는 사람은 2일부터 12일까지 네이버 채용 홈페이지를 통해 지원서를 접수하면 된다.4월 중 서류전형과 코딩테스트를 실시한다. 5월 1차 기술면접과 6월 2차 종합면접을 진행할 예정이다.합격자는 7월 입사(2021년 8월 이후 졸업자는 하반기 중 입사) 예정이며, 입사 후 현업 개발자로 빠르게 성장할 수 있도록 다양한 성장 지원 프로그램을 이수하게 된다.네이버 측은 ""글로벌 시장에 본격적으로 도전하고 함께 성장할 인재들의 많은 지원을 기대한다""며 ""다양한 교육 프로그램을 통해 충분한 잠재력을 지닌 신규 입사자들이 빠른 시간 내에 업무에 적응하고, 개발자로 성장할 수 있도록 적극 지원할 계획""이라고 전했다."
557461,"[카드] 새라온이앤티, 김보경 등 음원 IP 거래 연다",이인애 기자,2021.12.09 16:50:23,[프라임경제] 새라온이앤티가 제작한 김보경·김지환(투빅)·한에스더 등 가수들이 싱글 앨범 IP(지식재산권)가 아이피샵 플랫폼에 등록돼 거래된다. 이 같은 싱글 앨범 음원은 멜론·벅스·지니 등 플랫폼을 통해 먼저 유통된다.
546708,"[카드] '러브 마이셀프' 카카오, BTS 기브티콘 선봬",박지혜 기자,2021.06.15 14:25:58,[프라임경제] 카카오(035720)가 방탄소년단(BTS)과 함께 이모티콘 구매를 통해 나눔을 실천할 수 있는 '기브티콘(Give-ticon)'을 선보인다고 15일 밝혔다.
538429,"네이버, 올해 개발자 900명 채용…역대 최대 규모",박지혜 기자,2021.03.29 09:56:15,"[프라임경제] 네이버(035420)가 올해 역대 최대 규모로 개발자 채용에 나선다.= 박지혜 기자네이버가 글로벌 도전을 본격화 하기 위해 올해 900여명의 개발자를 채용한다고 29일 밝혔다.이를 위해 네이버는 연 1회 실시하던 신입 공개채용을 상·하반기 연 2회로 확대하고, 4월부터 상반기 공채에 들어갈 예정이다.네이버는 컴퓨터공학 전공자뿐만 아니라 비전공자를 위한 별도의 개발자 육성·채용 트랙도 신설할 계획이다.또 매월 1~10일 경력자를 뽑는 '월간 영입' 프로그램을 신설해 매달 정기적으로 경력 사원을 모집한다. 첫 경력 사원 모집은 내달 1일부터 시작한다.7월에 입사 예정인 상반기 신입 개발자 공채는 다음달 2일부터 12일까지 네이버 채용 홈페이지에서 모집을 실시하고, 12월에 입사하는 하반기 공채는 9월에 모집을 실시한다.황순배 네이버 채용담당 책임리더는 ""정기적인 공채 채용 기회를 늘려 수시 채용의 예측 불확실성을 제거하고 될성부른 인재를 직접 육성할 수 있는 프로그램을 도입해 다양한 인재들이 개발자로 커 갈 수 있도록 지원할 것""이라며 ""개발에 최적화된 업무 환경 안에서 사용자의 불편함을 해소하기 위해 몰입하며 회사와 함께 성장할 수 있는 인재를 선발할 계획""이라고 말했다."
582835,카카오 'CEO 수난사'…올해만 4번째 교체,박지혜 기자,2022.10.21 14:48:48,"[프라임경제] 남궁훈 카카오(035720) 대표가 지난 15일 판교 데이터센터 화재로 인한 먹통 사태에 대해 책임지고 물러났다. 카카오의 최고경영자(CEO)가 지난 1년새 네 차례 교체되면서 'CEO 수난사'가 이어지고 있다.이에 일각에서는 김범수 창업자가 경영 일선에 복귀해 사태를 수습해야 되는 것 아니냐는 의견도 나온다. 그러나 카카오는 김 창업자의 경영 복귀에 대해 선을 그었다.남궁훈(왼쪽)·홍은택 카카오 각자대표가 19일 경기 성남시 카카오판교아지트에서 대국민 사과를 하고 있다. ⓒ 연합뉴스◆'구원 투수' 남궁훈도 낙마카카오는 지난 19일 공시를 통해 ""카카오 대표이사가 남궁훈, 홍은택 각자 대표이사에서 홍은택 대표이사로 변경된다""고 밝혔다.이날 남궁 대표는 판교 사옥에서 열린 기자회견에서 ""카카오의 쇄신과 변화에 대한 의지를 가지고자 대표이사직을 내려놓는다""며 ""대신 이번 사건을 수습하기 위해 꾸려진 사내 비상대책위원회의 재난 대책 소위원회 업무를 맡아 끝까지 책임지는 모습을 보이겠다""고 말했다.취임 당시부터 카카오는 위기를 맞이한 상황이었다. 남궁 대표는 올해 초 카카오페이 경영진 먹튀 논란으로 카카오가 위기에 빠진 시기에 '구원 투수'로 등장했다.김범수 창업자와 20년 넘는 긴 인연을 맺어온 그는 김 창업자의 제안에 올해 1월 카카오 단독 대표로 내정됐다. 이후 7월 홍은택 대표를 각자대표로 선임해 투톱 체제를 갖췄다.남궁 대표는 끊임없이 내부 소통에 힘쓰고 임원 주식 매도 가이드라인을 발표했다. 또 '주가가 15만원이 될 때까지 연봉과 인센티브 지급 일체를 보류하며 최저임금만 받겠다'고 파격 선언을 하는 등 카카오 쇄신에 적극적으로 나섰다.하지만 남궁 대표는 취임 이후 임기 기간 1년을 채우지 못했다. 카카오의 위기 대응 능력이 도마 위에 올랐고 남궁 대표가 책임을 지고 물러나게 됐다. 여기 더해 최근 당뇨신경병증 투병도 부담이 됐던 것으로 보인다.◆경영 손 뗀 김범수 창업자 등판할까1년새 수장이 네 번 바뀌는 '리더십 잔혹사'가 이어지면서 일각에서는 김범수 창업자가 경영 전면에 나서서 사태를 수습해야 한다는 목소리가 나온다.아울러 논란이 생길 때마다 반복적으로 경영진을 교체하는 방식은 한계가 있다는 지적도 있다. 잦은 리더십 개편으로 인해 내부 혼란을 야기하고 사업의 영속성을 저해시킬 수 있다는 우려 때문이다.이에 일각에서는 남궁 대표의 각자대표직 사임으로 김 창업자의 경영 일선 복귀 가능성을 점치고 있다. 김 창업자는 지난 3월 이사회 의장직에서 물러나 경영에 관여하지 않고 있는 것으로 알려졌다.그러나 카카오는 김 창업자의 경영 복귀에 대해 선을 그었다. 이와 관련 홍 대표는 ""김범수 창업자가 경영에 관여 안 하고 있다. 필요에 따라 선택적으로 개입하는 것은 바람직하지 않다""고 했다."
603244,[포토]  카카오게임즈 기대작 '아레스' 사전등록 시작,김소미 기자,2023.06.07 16:50:18,카카오게임즈의 대작 MMORPG '아레스 : 라이즈 오브 가디언즈(이하 아레스)'가 사전등록 시작했다. ⓒ 카카오게임즈[프라임경제] 카카오게임즈(293490)의 대작 MMORPG '아레스 : 라이즈 오브 가디언즈(이하 아레스)'가 사전등록 시작과 함께 수도권 주요 전광판을 점령하며 기대감을 고조시키고 있다.
583640,"카카오, 먹통 피해 접수 기간 5일 연장",박지혜 기자,2022.10.31 10:53:55,"[프라임경제] 카카오(035720)가 '먹통 사태' 피해 접수를 닷새 연장했다.31일 카카오에 따르면 지난달 19일부터 시작한 판교 데이터센터 화재로 인한 서비스 장애 피해 사례 접수기간을 기존 11월1일에서 5일 연장한다. 이에 따라 11월6일까지 피해 접수를 받는다.ⓒ 카카오 피해 접수 채널 캡처다만 카카오는 현재까지 접수된 피해 사례 건수는 구체적으로 밝히지 않았다.앞서 김범수 카카오 미래이니셔티브센터장은 지난달 24일 국회 과학기술정보방송통신위원회 종합감사에 출석해 카카오 먹통 사태와 관련해 현재 4만5000여건의 피해 사례가 접수됐다고 밝혔다.이날 김 센터장은 서비스 보상에 있어서 약관 이상으로 지급할 뜻을 밝히기도 했다. 그는 보상 기준에 대해 ""계열사별로 약관과 약관에 플러스 알파적인 기준을 만들고 있는 것으로 안다""고 말했다.이어 ""유료 서비스는 약관에 따라 약관 이상 보상을 지급했거나 준비하고 있는 것으로 알고 있다""며 ""무료 서비스는 전 세계적으로 선례가 없어서 피해 사례를 접수하는 대로, 정리되는 대로 피해받은 이용자나 이용자 대표 단체를 포함해 협의체를 만들어 조금이라도 도움 될 수 있도록 방안을 마련하겠다""고 덧붙였다.무료 서비스 이용자와 소상공인 등에 대한 보상 정책과 규모는 피해 접수 종료 후 발표할 것으로 전망된다."
522520,"[컨콜] 네이버, 저탄소 경제 동참…""중장기적 ESG 전략 수립""",박지혜 기자,2020.10.29 11:19:41,"[프라임경제] 네이버(035420)는 저탄소 경제에 동참하고자 중장기적인 ESG 전략을 수립 중이라고 밝혔다.한성숙 네이버 대표는 29일 3분기 실적발표 컨퍼런스콜에서 ""네이버는 저탄소 경제에 동참하고자 2040년까지 배출되는 탄소량보다 감축을 더 크게 하는 '카본 네거티브' 목표를 추진할 예정""이라고 말했다.그러면서 ""신종 코로나바이러스 감염증(코로나19)으로 인한 비대면 속 온라인 플랫폼에 대한 사회적 책임 요구가 확대 중""이라며 ""이런 맥락에서 네이버는 환경적 가치 창출을 위한 투자를 강화하고자 ESG 전략을 수립 중""이라고 설명했다.또한, 한 대표는 ""5G 비대면 시대 도래로 데이터 사용량 급증하고 있고, 향후 10년간 네이버의 탄소배출량 급증할 것""이라고 전망했다.이에 네이버는 현재 최고 수준 전력 효율성을 가진 데이터센터, 오피스를 가지고 있지만, 기후변화로 인한 리스크가 발생하지 않도록 추가적 노력이 필요하다고 판단했다.한 대표는 ""재생에너지 확대, 탄소저감 솔루션 투자 등을 적극 검토하고 향후 친환경 투자를 늘릴 것""이라며 ""주주를 비롯한 이해관계자들과 지속적으로 소통해나갈 계획""이라고 강조했다."
556467,"광주 인공지능 집적단지 첫 삽…""AI 기회의 땅""",이인애 기자,2021.11.22 15:53:06,"[프라임경제] 광주광역시와 정부가 실무형 AI 인재를 양성하고 AI 스타트업을 육성하는 등 목표를 가지고 계획한 광주 인공지능 집적단지 첫 삽을 떴다.지역 주력산업(자동차·에너지·헬스케어)과 인공지능을 융합하는 집적단지 조성으로 미래 신산업 육성 및 지역 경제·일자리 혁신에 크게 기여할 것으로 기대하고 있다.광주광역시와 정부가 실무형 AI 인재를 양성하고 AI 스타트업을 육성하는 등 목표를 가지고 계획한 광주 인공지능 집적단지 첫 삽을 떴다. ⓒ 연합뉴스과학기술정보통신부(이하 과기정통부)는 22일 열린 광주 인공지능 집적단지 착공식에 임혜숙 과기정통부 장관이 참석했다고 밝혔다.착공식은 △주제 영상 상영 △임혜숙 과학기술정보통신부 장관의 축사 △이용섭 광주광역시장의 환영사 △집적단지 사업의 경과 보고 및 향후 계획 등의 순서로 진행됐다.광주 집적단지는 '국가균형발전프로젝트'의 일환으로 2020년부터 2024년까지 5년 동안 4000여 억원의 대규모 예산을 투입해 인공지능에 필요한 데이터센터 등의 △인프라 △기업 △인재 등이 집약된 인공지능 생태계를 조성하는 사업이다.정부는 광주광역시와의 협업을 통해 △인공지능 데이터센터 △실증 환경 △창업환경 등이 집약된 집적단지를 조성하고, 인공지능 생태계의 거점으로 육성해 나갈 계획이다.이를 위해 광주광역시 첨단 3지구 내의 1공구에 △대지 4만7256㎡ 규모로 △지하 1층·지상 7층의 실증동 및 창업동 △지상 2층의 데이터센터 등 총 3개동으로 집적단지 시설을 구축 중이며 2023년 완공할 방침이다.집적단지 핵심인프라인 인공지능 데이터센터는 연산량 88.5PF 규모로, 대규모 데이터의 수집·축적뿐만 아니라 다양한 개발도구와 인공지능 반도체 테스트 환경을 제공하는 등 세계적 기술과 혁신적 서비스를 창출할 거점으로 조성될 예정이다.임혜숙 과기정통부 장관은 ""광주가 인공지능 중심도시를 향한 혁신적 도전을 통해, 포스트 코로나 시대의 새로운 산업과 일자리를 만들어내는 세계적인 인공지능 혁신도시로 발전해 나갈 것""이라며 ""광주 인공지능 집적단지가 대한민국의 국가 인공지능 핵심 거점으로 도약해 나갈 수 있도록 적극적으로 지원하겠다""고 말했다."
589809,"카카오, 오늘부터 '먹통 보상' 무료 이모티콘 지급",박지혜 기자,2023.01.05 11:48:18,"[프라임경제] 카카오가 지난해 10월 발생한 '카카오 먹통 사태' 피해 보상 차원에서 전국민을 대상으로 카카오톡 무료 이모티콘 3종을 5일부터 지급한다.카카오 무료 이모티콘 3종. ⓒ 카카오톡 갈무리카카오는 이날 오전 '마음 패키지'라는 이름의 특별 페이지를 열고, 전국민 이용자들에게 이모티콘 3종(영구 이용 1종·90일 이용 2종)을 제공하고 있다.마음 패키지는 △서비스 장애의 원인과 재발 방지 대책을 담은 '다짐보고서' △이모티콘 3종 △임팩트 커머스 카카오메이커스에서 사용 가능한 감사 쿠폰 2종 △카카오톡 데이터 관리 서비스 '톡서랍 플러스'로 구성됐다.카카오 계정을 보유한 국내 번호 이용자라면 오는 20일까지 해당 프로모션 페이지를 통해 받을 수 있다.이모티콘 3종은 영구적으로 사용할 수 있는 춘식이 이모티콘 1종과 90일간 쓸 수 있는 토심이와 토뭉이·망그러진 곰 2종으로 구성됐다.아울러 카카오는 임팩트 커머스 카카오메이커스에서 사용할 수 있는 감사 쿠폰 2종(2000원, 3000원)도 제공한다.이와 함께 카카오 데이터 관리 서비스 ‘톡서랍 플러스’ 100GB 1개월 이용권을 선착순으로 지급한다.마음 보고서에는 지난해 10월15일 SK C&C 판교 데이터센터 화재로 발생한 카카오 서비스 장애 상황과 복구 시점, 장애에 대한 원인과 배경을 담았다.카카오의 다짐 보고서. ⓒ 카카오톡 갈무리한편, 카카오는 전날 공식 소통 채널을 통해 카카오 대란 관련 '다짐 보고서'를 게재했다. 서비스 장애와 관련해 철저한 원인 분석과 재발 방지를 위한 대책을 마련하겠다고 재차 약속했다.카카오는 ""(서비스 장애로) 많은 분들이 어려움을 겪었고, 이를 수습하고 대응하는 과정에서도 많은 분들의 기대에 미치지 못해 큰 불편을 드렸다""고 사과했다.카카오는 △인프라 전문 조직 세팅 △내부 위기 대응 매뉴얼 구축 △카카오 자체 데이터센터 보완 △지난 5년대비 3배이상 투자 등을 약속했다."
