605036,"두나무·LGU+·네이버, 미래 먹거리 '웹 3.0' 공들인다",박지혜 기자,2023.06.27 10:24:19,"[프라임경제] 국내 기업들이 블록체인 등 웹 3.0(Web 3.0) 기술을 새로운 먹거리로 삼고 공을 들이고 있다.웹 3.0 시장은 챗GPT의 등장으로 주춤했지만, 새로운 패러다임의 돌풍이 일고 있다. 앞으로 일상화될 웹 3.0의 핵심은 '탈중앙화'와 '정보의 개인 소유'다.ⓒ 두나무27일 업계에 따르면 두나무는 대체불가능토큰(NFT) 분야 신사업을 지속적으로 이어가고 있다.두나무는 지난해 1월 엔터테인먼트 기업 하이브와 손을 잡고 합작법인 '레벨스(Levvels)'를 설립하며 디지털 기술력과 아티스트 지식재산권(IP)을 접목시켰다.레벨스의 디지털 컬렉터블 플랫폼인 '모먼티카(MOMENTICA)'를 통해 국내외 팬들은 공개된 적 없는 아티스트의 다양한 테이크(디지털 카드)를 수집하거나 감상·교환할 수 있다. 앱스토어 등에서 모먼티카 앱을 다운로드하면 세븐틴 등의 테이크를 수집할 수 있으며 블록체인에 기록돼 원본 증명이 가능하다.두나무에 따르면 지난 2월 선보인 세븐틴의 첫 번째 테이크 '드림(DREAM)' 발매 후 한 달 동안 모먼티카 신규 가입자는 전월 동기 대비 55% 늘었다. 같은 기간 글로벌 회원 비율은 전체 60%를 넘겼고, 아티스트 세븐틴의 팔로워는 3만8000명, 테이크 소지자 수는 6만명 증가했다.이러한 성과에 힘입어 모먼티카는 일본 앱스토어 엔터테인먼트 부분에서 1위를 달성했다.두나무의 메타버스 플랫폼 '세컨블록(2ndblock)'도 다양한 분야에서 활용되고 있다. 시공간의 제약이 없는 가상공간의 특징을 살려 산림 보호에 대한 경각심을 고취시킨 '세컨포레스트' 캠페인이 대표적이다.지난 3월 발생한 튀르키예 지진 피해 복구에도 세컨블록이 활용됐다. 두나무는 유니세프한국위원회와 비트코인 모금을 진행, 투자자들의 구호 모금 현황을 세컨블록에 공개했다. 이 밖에 세컨블록은 컨퍼런스, 기업탐방 등 시공간의 제약 없이 더욱 많은 분야에서 다채롭게 활용될 계획이다.두나무의 블록체인 전문 자회사 '람다256'도 자체 서비스 플랫폼인 '루니버스(Luniverse)'를 통해 블록체인 기술 상용화와 생태계 조성에 앞장서고 있다. 람다256은 △토큰증권 시장을 공략할 '루니버스 STO' △NFT 서비스를 위한 '루니버스NFT' △퍼블릭 메인넷 지원 '루니버스 노바' 등 신규 서비스를 추진 중이다.ⓒ LG유플러스LG유플러스(032640)도 웹 3.0 전환에 속도를 내고 있다. LG유플러스는 지난해 9월 △라이프스타일 플랫폼 △놀이 플랫폼 △성장케어 플랫폼 △SOHO·SME·모빌리티 등 웹 3.0으로 대표되는 미래기술을 '4대 플랫폼'으로 구성하겠다고 밝힌 바 있다.LG유플러스는 람다256과 손을 잡았다. LG유플러스는 서비스 파트너들이 상시 협업 체계를 구축하고, 서비스 파트너들이 개발에만 전념하도록 지원하는 프로그램을 제공하고 있다.또 람다256의 웹 3.0 메인넷 '더밸런스'에 참여해 루니버스에서 제공하는 NFT, 메타버스 등을 활용해 서비스 파트너들과 기술 협력을 추진 중이다.국내 대표 테크 기업인 네이버(035420)도 적극적이다. 손자회사인 네이버제트를 통해 메타버스 플랫폼 '제페토'를 운영하고 있다. 제페토는 현재 글로벌 플랫폼으로 성장해 전세계 3억4000만명 이상이 이용하고 있다.지난해 3월에는 게임 개발사 슈퍼캣과 합작으로 메타버스 플랫폼 '젭'을 선보였는데, 8개월 만에 누적 이용자가 300만명을 돌파했다. 젭은 최대 5만명의 대규모 인원을 동시에 수용할 수 있는 웹 기반 플랫폼이다.제페토를 활용한 NFT 사업도 확장세를 이어가고 있다. 네이버 관계사 라인은 블록체인 사업 자회사 라인테크플러스를 통해 제페토의 NFT를 발행했다. 일본에서 사업을 전개하는 라인은 이미 블록체인 네트워크와 디지털 자산 '핀시아(FNSA)'를 통해 생태계를 구축하고 있다.국내에서는 NFT 제작과 발행, 마케팅, 거래까지 모두 가능한 글로벌 NFT 퍼블리싱 플랫폼 '도시(DOSI)'에서 한정판 식음료 멤버십 NFT를 선보였다. 도시는 NFT 생태계 확장에 앞장서고 있는 자회사 라인넥스트에서 운영하며 글로벌 180여국에 개인 간 거래(C2C) 서비스를 제공하고 있다.지난달 웹 3.0 게임 플랫폼 '게임도시' 정식 출시 후 27일 첫 신작 타이틀을 공개했다."
534952,'당신과 일하기 싫다' 카카오 인사평가 논란…김범수 해결 나설까,박지혜 기자,2021.02.25 13:22:56,"[프라임경제] '당신과 일하기 싫다'는 인사평가 항목으로 인사평가 논란이 불거진 카카오(035720)는 내달 2일 직원들과 개선방안을 논의한다. 김범수 카카오 의장이 직접 인사평가 논란 해결에 나설지 주목된다.김범수 카카오 의장. ⓒ 카카오 나우 매거진 캡처앞서 지난 17일 직장인 익명 커뮤니티 블라인드에 카카오 직원으로 추정되는 이용자의 유서 형식의 글로 '직장 내 괴롭힘' 논란이 일었다.이 작성자는 ""지금 삶은 지옥 그 자체이고, 너무 힘들고 지친다""며 ""회사의 왕따 문제가 없어졌으면 좋겠다""고 호소했다.이어 ""상위평가에도 썼지만 바뀌는 건 없었다""며 ""지옥같은 회사생활을 만들어준 당신들을 지옥에서도 용서하지 못한다""고 적었다.지난 17일 블라인드에 올라온 유서 형식의 카카오 직원 추정 글. ⓒ 블라인드카카오는 극단적 선택을 한 직원이 없다고 밝혔고 원글은 현재 삭제된 상황이다.하지만 사회관계망서비스(SNS)와 온라인 커뮤니티에 해당 글이 확산되면서 논란은 가라앉지 않았다.바로 다음 날 블라인드에 '용기내어 폭로합니다. 카카오의 인사평가는 살인입니다'라는 추가 폭로 글이 게시됐다.지난 18일 블라인드에 올라인 카카오 직원 추정 글. ⓒ 블라인드카카오 직원으로 추정되는 작성자는 ""카카오는 평가결과에 '이사람과 일하기 싫습니다'를 수집해 전 직원에게 제공한다""며 ""전사와 비교까지 해주며 '당신은 바닥'이라고 낙인찍듯 짓누른다""고 폭로했다.그러면서 ""360도 다면평가를 하나 조직장은 그 내용을 참고만 할 뿐 본인이 원하는대로 평가결과를 산정할 수 있다""며 ""조직장 눈 밖에 나면 그 순간부터 지옥이 시작된다""고 토로했다.이 작성자는 조직장의 괴롭힘을 상위평가에 적은 후 투명인간 취급을 받아 현재 정신과 치료를 받고 있다고 밝혔다.폭로글이 이어지자 또다른 블라인드 이용자는 '카카오 인사평가 시즌에 유서가 올라오는 이유'라는 제목으로 글을 올렸다.블라인드에 게재된 '카카오 인사평가 시즌에 유서가 올라오는 이유'라는 제목의 글. ⓒ 블라인드해당 글에서는 '함께 일하고 싶지 않다'라고 평가받은 수가 적힌 평가결과지 일부를 공개하며 ""유서가 안 나오는 게 이상하다""라고 꼬집었다.댓글에는 해당 평가에 대한 후속조치도 없고 '함께 일하고 싶지 않다' 숫자만 공개하는 제도라는 지적이 나왔다.카카오 측은 전 직원 중 '함께 일하고 싶지 않다'라고 응답한 비율은 1%대에 불과하며, 동료평가도 참고자료 중 하나로만 활용된다는 입장이다.인사평가 논란이 지속되는 가운데 김범수 카카오 의장이 직접 인사평가 문제 해결에 나설지 주목된다.25일 오후 2시 김범수 카카오 이사회 의장은 온라인으로 직원 간담회를 진행한다.이번 간담회는 기부 선언과 관련한 간담회로, 페이, 뱅크, 모빌리티 등 카카오 계열사 직원들까지 약 6000명이 모인다. 계열사 직원들을 대상으로 하는 자리로 본사 문제를 언급할 가능성은 낮아 보인다.카카오 관계자는 ""인사평가 관련 질문이 나올 수는 있는데, 행사 취지가 기존에 기부 관련 직원들 의견을 듣는 자리로 마련됐다""고 설명했다.아울러 ""행사에 참여하는 자회사들은 인사제도, 보상체계가 달라서 전체 다 관통하는 주제는 아니다""라며 ""질문이 나오면 이야기는 나올 수 있다""고 부연했다.인사평가 논란 이후 제도 개선에 대해서는 ""3월2일 카카오 전 직원이 참여하는 오픈톡 행사가 있다""면서 ""전 직원들이 모여 인사제도 평가제도에 대한 개선방안을 논의할 예정""이라고 말했다."
531174,"김범수 카카오 의장, 아내·자녀 등에 33만주 증여",박지혜 기자,2021.01.19 21:14:33,"[프라임경제] 김범수 카카오(035720) 의장이 자신이 보유한 주식 33만주를 아내, 자녀, 친인척에게 증여했다.김범수 카카오 의장. ⓒ 카카오 나우 매거진 캡처19일 카카오는 김 의장 소유 주식이 1250만631주에서 1217만631주로 감소했다고 공시했다.이날 종가(44만원) 기준 약 1452억원 규모다. 아내 형미선씨, 아들 김상빈씨, 딸 김예빈씨에게 각각 6만주씩 증여했다.또한, 친인척 11명에게 총 15만주를 증여했다. 김행자(2만5000주)·김명희(2만800주)·김대환(4200주)·김화영(1만5000주)·장윤정(5415주)·김예림(4585주)·김은정(1만5900주)·김건태(4550주)·김유태(4550주)·형미숙(1만9000주)·박효빈(6000주)씨 등이 증여받았다.김 의장의 주식보유 비율은 14.2%에서 13.74%로 감소했다."
598741,"카카오, 강릉 산불 피해 복구에 10억원 기부",박지혜 기자,2023.04.14 15:47:29,"[프라임경제] 카카오(035720)가 강원도 강릉 지역의 산불 피해 복구 지원에 나선다. 김범수 미래이니셔티브 센터장도 동참한다.ⓒ 카카오카카오는 14일 강원도 강릉 지역에서 발생한 산불 피해 복구 및 이재민 지원을 위해 희망브리지 전국재해구호협회에 10억원을 기부한다고 밝혔다. 김범수 미래이니셔티브센터장도 뜻을 함께 하기 위해 10억원 상당의 개인 보유 주식을 기부한다.카카오의 사회공헌 플랫폼 '카카오같이가치'에서도 지난 11일부터 전국재해구호협회, 어린이재단과 함께 산불 피해 복구 지원을 위한 긴급 모금 캠페인을 진행하고 있다. 현재까지 3만명이 넘는 이용자들이 기부에 함께 참여하고 있다.카카오와 김범수 센터장의 기부금 20억원과 카카오같이가치 이용자의 모금액은 전국재해구호협회를 비롯한 여러 기관으로 전달돼 산불 피해 지역 이재민을 위한 생수, 먹거리 등의 식료품과 담요 등의 생필품, 구호키트 지원에 쓰인다. 삶의 터전을 잃어버린 이재민들의 주거 및 생계 지원금으로도 사용된다.모금 참여를 희망하는 이용자는 모금함 페이지 또는 개별 모금함을 통해 직접 기부하거나 댓글 등을 통해 동참할 수 있다.이용자가 모금함 페이지에 하단에 응원 댓글을 작성할 때마다 카카오가 댓글 1건 당 1000원을 기부한다. 개별 모금함을 클릭해 댓글, 응원, 공유 시 1건 당 100원을 추가로 기부한다.홍은택 카카오 대표는 ""많은 이재민들이 고통을 겪고 있는 상황임을 감안해 모금 캠페인 진행과 더불어 카카오와 김범수 미래이니셔티브 센터장도 직접 기부를 결정했다""며 ""피해 주민들의 빠른 일상 회복과 안전한 복구 작업에 도움이 되길 희망한다""고 말했다."
563928,"CJ ENM, 콘텐츠 넘어 NFT로 영토 확장…블록체인 기술력 확보 관건",이인애 기자,2022.03.29 17:40:22,"[프라임경제] CJ ENM(035760)이 공식적으로 NFT(대체불가토큰) 사업에 출사표를 던졌다. 암호자산 관련 신규 사업 추진을 통한 영토 확장 계획을 밝힌 CJ ENM은 콘텐츠 제작 역량과 디지털 플랫폼 강화 등 혁신성장 방안도 함께 제시했다.서울 마포구 CJ ENM 상암센터에서 CJ ENM은 29일 제28기 정기 주주총회를 개최했다.서울 마포구 CJ ENM 상암센터에서 CJ ENM은 29일 제28기 정기 주주총회를 개최했다. ⓒ CJ ENMCJ ENM은 이날 정관에 △블록체인 기술 기반 암호자산(NFT 포함) 관련 매매 및 중개업 △블록체인 기술 기반 암호자산(NFT 포함) 관련 콘텐츠 기획·제작·유통·중개·마케팅업·광고대행업 등의 사업 목적을 신규로 추가했다.물론 당장 NFT와 관련된 성과를 내기엔 쉽지 않을 전망이다. 블록체인 기술력이 부족할 뿐만 아니라 사업내용 역시 구체적으로 정해진 바 없다는 입장이다.그러나 지난 22일 ""사업 다각화를 위해 메타버스·NFT 등 디지털 신규 사업을 구상 중""이라고 밝혔다. 당시 CJ ENM은 ""치열한 글로벌 경쟁에서 생존하기 위해 미래 성장 기반이 될 신규 사업 진출이 반드시 필요한 상황""이라고 강조했었다.이같은 최근 행보과 정관 변경에 비춰 조만간 사업 확장을 위한 본격적 움직임이 있을 것으로 전망된다.강호성 CJ ENM 대표는 ""올해는 글로벌 경쟁력을 강화하고 회사의 건강한 성장을 목표한다""고 말했다. 이들은 지난해 코로나 펜데믹 상황에서도 연간 기준 사상 최대 영업이익을 달성했다. 콘텐츠 사업의 디지털 매출 고성장과 커머스 부문 자체 브랜드 성장에 힘입은 결과다.CJ ENM의 2021년 연간 매출은 전년 대비 4.8% 증가한 3조5500억원·영업이익은 9.1% 증가한 2970억원을 달성했다.이 기세를 몰아 올해엔 글로벌 경쟁력 강화에 집중할 계획이다. 자체 브랜드 유통 채널을 다각화하고 모바일 라이브 커머스 사업에도 힘을 실을 예정이다.강 대표는 ""지난해는 CJ ENM이 콘텐츠와 커머스 사업 경쟁력을 강화하며 더 큰 도약으로 이끈 한 해였다""고 자평하며 ""(경제) 불확실성 속에서도 CJ ENM은 글로벌 경쟁력을 갖춘 웰메이드 콘텐츠 IP를 창출하고 차별화된 상품 기획과 자체 브랜드 성장을 통해 좋은 성과를 창출하겠다""고 말했다.한편, 이날 주총에서는 △재무제표 승인의 건 △정관 일부 변경 △사내이사(윤상현 커머스 부문 대표) 신규 선임 △이사 보수한도 승인 △임원 퇴직금 규정 일부 변경 등이 모두 원안 가결됐다."
556012,네이버 다음 첫 화면서 연합뉴스 퇴출,이인애 기자,2021.11.13 13:36:48,"[프라임경제] 앞으로 네이버와 다음 첫 화면에서 연합뉴스 기사를 볼 수 없게 된다. 뉴스제휴평가위원회가 기사형 광고(돈을 받고 대가로 쓴 기사) 2000여건을 송출한 연합뉴스에 '강등'을 결정한 것.이에 따라 연합뉴스는 약 100억원 상당의 수입을 잃게 될 전망이다. 연합뉴스는 이 같은 결정이 부당하다며 대응을 예고했다.앞으로 네이버 첫 화면에서 연합뉴스 기사를 볼 수 없게 된다. ⓒ 연합뉴스뉴스제휴평가위원회 심의위원회(이하 심의위원회)는 12일 뉴스 제휴 및 제재 심사를 포함한 전원회의를 열고 벌점이 누적된 9곳의 매체에 대한 재평가를 진행했다. 심의위원회는 네이버와 카카오의 뉴스 제휴 심사를 담당한다.이들은 올해 3월부터 8월까지 부정행위로 부과받은 누적벌점이 총 6점 이상인 9개(네이버 9개·카카오 2개) 매체를 대상으로 재평가를 실시했다.그 결과 뉴스검색 매체는 모두 계약해지되었고 뉴스콘텐츠(CP) 2개·뉴스스탠드 1개 매체는 제휴 지위가 변경됐다.CP에서 강등된 매체 중 하나는 기사형 광고를 대량 송출해 32일 노출 중단 제재를 받았던 연합뉴스가 포함된 것으로 알려졌다. 이들은 포털로부터 기사 구독에 따른 수익을 배분 받는 CP사로서 매년 100억원의 수입을 얻고 있었다. 이번 제재로 연 100억원 규모의 금전적 손해뿐 아니라 포털뉴스 유통 시장에서 존재감을 상실하게 됐다.네이버에서는 뉴스스탠드로, 다음에서는 검색제휴 매체로 강등됐다. 두 포털 내에서 기사 검색은 여전히 가능하지만 첫 화면에 노출되지 못 하면서 기사 파급력이 약해질 것이라는 전망이 우세한 상황이다.이에 성기홍 연합뉴스 사장은 입장문을 통해 ""네이버와 카카오 양대 포털 공간에서 연합뉴스와 독자들의 만남을 사실상 차단하는 남득할 수 없는 조치""라며 ""연합뉴스는 향후 이번 사태에 대해 법적 조치를 비로해서 다각적인 대응에 나설 것""이라고 밝혔다.일각에서는 국가기간뉴스통신사로서 정부로부터 매해 300억원 가량의 구독료를 받고 있는 연합뉴스가 행사 일정을 고지하거나 제품을 소개하는 광고 홍보성 기사를 송출해 왔다는 점에서 마땅한 제재라는 시각도 나온다.심의위원회는 제휴 규정에 따라 △기사 생산량 △자체 기사 비율 △윤리적 실천 의지의 '정량평가(20%)'와 △저널리즘 품질 요소 △윤리적 요소 △이용자 요소 등이 포함된 '정성평가(80%)'로 평가를 진행한다.평가 작업에는 한 매체당 무작위로 배정된 평가위원이 최소 9명씩 참여한다. 위원들의 평가점수 중 최고점수와 최저점수를 제외한 평균 점수가 '뉴스콘텐츠 제휴'의 경우 80점, '뉴스스탠드 제휴'의 경우 70점, '뉴스검색 제휴'의 경우 60점 이상인 매체가 평가에 통과하는 방식이다.김동민 심의위원회 위원장은 ""제평위 6기 출범 이후에 재평가 통과 비율은 전년과 비교해 높아졌지만 재평가 매체가 줄어든 영향도 있었다""며 ""기존 매체의 재평가는 위원들의 평가가 조금 더 엄격하게 진행되고 있는 것으로 보인다. 특히 양질의 기사에 대한 뉴스 소비자들의 니즈를 충족시켜야 한다는 합의가 형성 되고 있는 것 같다""고 말했다."
536868,"카카오 김범수, 더기빙플레지 참여…""재산 절반 이상 사회환원""",박지혜 기자,2021.03.16 09:59:21,"[프라임경제] 김범수 카카오 이사회 의장이 세계적인 자발적 기부 운동 '더기빙플레지'(The Giving Pledge)에 참여해 재산 절반 이상 기부를 공식 서약했다.김범수 카카오 이사회 의장. ⓒ 카카오카카오(035720)는 김범수 의장이 16일 더기빙플레지의 220번째 기부자로 이름을 올렸다고 밝혔다.더기빙플레지는 2010년 빌게이츠 마이크로소프트 회장과 그의 아내 멀린다 게이츠, 워런 버핏 버크셔해서웨이 회장이 재산 사회 환원을 서약하며 시작한 자발적 기부운동이다. 현재 25개국 220명이 서약했다.김 의장은 기빙플레지 서약서에서 ""1995년 마이크로소프트 창립 20주년 특집 기사를 보고 창업의 꿈을 키웠던 청년이 이제 기빙플레지 서약을 앞두고 있다""면서 ""기사를 처음 접했던 때 만큼이나 설렘을 느낀다""고 말했다.그러면서 ""기부 서약이라는 의미 있는 기회를 마련해준 빌·멀린다 게이츠 부부와 워런 버핏, 그리고 앞선 기부자에게 존경과 감사의 인사를 전한다""고 언급했다.이어 ""저와 제 아내는 오늘 이 서약을 통해 죽기 전까지 재산의 절반 이상을 사회에 환원하려고 한다""며 ""자녀들과 오랜 시간 동안 함께 고민하고 이야기 나눴던 여러 주제들 가운데 사회문제 해결에 보탬이 될 수 있는 일부터 기부금을 쓸 생각""이라고 밝혔다.또한, 김 의장은 ""목표했던 부를 얻고 난 뒤 인생의 방향을 잃고 한동안 방황해야 했으나 '무엇이 성공인가'라는 시를 접한 뒤 앞으로의 삶에 방향타를 잡을 수 있었다""며 ""성공의 의미를 다시 새겼던 10여년 전 100명의 창업가(CEO)를 육성·지원하는 프로젝트를 시작한 뒤, 카카오 공동체라는 훌륭한 결실을 맺으며 대한민국 많은 사람들의 삶에 영향을 미치게 됐다""고 회상했다.김 의장은 서약을 시작으로 기업이 접근하기 어려운 영역의 사회문제 해결에 나설 계획이다.그는 ""사회적 기업이나 재단을 통해 사회문제 해결에 적극적으로 나서는 100명의 혁신가를 발굴해 지원하고, 미래 교육 시스템에 대한 적절한 대안도 찾으며, 빈부 격차로 기울어진 운동장을 바로 세우고자 노력하고 아프고 힘든 이들을 돕는 사람들에 대한 지원을 아끼지 않을 것""이라고 밝혔다.끝으로 ""우리가 걸어가는 길이 세상을 바꾸기 위해 도전하는 또 다른 혁신가들의 여정에 보탬이 되기를 기대하며 서약에 흔쾌히 동의하고 지지해준 가족들에게 이 자리를 빌어 사랑하고 고맙다는 말을 전하고 싶다""고 말을 보탰다.김 의장은 지난달 8일 카카오 전 직원에게 보낸 카카오톡 신년 메시지를 통해 살아가는 동안 재산의 절반 이상을 사회문제 해결을 위해 기부하겠다고 밝힌 바 있다."
