607159,[캐리해볼까] 넷마블·컴투스·한빛소프트 외,김소미 기자,2023.07.17 17:05:54,"[프라임경제]엔씨소프트문화재단에서 펴낸 '게임사전'에 따르면 '캐리(carry)'는 '게임을 아군의 승리로 이끌어 가는 플레이어 또는 플레이어의 행위'를 뜻한다. 캐리 강도가 높을 경우 '하드 캐리'라고 하는데, 흔히 '멱살 잡고 캐리한다'고도 표현한다. 기사를 보는 플레이어들이 하드 캐리할 때까지 매일 유용한 게임 정보를 제공한다.◆넷마블-틱톡, 신작 '신의 탑: 새로운 세계' 챌린지 진행넷마블(251270)은 동영상 플랫폼 틱톡과 함께 오는 26일 출시하는 기대 신작 RPG '신의 탑: 새로운 세계'의 틱톡 챌린지를 진행한다.이용자는 틱톡에서 '신의 탑: 새로운 세계' 필터를 통해 화면에 떠다니는 '신의 탑' 캐릭터 버블을 터뜨려 점수를 획득, 이를 통해 라크(신의 탑 캐릭터)로 변신해볼 수 있다.챌린지 참가 희망자는 해당 필터를 이용해 영상을 찍어 해시태그(#넷마블신의탑변신챌린지)와 함께 본인 틱톡 계정에 게시하면 된다.넷마블은 동영상 플랫폼 틱톡과 함께 오는 26일 출시하는 기대 신작 RPG '신의 탑: 새로운 세계'의 틱톡 챌린지를 진행한다. ⓒ 넷마블넷마블에 따르면 '신의 탑: 새로운 세계'는 조회수 60억회를 돌파한 네이버웹툰 '신의 탑'을 기반으로 한 수집형 애니메이션 RPG다. 원작을 압도적 퀄리티의 그래픽으로 한 편의 애니메이션처럼 즐길 수 있고, 쉽고 간편한 게임성을 내세운다. 특히 '새로운 세계'라는 부제에 걸맞게 원작자 SIU와 협업, 게임만의 고유한 스토리도 선보인다.오는 25일까지 사전등록에 참여하면 △11만9000원 패키지 상품 △SSR등급 '스물다섯번째 밤' 캐릭터 △캐릭터 소환 티켓 10개를 제공한다.한편 '신의탑: 새로운 세계'는 오는 26일 전세계(중국, 베트남 등 일부 국가 제외) 구글플레이, 애플 앱스토어에 출시할 계획이다.◆컴투스 신작 '낚시의 신: 크루' 이색 콘텐츠 공개컴투스(078340) 자사 3D 레포츠 게임 '낚시의 신: 크루(Ace Fishing: Crew)' 오는 20일 글로벌 출시를 앞두고 있다.'낚시의 신: 크루'는 글로벌 7000만 다운로드를 자랑하는 '낚시의 신' IP를 기반으로, 3D 그래픽으로 구현된 바닷속을 1인칭 시점으로 탐험하며 다양한 어종과 해양 환경을 눈으로 보고 낚시를 즐길 수 있는 수집형 레포츠 게임이다.이외에도 캐릭터를 수집하고 성장시키는 시스템부터 직접 잡은 물고기를 이용해 식당을 운영하거나 대회 등에 참가해 다른 유저와 경쟁을 펼치는 등 여러 콘텐츠를 보유하고 있어 낚시에 익숙지 않은 사람들도 누구나 재밌게 즐길 수 있다.컴투스는 자사 3D 레포츠 게임 '낚시의 신: 크루(Ace Fishing: Crew)' 오는 20일 글로벌 출시를 앞두고 있다.컴투스는 낚시뿐만 아니라 코미디, 게임 등 여러 인플루언서와 함께 '낚시의 신: 크루'의 특징과 재미를 알리는 다양한 콘텐츠를 선보인다.아프리카 TV와 함께 유명 게임 및 낚시 인플루언서들과도 협업을 펼친다. 이들과 함께 진행된 이번 콘텐츠는 실제 낚시와 게임인 '낚시의 신: 크루'가 접목된 형식으로 진행됐다.'낚시의 신: 크루'의 손맛과 재미를 시청자들에게 전달할 예정이다. 본편 VOD는 게임 출시 하루 전인 19일부터 게임 공식 유튜브와 각 BJ들의 채널 등을 통해서 순차 공개될 예정이다.◆소울타이드, 신규 상시 콘텐츠 '낚시' 추가한빛소프트(046080)가 서비스하는 모바일 서브컬처 게임 '소울타이드'가 오는 17일 점검을 통해 신규 상시 콘텐츠인 '낚시'를 업데이트한다.소울타이드에 따르면 게임 내 '저택'에서 수행할 수 있는 임무에 낚시가 추가된다. 7챕터를 클리어 한 유저는 업데이트 후 해당 콘텐츠를 바로 이용 가능하다.저택에서 제작하는 '정련석'으로 낚싯대를 구매하고 낚싯대 사용 횟수만큼 물고기를 잡을 수 있다. 물고기 도감을 완성해 나가면 보유 중인 모든 인형의 △공격력 △방어력 △체력이 영구 상승한다.모바일 서브컬처 게임 '소울타이드'가 오는 17일 점검을 통해 신규 상시 콘텐츠인 '낚시'를 업데이트한다. ⓒ 한빛소프트또한 낚은 물고기를 방생하면 '물고기 무늬 은화'를 획득할 수 있는데 이를 사용해 △인형 소환티켓 △성장 재료 △골드 등의 소모성 아이템으로 교환 가능하다.소울타이드는 이와 함께 신규 SSR 서번트인 '저항하는 라이주'를 선보인다. 이 서번트는 번개 대미지를 크게 높여줘 번개 딜러 중심인 파티의 공격력 향상에 도움이 된다.유저들은 오는 24일까지 별의 전당 소환에서 '저항하는 라이주'또는 '흑요석 기사'를 획득할 수 있다.이외에도 출시 100일 전야제 이벤트로 7월31일 점검 전까지 인형 코스툼 10종을 할인 판매한다. 유저들은 상점에서 코스튬 코인을 특가에 구매 후 원하는 코스튬으로 교환할 수 있다.◆배틀그라운드 모바일 '2023 PMWI' 태국 뱀파이어 연속 우승크래프톤(259960)이 배틀그라운드 모바일 국제 대회 '2023 배틀그라운드 모바일 월드 인비테이셔널(이하 2023 PMWI)'을 태국 '뱀파이어 이스포츠'의 2년 연속 우승으로 성황리에 마쳤다고 17일 밝혔다.2023 PMWI는 전 세계 각 지역별 리그에서 우승을 차지한 팀들과 각 지역 팬 투표로 선정된 팀들이 참가해 총 300만 달러(약 38억원)의 상금을 두고 세계 최강의 팀을 가린 대회다. 이번 대회는 '게이머스 에이트'와 연계돼 사우디아라비아 리야드에서 지난 16일까지 진행됐다.우승팀인 태국 '뱀파이어 이스포츠'는 올스타 스테이지에서부터 총 4치킨을 획득하며 1위로 메인 토너먼트에 진출했으며, 메인 토너먼트에서도 4개의 치킨으로 총점 227점으로 2년 연속 PMWI 우승 트로피를 들어 올렸다.태국 '뱀파이어 이스포츠'는 올스타 스테이지에서부터 총 4치킨을 획득하며 1위로 메인 토너먼트에 진출했으며, 메인 토너먼트에서도 4개의 치킨으로 총점 227점으로 2년 연속 PMWI 우승 트로피를 들어 올렸다. ⓒ 크래프톤총 6일간의 대회 일정 내내 1위를 단 한 번도 내주지 않으며, 그야말로 압도적인 경기력으로 대회를 지배했다. 올스타 스테이지와 메인 토너먼트 합산 총 54만 달러(약 6억9000만원)의 상금을 거머쥐었다.2위를 차지한 중국의 '식스 투 에잇'은 메인 토너먼트 1일차를 4위로 마감했지만 2일차에 순위를 2위까지 끌어올렸고, 마지막 3일차까지 순위를 지켜내면서 상금 20만 달러(약 2억5000만원)를 획득했다.한국 대표 자격으로 PMWI에 2년 연속 출전한 '디플러스 기아'는 올스타 스테이지에서 2위를 기록하며, 대회를 산뜻하게 출발했다. 하지만 메인 토너먼트에서 좋은 흐름을 끝까지 이어가지 못하면서 총점 96점으로 대회를 9위로 마감했다.한편 2023 PMWI를 비롯한 배틀그라운드 모바일 이스포츠에 대한 자세한 내용은 배틀그라운드 모바일 이스포츠 홈페이지에서 확인할 수 있다."
560085,"'쇼핑하면 기부는 덤' 포인트팡, 메타버스 온라인 론칭 행사",이인애 기자,2022.01.24 14:44:15,"[프라임경제] 쇼핑 금액의 3~5%를 포인트로 돌려주고, 기부할 수 있도록 해주는 서비스가 메타버스 플랫폼에서 소개된다.24일 김기연 포인트팡 대표는 자체 제작한 메타버스 공간에서 '포인트팡 앱' 온라인 론칭 행사를 개최한다고 밝혔다.김기연 포인트팡 대표는 자체 제작한 메타버스 공간에서 '포인트팡 앱' 온라인 론칭 행사를 개최한다고 밝혔다. ⓒ 포인트팡김기연 포인트팡 대표를 포함한 임직원들(김태호·성대근)은 이번 행사에 아바타로 참여해 포인트팡 론칭을 축하하는 자리를 마련한다.행사에서는 포인트팡과 관련된 각종 홍보물·영상 등을 확인할 수 있으며 김기연 대표의 가상 캐릭터가 단상 위로 등장해 AI 음성 데이터가 입력된 영상으로 포인트팡의 핵심 기능에 대하여 선보일 예정이다.쿠팡 파트너스 제휴처인 포인트팡을 통해 쿠팡 상품을 구매할 시 구매 금액의 3~5%를 포인트로 받을 수 있다. 리워드 과정에서 자체 검수 프로그램을 통해 구매내역을 검토하여 포인트를 지급하는 서비스다.이를 통해 적립된 포인트는 포인트팡의 주요 서비스(예금·기부·선물·교환)를 이용하는 데 쓸 수 있다. 추후 다방면으로 관련 서비스를 제공하기 위해 많은 노력을 기울이고 있다는 게 포인트팡 측 설명이다.포인트팡의 또 다른 핵심 기능은 '쇼핑하며 모은 나의 행복을 함께 나누기'다. 쇼핑을 통해 모은 포인트를 통해 기부하는 형식이다.김태호 포인트팡 총괄이사는 ""최근에 쇼핑을 언제 해 보았는지, 한 달에 얼마나 하는지를 생각해 보면 일반적으로 기부나 봉사의 경우 쉽사리 시도하기가 어려움을 알 수 있다""며 ""기부는 금액은 중요치 않다고 생각하기에 포인트팡을 통해 쇼핑하고, 그에 따른 보상으로 쌓이는 포인트로 조금이나마 기부의 재미와 행복을 느낄 수 있을 것으로 생각한다""고 말했다.이어 ""기부가 생활이 된다면 이 세상은 조금이나마 더욱 행복해질 것이라 믿기에 그 첫걸음을 포인트팡에서, 포인트팡과 함께 시작해 주셨으면 좋겠다""고 전했다.성대근 포인트팡 CTO(최고기술책임자)는 ""한 번의 쇼핑으로 잠깐 즐겁고 마는 사이트가 아닌 쇼핑을 통해 또 쇼핑을 즐기고, 기타 서비스를 통해 함께 기쁨을 나누어 오랫동안 따뜻한 마음을 간직할 수 있는 사이트가 되길 바란다""며 ""처음 포인트팡을 시작할 때의 마음 그대로 회원들에게 포인트를 모으는 즐거움과 다양한 기쁨을 선물할 수 있는 사이트가 되길 바란다""고 밝혔다."
596060,"카카오, 오픈채팅 정보유출 의혹 업체 고발",박지혜 기자,2023.03.16 17:53:36,"[프라임경제] 카카오(035720)가 최근 오픈 채팅방에서 이용자 개인정보를 유출해 거래했다는 의혹이 제기된 업체를 경찰에 고발했다.카카오는 최근 오픈 채팅방에서 이용자 개인정보를 유출해 거래했다는 의혹이 제기된 업체를 경찰에 고발했다. ⓒ 카카오16일 카카오에 따르면 카카오는 지난 15일 업무방해 등 위법행위 혐의로 성남 분당경찰서에 A업체 고발을 접수했다.카카오는 ""불법적인 행위에 강력하게 대응해 이용자들이 안심할 수 있도록 노력할 계획""라고 밝혔다.앞서 이달 초 카카오톡 오픈채팅방에서 참여자들의 실명·전화번호를 추출해 판매한다는 광고글들이 온라인 사이트에 게재됐다.해당 업체는 개인정보 구매 의사를 밝히는 이들을 텔레그램으로 유인해 건당 2만~3만원의 가격을 제시하는 것으로 알려졌다. 업체가 먼저 데이터 추출 인증을 하고, 구매 희망자가 일부 금액을 선입금하면 나머지 개인정보들을 제공받는 식이다.카카오는 톡 유저 아이디를 추출하는 어뷰징 행위를 인지한 후 더는 사용자이름 정보를 추출할 수 없도록 조치했다.카카오는 일부 일련번호 형태의 톡 유저 아이디(ID)가 유출된 사실은 있지만, 이를 역추적해 신상정보는 알 수 없다고 반박했다.카카오 관계자는 ""오픈채팅 상에서 참여자의 전화번호나 이메일, 대화내용 등을 확인하는 것은 불가능한 사안으로, 오픈채팅 외의 수단을 활용한 것으로 판단하고 있다""고 설명했다.한편, 개인정보보호위원회(이하 개인정보위)는 지난 14일 카카오톡 오픈 채팅방의 개인정보 유출과 관련 조사에 착수했다.개인정보위는 카카오톡 오픈채팅방의 보안 취약점과 개인정보 유출경위와 규모, 기술적·관리적 보호조치 등 개인정보 보호법 위반여부에 대해 조사한다."
545258,"""네이버 들어와 폭로할까""…'정권·포털 유착' 두고 여야 공방",박지혜 기자,2021.05.27 16:53:56,"[프라임경제] 국회 과학기술정보방송통신위원회가 27일 개최한 '포털 알고리즘 관련 공청회'에서 정권과 포털업체 간 유착 주장을 놓고 여야가 공방을 벌여 파행을 거듭했다.포털 알고리즘 관련 공청회가 27일 오전 국회 과학기술정보방송통신위원회에서 열리고 있다. ⓒ 연합뉴스이날 박성중 국민의힘 의원은 ""연달아 포털의 뉴스, 대외 담당 출신이 청와대 고위공직자로 선임되는 사실만 봐도 여당과 청와대가 포털과 모종의 유착관계, 포털 길들이기라고 생각할 수밖에 없다""고 지적했다.네이버(035420) 부사장 출신인 윤영찬 더불어민주당 의원이 청와대 국민소통수석을 맡고, 청와대 디지털소통센터장에 포털 출신이 잇달아 임명된 사례를 가리킨 것이다.박 의원은 ""포털이 알고리즘을 아무리 중립적으로 만들어도 무용지물일 수밖에 없다""면서 정권과 포털의 유착 의혹을 제기했다.허은아 국민의힘 의원도 ""윤영찬 당시 네이버 뉴스 담당 임원이 민주당 의원으로 진출했고 고주희 전 네이버 뉴스제휴팀장이 청와대로 옮긴 사실을 봐도 민주당 정권이 네이버와 모종의 유착 관계가 있다는 얘기가 있다""고 주장했다.이에 조승래 더불어민주당 의원은 ""그렇게 의심할 수 있다""면서도 ""디지털 커뮤니케이션과 관련해 전문성을 가진 분들이 정부에서 일하는 것도 권장할 만한 일이라고 본다""고 말했다.그러면서 ""어느 정당에서는 막 포털 사업자를 찾아가는 항의 방문까지 하지 않느냐""고 꼬집었다.허 의원은 윤 의원의 '포털 갑질' 논란을 거론하며 언성을 높였다.지난해 9월 국회 본회의장에서 윤 의원이 누군가에게 텔레그램 앱으로 메시지를 보내는 장면이 카메라에 포착됐다.사진에는 윤 의원이 주호영 국민의힘 원내대표 발언 기사가 걸린 포털 다음(Daum) 모바일 메인 화면 캡처 이미지를 보내자 상대방이 ""주호영 연설은 바로 메인에 반영되네요""라고 답변하는 모습이 담겼다.윤 의원은 ""이거 (다음 모회사인) 카카오(035720)에 강력히 항의해주세요""라며 ""카카오 너무하는군요. 들어오라 하세요""라는 메시지도 적어 보냈다. 이는 카카오 관계자를 국회로 부르라고 지시한 것으로 풀이됐다.당시 국민의힘은 이 사건을 두고 '포털장악 시도'라고 강하게 비판했다.허 의원이 이 사건을 거론하며 비난하자 윤 의원은 ""(네이버 재직 시절)당시 가장 많은 압력을 행사했던 분들은 국민의힘의 전신 당""이라며 ""'네이버 들어오라'고 한 사람 누군가요? 폭로할까요?""라고 반박해 소란이 벌어졌다.한준호 더불어민주당 의원은 ""얼마 되지 않는 시간에 공청회를 진행하고 있는데 상대 의원에 대해 질의하는 데 몇분을 소요하고 있나""면서 불만을 드러냈다."
603667,"한빛소프트, MMORPG '에이카' 튀르키예 서비스 계약",김소미 기자,2023.06.13 09:12:07,"[프라임경제] 한빛소프트가 서비스하는 PC 온라인 MMORPG '에이카'가 튀르키예(터키) 서비스 계약을 체결하며 중동과 북미 진출 발판도 마련했다고 13일 밝혔다.에이카는 씨비엠인터랙티브와 글로벌 서비스 계약을 체결함에 따라 올해 하반기 튀르키예 서버스를 시작으로 중동과 북미를 중심으로 한 글로벌 시장에 에이카를 선보일 계획이다.ⓒ 한빛소프트씨비엠인터랙티브는 전 세계에 게임 서비스를 제공하는 전문 퍼블리셔로 한국 본사와 튀르키예 지사를 운영하고 있으며 20개 이상의 PC 및 모바일 게임에 대한 다양한 경험을 가진 전문가들로 구성됐다.한빛소프트에 따르면 이 회사는 경쟁력 있는 국내 게임을 소싱하면서 현지 운영진을 통해 국가에 맞게 현지화 작업을 진행하고, 유저들과의 밀접한 소통을 강조하며 성장하고 있다.또한 튀르키예는 중동 국가들과 문화를 공유하고 지리적으로도 가까워, 이 시장 진출을 통해 에이카 서비스 지역 확대의 교두보 역할을 할 수 있을 것으로 전망한다.중동 지역은 세계에서 가장 빠르게 성장 중인 곳으로 꼽힌다. 한국 게임에 대한 이용시간과 소비액이 높으며 온라인 MMORPG에 대한 선호도가 높다는게 회사 측 설명이다.ⓒ 에이카에이카 관계자는 ""다수의 글로벌 국가 론칭 경험을 가진 퍼블리셔와 함께 하게 돼 기쁘게 생각한다""며 ""마음을 담은 콘텐츠로 글로벌 유저들에게 최고의 경험을 제공할 수 있도록 준비할 것""이라고 말했다.한편 이벤트 및 게임 관련 더욱 자세한 내용은 한빛온 공식 홈페이지에서 찾아볼 수 있다."
525771,"네이버-국민연금공단, 모바일 전자문서 서비스 확대",박지혜 기자,2020.11.30 11:50:57,"[프라임경제] 네이버(035420)와 국민연금공단이 모바일 전자문서 서비스를 본격 확대한다고 30일 밝혔다.ⓒ 네이버30일부터 국민연금공단의 두루누리 사회보험료 지원 내역서가 네이버 앱을 통해 발송된다. 12월부터는 국민연금 가입내역서를 포함해 국민연금공단의 다양한 안내문도 네이버 전자문서 서비스로 확대한다.​​이는 양사가 지난해 11월, 모바일 전자고지 서비스 활성화를 체결하며 네이버 플랫폼 내에서 국민연금 관련 정보 제공, 네이버 앱을 활용한 전자문서 송달을 위해 협력키로 한 MOU의 연장선상에 있다.특히 네이버 전자문서 서비스는 모바일 문서가 도착했을 때뿐만 아니라 미확인 문서에 대해 주기적으로 푸쉬(Push) 알림을 제공한다.네이버는 전자문서 서비스 확대와 함께 12월 중순부터는 네이버 인증서를 통한 국민연금공단 모바일 앱, 홈페이지 내 로그인 기능도 제공할 계획이다. 별도의 프로그램 설치 없이 네이버인증서로 가입 내역 조회부터 증명서 발급까지 가능하다.김대순 디지털혁신본부장은 ""코로나19로 앞당겨진 언택트 시대에 모바일 전자문서는 비대면 서비스의 선택이 아닌 필수가 될 것""이라며 ""앞으로도 전자문서 포함한 모바일 서비스를 점차 확대해 고객편의 중심의 서비스 제공에 더 노력하겠다""고 말했다.오경수 네이버 리더는 ""네이버 인증서와 전자문서를 기반으로 국민연금공단의 다양한 서비스를 보다 안전하고 편리하게 이용하는 사용자 경험을 제공하겠다""고 밝혔다."
555798,"인신협·퍼블리시, '언론 생태계 조성 위한 MOU' 체결",박성현 기자,2021.11.10 11:19:27,"한국인터넷신문협회와 퍼블리시가 업무협약을 맺었다. ⓒ 한국인터넷신문협회[프라임경제] 한국인터넷신문협회(회장 이의춘, 이하 인신협)는 퍼블리시(대표 권성민)의 블록체인 기술 등을 활용해 독자, 기자, 언론사 간 선순환 생태계 구축 협력방안을 모색, 추진하기로 했다.인신협은 퍼블리시와 함께 투명성과 공정성, 신뢰의 원칙이 제대로 작동하는 지속 가능한 인터넷신문 환경 조성을 위한 업무협약(MOU)을 체결했다고 지난 9일 밝혔다.이번 MOU는 인신협이 블록체인 생태계 구축에 필요한 기술 및 인프라를 퍼블리시로부터 제공받는다는 내용을 담고 있고, 인신협은 협회 회원사 및 기자의 권익을 보호하면서 △관련 연구 △캠페인 △공익사업 등을 함께 진행해 나갈 계획이다.이의춘 인신협 회장은 ""이번 협약은 회원사 기자들의 신원증명에 블록체인 DID(분산신원증명) 기술을 선제적으로 도입하고 팩트체크 등 다양한 현안에 블록체인 기술을 적용하는 계기가 될 것""이라고 설명했다.권성민 퍼블리시 대표는 ""우리나라 대표 인터넷언론 단체와 함께하는 첫 시도인 만큼 막중한 공적 책임감을 가지고, 인터넷신문산업이 다른 IT산업군들 못지않은 기술 경쟁력을 가진 산업으로 성장하는 데 최선을 다하겠다""고 포부를 밝혔다.한편, 인신협과 퍼블리시는 협의 사항을 구체화하고 발전시키기 위해 협의체를 구성할 수 있다는 뜻을 모았으며 DID 기술을 적용한 협회 회원증 발급을 추진하기로 했다."
604931,'서머너즈 워' 컴투스 'RELOADED' 쇼케이스 성료,김소미 기자,2023.06.27 09:47:27,"[프라임경제] 컴투스(078340)가 지난 24일 글로벌 히트작 '서머너즈 워'의 'RELOADED' 업데이트 쇼케이스를 열고, 향후 10년의 초석을 마련하는 대규모 업데이트를 공개했다.'서머너즈 워'는 현재까지 1억9000만 다운로드, 3조원 이상의 매출을 기록하며 △아메리카 △유럽 △아시아 등 세계 전역에서 오랜 기간 사랑받고 있는 컴투스의 대표 모바일 게임이다.컴투스는 'RELOADED'라는 타이틀 아래 다양한 콘텐츠 개편과 여러 신규 콘텐츠를 선보일 예정이다.쇼케이스에서는 공략의 재미와 보상 획득의 효율성을 높이는 신규 콘텐츠가 공개됐다. ⓒ 컴투스쇼케이스에서는 카이로스 던전 내 '정령의 던전'과 '심연의 층' 스테이지 등 공략의 재미와 보상 획득의 효율성을 높이는 신규 콘텐츠도 선보였다. 또한 유저의 빠르고 편리한 성장을 돕는 룬과 아티팩트, 새로운 진화 시스템도 소개됐다.컴투스 관계자는 ""특히 실패 없는 룬 강화 시스템과, 아티팩트를 최종형으로 획득할 수 있도록 하는 개편안을 밝혀 객석의 뜨거운 호응을 얻었다""고 말했다.이와 함께 업데이트를 통해 턴 획득 및 공격 게이지 흡수 로직을 변경하는 등 보다 일관적인 플레이가 가능하도록 했다.컴투스 이주환 대표, 김태형 PD, 홍석기 사업실장, 서지영 기획팀장 등이 직접 무대에 올라 유저들이 보낸 질문과 응원에 화답하며 소통하는 시간을 마련했다. ⓒ 컴투스김태형 컴투스 PD는 ""오랜 시간 '서머너즈 워'를 플레이한 유저 분들이 만족할 수 있도록, 어떤 요소를 과감히 변화시킬 수 있을지 고민했다""라며 ""이번 업데이트로 게임 본연의 재미를 전할 것""이라고 전했다.유저들과의 질의응답 시간도 진행됐다. 이주환 컴투스 대표, 김태형 PD, 홍석기 사업실장, 서지영 기획팀장 등이 직접 무대에 올라 유저들이 보낸 질문과 응원에 화답하며 소통하는 시간을 마련했다.행사는 지난 2019년 'RE:BOOST' 쇼케이스 이후 4년 만에 오프라인으로 신규 콘텐츠를 소개하는 자리다.컴투스는 ""수 백 명의 유저가 현장을 가득 채우며 행사 시작 전부터 열기를 더했다""며 ""'서머너즈 워' 공식 유튜브 채널에서 한국어·영어·프랑스어 등 총 9개 언어로 실시간 중계된 영상이 종료 이후 만 하루 동안 누적 33만 시청자를 기록, 글로벌 히트작의 면모를 입증했다""고 자신했다.이어 '서머너즈 워' 9주년 기념 글로벌 팬아트 공모전 당선작도 공개됐다. 작품이 선정된 89명의 유저들에게는 총 상금 4500달러(한화 약 590만원)을 비롯해 게임 굿즈 및 쿠폰 등을 수상에 따라 시상할 계획이다.이외에도 쇼케이스 참석자들에게는 이번 쇼케이스 한정 굿즈가 포함된 웰컴 선물 키트가 제공되고, 게임 쿠폰 등을 선물로 획득할 수 있는 여러 현장 이벤트를 진행했다.한편 쇼케이스를 통해 소개된 대규모 업데이트는 오는 30일 진행될 예정이다. 'RELOADED' 쇼케이스 영상은 '서머너즈 워' 공식 유튜브 채널에서 다시 볼 수 있다."
