438279,[기고문] History of Mr.Market Part.2 증권 파동과 시장의 진실2,박하늘 인터넷카페 블랙버드 파트너스 공동연구원,2018.11.30 16:27:39,"[프라임경제] 1961년 '경제개발 5개년 계획' 일환으로 박정희 의장이 이끄는 국가재건최고회의는 자본시장 육성을 천명했다.1962년 1월 자본시장 활성화를 위해 '증권거래법'을 제정했다.이러한 시대적 흐름 속에서 큰 기회를 본 세력들은 당시 막강한 권력기관이었던 중앙정보부와 당시 투자의 귀재 윤응상을 중심으로 통일·일흥·동명 등 3개의 증권회사를 창설해, 대한증권거래소 발행주식(대증주)를 대량으로 매집한다.자본시장 성장의 수혜를 한몸에 받을 것이라는 기대로 이전까지 액면가(50전) 수준인 대한증권거래소 발행주식(대증주) 시세는 '날개'를 달고 폭등하게 된다. 1961년 11월 주당 50전을 뛰어넘더니 이듬해 1월 법 통과 직후 1환(1환=100전)을 돌파해, 3월엔 9환대로 치솟았고 4월엔 액면가의 무려 80배를 웃도는 최고 42환대까지 폭등했다.그러나 대증주 거래량이 정점에 달했던 1962년 5월, 대증주 매집으로 주가를 폭등시킨 3곳 증권사의 '현금이 바닥났다'는 소문이 돌기 시작한다.경쟁사들은 이 기회를 놓치지 않고,  맹공격을 퍼부으며 물량들을 쏟아내기 시작했다.대증주를 매물을 받고 또 받아내던 3곳의 증권사는 결국 5월31일, 결제대금 580억환 가운데 무려 352억환을 마련하지 못하며 '결제 불이행 사태'에 빠지게 된다.이 사태를 타개하기 위해 정부는 금융통화위원회로 하여금 대출을 승인하게 하는 등 수습을 시도하기도 하며, 일부 거래에 대해서는 쌍방 합의로 매매계약 무효라는 비상수단까지 동원하게 된다.해당 사건으로 인하여 거래소는 그 신뢰도가 크게 추락했고, 시장을 열 때마다 대규모 물량이 출회하면서 대폭락이 일어났다. 결국 정부는 1963년 2월25일 거래소의 무기한 휴장을 선언하게 된다.서글픈 현실이지만 정부는 시장의 안정을 위해서는 어쩔 수 없이 투기 세력의 파산을 막을 수밖에 없다는 것, 이 또한 시장의 중요한 진실 중 한 가지다.박하늘 인터넷카페 블랙버드 파트너스 공동연구원"
484008,[허준열의 분양분석 11] 용인 '신봉동 씨앤아트힐' 타운하우스,허준열 칼럼니스트,2019.11.22 18:30:21,"[프라임경제]신규 분양 가격할인 앱 '투자의 신'은 부동산 투자와 관련한 제반의 정보를 서비스하고 있다. 일반정보 전달뿐 아니라 분양현장을 시장 이슈의 잣대 위에서 꼼꼼히 분석한다. '투자의 신' 허준열 대표가 직접 현장정보를 평가하고, 투자에 필요한 실질적 정보를 잡아낸다. 열한 번째 현장은 우리앤하우징 건설이 시공을 맡은 '신봉동 씨앤아트힐'.'투자의 신' 어플리케이션(앱)으로 △상권 △배후인프라 △입지 △경쟁력 △투자 가치 등에 대한 문의가 많이 들어온다. 그 중 '신봉동 씨앤아트힐'을 선정해 면면을 살펴본다.용인 '신봉동 씨앤아트힐' 타운하우스 조감도. ⓒ 우리앤하우징타운하우스는 전원주택의 여유로움과 도심 속 편리함을 동시에 누릴 수 있다는 점에서 누구나 한 번쯤은 생각해본 로망이다. 타운하우스 '씨앤아트힐'은 경기도 용인시 수지구 신봉동 651-1번지에 위치한 104세대 규모의 대단지 타운하우스다.용인 수지구 신봉동은 도시가스 시설과 광교산 자락의 자연환경을 접하고 있으며, 차량으로 3분 거리에 용인·서울고속도로 서수지IC가 자리하고 있다. 또한 대왕 판교로 및 수서 간 고속국도를 이용하면 강남 진입이 15분대에 가능하다.주변 교육환경으로 신봉초등학교, 신봉중학교, 신봉고등학교가 있지만, 거리가 가까운 편은 아니다. 타운하우스에 거주하고 싶은 로망이 자녀들 등하교라는 현실에 부딪혀 실행하지 못한 사례들이 꽤나 많다. 때문에 자녀들이 성장하고 등하교에 대한 부담이 없을 때 선택하는 분들도 꽤 있다.수년 전부터 용인시에서 전원주택, 단독주택, 타운하우스 주택공급이 타 지역보다 월등히 높다. 장점으로는 자연이 숨 쉬는 가까운 곳에서 도시생활도 동시에 누릴 수 있다는 것. 단점으로 과잉 공급이라는 불안한 요소가 존재한다는 점이다.따라서 시행사나 시공사는 소비자의 선택을 받을 수 있겠끔 모든 부분에서 여간 신경을 쓰지 않으면 안 될 것이다. 만일 소비자의 생각을 제대로 읽지 못한다면 곧바로 미분양으로 직결 될 수 있기 때문이다.신봉동 씨앤아트힐은 타입별 104.16㎡에서 146.28㎡ 면적이 공급되는 타운하우스로 각 주거 공간마다 사용자의 개성과 취향, 라이프스타일을 반영한 맞춤 설계가 적용됐다. 아파트 내부와 비교해도 손색이 없는 주거 편의는 기대를 모으고 있다.타운하우스는 아파트 시장과 밀접한 관계가 있다. 아파트 시장이 호경기라면 빌라나 타운하우스도 가격이 동반 상승하며, 아파트 시장이 불경기면 마찬가지로 빌라나 타운하우스 가격이 떨어지는 경향이 있다. 가장 큰 이유는 아파트, 빌라, 타운하우스가 모두 주거가 목적이기 때문이다.아파트는 실 거주 목적과 미래 투자성이 강한 부동산인 반면, 타운하우스는 미래투자성보다 오로지 실 거주 목적이 전부인 부동산이라 설명된다. 신봉동 씨앤아트힐도 실 거주목적으로 다가가는 것이 현명한 방법이라 생각된다.때문에 투자성 부동산이 아닌, 실 거주 부동산은 공사중지나 하자공사 등 특별한 경우를 제외하고 실 거주를 할 개인의 생각과 판단이 무엇보다도 중요한 요소로 꼽힌다.필자는 서울 인근인 파주, 일산보다 용인쪽 타운하우스가 지리적으로 유리한 위치에 있다고 평가한다. 타운하우스는 아파트와 다르게 단독주택 성격을 띠기 때문에 그만큼 좋은 자재로 선별 된 품질, 깔끔한 마감처리 그리고 견고한 내구성이 가격보다 중요한 선택 포인트로 작용한다.이러한 요소들이 충족되지 않는다면, 타운하우스 분양가격이 저렴한 3억원에서 4억원대라도 부동산 가치를 잃어버린 것이라 단언할 수 있다. 이러한 연유로 소비자는 겉모습이나 분양상담사 말에 의존해서 판단하기 보다 본인이 장기적으로 거주 한다는 생각을 잊지 말고 주변환경과 외부, 내부를 꼼꼼히 체크하고 판단하길 바란다.[한줄 평가]신봉동 씨앤아트힐은 팬션처럼 전원생활을 누리며, 더불어 도시생활도 함께 누릴 수 있는 타운하우스다. 아울러 회사가 내세운 분양가격 5억원대가 합리적인 분양가격으로 판단 될지는 시행사와 시공사가 얼마만큼 집을 잘 짓는냐에 따라 결정될 것이다.- '허준열' 열두번째 현장은 서초 ‘지젤 시그니티’ 오피스텔에 대해 살펴본다."
505898,[허준열의 분양분석 26] '검암역 로열파크시티 푸르지오' 아파트,허준열 칼럼니스트,2020.05.28 17:47:50,"[프라임경제]신규 분양 가격할인 앱 '투자의 신'은 부동산 투자와 관련한 제반의 정보를 서비스하고 있다. 일반정보 전달뿐 아니라 분양현장을 시장 이슈의 잣대 위에서 꼼꼼히 분석한다. '투자의 신' 허준열 대표가 직접 현장정보를 평가하고, 투자에 필요한 실질적 정보를 잡아낸다. 스물여섯 번째 현장은 대우건설이 시공을 맡은 '검안역 로열파크시티 푸르지오'.'투자의 신' 어플리케이션(앱)으로 △상권 △배후인프라 △입지 △경쟁력 △투자 가치 등에 대한 분석문의가 많이 들어온다. 그 중 '검암역 로열파크시티 푸르지오'를 선정해 면면을 살펴본다.검안역 로열파크시티 프르지오 모델하우스 조감도. ⓒ 대우건설검암역 로열파크시티 푸르지오는 인천시 서구 백석동 170-3번지 일원에 위치하고 있으며, 지하 2층에서 지상 최고 40층 규모로 25개동 총 4805세대다. 총 사업비 약 2조5000억원에 하나은행이 금융 주관사를 맡고 있다.전용 면적 기준 59㎡, 74㎡, 84㎡, 101㎡, 152㎡, 241㎡로 분양 공급할 예정으로 전용 84㎡ 이하의 중소형 평형이 전체 세대수 90%이상 대다수를 차지한다.인천 한들 도시개발 사업구역에 들어서는 검암역 로열파크시티 푸르지오는 경인 아라뱃길과 정서진이 가까워 이를 볼 수 있는 오션뷰, 아라뱃길을 조망하는 리버뷰를 볼 수 있는 아파트 단지다.아울러 조경공사는 삼성물산 에버랜드와 업무협약을 통해 아파트 단지 내 조경을 미니 에버랜드 컨셉으로 선보일 예정이다.검암역 로열파크시티 푸르지오는 수영장, 사우나, 휘트니스클럽 등 입주민 전용 커뮤니티와 더불어 조식 서비스, 연회장, 파티룸, 게스트 하우스, 펫카페 등 다양한 편의시설로 계약자들의 마음을 잡기 위한 설계가 돋보인다.검안역 로얄파크시티 프르지오 모델하우스. ⓒ 대우건설특히 인천 공항철도와 인천 지하철 2호선 환승역인 검암역과 독정역을 이용할 수 있으며, 검암역에서 김포공항역까지 2정거장으로 약 10분대에 진입이 가능하다. 하지만 해당 아파트에서 검암역까지 도보로 쉽지 않는 거리라는 점을 참고 하길 바란다.또한 대단지 4800규모 아파트지만, 인근에는 다른 아파트가 없어 현재 인프라 시설은 여전히 아쉬움으로 남는 부분이다. 물론 검암역 주변으로 공공주택 조성 계획은 있다.분양가격은 84㎡가 5억원 초반에서 5억원 중반으로 평당 1500만원이다. 분양가격 기준 1300만원에서 1400만원대가 적당하다고 평가되지만, 차원이 다른 단지 내 조경공사와 편의시설 등으로 분양가가 상승했을 것이라 분석된다.검암역 로열파크시티 푸르지오는 부동산 비규제지역에 포함되며, 12개월 이상 청약 통장을 갖고 있으면 세대주나 세대원이라도 청약이 가능하고 분양권 매매도 6개월 후 전매가 가능하다. 실 거주 목적이 아닌, 단기투자 목적과는 거리가 멀다고 평가된다.연 0.75%대 은행금리로 단기투자를 찾는 사람들이 더욱 늘어나고 있는 추세 속에서 정확한 분석없이 무분별한 묻지 마 투자는 지양해야 할 부분이다. 친구 따라 강남 간다는 투자방법이 아닌 현명한 판단이 필요한 때다.[한줄평가]검암역 로열파크시티 푸르지오는 4800세대가 들어서는 대단지 아파트다. 하지만 주변 인프라 부족과 검안역과 거리가 먼 것은 아쉬움을 남긴다. 때문에 단기투자 보다 장기적인 접근으로 다가가야 할 것으로 분석된다. 2023년 말 입주에 맞춰, 향후 생활 인프라 개발 및 편의시설이 어떻게 이루어질지가 관심사다."
574279,[기고] 시민과 공직자가 하나 된 손님 맞이,김동일 보령시장,2022.07.22 11:27:48,"[프라임경제] 2022보령해양머드박람회가 한달간의 대장정을 시작됐다.지난 16일 5년여의 준비를 마무리하는 2022보령해양머드박람회의 성대한 개막식이 개최됐다. 여기 보령에서 세계인의 여름 축제인 제25회 보령머드축제와 함께 동시 개최되면서 올여름 피서객을 위한 여름향연을 한달간 선물하게 됐다.'해양의 재발견, 머드의 미래가치'라는 주제로 7월16일부터 8월15일까지 대천해수욕장 일원에서 펼쳐지는 2022보령해양머드박람회는 코로나 펜데믹 이후 3년 만에 처음 열린 국제행사다. 시작 이전부터 국·내외의 많은 관심과 이목을 집중시켰다.더욱이 이번 박람회 개막식에 윤석열 대통령도 참석해 보령시민은 물론 관광객들에게 보령과 충남, 특히 박람회의 위상을 높이고 보령의 역사를 새로 쓰는 기회가 됐다.이 자리에서 대통령은 ""건강관리와 관광, 휴양, 서비스를 동시에 제공하는 해양치유산업을 육성해서 연안과 어촌 지역에 새로운 경제적 활력을 불어넣도록 하겠다""고 말하며 ""지역 스스로 성장산업을 발굴하고 키워나갈 수 있는 지방시대를 열겠다""고 말했다.필자는 이런 면에서 이번 박람회를 통해 해양자원의 중요성, 특히 머드의 미래가치, 해양신산업에 대한 성장동력이 더욱 활력을 띨 것으로 기대한다.보령은 일찍이 머드의 경제적 효용 가치를 창출하고 머드를 활용한 신산업 성장동력의 발판을 마련했을 뿐 아니라 머드의 생태적 환경이 인류의 생존에 중요한 자산임을 밝힘으로써, 사업성과 생태환경 보존이라는 두 마리 토끼를 잡았다는 긍정적 평가도 받고 있다.필자는 박람회가 정부승인 국제행사로 결정되면서부터 지난 5년간 지역의 주인인 시민과 공직자가 한마음 한뜻으로, 준비와 시작 과정에 함께 참여해 2022보령해양머드박람회와 제25회 보령머드축제를 위해 온 힘을 기울여왔다.특히 이번 박람회는 머드의 미래가치와 비전을 제시하며 해양자원을 활용한 글로벌 모멘텀을 마련해 해양신산업 글로벌 리더화, 세계적 해양치유 자원으로 실용화, 생태적 가치(블루카본) 조명, 세계와 공유화, 해양레저관광의 대중·산업화를 선도하고자 마련된 자리다.제25회 보령머드축제도 동시 개막함으로써 축제와 해양머드 신산업이 결합된 국내 첫 하이브리드 박람회라는 호평을 끌어냈다.미국과 유럽, 호주 등에서 매년 열리고 있는 익스트림 장애물을 통과해 달리는 터프머더 대회 '2022터프머더 보령' 또한 8월13일 웅천체육공원에서 개최되면서 전세계인들이 몰려오고 있다.박람회와 축제가 치러지는 한달의 기간동안 보령시민과 지역 상인, 시민공동체 등 모두의 참여와 노력으로 바가지요금 근절, 주류 4000원 균일 판매, 청결한 음식문화 등과 같이 상호 협력과 단결을 통해 쾌적하고 청결한 피서 문화를 만들어 가게 됐다.이로써 모두가 주인인 행사, 모두가 대표인 축제, 시민과 공동체, 공직자가 어우러지고, 지역의 문화가 지역의 가치와 만나 미소와 친절이 돼 여름 파도처럼 청량하게 펼쳐지는 한여름 축제가 완성됐다.필자가 앞서 말했듯이 이 모든 것은 시민, 자원봉사자, 공동체, 상인회, 공직자가 주인의식을 갖고 자체의 자정 활동과 단결을 통해 보령이라는 지역사회가 이루어낸 결과물이다.필자는 이번 박람회와 축제를 통해 지역사회와 방문객, 관광객 모두가 사회적 거리두기 만큼이나 위축됐던 개인적 자존감과 사회적 자신감이 회복되는 계기가 되기를 바란다.억눌리고 침체돼 있던 과거를 벗어나 엔데믹을 준비하는 우리 모두에게 이번 행사와 축제가 미래로 가는 발걸음을 가볍게 하는 활력 백신이 돼 한여름 밤을 수놓는 폭죽의 불꽃처럼 모두의 가슴에 날길 바란다.앞으로도 시는 시민은 물론 박람회를 찾는 방문객, 머드축제와 대천해수욕장을 찾는 피서객이 건강하고 안전하게 이 축제를 즐길 수 있도록 더욱 방역에 최선을 다하겠다고 다짐해 본다.연마장양(鍊磨長養)이라는 말이 있다. 갈고 닦아 오래도록 준비해옴을 일컫는 사자성어다. 모든 준비를 끝내고 드디어 환대의 문을 열었다. 여기에 마침표를 찍는 화룡점정은 잔치에 방문해 먹고 즐기는 방문객 여러분이다.보령이 마련한 2022보령해양머드박람회와 제25회 보령머드축제는 여러분이 즐기고, 먹고 체험할 수 있는 여름 축제 잔칫상이다. 박람회와 축제를 통해 여러분의 가슴에 행복의 배부름과 희망의 시원한 바다가 한가득 담기기를 바란다.ⓒ 김동일 보령시장김동일 충남 보령시장"
479687,[허준열의 분양분석 3] 가양 '데시앙 플렉스' 지식산업센터,허준열 칼럼니스트,2019.11.14 18:32:02,"[프라임경제]신규 분양할인 시스템 개발업체 '투자의 신'은 부동산 투자와 관련한 제반의 정보를 서비스하고 있다. 일반 정보 전달뿐 아니라 분양현장을 시장 이슈의 잣대 위에서 꼼꼼히 분석한다. '투자의 신' 허준열 대표가 직접 현장정보를 평가하고, 투자에 필요한 실질적 정보를 잡아낸다. 세 번째 현장은 태영건설이 시공을 맡은 가양 '데시앙 플렉스' .'투자의 신' 어플리케이션(앱)으로 △상권 △배후인프라 △입지 △경쟁력 △투자 가치 등에 대한 문의가 많이 들어온다. 그 중 가양 '데시앙 플렉스'를 선정해 면면을 살펴본다.가양 데시앙 플렉스 부지인근 홈플러스. ⓒ 투자의 신서울 강서구의 가양 데시앙 플렉스 지식산업센터 소재지는 등촌동 14-7번지외 1필지에 있으며, 구 한성자동차매매단지 부지에 세워질 예정이다. 건축물 대지면적은 5238.00㎡(1584.50평)으로 총 지하 5층부터 지상 12층까지며, 지상 1, 2층은 근린생활시설 및 업무지원시설, 3층부터 12층까지 지식산업센터로 구성될 예정이다.가양 데시앙 플렉스 지식산업센터는 태영건설이 시공하고 KB부동산이 신탁을 맡고 있다. 지리적으로 가양역에서 약 390m거리에 위치하고 있고, 9호선 양천향교역에서 약 700m, 5호선 발산역에서는 약 900m 거리다.향후 개통 예정인 서부광역철도와 강북횡단철도 등 교통망이 추가로 확보되면 대중교통을 통한 접근성이 더욱 좋아질 것으로 예상된다.또한 공항대로·강변북로·올림픽대로·남부순환도로가 인접해있어 도심과 수도권을 잇는 주요도로 네트워크도 좋은 편이다. 도로 접근성이 용이한 만큼 물류이동이 수월해 유류비 등 불필요한 경비를 절감할 수 있다는 점도 긍정 요소다.가양 데시앙 플렉스 모델하우스. ⓒ 투자의 신가양 데시앙 플렉스는 업무중심구역으로 주변의 중소기업과 대기업들의 입주가 예정돼 있다. 또한 인근 마곡지구에는 약 110만평 규모 IT, BT, GT 등의 산업 클러스터 단지가 구성이 돼있고, 대기업 외 136개 기업의 입주가 확정 또는 예정됨에 따라 첨단 융합 복합 R&D도시의 면모도 갖춘다.아울러 인접한 곳에 CJ바이오센터가 있으며, CJ바이오센터 연구시설 부지에 CJ그룹 타운 개발계획으로 제일제당 등 계열사가 입주할 예정이기도 하다.강서구청은 지난 2018년 7월 '가양동 CJ공장부지 지구단위계획 결정(변경) 및 세부개발계획 결정안' 재열람공고를 진행조례 개정 후, 도시건축공동위원회에 재상정될 예정이다.지식산업센터 지역으로 성공한 상암DMC는 MBC글로벌미디어센터, YTN, SBS프리즘타워, KBS미디어센터, 한국경제신문·TV, 중앙·조선·동아일보의 종합편성채널 방송국과 언론사들 그리고 CJ E&M, LG CNS, LG U+, 팬택R&D센터, 누리꿈스퀘어, 한샘 등 대기업 수십여개가 자리 잡고 있다.이렇듯 가양 데시앙 플렉스가 가진 입지 특수성을 잘 활용한다면, 기업 입주량 증가에 따라 가양역 주변으로 지식산업센터 공급량 증가 또한 예상할 수 있다.반면 마곡지구 쪽 대기업 입주가 예상과 달리 다소 더디게 진행되고 있는데, 관련기업들의 입주도 덩달아 늦어지고 있는 상황은 주의해야 할 점이다. 이는 마곡지구 산업단지의 개발 등이 대체로 동시에 진행되다보니 생기는 현상으로 판단된다.또한 공실률 증가 가능성도 배제 할 수 없다. 한꺼번에 공급 물량이 쏟아지기 때문인데, 투자 목적이라면, 공급량 증가에 따른 단기 임대료 하락도 예상하고 있어야 할 것이다.[한줄 평가] 가양 데시앙 플렉스는 위치·교통적으로 무난한 부동산이다. 지식산업센터 투자의 매력은 오피스텔보다 담보대출이 많이 나온다는 점이다. 또 개인 보다는 기업으로부터 월세를 받을 확률이 높기 때문에 장기적으로 볼 때 공실 걱정이 낮은 것으도 장점이다. 하지만 모든 부동산이 그렇듯 초기 물량이 많아지면 단기적으로 월세가 낮게 형성되기도 하는데, 경쟁력 있는 층수나 전망이 좋은 곳을 선택하는 것도 현명한 방법일 수 있다.- '투자의 신' 네 번째는 이수 '스위첸 포레힐즈' 대해 살펴본다."
