article_number,score,keyword1,keyword2,keyword3,keyword4,keyword5,message,model,temperature,max_tokens,top_p,frequency_penalty,presence_penalty,response
604839,4,우리금융그룹, 스타트업, 협력 프로그램, 디노랩, 선발,"다음 뉴스 기사를  3문장으로 요약해, 총 답변의 길이는 150자 이내로 제한한다. + content",gpt-3.5-turbo-16k,1,256,1,0,0,우리금융그룹은 스타트업 협력 프로그램 '디노랩' 4기에 참여할 14개 업체를 선발했다. 전북은행은 취약계층 디지털 정보격차 해소를 위해 중고 PC 전달식을 실시했고 토스뱅크는 '알유넥스트 함께 응원하기 서비스'를 선보였다. 선발된 기업들은 무상 사무공간 사업협력 및 투자유치 기회를 제공받게 된다. 전북은행은 ESG 경영의 일환으로 중고 PC를 전달하였고 토스뱅크는 걸그룹 서바이벌 프로그램 '알유넥스트'를 응원할 수 있는 서비스를
604833,3,가맹점 수수료, 카드사, 금융서비스 수출, 해외진출, 동남아시아 시장,"다음 뉴스 기사를  3문장으로 요약해, 총 답변의 길이는 150자 이내로 제한한다. + content",gpt-3.5-turbo-16k,1,256,1,0,0,금융당국과 카드사들은 수익 다변화를 위해 해외진출을 독려하고 있다. 특히 동남아시아 시장을 새로운 성장 동력으로 보고 있으며 한국의 금융 및 보험 서비스 수출 규모가 저조한 것을 해외진출의 동기로 삼고 있다. 금융당국은 해외진출을 지원하기 위한 규제개선방안을 발표할 예정이며 국내 카드사들의 해외 법인들은 수익성을 높이기 위해 다양한 방법으로 동남아 시장에 진출하고 있다.
604805,2,외화예금, 엔화예금, 여유자금, 거주자외화예금, 증가 전환,"다음 뉴스 기사를  3문장으로 요약해, 총 답변의 길이는 150자 이내로 제한한다. + content",gpt-3.5-turbo-16k,1,256,1,0,0,국내 거주자 외화예금이 지난달 약 5개월만에 54억달러 증가하여 967억9000만달러로 늘어났다. 이는 지난해 12월 이후 감소세를 이어온 것을 반전시킨 결과이다. 주요 통화별로는 달러화예금과 유로화예금이 증가하였으며 엔화예금은 엔화 환율 하락에 영향을 받아 증가한 것으로 보인다.
604746,2,청년도약계좌, 정책금융상품, 금융위원회, 5부제, 가입제한 해제,"다음 뉴스 기사를  3문장으로 요약해, 총 답변의 길이는 150자 이내로 제한한다. + content",gpt-3.5-turbo-16k,1,256,1,0,0,청년도약계좌 가입에 대한 5부제 가입제한이 해제되면서 5시간 만에 약 13만명이 가입을 신청했다. 이로써 누적 가입 신청자는 약 55만명이 되었으며 신청자 수는 이전과 비교해 두 배 이상 증가한 것으로 나타났다. 이제 출생연도 끝자리와는 상관없이 11개 취급은행에서 가입 신청이 가능하다.
604736,3,주택담보대출, 은행권, 특례보금자리론, 한국은행, 부동산 경기,"다음 뉴스 기사를  3문장으로 요약해, 총 답변의 길이는 150자 이내로 제한한다. + content",gpt-3.5-turbo-16k,1,256,1,0,0,정부의 부동산 경기 부양책에 따라 주택담보대출이 이달에도 증가세를 보이고 있다. 이는 중앙은행의 긴축통화정책 종료가 알려지지 않은 상태에서도 빚을 내서 집을 사는 이들이 늘고 있음을 나타낸다. 하지만 한국은행은 부동산 시장 활성화에 의한 금융불균형 우려로 인해 긴축통화정책을 이어가는 상황이기 때문에 정부와 중앙은행 사이에는 엇박자가 형성되고 있는 것으로 보인다.
604723,4,하나은행, IBK기업은행, 신한은행, 청년 상생금융, 복지,"다음 뉴스 기사를  3문장으로 요약해, 총 답변의 길이는 150자 이내로 제한한다. + content",gpt-3.5-turbo-16k,1,256,1,0,0,하나은행이 경기도와 업무협약을 체결하여 청년 상생금융인 '경기청년 기회사다리금융'을 추진한다. IBK기업은행은 중소기업 근로자 자녀에게 장학금을 전달하고 신한은행은 발달장애인을 대상으로 체험형 금융교육을 실시한다. 이들은 각각 소외계층에 대한 지원과 자산관리 습관 형성을 목표로 한다.
604717,5,금감원, 워크숍, 금융사고, 내부통제, 은행권,"다음 뉴스 기사를  3문장으로 요약해, 총 답변의 길이는 150자 이내로 제한한다. + content",gpt-3.5-turbo-16k,1,256,1,0,0,금융감독원은 은행권 내부통제 업무 담당자와 함께 '2023년 상반기 은행권 내부통제 워크숍'을 개최했다. 이 워크숍은 금융사고 보고 활성화와 은행 내부통제 역량 강화를 목적으로 마련되었다. 금감원은 은행이 사고 발생 시 구체적 내용을 파악하고 중요한 사항은 금감원에 보고해야 한다고 요청했다.
604650,4,만 나이, 리치앤코, 웹툰, 문의, 보험료,"다음 뉴스 기사를  3문장으로 요약해, 총 답변의 길이는 150자 이내로 제한한다. + content",gpt-3.5-turbo-16k,1,256,1,0,0,보험 상품 대리점 리치앤코가 자사 웹툰 '보미의 일기'를 통해 보험 나이 궁금증을 해소하는데 도움을 줬다고 밝혔다. '만 나이 통일법' 시행으로 인해 보험료를 내리게 될 것으로 예상되어 가입자들의 관심이 증가했는데 리치앤코는 웹툰을 통해 이러한 궁금증을 해소하고 보험 정보를 제공했다. 리치앤코는 만 나이 시행에도 보험료 변동은 없다고 설명하며 보험 가입자들에게 조기에 부족한 보장을 보충하는 것이 좋다고 추천했다.
604647,2,신한카드, NH카드, 삼성카드, 카드출시, 서비스 개편,"다음 뉴스 기사를  3문장으로 요약해, 총 답변의 길이는 150자 이내로 제한한다. + content",gpt-3.5-turbo-16k,1,256,1,0,0,신한카드 삼성카드 NH농협카드가 각각 혜택을 강화한 카드 상품을 출시했다. 신한카드는 '신한카드 픽 선불' 시리즈로 애니메이션 '짱구는 못말려'의 디자인을 적용하고 NH농협카드는 여가 특화 상품인 '지금플레이' 카드를 출시했다. 또한 삼성카드는 청소년 전용카드 상품인 '삼성 iD 포켓(POCKET) 카드'의 서비스를 개편했다.
604643,2,청년도약계좌, 금융위원회, 5부제, 가입신청, 정책 금융상품,"다음 뉴스 기사를  3문장으로 요약해, 총 답변의 길이는 150자 이내로 제한한다. + content",gpt-3.5-turbo-16k,1,256,1,0,0,청년도약계좌의 5부제 가입 제한이 사라지며 청년은 이제 출생연도 끝자리와 관계없이 가입 신청을 할 수 있다. 청년은 매월 2주 동안 가입 신청이 가능하며 7월 가입 신청 기간은 3일부터 14일까지로 정해졌다. 청년도약계좌는 5년간 70만원을 매월 납입해 최대 5000만원의 목돈을 모을 수 있으며 11개 은행에서 취급된다. 또한 자금이 필요한 경우 적금담보대출을 고려하는 것을 추천하고 있다.
604641,5,금융당국, 금융사고, 책무구조도, 내부통제, 관리 의무,"다음 뉴스 기사를  3문장으로 요약해, 총 답변의 길이는 150자 이내로 제한한다. + content",gpt-3.5-turbo-16k,1,256,1,0,0,금융당국은 펀드 불완전판매 횡령 등의 금융사고가 발생한 경우 금융사 임원들의 내부통제 실패 책임에서 면책될 수 있는 기준을 마련하기로 결정했다. 이를 위해 금융위원회가 '금융회사 내부통제 제도개선 방안'을 발표하였으며 이를 통해 금융사 대표이사 및 임원들은 각자의 책무구조도를 작성하고 최종책임자를 지정해야 한다. 책무구조도에는 책무의 종류와 관리 의무가 명시되며 임원들은 내부통제 총괄 책임자로서 대표가 마련한 책무구
604624,5,비씨카드, 컬리카드, 적립금, 혜택, PLCC,"다음 뉴스 기사를  3문장으로 요약해, 총 답변의 길이는 150자 이내로 제한한다. + content",gpt-3.5-turbo-16k,1,256,1,0,0,컬리에 특화된 비씨카드의 전용 PLCC인 컬리카드가 발급 두 달 만에 3만좌를 돌파했다. 컬리카드는 컬리에서 결제 시 최대 12%까지 적립금을 쌓을 수 있으며 다양한 이벤트 및 혜택도 제공된다. 국내 및 해외 브랜드로 발급되며 여행 호텔 다이닝 등 다양한 특화 혜택을 제공하는 아멕스의 서비스도 이용할 수 있다.
604595,1,엘리뇨, 침수피해, 손해보험, 차보험, 폭우,"다음 뉴스 기사를  3문장으로 요약해, 총 답변의 길이는 150자 이내로 제한한다. + content",gpt-3.5-turbo-16k,1,256,1,0,0,보험사들은 엘니뇨 영향으로 올해 차량 침수 피해가 2500억원을 상회할 것으로 전망하고 있다. 작년에 이미 2147억원의 차량 침수 피해가 발생하여 이를 상회하거나 비슷한 수준의 피해가 예상된다. 엘니뇨 발생 확률이 높아지면서 폭우와 강수량의 증가로 인한 피해가 예상되고 있으며 보험사들은 피해 대비를 위해 준비하고 있다. 대형 손보사들의 자동차보험 손해율도 작년 집중호우로 인해 80%를 상회하며 악화된 상황이었다.
604585,2,혁신금융서비스, 금융위원회, 온라인 플랫폼, 가족카드, 신규지정,"다음 뉴스 기사를  3문장으로 요약해, 총 답변의 길이는 150자 이내로 제한한다. + content",gpt-3.5-turbo-16k,1,256,1,0,0,금융위원회는 21일 정례회의에서 20개의 혁신금융서비스를 신규 지정했다. 이 중 16개사는 예금상품 비교와 추천을 포함한 온라인 플랫폼 서비스로 소비자는 다양한 금융회사의 상품을 비교하고 추천받을 수 있다. 이에 따라 금융상품판매업 등록과 특례도 부여되었다. 또한 현대카드와 우리카드는 '미성년 자녀를 위한 카족카드 서비스'로 혁신금융서비스로 지정되었으며 대출모집인을 활용한 주택담보대출 비교 플랫폼 등 다양한 혁신금
604511,3,리치앤코, 부당승환계약, 과태료, 변액연금보험, 법인보험대리점,"다음 뉴스 기사를  3문장으로 요약해, 총 답변의 길이는 150자 이내로 제한한다. + content",gpt-3.5-turbo-16k,1,256,1,0,0,리치앤코 설계사들이 부당한 보험계약을 체결하고 부당승환계약을 실행한 것으로 적발되었다. 금융감독원은 이에 대해 9760만원의 과태료를 부과하고 설계사들에게도 과태료를 부과했다. 이러한 부당승환계약으로 인해 보험업 전반에 신뢰도에 흠집이 생겼다는 비판이 제기되고 있다.
604545,5,우리금융, 탈북아동, 대안학교, 신한은행, KB국민은행,"다음 뉴스 기사를  3문장으로 요약해, 총 답변의 길이는 150자 이내로 제한한다. + content",gpt-3.5-turbo-16k,1,256,1,0,0,우리금융그룹은 탈북아동 및 청소년 대안학교에 1000만원을 기부하는 전달식을 가졌다. 신한은행은 금융상품 비교 서비스를 오픈하고 KB국민은행은 병역명문가를 대상으로 우대 혜택을 제공한다.
604523,3,대환대출, 이자, 절감, 불법 광고, 금리,"다음 뉴스 기사를  3문장으로 요약해, 총 답변의 길이는 150자 이내로 제한한다. + content",gpt-3.5-turbo-16k,1,256,1,0,0,대환대출 서비스가 시행된 지 22일 만에 약 5000억원의 대출자산 이동이 발생한 것으로 파악되었다. 대출자들은 연간 100억원 이상의 이자를 절감한 것으로 추정된다. 은행 소비자에게서 이동이 가장 많았고 대출의 순유입도 점차 다양해지고 있다는 것이 확인되었다. 대환대출 인프라의 홍보 효과에 따라 소비자 선택권이 확대되었지만 금감원은 불법광고에 주의를 요구했다.
604512,1,역전세, 보증금 반환, 전셋값 하락, 전세보증금, 한국은행 ,"다음 뉴스 기사를  3문장으로 요약해, 총 답변의 길이는 150자 이내로 제한한다. + content",gpt-3.5-turbo-16k,1,256,1,0,0,한국은행에 따르면 전셋값 하락이 지속될 경우 약 9만 가구가 보증금을 돌려주지 못할 수 있다. 집주인이 추가로 빚을 내더라도 보증금을 반환할 수 없는 상황이다. 한국은행은 올해 말까지 전셋값이 10-20% 하락할 것으로 가정하며 약 7.6%의 가구가 예금을 깨거나 대출을 받아야 보증금을 반환할 수 있다고 전망했다.
604508,3,한국은행, 금융기관, 자산건정성 악화, 금융안정보고서, 대출,"다음 뉴스 기사를  3문장으로 요약해, 총 답변의 길이는 150자 이내로 제한한다. + content",gpt-3.5-turbo-16k,1,256,1,0,0,장민태 기자에 따르면 한국은행이 발간한 '금융안정보고서'에 따르면 지난 1분기 한국의 금융기관들은 자산 건전성 악화를 겪었다고 한다. 이는 취약 대출자들 때문인데 이들 취약 대출자들은 대출을 받은 3개 이상의 기관에서 대출을 이용 중이었다. 한국은행은 이로 인해 대출 부실 위험이 증가할 수 있다고 경고했다.
604427,3,은행, 예대율, 규제, 금융시장, 시장안정조치,"다음 뉴스 기사를  3문장으로 요약해, 총 답변의 길이는 150자 이내로 제한한다. + content",gpt-3.5-turbo-16k,1,256,1,0,0,금융위원회는 반복되던 은행 예대율 규제 등을 오는 7월부터 다시 정상화한다고 발표했다. 이는 지난해 발생한 채권시장 자금경색 사태의 약 8개월 만의 조치 복귀이다. 금융위원회는 또한 은행 유동성커버리지비율(LCR) 규제는 내달부터 12월말까지 단계적으로 95%까지 정상화될 예정이라고 밝혔다.
604363,3,기업 부채, 기업경영분석, 부채비율, 차입금의존도, 매출액증가율,"다음 뉴스 기사를  3문장으로 요약해, 총 답변의 길이는 150자 이내로 제한한다. + content",gpt-3.5-turbo-16k,1,256,1,0,0,1분기 기업 부채비율이 7년 만에 최고 수준으로 상승하였다. 외감기업의 부채비율은 94.95%로 이전 기록(94.96%)을 넘어섰으며 차입금의존도도 상승하였다. 또한 1분기에는 외감기업의 안전성과 성장성 수익성이 모두 악화되었다는 결과가 나타났다. 이는 대기업 중 세 군데의 대규모 영업손실에 의해 발생한 영향으로 추정된다.
604370,4,보험료, 실손 보험, 할인, 4세대, 비급여 의료이용량,"다음 뉴스 기사를  3문장으로 요약해, 총 답변의 길이는 150자 이내로 제한한다. + content",gpt-3.5-turbo-16k,1,256,1,0,0,기존 실손 보험 가입자가 4세대 실손 보험으로 전환 시 1년 동안 보험료를 반값으로 할인해주는 혜택이 연말까지 연장된다고 보험업계가 밝혔다. 이로써 기존 실손 보험 가입자는 할인혜택을 받고 4세대 실손 보험으로 전환할 수 있는 기회가 계속될 것이다. 4세대 실손 보험은 비급여 의료 이용량에 따라 보험료가 차등 적용되어 더 저렴하게 이용할 수 있는 특징이 있다.
604328,3,보험, 대학생 아이디어 공모전, 장학금, 경제교육, 사회공헌,"다음 뉴스 기사를  3문장으로 요약해, 총 답변의 길이는 150자 이내로 제한한다. + content",gpt-3.5-turbo-16k,1,256,1,0,0,KDB생명은 '2023 KDB다이렉트보험 대학생 아이디어 공모전' 시상식을 개최하여 우수한 아이디어와 실행안을 제시한 대상 및 우수팀을 시상했다. DB손해보험은 충주성심학교에 장학금 2000만원을 전달하여 가정형편이 어려운 학생들을 지원하였다. 또한 한화생명은 '1사 1교 금융교육'을 통해 전국 초·중학교 학생 8만명에게 금융지식을 전파하였다.
604319,3,SGI서울보증, 코스피, 한국거래소, 공기업 예비상장, 상장예비심사,"다음 뉴스 기사를  3문장으로 요약해, 총 답변의 길이는 150자 이내로 제한한다. + content",gpt-3.5-turbo-16k,1,256,1,0,0,SGI서울보증이 한국거래소(KRX) 유가증권시장에 상장예비심사를 신청했으며 몸값은 2조~3조원으로 추산된다. 최근 3년간 실적이 증가하고 배당성향도 상승하고 있는 SGI서울보증은 예금보험공사의 지원으로 설립된 보증사로 국내 최대 종합보증사로 알려져 있다. 상장 시기는 공적자금관리위원회의 논의를 거쳐 결정될 예정이다.
604259,5,금융감독원, 경남은행, 대주주, 신용공여, 과태료,"다음 뉴스 기사를  3문장으로 요약해, 총 답변의 길이는 150자 이내로 제한한다. + content",gpt-3.5-turbo-16k,1,256,1,0,0,금융감독원은 경남은행이 대주주에 대한 신용공여 절차를 미준수하여 은행법 위반으로 과태료 4000만원을 부과받고 관련 임원 1명에게 주의 상당 조치를 내렸다. 경남은행은 이사회 재적이사 전원의 찬성을 거치치 않고 대주주 BNK캐피탈에 대해 기준금액 이상의 신용공여를 결정했다. 금감원은 경남은행에 보고·공시 의무 및 절차 준수를 강화하도록 개선 사항을 통보했다.
604232,4,신안흔행, SOHO사관학교, 25기, 청년 자영업자, 예비 창업자,"다음 뉴스 기사를  3문장으로 요약해, 총 답변의 길이는 150자 이내로 제한한다. + content",gpt-3.5-turbo-16k,1,256,1,0,0,신한은행은 '신한 SOHO사관학교 25기'를 개강하여 청년 자영업자와 예비 창업자를 대상으로 경영 컨설팅을 제공할 예정이다. IBK기업은행의 김성태 은행장은 중소기업 관련 인물사진전에서 금융접근성을 대표하는 인물로 선정되었으며 사진과 메시지는 OECD 본관 로비와 중소기업 장관 회의 행사장에 전시될 예정이다. KB국민은행은 'KB Green Wave Report'를 발간하여 ESG 전략과 기후변화 대응을 소개하고 생물다양성 보존 및 탄소배출 저감 활동 등을 기술했다.
604174,5,애플페이, 삼성페이, 수수료, 카드사, 유료화,"다음 뉴스 기사를  3문장으로 요약해, 총 답변의 길이는 150자 이내로 제한한다. + content",gpt-3.5-turbo-16k,1,256,1,0,0,삼성전자가 삼성페이 유료화 가능성을 고려하면서 애플페이가 수수료를 받는 상황에서 협상을 시작했다. 애플페이와 계약이 만료된 7개 카드사와의 협의가 이뤄지고 있으며 삼성전자는 신한과 KB국민카드와 접촉하고 있다. 삼성전자의 결정에 따라 애플페이 시장 점유율과 삼성페이의 경쟁력이 변화할 수 있을 것으로 예상된다.
604147,3,횡령, 참저축은행, 금감원, 금융사지배구조법, 제재공시,"다음 뉴스 기사를  3문장으로 요약해, 총 답변의 길이는 150자 이내로 제한한다. + content",gpt-3.5-turbo-16k,1,256,1,0,0,금융감독원은 참저축은행에서 발생한 횡령 사건에 대해 제재를 내렸다. 검사 결과 참저축은행은 3억2900만원 규모의 횡령 사건을 적발했으며 2명의 임직원이 관련된 것으로 밝혀졌다. 이들은 자금을 가족의 계좌로 이체하거나 공탁금을 속여 빼돌리는 등의 방법을 사용했다. 금감원은 이를 위반한 참저축은행의 조직 구성 문제에 대해 시정 조치를 취하도록 지시했다.
