article_number,score,keyword1,keyword2,keyword3,keyword4,keyword5,message,model,temperature,max_tokens,top_p,frequency_penalty,presence_penalty,response
605490,3,금융위원회, 이윤수 자본시장국장, 신임 FIU 원장, 행정고시, 금융정보분석원장,"다음 뉴스 기사를  3문장으로 요약해, 총 답변의 길이는 150자 이내로 제한한다. + content",gpt-3.5-turbo-16k,1,256,1,0,0,금융위원회는 이윤수 자본시장국장을 금융정보분석원(FIU) 원장으로 임명했으며 임기는 내달 3일부터 시작된다. 이윤수 신임 FIU 원장은 공직 경력뿐만 아니라 금융 분야에서의 전문성으로 평가받고 있다.
605461,3,주택담보대출, 신용대출, 금리 상승, 가계대출, 한국은행,"다음 뉴스 기사를  3문장으로 요약해, 총 답변의 길이는 150자 이내로 제한한다. + content",gpt-3.5-turbo-16k,1,256,1,0,0,은행 대출과 예금 금리가 한국은행 기준금리 동결에도 상승세를 보였다. 지난해 11월 이후 처음으로 금리가 오른 것으로 나타났으며 특히 대출금리는 약 6개월 만에 상승했다. 기업대출의 영향으로 인해 대출금리가 상승하였으며 반면 가계대출은 주택담보대출과 전세자금대출의 금리가 하락하면서 상승했다. 비은행금융기관 대출금리는 전반적으로 약간의 하락세를 보인 것으로 나타났다.
605460,3,삼정화재, 애니핏 플러스, 유튜브 채널, 광고, 건강관리,"다음 뉴스 기사를  3문장으로 요약해, 총 답변의 길이는 150자 이내로 제한한다. + content",gpt-3.5-turbo-16k,1,256,1,0,0,삼성화재는 애니핏 플러스 출시 1주년을 맞아 새로운 광고 영상을 공개했다. 광고는 총 3편으로 애니핏 플러스 애플리케이션의 다양한 기능을 보여준다. 슬로건은 'anything possible Anyfit PLUS'로 건강관리를 위해 모든 시도를 권장한다. 영상에서는 발병 위험 예측 분석 팀 걷기 챌린지 영양제 추천 서비스 등의 기능을 소개한다.
605454,1,KDB생명 매각 본입, 우리금융지주, 하나금융지주, 산업은행, 매각에 성공,"다음 뉴스 기사를  3문장으로 요약해, 총 답변의 길이는 150자 이내로 제한한다. + content",gpt-3.5-turbo-16k,1,256,1,0,0,KDB생명의 매각 본입찰이 7월로 연기되었다. 이는 KDB산업은행이 입찰에 참여할 투자자를 늘리기 위한 조치로 분석되고 있다. 산업은행과 칸서스자산운용은 매각 일정을 연기하고 이번 매각은 다섯 번째인만큼 투자자 참여를 독려하기 위한 것으로 알려졌다. 매각 대상은 KDB생명 지분 92.7%로 예상 판매가격은 2000억원대이다.
605443,2,임종룡 회장, 우리금융그룹, 소통, 인사제도 개선, 영업중심 문화,"다음 뉴스 기사를  3문장으로 요약해, 총 답변의 길이는 150자 이내로 제한한다. + content",gpt-3.5-turbo-16k,1,256,1,0,0,"우리금융그룹의 임종룡 회장이 직원들의 의견을 받기 위해 '소원수리함'을 마련했다고 밝혔다. 임 회장은 편지를 통해 ""자유로운 소통을 위해 중간 과정을 생략하는 용기가 필요하다""며 직원들에게 알려달라고 요청했다. 또한 내부 제도 개선과 증권·보험사 인수를 통한 비은행 포트폴리오 비중 확대 등을 향후 방향으로 제시했다."
605442,2,보험사기방지법, 금융감독원, 특별법, 윤창현 의원실, 보험료 절감,"다음 뉴스 기사를  3문장으로 요약해, 총 답변의 길이는 150자 이내로 제한한다. + content",gpt-3.5-turbo-16k,1,256,1,0,0,연간 보험사기 피해액이 1조원을 넘어섰지만 보험사기방지법 개정에 대한 논의는 아직 제자리 걸음이다. 보험사기규모는 꾸준히 상승하고 있으며 이는 일반 가입자의 보험료 상승으로 이어질 우려가 있다. 보험사기 방지를 위한 특별법 개정안은 논의가 계속 지연되고 있으며 업계에서는 이러한 상황을 우려하고 있다. 개정을 통해 보험사기를 줄이고 소비자에게 더 나은 보험상품을 제공할 수 있을 것으로 기대된다.
605426,2,한화손해보험, ESG경영보고서, 2023 보고서, 통합 ESG 인덱스, 핵심 성과,"다음 뉴스 기사를  3문장으로 요약해, 총 답변의 길이는 150자 이내로 제한한다. + content",gpt-3.5-turbo-16k,1,256,1,0,0,한화손해보험은 '2023 지속가능경영보고서'를 발간하여 ESG경영 전략 목표와 성과를 공개했다. 보고서에는 펨테크연구소 설립 상생협력 금융신상품 우수사례 선정 환경정책 로드맵 공개 등의 핵심 성과가 강조되었다. 한화손해보험은 고객에게 더 나은 가치를 제공하고 지속가능한 발전을 위해 ESG활동을 추진할 것을 약속했다.
605407,1,흥국화재 우선주, 한국거래소, 금융당국, 배당, 상장 폐지,"다음 뉴스 기사를  3문장으로 요약해, 총 답변의 길이는 150자 이내로 제한한다. + content",gpt-3.5-turbo-16k,1,256,1,0,0,흥국화재2우선주가 상장폐지 우려로 주가가 흔들리고 있다. 지난해 말부터 관리종목으로 지정된 이후 흥국화재는 대응책을 내놓지 않아 투기 종목으로 전락하고 투자자의 피해가 커지고 있다. 주식 수 부족으로 인해 상장폐지 위기에 놓여 주식 수를 충족시키기 위해 유상증자나 액면분할 등의 조치가 필요하다. 그러나 흥국화재는 추가 주식 발행 계획이 없다고 밝혔다. 이로 인해 주가는 변동이 크며 투자자들은 배당 한 번도 받지 못한 점에 분통을 터뜨리고 있다.
605386,1,이복현 금감원장, KB금융, 우리카드 행사, KB금융 회장 선임, 승계 절차,"다음 뉴스 기사를  3문장으로 요약해, 총 답변의 길이는 150자 이내로 제한한다. + content",gpt-3.5-turbo-16k,1,256,1,0,0,금융감독원장 이복현은 KB금융그룹 차기 회장 인선 절차에 공평성을 강조하며 업계 모범이 되기를 바란다고 밝혔다. 현재 KB금융은 차기 회장 후보군을 선정 중이며 허인 양종희 이동철 부회장과 박정림 총괄부문장이 가장 유력한 후보로 거론되고 있다. 이복현 원장은 KB금융의 노력에도 개선의 여지가 있다는 점을 발견하여 의견을 전달했다고 강조했다.
605380,3,KB금융, 금융지원 프로그램, 특별대출, 기업대출, 청구유예,"다음 뉴스 기사를  3문장으로 요약해, 총 답변의 길이는 150자 이내로 제한한다. + content",gpt-3.5-turbo-16k,1,256,1,0,0,KB금융은 장마철 자연재해 피해 대비를 위해 금융지원 프로그램을 가동한다고 밝혔다. 이번 지원은 특별대출 금리우대 보험료와 카드 결제대금 유예 등으로 구성되며 지원 대상은 장마철 호우 등으로 피해를 본 수재민이다. 추가로 KB금융은 대규모 피해 발생 시 해당 지역에 긴급 구호키트와 급식차 세탁차 등을 지원할 계획이다.
605339,1,이복현 금감원장, 채무감면, 서민 자금 공급, 우리카드, 임종룡 회장,"다음 뉴스 기사를  3문장으로 요약해, 총 답변의 길이는 150자 이내로 제한한다. + content",gpt-3.5-turbo-16k,1,256,1,0,0,이복현 금융감독원장은 '우리카드 상생금융 출시 기념 취약계층 후원금 전달 및 소상공인 간담회'에 참석하여 제2금융권에 취약계층에 대한 자금공급을 위축되지 않도록 노력해달라고 당부했다. 이같은 발언은 카드사들의 연체율 상승과 자금공급 위축 우려를 반영한 것으로 풀이된다. 우리카드가 상생금융 지원책을 내놓은 것을 계기로 다른 금융사들도 취약계층 지원에 나서 달라는 촉구가 이루어지고 있다.
605322,1,보험시장, 마케팅, 지원사업, 기부, 입지 확보,"다음 뉴스 기사를  3문장으로 요약해, 총 답변의 길이는 150자 이내로 제한한다. + content",gpt-3.5-turbo-16k,1,256,1,0,0,KB손해보험은 노인 교통안전을 위해 반짝반짝 캠페인을 진행하고 안전용품을 폐지수거 어르신들에게 전달했다. AXA손해보험은 국가서비스대상 자동차보험 부문 대상을 수상하여 고객들로부터 신뢰와 만족도가 높은 서비스로 인정받았다. 한화생명은 신설된 VIP 고객 서비스 기부금을 전달하는 행사를 개최하였고 NH농협생명은 집중호우로 피해를 입은 함평군을 현장 점검하고 복구 지원을 약속했다.
605313,4,후쿠시마 오염수, 금융당국, 소비자 불안감, 보험회사, 불건전 영업행위,"다음 뉴스 기사를  3문장으로 요약해, 총 답변의 길이는 150자 이내로 제한한다. + content",gpt-3.5-turbo-16k,1,256,1,0,0,금융당국이 후쿠시마 오염수를 악용한 보험사에 대해 엄정 대응하겠다고 밝혔다. 최근 일부 보험회사가 국내에도 방사성 물질이 전파된다는 주장으로 암 보험 가입을 권유했으며 금융당국은 이러한 불건전 영업행위를 중단시키기 위한 조치를 취했다. 또한 금융당국은 보험업계의 영업행위를 면밀히 모니터링하고 금융소비자보호법을 위반한 사항이 발견될 경우 엄중 조치할 것이라고 밝혔다.
605282,3,롯데카드, 유동성 확보, ABCP, ESG 프레임워크, KB국민은행,"다음 뉴스 기사를  3문장으로 요약해, 총 답변의 길이는 150자 이내로 제한한다. + content",gpt-3.5-turbo-16k,1,256,1,0,0,롯데카드가 3000억원 규모의 ABCP를 발행했다. 이번 발행은 신용카드 매출채권을 기초자산으로 설정하여 이루어졌으며 KB국민은행이 투자자로 참여했다. 발행된 자금은 저소득층에 대한 금융서비스 지원 목적으로 사용될 예정이다.
605265,3,케이뱅크, 미성년자, 선불전자지급수단, 서비스 정지 방법, 규제 방법,"다음 뉴스 기사를  3문장으로 요약해, 총 답변의 길이는 150자 이내로 제한한다. + content",gpt-3.5-turbo-16k,1,256,1,0,0,케이뱅크가 선불전자지급수단의 정지 절차에 대해 본사와 고객센터 간 불일치를 보인다. 케이뱅크는 대면 방문을 요구하는 반면 다른 은행은 비대면으로 정지 가능하다. 특히 미성년자의 도박 등 위험한 이용에 대한 규제 필요성이 제기되면서 케이뱅크는 분노와 비난을 받고 있다.
605261,4,대부업, 저신용자, 금융감독원, 불법 사금융, 연체율,"다음 뉴스 기사를  3문장으로 요약해, 총 답변의 길이는 150자 이내로 제한한다. + content",gpt-3.5-turbo-16k,1,256,1,0,0,지난해 말을 기준으로 대부업 이용자가 7만5000명 줄어 98만9000명으로 감소했다. 저신용자들은 대부업을 이용하지 못하고 불법 사금융으로 이동한 것으로 추정되며 대부업 이용자수는 약 15년 만에 100만명 아래로 떨어졌다. 대부업 대출잔액은 15조8678억원으로 줄어들었고 대부 수요는 담보 대출의 영향으로 계속해서 증가하는 추세이다. 하지만 연체율은 지난해 말엔 7.3%로 상승했으며 금융당국은 이에 대한 우려를 표명하고 대부업 이용 저신용층에 대한 금융 애로 해소와 불
605231,3,만 나이, 금감원, 보험나이, 금융불편 상담센터, 새 제도,"다음 뉴스 기사를  3문장으로 요약해, 총 답변의 길이는 150자 이내로 제한한다. + content",gpt-3.5-turbo-16k,1,256,1,0,0,윤석열 정부가 도입하려는 '만 나이 통일법'이 시행되면서 은행 서비스 이용에 따른 혼란이 예상되지만 은행권과 카드업계는 큰 혼선 없을 것으로 예상되며 금감원은 금융불편 상담센터를 설치하여 불편사항을 처리할 예정이다. 하지만 보험업권은 '보험나이'라는 별도의 개념을 사용하고 있기 때문에 유의해야 한다.
605204,3,영상통화, 금융위원회, 보험상품, 화재보험, 보험제도,"다음 뉴스 기사를  3문장으로 요약해, 총 답변의 길이는 150자 이내로 제한한다. + content",gpt-3.5-turbo-16k,1,256,1,0,0,금융위는 하반기부터 영상통화로만 보험에 가입할 수 있게 되며 일부 보험제도가 개편되어 소비자 편익이 증가될 것으로 예상된다. 이 개편으로 소비자는 영상통화를 통해 보험 설명을 듣고 동시에 보험 설명서 등을 확인할 수 있게 되었으며 보험회사는 보험상품과 연계한 물품 제공 범위가 넓어져 소비자 만족도를 높일 수 있게 되었다. 또한 보험상품 관련 비교·공시 항목도 개선되어 소비자의 보다 정확한 정보에 기반하여 선택할 수 있게 되었다.
605200,2,대환대출, 이자부담, 고객이탈, 카드업계, 플랫폼 업체,"다음 뉴스 기사를  3문장으로 요약해, 총 답변의 길이는 150자 이내로 제한한다. + content",gpt-3.5-turbo-16k,1,256,1,0,0,대환대출 플랫폼 입점을 준비하고 있는 카드사들이 부담을 느끼며 냉가슴을 앓고 있다. 이는 플랫폼 입점의 이점보다 고객을 빼앗길 우려와 중개수수료 부담 때문이다. 카드사들은 대환대출 비교 플랫폼에 입점을 검토하고 있지만 금리 경쟁력이 부족하고 부담이 크다는 이유로 고민하고 있다. 플랫폼 업체는 카드사 입점으로 데이터 축적과 중개수수료 수입이 가능해 유리한 시장 환경을 조성할 수 있다는 점에서 입점에 긍정적이다.
605196,1,사회공헌 활동, 이벤트, 지원, 서비스, 보험 시장,"다음 뉴스 기사를  3문장으로 요약해, 총 답변의 길이는 150자 이내로 제한한다. + content",gpt-3.5-turbo-16k,1,256,1,0,0,NH농협생명은 농촌일손돕기를 통해 영농가에 도움을 주고자 버섯농장을 방문한 반면 SGI서울보증은 IBK기업은행과 소상공인 자금경색을 해소하기 위한 파트너십을 구축했다. 한편 한화손해보험은 행정안전부와 안전문화 사회공헌활동에 참여하는 등 보험사들이 다양한 사회공헌 활동에 나서고 있다.
605191,2,현대카드, 신용등급, SI, 지위 평가, PLCC,"다음 뉴스 기사를  3문장으로 요약해, 총 답변의 길이는 150자 이내로 제한한다. + content",gpt-3.5-turbo-16k,1,256,1,0,0,현대카드는 세계 3대 신용평가사 S&P가 그룹 내 평가 지위를 4등급에서 3등급으로 상향 조정하고 신용등급 전망을 안정적으로 유지했다고 밝혔다. S&P는 현대카드의 차량 내 결제 서비스 사업과 현대차 및 기아와의 협업을 인정하며 평가했다. 현대카드는 친환경차 트렌드에 맞춘 전기차 신용카드 발급량도 증가하고 있으며 신용평가 등급은 BBB(Stable)을 유지했다.
605075,2,금융위원회, 숨은 보험금, 중도보험금, 서민금융진흥원, 휴먼보험금,"다음 뉴스 기사를  3문장으로 요약해, 총 답변의 길이는 150자 이내로 제한한다. + content",gpt-3.5-turbo-16k,1,256,1,0,0,금융위원회는 9월부터 '숨은 보험금 찾아주기 캠페인'을 실시할 계획이다. 현재까지 청구 및 지급되지 않은 보험금은 약 12조4000억원에 달하며 이에 대한 안내를 위해 보험사는 최신 주소로 보험계약자에게 우편으로 안내할 예정이다. 또한 휴면보험금의 서민금융진흥원 출연 시기를 1년 앞당기고 출연된 휴면보험금의 운영수익금은 취약계층 지원사업에 사용될 예정이다.
605076,4,신한은행, 시니어이동점포, NH농협은행, KB국민은행, 고객 편의,"다음 뉴스 기사를  3문장으로 요약해, 총 답변의 길이는 150자 이내로 제한한다. + content",gpt-3.5-turbo-16k,1,256,1,0,0,신한은행은 '찾아가는 시니어이동점포' 서비스를 시작하여 경로 불편한 양천어르신종합복지관을 방문해 금융업무와 보이스피싱 금융교육 등을 제공할 예정이다. NH농협은행은 ESG채권 '농업지원 소셜본드'를 발행하여 농업인 및 농업 부문에 대한 재정 지원에 전액 쓰이도록 했으며 KB국민은행은 한국씨티은행과의 업무 제휴 협약을 통해 씨티은행 고객에게 국민은행의 상품과 서비스 이용을 가능하게 했다.
605070,2,오토바이 보험, 배달, 금융감독원, 보호할인등급, 보험료 할인,"다음 뉴스 기사를  3문장으로 요약해, 총 답변의 길이는 150자 이내로 제한한다. + content",gpt-3.5-turbo-16k,1,256,1,0,0,금융감독원은 보험료 부담으로 인한 이륜차보험 가입률 저조로 인한 보장 사각지대 해소를 위해 이륜차보험료 산정체계 개선방안을 마련했다. 최초가입자 보호할인등급 신설과 단체할인·할증제도 등을 도입하여 보험료 부담을 완화하고 손해율이 좋은 법인에 대한 보험료 할인 혜택을 제공할 예정이다. 또한 시간제보험 판매사를 확대해 시간제보험 가입에 어려움을 겪는 이륜차 운전자도 보장받을 수 있도록 하겠다고 당국은 밝혔다.
605057,4,삼성페이, 유료화, 수수료, 카드사, 공동 마케팅 비용,"다음 뉴스 기사를  3문장으로 요약해, 총 답변의 길이는 150자 이내로 제한한다. + content",gpt-3.5-turbo-16k,1,256,1,0,0,삼성페이가 유료화 방향으로 나아가면서 삼성전자는 카드사들에게 수수료를 부과하고 일부 상쇄를 위한 상생 방안을 제안하고 있다. 이로 인해 카드사들은 수수료 부담을 회피하기 위해 혜택을 줄일 가능성이 높아지는 우려가 제기되고 있다. 구체적인 수수료율은 아직 협상 중이지만 카드사별 점유율과 결제 건수에 따라 낮은 수수료율이 적용될 것으로 예상되고 있다.
605041,5,NH, 보험, 농생통통, 앱, 힐링워킹,"다음 뉴스 기사를  3문장으로 요약해, 총 답변의 길이는 150자 이내로 제한한다. + content",gpt-3.5-turbo-16k,1,256,1,0,0,NH농협생명 KB손해보험 DB손해보험 등 보험사들이 입지 확보와 경쟁력 강화를 위해 다양한 마케팅과 프로모션을 추진하고 있다. NH농협생명은 농생통통 이벤트 개최와 소통문화 조성을 통해 직원들의 애로사항과 의견 교류를 촉진하고 있는 반면 KB손해보험은 보험 서비스 통합 앱 출시로 고객 편의성과 사용성을 강화하고 있다. 또한 DB손해보험은 힐링워킹 이벤트를 통해 건강과 금융서비스를 함께 제공하며 고객들의 신뢰를 얻고
605030,3,수협중앙회, 금융감독원, 자금세탁방지, 감사, ??,"다음 뉴스 기사를  3문장으로 요약해, 총 답변의 길이는 150자 이내로 제한한다. + content",gpt-3.5-turbo-16k,1,256,1,0,0,금감원은 수협중앙회의 자금세탁방지 업무 소홀을 지적하고 체계 개선을 요구했다. 수협은 적절한 기준 없이 문제를 현지 조치하고 자금세탁방지 검사를 부족하게 실시하였으며 인력 부족 문제와 독립적 감사 절차를 지적받았다. 또한 수협은 고객확인 업무의 점검 절차를 갖추지 않았고 위험평가모형 적정성과 의심거래 추출건 보고 등에도 미흡한 점이 있었다. 이를 통해 금감원은 개선을 요청하였다.
605024,5,수수료, 삼성페이, 유료화, 카드사, 소비자,"다음 뉴스 기사를  3문장으로 요약해, 총 답변의 길이는 150자 이내로 제한한다. + content",gpt-3.5-turbo-16k,1,256,1,0,0,삼성전자가 카드사에 삼성페이 수수료를 부과하고 일부 금액을 공동 마케팅 금액으로 지원하는 방안을 고려 중인 것으로 전해졌다. 이는 애플이 현대카드에 수수료를 부과한 것을 반영한 조치로 삼성전자와 카드사 간의 개별협상이 이어지고 있다. 이러한 유료화로 인해 카드사 수익성 악화와 소비자 혜택 감소가 우려되고 있다.
604983,3,보험, AIA생명, KB손해보험, 동양생명, 마케팅,"다음 뉴스 기사를  3문장으로 요약해, 총 답변의 길이는 150자 이내로 제한한다. + content",gpt-3.5-turbo-16k,1,256,1,0,0,AIA생명은 임직원과 함께 '노 플라스틱 한강 줍깅 행사'를 개최하여 환경 보호에 참여했고 KB손해보험은 이동의료차량을 유기동물 보호를 위해 기증했다. 또한 동양생명은 고객제도를 개편하고 우수고객에게 차별화된 서비스를 제공한다.
604978,3,KB국민은행, 디지털서비스, 공공 서비스, 앱, 은행사,"다음 뉴스 기사를  3문장으로 요약해, 총 답변의 길이는 150자 이내로 제한한다. + content",gpt-3.5-turbo-16k,1,256,1,0,0,KB국민은행은 앱 KB스타뱅킹의 'KB 월렛'에서 행정안전부 등의 공공서비스를 제공한다고 발표했다. 이에 따라 자동차 검사 예약과 인천국제공항 지도 등의 서비스가 이용 가능해졌으며 향후 더 많은 공공 서비스를 제공할 예정이다. 또한 카카오뱅크는 국세와 공과금 납부 서비스를 출시하고 산업은행은 'KDB스마트 오션인프라 펀드 프로그램'을 출시하여 해양물류 및 항만 등의 지원을 확대하고자 한다.
604957,4,DSR, 가계대출, 한국은행, 이자, 금리 인상,"다음 뉴스 기사를  3문장으로 요약해, 총 답변의 길이는 150자 이내로 제한한다. + content",gpt-3.5-turbo-16k,1,256,1,0,0,DSR(Debt Service Ratio)은 지난해 4분기에 이어 올해 1분기에도 40%를 넘어선 가계대출 상환액 대비 연 소득 비율로 나타났다. 이로 인해 가계대출 부실 신호가 커지고 있어 대출 리스크 관리가 필요한 상황이다. 금리 인상으로 인한 이자 부담이 늘어난 데다가 은행권의 가계대출 연체율과 고정이하여신비율도 상승세를 보여 가계대출 리스크 규모가 커지고 있다는 점을 알렸다.
604887,1,영상통화, 금융위원회, 화재보험, 보험상품, ,"다음 뉴스 기사를  3문장으로 요약해, 총 답변의 길이는 150자 이내로 제한한다. + content",gpt-3.5-turbo-16k,1,256,1,0,0,현대카드와 비자가 데이터 사업 협력을 위해 전략적 파트너십을 맺었다. 이를 통해 현대카드의 데이터 분석 솔루션을 비자의 글로벌 네트워크를 활용하여 해외에서 선보이고 두 회사가 데이터 상품 및 솔루션 개발에도 협력할 예정이다. 또한 현대카드와 비자는 다양한 분야에서의 협업을 강화하고 비자는 현대카드의 파트너사 데이터 동맹에 참여할 계획이다.
604875,2,예금보호한도, 금융위원회, 예금자보호법, 5000만원, 보험,"다음 뉴스 기사를  3문장으로 요약해, 총 답변의 길이는 150자 이내로 제한한다. + content",gpt-3.5-turbo-16k,1,256,1,0,0,금융당국은 연금저축 사고보험금 중소기업퇴직연금기금에 대해 각각 5000만원의 예금보호한도를 적용하기로 했다. 이로써 예금자는 5000만원까지 해당 자산을 보호받을 수 있게 되었다. 이번 조치로 예금자의 보호체계가 강화되었다.
604863,4,1020, KB국민카드, 노리2 체크카드, 플레이 버전, 생활편의,"다음 뉴스 기사를  3문장으로 요약해, 총 답변의 길이는 150자 이내로 제한한다. + content",gpt-3.5-turbo-16k,1,256,1,0,0,KB국민카드가 'KB국민 노리2 체크카드' 플레이 버전을 출시하여 생활편의 영역에서 할인 혜택을 제공한다고 밝혔다. 해당 카드는 커피 편의점 배달 등 10개 업종에서 일상 혜택을 받을 수 있으며 플레이형 발급 시 PC방과 패스트푸드점 할인 혜택도 추가로 제공된다. 또한 다양한 이벤트도 진행되며 게임이나 1020세대의 놀이 문화와 연계한 마케팅 활동을 전개할 예정이다.
604858,4,한덕수, 6.25전쟁 기념식, 자주국방, 한미일 안보 협력, 북한,"다음 뉴스 기사를  3문장으로 요약해, 총 답변의 길이는 150자 이내로 제한한다. + content",gpt-3.5-turbo-16k,1,256,1,0,0,한덕수 국무총리는 6‧25 전쟁 기념식에 참석해 자주국방 의지를 표명했다. 한덕수 총리는 북한의 거짓된 선의에 휘둘리지 않으며 강력한 자주국방으로 안보를 지키겠다고 밝혔다. 또한 한덕수 총리는 한미일 안보 협력의 중요성을 강조하며 한미일 3국간의 안보 협력을 더욱 단단하게 할 것이라고 말했다.
604848,3,청년도약계좌, 중도 해지, 적금담보대출, 청년희망적금, 금융감독원,"다음 뉴스 기사를  3문장으로 요약해, 총 답변의 길이는 150자 이내로 제한한다. + content",gpt-3.5-turbo-16k,1,256,1,0,0,금융당국이 최근 출시된 '청년도약계좌'의 중도 해지를 막기 위한 방안을 논의하고 있다. 이는 만기가 5년으로 긴 기간이기 때문에 가입자들이 중도 해지할 수 있는 우려가 있기 때문이다. 중도 해지를 포함한 청년희망적금과 관련된 연구 용역도 진행되고 있다.청년도약계좌의 중도 해지 방안에 대한 구체화된 방법은 아직 도출되지 않았으며 청년희망적금의 중도 해지자 비율이 증가하는 상황과 마찬가지로 청년도약계좌도 중도 해지 우려가 있다. 이에 대한 대책 마련이 금
