article_number,score,keyword1,keyword2,keyword3,keyword4,keyword5,message,model,temperature,max_tokens,top_p,frequency_penalty,presence_penalty,response
606213,5,보람상조, 플랫폼 기업, 비즈마켓, 보람라이프플랜, 업무협약,"다음 뉴스 기사를  3문장으로 요약해, 총 답변의 길이는 150자 이내로 제한한다. + content",gpt-3.5-turbo-16k,1,256,1,0,0,보람상조가 플랫폼 기업과 함께 상품 판매채널을 확대하여 고객만족 경영에 노력하고 있다. 이를 위해 비즈마켓과 이해라이프스타일과의 B2B 업무협약을 맺었으며 보람라이프플랜 상품을 판매할 예정이다. 이번 협약은 보람상조의 다양한 제휴 비즈니스에 활력을 불어넣을 것으로 기대된다.
606202,2,금융위원회, 김주현 위원장, 취약계층, 규제개선, 자금지원,"다음 뉴스 기사를  3문장으로 요약해, 총 답변의 길이는 150자 이내로 제한한다. + content",gpt-3.5-turbo-16k,1,256,1,0,0,김주현 금융위원회 위원장이 1주년을 맞아 금융시장 안정과 서민 지원에 초점을 둘 것을 강조했다. 금융시장 안정을 위해 부동산 PF 연착륙 등을 추진하고 취약계층을 위해 정책서민금융 공급규모를 확대할 예정이라고 밝혔다. 또한 금융산업 혁신과 경제 성장을 지원하기 위해 금융과 비금융 간 융합을 통한 서비스 개발과 금융제도 보완을 추진할 계획이다.
606159,2,롯데카드, 횡령사고, 협력업체, 통제 부실, 100억원,"다음 뉴스 기사를  3문장으로 요약해, 총 답변의 길이는 150자 이내로 제한한다. + content",gpt-3.5-turbo-16k,1,256,1,0,0,롯데카드 일부 직원이 용역업체로부터 금품을 수취한 횡령 사고가 발생한 가운데 내부 통제 부실 논란이 제기되고 있다. 롯데카드는 사건에 대한 조사를 진행 중이며 횡령 사고와 관련해 책임을 지는 임원들의 미래가 불투명하다.금융당국은 내부 직원의 이러한 일탈이 반복되면 금융회사 CEO에게 책임을 물을 예정이지만 현재 법령상 적용 대상은 아직 아니다.롯데카드는 현재 사실관계를 파악하기 위해 감사를 진행 중이며 조사결과에 따라 이후 조치를 취할 예
606138,3,OK금융그룹, 최윤 회장, 항저우 아시안게임, 선수단 단장, 스포츠 지원,"다음 뉴스 기사를  3문장으로 요약해, 총 답변의 길이는 150자 이내로 제한한다. + content",gpt-3.5-turbo-16k,1,256,1,0,0,최윤 OK금융그룹 회장이 항저우 아시안게임 대한민국 국가대표 선수단장으로 공식 선임되었다. 최윤 회장은 9월부터 10월까지 선수단 운영을 총괄하며 국내외 단체와의 협력을 통해 게임을 대한민국의 대축제로 만들기 위해 노력할 것이라 밝혔다. 이는 아시안게임 역사상 재외동포 출신 선수단장의 첫 선임이다.
606141,4,새마을금고, 출자 특혜, 사모펀드, 류 대표, 검찰 조사,"다음 뉴스 기사를  3문장으로 요약해, 총 답변의 길이는 150자 이내로 제한한다. + content",gpt-3.5-turbo-16k,1,256,1,0,0,새마을금고중앙회의 사모펀드 비도가 수사되며 류혁 신용공제 대표이사가 체포되었다. 검찰은 류 대표의 특정 자산운용사에 펀드 출자 특혜 의혹을 조사하고 있다. 이는 이전에 수사된 새마을금고의 프로젝트파이낸싱 및 사모펀드 운용 업체와의 인수과정과 관련된 것으로 알려졌다.
606098,2,보험사, 자회사 설립, 노조 리스크, 판매실적, 자금회수,"다음 뉴스 기사를  3문장으로 요약해, 총 답변의 길이는 150자 이내로 제한한다. + content",gpt-3.5-turbo-16k,1,256,1,0,0,보험사들이 자회사형 조달기구(GA) 설립에 뛰어들고 있으며 판매 채널 다변화와 비용 효율성 개선을 위해 자체 GA 설립을 추진하고 있다. 그러나 자회사 설립 초기 리스크와 노사 간 대립 등의 문제가 존재하여 투자 시기와 규모를 신중하게 결정해야 한다는 지적이 나왔다. 노사 협상과 설계사 교육 관리 조직 구축을 통해 리스크를 최소화하고 기존 채널과의 시너지 효과를 고려하는 것이 중요하다는 의견이다. 
606112,4,BC카드, 인도네시아, 그린카드 플랫폼, 자카르타주정부은행, 스마트시티,"다음 뉴스 기사를  3문장으로 요약해, 총 답변의 길이는 150자 이내로 제한한다. + content",gpt-3.5-turbo-16k,1,256,1,0,0,BC카드는 인도네시아 자카르타주정부은행과 '그린카드 플랫폼' 업무협약을 체결했다. 그린카드 플랫폼은 친환경 소비를 촉진하기 위해 에코머니 포인트를 적립해주고 공공시설 무료입장과 할인 혜택도 제공한다.이번 계약으로 BC카드는 인도네시아에서의 K-금융 세일즈와 현지화에 앞장서게 되었으며 인도네시아 지방정부은행과의 협력을 통해 매입시스템 수출과 카드발급 사업을 확장할 수 있는 기회를 얻었다.
606099,2,현대캐피탈 , 자동차 특화, 자동차 금융상품, 추천 서비스, 차량 개인화 추천,"다음 뉴스 기사를  3문장으로 요약해, 총 답변의 길이는 150자 이내로 제한한다. + content",gpt-3.5-turbo-16k,1,256,1,0,0,현대캐피탈은 현대캐피탈 앱을 맞춤형 차량 추천을 위해 전면 개편했다. 개편된 앱은 자동차 탐색을 중심으로 한 직관적인 메인화면과 AI 기술과 마이데이터를 활용한 맞춤형 추천 서비스를 제공한다. 또한 사용자 편의성을 높이기 위해 차량탐색 기능을 강화하고 이용 가능한 금융상품을 추천해준다.
606074,3,캠페인, 하나은행, 신한은행, KB국민은행, 메타버스 클래스 사업,"다음 뉴스 기사를  3문장으로 요약해, 총 답변의 길이는 150자 이내로 제한한다. + content",gpt-3.5-turbo-16k,1,256,1,0,0,하나은행은 '메타버스 클래스 사업' 업무협약을 컴투버스와 솜씨당과 체결하여 메타버스 생태계 활성화를 추진할 예정이다. 신한은행은 '신한프렌즈 티셔츠 커스터마이징 콘테스트'를 개최하여 참가자들로부터 우수작품을 선정하고 상금을 제공할 예정이다. 또한 KB국민은행에서는 '목요일엔 출석 체크하고 우산 선물하기' 캠페인을 진행하여 출석체크한 고객에게 하트를 기부하고 추첨을 통해 기프트카드를 제공할 예정이다.
606050,3,보람 그룹, 최철홍 회장, 경영대상, 상조 업계, 상조서비스,"다음 뉴스 기사를  3문장으로 요약해, 총 답변의 길이는 150자 이내로 제한한다. + content",gpt-3.5-turbo-16k,1,256,1,0,0,보람그룹의 최철홍 회장이 2년 연속 '한국의 최고 경영대상' 리더십부문 대상을 수상했다. 보람그룹은 고객 중심 경영을 바탕으로 국내 상조산업을 개척하고 현대화된 상조서비스를 제공해 대표 상조 브랜드로 성장했다. 보람그룹은 또한 기획재정위원회로부터 산업발전유공부문상을 받았다. 최철홍 회장은 앞으로도 고객을 중심으로하는 나눔경영 철학을 추구하며 사회와 상생하는 기업으로 발전하겠다고 밝혔다.
606009,2,새마을금고, 행정안전부, 지급 보호, 새마을 금고법, 담보대출 부실,"다음 뉴스 기사를  3문장으로 요약해, 총 답변의 길이는 150자 이내로 제한한다. + content",gpt-3.5-turbo-16k,1,256,1,0,0,새마을금고 위기설에 대해 행정안전부는 예·적금을 안전하게 관리하고 있으며 철저한 관리로 더욱 성장할 것이라고 밝혔다. 새마을금고의 대출금액은 196조8000억원이고 연체된 금액은 12조1600억원으로 역대 최고 수준이다. 행안부는 예금자보호와 인수합병을 통해 안정적인 예·적금 지급 보장을 위해 노력하고 있다고 설명했다.
605994,4,DB손해보험, 집중호우, 침수예방, 비상대응팀, 데이터 분석,"다음 뉴스 기사를  3문장으로 요약해, 총 답변의 길이는 150자 이내로 제한한다. + content",gpt-3.5-turbo-16k,1,256,1,0,0,DB손해보험은 슈퍼 엘니뇨로 인한 집중호우에 대비하여 차량 침수손해 예방을 위해 비상대응팀을 운영할 예정이다. 이 비상대응팀은 고객 서비스 제공 및 보상처리를 위해 2012년부터 운영되어 왔으며 지난해에도 기록적인 폭우에 효과적으로 대응하여 신속한 보상 및 서비스를 제공했다. 올해에는 침수 다발지역 데이터 분석을 통해 안내 및 예방대책을 마련하고 사고 예방 및 최소화를 위해 위험지역 순찰을 강화할 예정이다.
605988,5,금융위원회, 강화된 감독기준, D-SIB, D-SIFI, 자체정상화계획,"다음 뉴스 기사를  3문장으로 요약해, 총 답변의 길이는 150자 이내로 제한한다. + content",gpt-3.5-turbo-16k,1,256,1,0,0,금융위원회는 KB금융지주 등 10개 은행 및 은행지주회사를 중요 금융기관으로 선정하고 이들은 자체정상화 계획을 제출해야 한다고 밝혔다. D-SIB와 D-SIFI로 선정된 이들은 금융안정 및 부실 정리를 위한 강화된 감독기준을 받게 되며 KB금융지주와 신한금융지주는 최저 기준의 2배인 12%를 초과해 평가 받았다. 이들은 내년부터 추가자본 적립 의무를 부과받고 자체정상화계획을 제출해야 한다.
605958,2,금융감독원, 감사보고서, 재무제표, 회계투명성, 감사의견 변경,"다음 뉴스 기사를  3문장으로 요약해, 총 답변의 길이는 150자 이내로 제한한다. + content",gpt-3.5-turbo-16k,1,256,1,0,0,131개 상장사가 지난해 감사보고서를 정정한 것으로 확인되었다. 이로 인해 상장사들의 회계투명성 강화에 대한 지적이 나오고 있다. 경과기간 평균은 23.4개월로 긴 편이며 감사인과 회사 간의 마찰이 발생하는 경우가 있는 것으로 보인다. 금감원은 이를 분석하여 조치할 계획이다.
605916,0,금융감독원, 임원 성과급, 금융 당국, 자율 공개, 금융회사지배구조법,"다음 뉴스 기사를  3문장으로 요약해, 총 답변의 길이는 150자 이내로 제한한다. + content",gpt-3.5-turbo-16k,1,256,1,0,0,은행들의 성과보수체계가 공개되며 성과금의 지급 방식이 개선될 예정이다. 금융당국은 TF를 통해 세부 기준을 마련하고 성과금 조정과 환수를 추진하며 개별 임원의 보수지급계획과 보수지급액도 공개할 예정이다. 일반 직원의 성과급과 배당은 은행 경영현황 자율공개 보고서를 통해 구체적으로 공개될 것이다.
605907,1,OK배정장학재단, 11기 배정장학생, 장학금, 대학생, 대학원생,"다음 뉴스 기사를  3문장으로 요약해, 총 답변의 길이는 150자 이내로 제한한다. + content",gpt-3.5-turbo-16k,1,256,1,0,0,OK배정장학재단은 등록금 전액을 지원하는 '11기 OK배정장학생'을 모집한다고 발표했다. 대학(원)생을 대상으로 매월 최대 200만원을 지원하며 장학생은 면접 등 추가 전형을 거친 후 8월 중 최종 합격자를 발표할 예정이다. 이외에도 다양한 프로그램을 통해 장학생들의 리더십과 성장을 지원할 계획이다.
605885,3,새 시중은행, 금융당국, 대구은행, 지방은행, 중소기업대출비율,"다음 뉴스 기사를  3문장으로 요약해, 총 답변의 길이는 150자 이내로 제한한다. + content",gpt-3.5-turbo-16k,1,256,1,0,0,금융감독원과 금융위원회는 시중은행 경쟁을 촉진하기 위해 지방은행의 시중은행 전환을 허용하기로 결정했다. 대구은행은 이미 전환 의사를 밝혔으며 금융당국은 대구은행이 자본금과 지배구조 조건을 충족하고 있다고 평가하고 있다. 이로 인해 30년 만에 새로운 시중은행이 등장할 전망이다. 하지만 시중은행 전환에 대해 의문도 제기되고 있는데 지방은행의 규모와 체급 차이가 크기 때문에 경쟁력이 떨어질 수 있다는 지적이 있다. 그러나 금융당국은 경쟁자의 진입 자체
605826,4,우리은행, KB국민은행, 신한은행, 원금상환 지원, 외화 관련 이벤트,"다음 뉴스 기사를  3문장으로 요약해, 총 답변의 길이는 150자 이내로 제한한다. + content",gpt-3.5-turbo-16k,1,256,1,0,0,우리은행이 연체고객에게 원금상환 지원을 실시하는 프로그램을 선보였다. 연체원금을 감소시켜 부담을 덜어주며 이번 프로그램은 내달부터 1년 동안 진행되며 연체이자 납부액에 해당하는 원금을 자동상환해준다. KB국민은행은 비대면 채널을 통해 환전 신청한 고객에게 추첨을 통해 스타벅스 커피 쿠폰을 지급하고 신한은행은 외화 예·적금 상품 가입 고객에게 모두투어 여행상품 할인쿠폰을 제공하는 이벤트를 진행한다.
605822,3,동양생명, 보험계약대출, 금리 인하, 금리 확정형 상품, 이자 상환 부담,"다음 뉴스 기사를  3문장으로 요약해, 총 답변의 길이는 150자 이내로 제한한다. + content",gpt-3.5-turbo-16k,1,256,1,0,0,동양생명은 보험계약대출 이용자들의 이자 부담을 덜기 위해 금리 확정형 상품의 보험계약대출 최고금리를 9.9%에서 5.95%로 인하했다. 이 인하 금리는 지난 1일부터 적용되며 신규 및 기존 고객 모두 혜택을 받을 수 있다. 최고금리 인하로 인해 가계의 이자상환 부담을 줄이고자 하는 동양생명의 노력을 강조했다.
605808,3,금융감독원, 이권 카르텔, 워크숍, 반부패, 이복현 금감원장,"다음 뉴스 기사를  3문장으로 요약해, 총 답변의 길이는 150자 이내로 제한한다. + content",gpt-3.5-turbo-16k,1,256,1,0,0,이복현 금감원장은 최근 발생한 이권 카르텔 문제에 대해 강력한 감독과 검사를 주문했다. 원장은 금감원 내에서 반부패 의지를 고취하고 청렴 시책을 추진하기 위해 반부패 워크숍을 개최했다. 이번 워크숍에서는 모든 참석자들이 반부패와 청렴에 대한 다짐을 한 후 마무리되었다.
605803,2,한화생명, ESG경영, 지배구조 선진화, 탄소중립, 사회 공헌,"다음 뉴스 기사를  3문장으로 요약해, 총 답변의 길이는 150자 이내로 제한한다. + content",gpt-3.5-turbo-16k,1,256,1,0,0,한화생명은 '2023 지속가능경영보고서'를 발간하여 ESG(환경·사회·지배구조)경영 성과와 향후 계획을 공개했다. 보고서에는 환경경영 성과로 종이 사용량 절감과 전자약정시스템 도입 등이 언급되며 사회경영으로는 장애인 채용과 사회공헌활동에 관한 내용을 담았다. 한화생명은 ESG경영을 내재화하고 더 나은 환경과 사회를 위해 노력할 것이라고 밝혔다.
605775,3,손해보험 사회공헌협의회, 집중호우, 관악구, 침수방지 시설, 사회공헌사업,"다음 뉴스 기사를  3문장으로 요약해, 총 답변의 길이는 150자 이내로 제한한다. + content",gpt-3.5-turbo-16k,1,256,1,0,0,손해보험 사회공헌협의회는 여름철 장마 및 집중호우에 대비하기 위해 침수취약지역 주민과 복지기관을 대상으로 30억원 규모의 물막이판과 역류방지시설 설치를 지원한다. 관악구 소재 사회복지기관을 시작으로 물막이판 설치를 시작하고 반지하주택과 일반주택에도 설치를 확대할 계획이다. 이와 함께 손해보험업계는 재난발생 시 피해 보상과 복구를 위해 재난피해 예방사업뿐만 아니라 재난취약지역 풍수해보험 지원 등 다양한 사회공헌사
605770,4,보이스피싱, 일괄지급정지, 금융당국, 오프라인 채널, 디지털 소외계층,"다음 뉴스 기사를  3문장으로 요약해, 총 답변의 길이는 150자 이내로 제한한다. + content",gpt-3.5-turbo-16k,1,256,1,0,0,보이스피싱 피해자가 은행 영업점 및 고객센터를 통해 본인명의 계좌를 일괄지급정지할 수 있다고 금융당국이 밝혔다. 이는 일괄지급정지 서비스가 오프라인 채널까지 확대되면서 가능해진 것으로 온라인 신청에 이어 영업점 방문 및 고객센터 전화로도 계좌를 정지할 수 있다. 금융당국은 이를 통해 금융소비자의 편의성 증대와 피해 예방에 도움이 될 것으로 기대하고 있다.
605762,3,공정위, 국고채 담합, 시중은행, 윤석열 대통령, 금융분야 과점폐,"다음 뉴스 기사를  3문장으로 요약해, 총 답변의 길이는 150자 이내로 제한한다. + content",gpt-3.5-turbo-16k,1,256,1,0,0,공정위가 시중은행에 대한 국고채 입찰 담합 조사에 착수했다. 공정위는 5개 은행과 5개 증권사를 대상으로 현장조사를 진행하고 있는데 주목할 점은 국고채 입찰과정에서 부당한 정보 교환 또는 담합 여부를 중점적으로 조사한다는 것이다. 이 조사는 최근 윤석열 대통령의 언급 이후 공정위가 금융업계 전반에 대한 조사를 확대한 것으로 금감원도 관련 사항이 있다면 협조할 수 있다고 밝혔다.
605729,3,한국은행, 김웅 부총재보, 소비자물가 상승률, 근원물가,  통계청,"다음 뉴스 기사를  3문장으로 요약해, 총 답변의 길이는 150자 이내로 제한한다. + content",gpt-3.5-turbo-16k,1,256,1,0,0,한국은행은 소비자물가 상승률이 향후 다시 높아질 것이라고 예상하며 연간 전망치인 3.3%를 상회할 수 있다고 밝혔다. 물가 상승 속도는 완만한 둔화 흐름이 이어지지만 근원물가는 전망치를 상회할 가능성이 있다고 분석했다. 또한 국제유가 추이 경기 흐름 공공요금 조정 등 불확실성이 높은 상황이 물가에 영향을 줄 수 있다고 전망했다.
605717,3,SC제일은행, 투자전략 보고서, C.A.L.M, 포트폴리오, 주식 투자,"다음 뉴스 기사를  3문장으로 요약해, 총 답변의 길이는 150자 이내로 제한한다. + content",gpt-3.5-turbo-16k,1,256,1,0,0,SC제일은행이 '2023년 하반기 글로벌 금융시장 전망 및 투자전략 보고서'를 발표했다고 밝혔다. 이번 보고서는 상반기의 금융시장 흐름과 하반기의 전망을 다루고 있으며 불안정한 시기에도 안정적인 포트폴리오 다각화와 균형잡힌 투자에 집중하는 'C.A.L.M' 전략을 추천하고 있다. SC제일은행은 앞으로도 고객들의 재무적 목표에 맞는 최적의 자산배분 전략을 제시할 것이라고 밝혔다.
605692,3,금융감독원, DB생명, 상표권료, 경영유의, 지주사 몰아주기,"다음 뉴스 기사를  3문장으로 요약해, 총 답변의 길이는 150자 이내로 제한한다. + content",gpt-3.5-turbo-16k,1,256,1,0,0,DB생명은 지주사 DB Inc에 지나친 상표권 사용료를 지불함으로써 '지주사 몰아주기' 논란에 휘말렸다. DB생명은 투자영업수익 등을 포함한 상표권 사용료를 지불함으로써 금감원의 경영유의 조치를 받았고 그럼에도 불구하고 DB생명은 여전히 동일한 방식으로 상표권료를 지불하고 있는 것으로 알려져 비판을 받고 있다. DB손해보험도 동일한 문제로 금감원으로부터 경영유의 조치를 받았다.
605699,2,우리금융캐피탈, 정연기 대표이사, 취임식, 사업다각화, 선제적 리스크 관리,"다음 뉴스 기사를  3문장으로 요약해, 총 답변의 길이는 150자 이내로 제한한다. + content",gpt-3.5-turbo-16k,1,256,1,0,0,우리금융캐피탈은 새로운 대표이사로 정연기를 취임시켰다. 정 대표이사는 2023년까지 경영목표를 달성하고 사업다각화와 선제적 리스크관리로 안정적인 성장을 추구할 것이라고 밝혔다. 정 대표이사는 업계 초우량 캐피탈사로의 도약을 위해 노력할 것을 약속했다.
605653,1,진옥동 회장, 신한 금융, 내부통제 책무구조도, 신한컬쳐위크, 견제와 검증,"다음 뉴스 기사를  3문장으로 요약해, 총 답변의 길이는 150자 이내로 제한한다. + content",gpt-3.5-turbo-16k,1,256,1,0,0,진옥동 신한금융그룹 회장은 '내부통제 책무구조도'를 조기에 도입할 예정이라고 밝혔다. 이는 그룹의 지속성장가능성을 위해 업무의 모든 과정을 철저히 내부 견제와 검증하는 것이 필요하다는 강조였다. 진 회장은 또한 고객으로부터 인정받는 '일류' 신한을 위해 더 높은 내부 통제를 강화하겠다는 다짐을 전했다.
605634,2,우리은행, 조병규 우리은행장, 기업 금융, 조직개편, 현장경영,"다음 뉴스 기사를  3문장으로 요약해, 총 답변의 길이는 150자 이내로 제한한다. + content",gpt-3.5-turbo-16k,1,256,1,0,0,조병규 신임 우리은행장이 임시주주총회에서 공식 취임하고 조직개편 방향을 예고했다. 조 행장은 영업 중심의 개편과 인사권 강화를 통해 직원들의 업무 경쟁력을 향상시키고 고객 서비스를 강화하겠다는 강한 의지를 밝혔다. 또한 본인의 강점인 기업금융 역량을 우리은행에서 강화할 것이라고 밝혔다.
605628,2,카카오뱅크, 주택담보대출, 이자 절감, 중도상환해약금 면제, 낮은 금리,"다음 뉴스 기사를  3문장으로 요약해, 총 답변의 길이는 150자 이내로 제한한다. + content",gpt-3.5-turbo-16k,1,256,1,0,0,카카오뱅크와 주담대 대환 고객은 평균 321만원의 이자를 절감했으며 주담대 대환으로 총 252억원의 이자 절약 효과가 발생했다. 주택담보대출의 평균 금리는 연 3.88%로 카카오뱅크는 최대 0.6%의 금리 할인을 제공하고 있으며 대환 고객 비중이 작년 4분기에 비해 올해 2분기에는 두 배 수준으로 증가한 것으로 나타났다.
605610,0,은행권 연체율, 금융감독원, 기업 연체율, 추세 유지, 가계대출 연체율,"다음 뉴스 기사를  3문장으로 요약해, 총 답변의 길이는 150자 이내로 제한한다. + content",gpt-3.5-turbo-16k,1,256,1,0,0,4월말 기준으로 국내 은행 대출 연체율이 0.37%로 32개월 만에 최고 수준을 기록했다. 연체율 상승은 기업과 가계 대출 모두에서 나타났으며 신용대출 등 기타 대출의 연체율도 상승세를 보였다. 금감원은 현재 추세가 유지될 가능성이 있으며 건전성 관리와 손실흡수능력 확충을 통해 부담을 완화할 것이라고 밝혔다.
605603,3,해외여행, 신용카드, 비현금 결제, 여행지, 엔데믹,"다음 뉴스 기사를  3문장으로 요약해, 총 답변의 길이는 150자 이내로 제한한다. + content",gpt-3.5-turbo-16k,1,256,1,0,0,해외여행 수요가 코로나19로 인해 억제되었던 상황에서 급증하고 있다. 해외여행 계획이 있는 사람들은 신용카드를 주로 사용하며 모바일 페이도 증가하는 추세다. 하지만 현금 사용은 감소하고 있다. 인기 있는 여행지는 일본 호주 베트남이며 호주의 인지도가 상승한 것으로 보인다. 이에 따라 해외여행에 대한 관심과 수요가 증가하고 있다.
605589,0,보험시장, 마케팅, 프로모션, 보험 출시, 입지 확보,"다음 뉴스 기사를  3문장으로 요약해, 총 답변의 길이는 150자 이내로 제한한다. + content",gpt-3.5-turbo-16k,1,256,1,0,0,NH농협생명은 신상품인 병원비든든NH의료비보장보험 369뉴테크NH암보험 하나로든든NH연금보험을 출시했다. 동양생명은 유병자를 위한 '(무)수호천사NEW간편내가만드는보장보험'을 출시했으며 교보생명은 e보험 상품 7종을 출시하여 3040세대 소비자 선택권을 확대했다. 또한 한화손해보험은 여성전용보험 '한화 시그니처 여성 건강보험'을 판매하기 시작했다. AXA손해보험은 운전자 할인 특약을 강화했다.
605520,3,새마을금고, 대출 연체율, 비은행권 금융기관, 저신용자, 부실 리스크,"다음 뉴스 기사를  3문장으로 요약해, 총 답변의 길이는 150자 이내로 제한한다. + content",gpt-3.5-turbo-16k,1,256,1,0,0,비(非)은행권 금융기관인 새마을금고 등이 대출 연체율 상승에 대비하여 대출 문턱을 높이고 있다. 이로 인해 저신용자들은 불법 사금융으로 이동하고 있다. 새마을금고는 대출 연체율 상승으로 인해 대출 문턱을 높여 대출 관리를 강화하고 있다.
605496,5,KB국민은행, IBK기업은행, NH농협은행, 사회공헌백서, 이벤트,"다음 뉴스 기사를  3문장으로 요약해, 총 답변의 길이는 150자 이내로 제한한다. + content",gpt-3.5-turbo-16k,1,256,1,0,0,KB국민은행은 2022 사회공헌백서를 발간하여 지난해의 사회공헌활동을 기록했다. 이번 발간된 백서에는 학습·진로·지원 분야 친환경 사회공헌 활동 상생금융 실천 등이 포함되어 있으며 종이 사용량 절감을 위해 보고서는 온라인으로 배포될 예정이다. NH농협은행은 11번가에서 할인쿠폰 이벤트를 IBK기업은행은 주택청약종합저축 청년을 대상으로 금융바우처와 경품 제공 이벤트를 실시할 예정이다.
