article_number,score,keyword1,keyword2,keyword3,keyword4,keyword5,message,model,temperature,max_tokens,top_p,frequency_penalty,presence_penalty,response
604833,4,가맹점 수수료, 카드사, 금융서비스 수출, 해외진출, 동남아시아 시장,"다음 뉴스 기사를  3문장으로 요약해, 총 답변의 길이는 150자 이내로 제한한다. + content",gpt-3.5-turbo-16k,1,,1,0,0,한국의 카드사들이 코로나로 인한 가맹점 수수료 하락으로 수익이 어려워지자 해외진출을 통한 수익 다변화를 모색하고 있다. 금융당국은 동남아시아 시장을 새로운 성장 동력으로 인식하고 카드사의 해외진출을 적극 지원할 방침이다. 신한 KB국민 롯데 비씨 우리카드는 이미 동남아에서 법인을 운영하며 성장하고 있으며 이에 금융당국이 더욱 지원을 강화할 예정이다.
604805,1,외화예금, 엔화예금, 여유자금, 거주자외화예금, 증가 전환,"다음 뉴스 기사를  3문장으로 요약해, 총 답변의 길이는 150자 이내로 제한한다. + content",gpt-3.5-turbo-16k,1,,1,0,0,국내 거주자 외화예금이 5개월만에 증가했다. 거주자 외화예금은 지난해 12월 이후 계속 감소세였으나 이번에는 반등하였다. 달러화와 유로화 예금이 가장 크게 증가했으며 기업예금과 개인예금도 증가했다.
604746,2,청년도약계좌, 정책금융상품, 금융위원회, 5부제, 가입제한 해제,"다음 뉴스 기사를  3문장으로 요약해, 총 답변의 길이는 150자 이내로 제한한다. + content",gpt-3.5-turbo-16k,1,,1,0,0,서울 중구 소재 T타워 내 청년도약계좌 비대면 상담센터에 신청이 몰리고 있다. 청년도약계좌 가입 신청자는 13만4000명까지 증가하여 누적 가입신청자는 55만명에 이른다. 5부제 가입제한이 해제되면서 5배 이상의 신청 증가가 발생했다.
604736,2,주택담보대출, 은행권, 특례보금자리론, 한국은행, 부동산 경기,"다음 뉴스 기사를  3문장으로 요약해, 총 답변의 길이는 150자 이내로 제한한다. + content",gpt-3.5-turbo-16k,1,,1,0,0,4대 은행의 주택담보대출이 이달에도 증가세를 보이고 있다. 이는 정부의 부동산 경기 부양책이 영향을 미친 것으로 평가된다. 중앙은행과 정부의 긴축통화정책과 부동산 대출 정책이 엇박자인 것으로 지적되고 있다.
604723,3,하나은행, IBK기업은행, 신한은행, 청년 상생금융, 복지,"다음 뉴스 기사를  3문장으로 요약해, 총 답변의 길이는 150자 이내로 제한한다. + content",gpt-3.5-turbo-16k,1,,1,0,0,하나은행과 경기도가 업무협약을 체결해 '경기청년 기회사다리금융'을 추진한다. IBK기업은행은 중소기업 근로자 자녀에게 장학금을 전달했으며 신한은행은 발달장애인을 대상으로 체험형 금융교육을 실시했다. 이들은 사회적 책임을 다하며 소외계층을 돕고 청년들에게 기회를 제공하고 있다. (147자)
604717,5,금감원, 워크숍, 금융사고, 내부통제, 은행권,"다음 뉴스 기사를  3문장으로 요약해, 총 답변의 길이는 150자 이내로 제한한다. + content",gpt-3.5-turbo-16k,1,,1,0,0,금융감독원이 은행 지주와 은행의 내부통제 업무 담당자들과 함께 '2023년 상반기 은행권 내부통제 워크숍'을 개최했다. 이번 워크숍은 은행의 내부통제 역량을 강화하기 위해 마련되었으며금감원은 영업실적이나 업무 편의를 우선시하여 업무절차 미준수를 용인하는 은행의 태도를 지적했다. 또한 금감원은 외부 감정평가 등에 대한 업무 프로세스 개선 필요사항을 설명하며 금융사고 대응체계 구축을 위한 방안을 제시했다.
604650,4,만 나이, 리치앤코, 웹툰, 문의, 보험료,"다음 뉴스 기사를  3문장으로 요약해, 총 답변의 길이는 150자 이내로 제한한다. + content",gpt-3.5-turbo-16k,1,,1,0,0,보험 보유나이와 관련한 궁금증을 해결하기 위해 법인보험대리점 리치앤코가 자사 웹툰 '보미의 일기'를 활용했다. 리치앤코는 시행되는 '만 나이 통일법'에 따라 보험나이가 어려질 때 보험료도 하락할 것으로 예상하며 보험계약 시에는 '보험나이'가 적용되므로 보험료 변동은 없다고 설명했다. 웹툰에서는 다양한 보험관련 질의에 대해 답변을 제공하고 있으며 이를 통해 보험소비자 간의 정보 간극을 해소하고 있다.
604647,2,신한카드, NH카드, 삼성카드, 카드출시, 서비스 개편,"다음 뉴스 기사를  3문장으로 요약해, 총 답변의 길이는 150자 이내로 제한한다. + content",gpt-3.5-turbo-16k,1,,1,0,0,'신한카드 픽 선불' 시리즈의 상품 2종 출시로 신한카드가 재테크용 카드로 인기를 끌고 있다. NH농협카드도 여가 특화 카드를 출시하여 다양한 혜택을 제공한다. 삼성카드는 청소년 전용카드인 '삼성 iD 포켓 카드'의 서비스를 개편하여 업종 확대와 혜택 제공을 강화했다.
604643,2,청년도약계좌, 금융위원회, 5부제, 가입신청, 정책 금융상품,"다음 뉴스 기사를  3문장으로 요약해, 총 답변의 길이는 150자 이내로 제한한다. + content",gpt-3.5-turbo-16k,1,,1,0,0,청년도약계좌의 5부제 가입 제한이 사라진다. 이제 청년들은 출생연도 끝자리와 관계없이 가입을 할 수 있게 되었다. 가입 기간은 매월 2주간으로 제한된다. 청년들은 매월 70만원을 납입하여 최대 5000만원의 목돈을 모을 수 있다. 금융당국은 적금담보대출을 고려할 것을 조언했다.
604641,5,금융당국, 금융사고, 책무구조도, 내부통제, 관리 의무,"다음 뉴스 기사를  3문장으로 요약해, 총 답변의 길이는 150자 이내로 제한한다. + content",gpt-3.5-turbo-16k,1,,1,0,0,금융당국은 금융사 대표이사와 임원들이 내부통제 제도 실패에 대한 책임에서 면책될 수 있는 기준을 마련하기로 했다. 이를 위해 책무구조도를 작성해야 하며 적정성 여부는 사전 승인받을 필요는 없지만 당국의 시정 요구는 받을 수 있다. 면직 정직 감봉 견책 주의 등 다섯 가지 단계로 신분 제재가 부과되며 관리 의무를 위반한 임원에게는 면직 요구 직무 정지 문책 경고 주의적 경고 주의 등 징계가 내려질 수 있다. 이사회의 내부통제 감시역할도 구체화되며 내부통제를 충실히 이행하는 임원은 금융사고 발생 시 책임을 감경 또는 면제받을 수 있다.
604624,4,비씨카드, 컬리카드, 적립금, 혜택, PLCC,"다음 뉴스 기사를  3문장으로 요약해, 총 답변의 길이는 150자 이내로 제한한다. + content",gpt-3.5-turbo-16k,1,,1,0,0,비씨카드의 컬리카드가 발급 두 달 만에 3만좌를 돌파했다. 컬리카드는 컬리에서 운영 중인 가맹점에서 최대 12%까지 적립금을 받을 수 있는 혜택을 제공한다. 또한 컬리카드 이용자에게 다양한 이벤트도 진행되고 아멕스의 특화 혜택도 이용할 수 있다.
604595,3,엘리뇨, 침수피해, 손해보험, 차보험, 폭우,"다음 뉴스 기사를  3문장으로 요약해, 총 답변의 길이는 150자 이내로 제한한다. + content",gpt-3.5-turbo-16k,1,,1,0,0,장마전선으로 인한 침수피해 우려가 높아지면서 보험사들이 피해 대비에 만전을 기하고 있다. 엘니뇨 현상으로 폭우가 예상되어 손해보험업계는 차량 침수 피해액이 2500억원을 상회할 수 있다고 예측하고 있다. 재보험 가입과 침수예방 비상팀을 운영하는 등 피해를 최소화하기 위한 대비책을 마련하고 있다.
604585,2,혁신금융서비스, 금융위원회, 온라인 플랫폼, 가족카드, 신규지정,"다음 뉴스 기사를  3문장으로 요약해, 총 답변의 길이는 150자 이내로 제한한다. + content",gpt-3.5-turbo-16k,1,,1,0,0,금융위원회는 온라인 플랫폼을 통한 예금상품 비교·추천 서비스와 19개의 금융서비스를 혁신금융서비스로 신규 지정했다고 밝혔다. 지정받은 금융서비스는 예·적금 상품을 비교·추천 받을 수 있도록 도와준다. 또한 현대카드와 우리카드의 미성년 자녀를 위한 카족카드 서비스도 혁신금융서비스로 지정되었다.
604511,3,리치앤코, 부당승환계약, 과태료, 변액연금보험, 법인보험대리점,"다음 뉴스 기사를  3문장으로 요약해, 총 답변의 길이는 150자 이내로 제한한다. + content",gpt-3.5-turbo-16k,1,,1,0,0,GA 리치앤코 보험대리점 소속 설계사 28명이 부당승환계약을 체결하면서 부과금을 받고 비난받고 있다. 금감원은 보험대리점에 9760만원의 과태료 부과 설계사에도 20만~500만원의 과태료 부과했다. 부당승환계약은 보험업법에서 엄격히 금지되어 있으며 소비자에게 불이익을 야기할 수 있다는 점에서 문제가 되고 있다.
604545,5,우리금융, 탈북아동, 대안학교, 신한은행, KB국민은행,"다음 뉴스 기사를  3문장으로 요약해, 총 답변의 길이는 150자 이내로 제한한다. + content",gpt-3.5-turbo-16k,1,,1,0,0,우리금융그룹은 탈북아동 및 청소년들을 위한 대안학교에 1000만원을 기부하였고 신한은행은 금융상품 비교 서비스를 오픈하여 고객들의 편의를 높였으며 KB국민은행은 병역명문가를 대상으로 다양한 금융 혜택을 제공한다고 밝혔다.
604523,3,대환대출, 이자, 절감, 불법 광고, 금리,"다음 뉴스 기사를  3문장으로 요약해, 총 답변의 길이는 150자 이내로 제한한다. + content",gpt-3.5-turbo-16k,1,,1,0,0,최근 시행된 대환대출 서비스로 인해 약 5000억원의 대출자산이 이동되었으며 소비자들의 연간 이자 절감 규모는 100억원 이상일 것으로 추정된다고 한다. 은행 고객의 이동이 가장 많았으며 대출 비교 플랫폼과 제휴한 금융회사도 계속 증가하고 있다. 다만 금감원은 대환대출 사칭 불법광고가 증가하고 있어 주의를 당부하고 있다.
604512,2,역전세, 보증금 반환, 전셋값 하락, 전세보증금, 한국은행 ,"다음 뉴스 기사를  3문장으로 요약해, 총 답변의 길이는 150자 이내로 제한한다. + content",gpt-3.5-turbo-16k,1,,1,0,0,한국은행에 따르면 전셋값 하락이 이어질 경우 약 9만가구는 보증금을 돌려주지 못할 것으로 예상된다. 집주인들은 대출이나 예금 깨기로 차액을 메워야 한다. 전셋값이 20% 하락할 경우 약 9만가구가 대출받지 못하고 보증금 반환이 어려울 것으로 전망된다.
604508,4,한국은행, 금융기관, 자산건정성 악화, 금융안정보고서, 대출,"다음 뉴스 기사를  3문장으로 요약해, 총 답변의 길이는 150자 이내로 제한한다. + content",gpt-3.5-turbo-16k,1,,1,0,0,한국 은행이 국회에 금융안정보고서를 제출했는데 이에 따르면 국내 금융기관은 자산건전성이 1분기에 악화되었으며 이는 주로 3개 이상의 기관에서 대출을 받은 취약 대출자 때문이라고 한국 은행은 분석했다. 최근 늘어난 가계대출 연체채권은 주로 취약 대출자들로부터 발생했는데 이들은 전체 가계대출자의 5%에 불과한 인원이지만 신규 연체 대출자와 신규 연체 잔액 비중에서 높은 비율을 차지하고 있다고 한국은행은 설명했다. 또한 취약 대출자들 중 약 39.5%는 연체한 대출 잔액이 본인의 연간 소득액을 상회하고 있다고 한국은행은 밝혔다.
604427,4,은행, 예대율, 규제, 금융시장, 시장안정조치,"다음 뉴스 기사를  3문장으로 요약해, 총 답변의 길이는 150자 이내로 제한한다. + content",gpt-3.5-turbo-16k,1,,1,0,0,금융위원회는 7월부터 일부 규제를 다시 정상화하고 금융시장 현안을 점검하기 위해 회의를 개최했다. 은행 예대율 지주회사 자회사간 신용공여 한도 보험 퇴직연금 차입한도 등의 규제가 8개월 만에 정상화되며 은행 대출 문턱이 높아지게 된다. 또한 저축은행 예대율과 부동산 PF 취급 한도 등의 규제 완화는 연장될 예정이다.
604363,1,기업 부채, 기업경영분석, 부채비율, 차입금의존도, 매출액증가율,"다음 뉴스 기사를  3문장으로 요약해, 총 답변의 길이는 150자 이내로 제한한다. + content",gpt-3.5-turbo-16k,1,,1,0,0,한국은행에 따르면 한국 기업들의 부채비율은 7년 만에 최고 수준으로 치솟았다. 중소기업의 부채비율은 대기업보다 높으며 수익성과 성장성도 모두 악화되었다. 주요 원인은 대기업들이 대규모 영업손실을 겪은 것으로 보인다.
604370,4,보험료, 실손 보험, 할인, 4세대, 비급여 의료이용량,"다음 뉴스 기사를  3문장으로 요약해, 총 답변의 길이는 150자 이내로 제한한다. + content",gpt-3.5-turbo-16k,1,,1,0,0,기존 실손 보험 가입자가 4세대 실손 보험으로 전환 시 1년간 보험료 반값 할인 혜택이 연말까지 연장될 예정이다. 이 혜택을 통해 기존 가입자는 12월말까지 할인 혜택을 받고 4세대 실손 보험으로 전환할 수 있다. 4세대 실손 보험은 비급여 의료이용에 따라 보험료가 차등 적용되어 최대 75% 가량 저렴하게 이용할 수 있는 장점이 있다.
604328,3,보험, 대학생 아이디어 공모전, 장학금, 경제교육, 사회공헌,"다음 뉴스 기사를  3문장으로 요약해, 총 답변의 길이는 150자 이내로 제한한다. + content",gpt-3.5-turbo-16k,1,,1,0,0,보험사들은 치열한 경쟁 속에서 시장 입지를 확보하기 위해 새로운 상품과 마케팅 프로모션을 적극적으로 추진하고 있다. KDB생명은 대학생 아이디어 공모전 시상식을 개최하여 활성화를 도모하고 DB손해보험은 경제적으로 어려운 학생들을 위한 장학금을 전달하였으며 한화생명은 금융교육 프로그램을 통해 초중고 학생들에게 경제지식을 전달하고 있다.
604319,1,SGI서울보증, 코스피, 한국거래소, 공기업 예비상장, 상장예비심사,"다음 뉴스 기사를  3문장으로 요약해, 총 답변의 길이는 150자 이내로 제한한다. + content",gpt-3.5-turbo-16k,1,,1,0,0,SGI서울보증이 KRX에 상장 예비심사를 신청했다. 공적자금관리위원회의 논의를 거쳐 상장 시기가 결정될 예정이며 최대 주주인 예금보험공사가 10%(698만주)의 지분을 공모할 계획이다. SGI서울보증은 업적이 증가하고 배당 성향이 높아지며 최근 3년간 연결기준 자기자본이 5조411억원으로 연간 보증공급금액은 약 323조원이다.
604259,4,금융감독원, 경남은행, 대주주, 신용공여, 과태료,"다음 뉴스 기사를  3문장으로 요약해, 총 답변의 길이는 150자 이내로 제한한다. + content",gpt-3.5-turbo-16k,1,,1,0,0,BNK경남은행은 대주주에 대한 신용공여 절차를 위반하여 4000만원의 과태료를 부과받았고 관련 임원 1명에게 주의 조치를 받았다. 이는 경남은행이 이사회 재적이사 전원의 찬성 없이 대주주인 BNK캐피탈에 대해 기준금액 이상의 신용공여를 하였기 때문이다. 금감원은 경남은행에 대해 내부통제의 개선을 요구하고 개선사항 1건을 통보했다.
604232,3,신안흔행, SOHO사관학교, 25기, 청년 자영업자, 예비 창업자,"다음 뉴스 기사를  3문장으로 요약해, 총 답변의 길이는 150자 이내로 제한한다. + content",gpt-3.5-turbo-16k,1,,1,0,0,신한은행은 '신한 SOHO사관학교 25기'를 개강하여 청년 자영업자에게 경영 컨설팅을 제공한다. IBK기업은행은 김성태 은행장이 중소기업 관련 인물사진전에 금융접근성을 대표하는 인물로 선정되었다. KB국민은행은 '2022 KB Green Wave Report'를 발간하여 ESG 전략과 환경보고서를 소개했다.
604174,5,애플페이, 삼성페이, 수수료, 카드사, 유료화,"다음 뉴스 기사를  3문장으로 요약해, 총 답변의 길이는 150자 이내로 제한한다. + content",gpt-3.5-turbo-16k,1,,1,0,0,현대카드의 애플페이 단독 사용 기한이 오는 9월 종료되면서 다른 카드사들도 애플페이 도입을 준비하고 있다. 삼성전자도 수수료를 받으면서도 삼성페이 유료화를 검토하고 있으며 다른 카드사들이 애플페이에 합류하면 삼성전자도 유료화할 가능성이 있다. 삼성전자와 주요 카드사들은 협상을 시작했으며 현실적으로 삼성페이를 포기하기 어려워 결정에 어려움을 겪고 있다. 하지만 수수료 인상이 결정되면 카드혜택이 줄어들 수 있으므로 더 많은 협의가 필요하다.
604147,4,횡령, 참저축은행, 금감원, 금융사지배구조법, 제재공시,"다음 뉴스 기사를  3문장으로 요약해, 총 답변의 길이는 150자 이내로 제한한다. + content",gpt-3.5-turbo-16k,1,,1,0,0,대구 소재 참저축은행이 연속된 횡령사고로 금감원으로부터 제재를 받았다. 검사결과에 따르면 참저축은행은 3억2900만원 규모의 횡령사고를 적발되어 기관주의를 받고 2명의 임직원에게는 감봉·주의·견책 등 제재가 내려졌다. 금감원은 참저축은행이 금융사지배구조법을 어겼다고 판단하고 새로운 조직을 마련하는 등 시정 조치를 한다.
