article_number,score,keyword1,keyword2,keyword3,keyword4,keyword5,message,model,temperature,max_tokens,top_p,frequency_penalty,presence_penalty,response
606213,3,보람상조, 플랫폼 기업, 비즈마켓, 보람라이프플랜, 업무협약,"다음 뉴스 기사를  3문장으로 요약해, 총 답변의 길이는 150자 이내로 제한한다. + content",gpt-3.5-turbo-16k,1,,1,0,0,보람상조는 플랫폼 기업 비즈마켓과 협약을 맺어 상품을 판매한다. 보람상조의 리빙 결합상품인 '보람라이프플랜'이 상조와 가전 가구 제품이 필요한 소비자들에게 매력적으로 평가받는다. 이번 협약으로 보람상조의 다양한 제휴 비즈니스가 활성화될 것으로 전망된다.
606202,1,금융위원회, 김주현 위원장, 취약계층, 규제개선, 자금지원,"다음 뉴스 기사를  3문장으로 요약해, 총 답변의 길이는 150자 이내로 제한한다. + content",gpt-3.5-turbo-16k,1,,1,0,0,김주현 금융위원회 위원장이 취임 1주년 기자간담회에서 금융시장 안전과 국내 금융 산업 혁신에 주력할 것이라 강조했다. 지금까지의 성과는 물론 위험요인에 대한 관리 금융취약계층 지원 금융산업 혁신을 위한 정책 및 제도 개선 등 6가지 정책 방향을 제시했다. 또한 해외진출 관련 애로 해결과 경제 혁신성장을 위한 종합적인 지원 방안을 발표했다.
606159,3,롯데카드, 횡령사고, 협력업체, 통제 부실, 100억원,"다음 뉴스 기사를  3문장으로 요약해, 총 답변의 길이는 150자 이내로 제한한다. + content",gpt-3.5-turbo-16k,1,,1,0,0,롯데카드 일부 직원들이 용역업체로부터 금품을 받은 사실이 드러나며 내부 통제 부실 논란이 일고 있다. 금액은 약 100억원으로 알려져 있다. 현재 롯데카드는 사실관계 조사를 진행 중이다. 그러나 아직 해당 사건으로 인한 책임 묻기가 어렵다.
606138,4,OK금융그룹, 최윤 회장, 항저우 아시안게임, 선수단 단장, 스포츠 지원,"다음 뉴스 기사를  3문장으로 요약해, 총 답변의 길이는 150자 이내로 제한한다. + content",gpt-3.5-turbo-16k,1,,1,0,0,OK금융그룹이 최윤 회장을 '제19회 항저우 아시안게임' 대한민국 국가대표 선수단 단장으로 선임했다. 최윤 회장은 재외동포로서 역사상 첫 선수단장으로 선수단 운영 및 지원을 총괄한다. 최윤 회장은 스포츠를 통해 국민들에게 새로운 희망과 용기를 전해드릴 수 있도록 지원에 힘을 쓸 것이라고 밝혔다.
606141,4,새마을금고, 출자 특혜, 사모펀드, 류 대표, 검찰 조사,"다음 뉴스 기사를  3문장으로 요약해, 총 답변의 길이는 150자 이내로 제한한다. + content",gpt-3.5-turbo-16k,1,,1,0,0,새마을금고 중앙회의 사모펀드 출자 비리 수사가 증가하고 검찰 조사가 류 대표이사에까지 이어지고 있다. 새마을금고는 ST리더스프라이빗에쿼티와 손잡고 M캐피탈을 인수한 후 특혜 의혹이 제기되었다. 이에 검찰은 류 대표이사를 체포하고 조사를 진행하고 있다. 검찰은 48시간 이내에 구속영장을 발부받지 못하면 류 대표이사를 풀어줘야 한다.
606098,2,보험사, 자회사 설립, 노조 리스크, 판매실적, 자금회수,"다음 뉴스 기사를  3문장으로 요약해, 총 답변의 길이는 150자 이내로 제한한다. + content",gpt-3.5-turbo-16k,1,,1,0,0,국내 보험사들이 자회사 설립에 적극적으로 참여하고 있으며 최근 한화생명과 미래에셋생명의 자회사형 GA가 흑자전환에 성공하여 분위기는 더욱 달아오르고 있다. 자회사 설립에는 리스크가 존재하지만 보험사들은 판매 채널 다변화와 비용 효율성 제고를 위해 리스크를 감수하고 자체 GA 설정을 추진하고 있다. 그러나 자회사 설립에는 투자 시기와 규모를 명확히 정해야 하며 노사 간 대립과 수수료 부담 등의 문제도 존재한다.
606112,4,BC카드, 인도네시아, 그린카드 플랫폼, 자카르타주정부은행, 스마트시티,"다음 뉴스 기사를  3문장으로 요약해, 총 답변의 길이는 150자 이내로 제한한다. + content",gpt-3.5-turbo-16k,1,,1,0,0,BC카드는 자카르타주정부은행과 '그린카드 플랫폼' 업무협약(MOU)을 체결했다. BC카드는 그린카드 플랫폼을 운영하며 환경부 주관의 친환경 제품 구매 및 에코머니 포인트 등의 혜택을 제공한다. 이번 협약으로 BC카드는 인도네시아 내 K금융 세일즈 확장이 가능해졌다.
606099,2,현대캐피탈 , 자동차 특화, 자동차 금융상품, 추천 서비스, 차량 개인화 추천,"다음 뉴스 기사를  3문장으로 요약해, 총 답변의 길이는 150자 이내로 제한한다. + content",gpt-3.5-turbo-16k,1,,1,0,0,현대캐피탈은 현대캐피탈 앱을 맞춤형 차량 추천과 간편한 사용자 경험을 위해 전면 개편했다. 새로운 앱은 자동차 탐색 기능을 중심으로 제네시스 현대자동차 기아 전기차 네 가지 카테고리를 메인화면에 배치하였고 AI 기술과 마이데이터를 활용한 맞춤형 추천 서비스도 제공한다. 또한 사용자가 편리하게 이용할 수 있도록 마이 탭과 내자산 탭도 개편되었다.
606074,4,캠페인, 하나은행, 신한은행, KB국민은행, 메타버스 클래스 사업,"다음 뉴스 기사를  3문장으로 요약해, 총 답변의 길이는 150자 이내로 제한한다. + content",gpt-3.5-turbo-16k,1,,1,0,0,하나은행은 메타버스 클래스 사업 업무협약을 체결했으며 교육 콘텐츠 개발과 메타버스 금융 인프라 구축을 추진할 예정이다. 신한은행은 신한프렌즈 티셔츠 커스터마이징 콘테스트를 개최하고 우수 작품에게 여행상품권과 마이신한포인트를 제공할 예정이다. KB국민은행은 목요일엔 출석 체크하고 우산 선물하기 캠페인을 진행하며 출석 체크 시 하트 10개를 자동 기부하고 참여 고객에게 추첨을 통해 기프트카드와 문화상품권을 제공할 예정이다.
606050,2,보람 그룹, 최철홍 회장, 경영대상, 상조 업계, 상조서비스,"다음 뉴스 기사를  3문장으로 요약해, 총 답변의 길이는 150자 이내로 제한한다. + content",gpt-3.5-turbo-16k,1,,1,0,0,보람그룹 최철홍 회장이 2년 연속 '한국의 최고 경영대상' 리더십 부문 대상을 수상했다. 최철홍 회장은 32년간 고객 중심 경영을 통해 국내 상조산업의 기틀을 마련한 점이 인정되었다. 또한 보람그룹은 기획재정위원회로부터 산업발전유공부문상도 받았다.
606009,1,새마을금고, 행정안전부, 지급 보호, 새마을 금고법, 담보대출 부실,"다음 뉴스 기사를  3문장으로 요약해, 총 답변의 길이는 150자 이내로 제한한다. + content",gpt-3.5-turbo-16k,1,,1,0,0,행정안전부가 새마을금고 위기에 대한 조치를 취하고 있으며 새마을금고는 예·적금 관리를 철저하게 하고 계속 성장할 것을 약속했다. 새마을금고 대출금액 중 연체된 금액은 역대 최고 수준인 약 12조1600억원으로 도달했고 남양주 동부 새마을금고 폐업으로 인한 불안이 확산되고 있다. 새마을금고는 예금자 보호를 위해 합병과 상환준비금 제도를 운용하고 있으며 안정적인 예금 지급 보장을 위한 새마을금고법 개정이 추진되고 있다.
605994,4,DB손해보험, 집중호우, 침수예방, 비상대응팀, 데이터 분석,"다음 뉴스 기사를  3문장으로 요약해, 총 답변의 길이는 150자 이내로 제한한다. + content",gpt-3.5-turbo-16k,1,,1,0,0,DB손해보험은 슈퍼 엘니뇨로 인한 집중호우에 대비해 비상대응팀을 운영한다고 발표했다. 지난해 강남과 포항 지역 침수사고에도 신속한 보상처리와 서비스를 제공하며 올해에는 침수 다발지역 데이터 분석을 통해 안내와 예방대책을 마련할 계획이라고 밝혀했다. 또한 사고 예방을 위해 상습 침수지역 파악과 순찰을 강화하고 비상 상황에 대비해 비상캠프 운영과 사고조치 프로세스 준비를 강조했다.
605988,3,금융위원회, 강화된 감독기준, D-SIB, D-SIFI, 자체정상화계획,"다음 뉴스 기사를  3문장으로 요약해, 총 답변의 길이는 150자 이내로 제한한다. + content",gpt-3.5-turbo-16k,1,,1,0,0,서울정부청사 금융위원회는 KB금융지주 등 10개의 은행과 은행지주회사를 중요 금융기관으로 선정하여 자체정상화 계획을 제출하도록 했다. 이들은 D-SIB와 D-SIFI로 선정되어 추가 자본 적립 의무와 부실정리계획 제도의 적용 대상이 될 것이다. 이번 평가에서 KB금융지주와 신한금융지주는 최저 기준의 2배인 12%를 초과한 선정 기준을 충족했다.
605958,3,금융감독원, 감사보고서, 재무제표, 회계투명성, 감사의견 변경,"다음 뉴스 기사를  3문장으로 요약해, 총 답변의 길이는 150자 이내로 제한한다. + content",gpt-3.5-turbo-16k,1,,1,0,0,금융감독원에 따르면 지난해 131개 회사가 총 379회 감사보고서를 정정한 것으로 파악됐다. 이로 인해 회계투명성 강화에 대한 우려가 제기되고 있다. 코스피 상장사의 정정 횟수는 감소했지만 코스닥 상장사는 증가했다. 금감원은 회계정보 이용자들을 위해 분석결과 및 시사점을 제공하고 회계투명성 강화를 위한 노력을 강조했다.
605916,0,금융감독원, 임원 성과급, 금융 당국, 자율 공개, 금융회사지배구조법,"다음 뉴스 기사를  3문장으로 요약해, 총 답변의 길이는 150자 이내로 제한한다. + content",gpt-3.5-turbo-16k,1,,1,0,0,한국의 금융당국은 은행 임직원의 성과보수체계를 공개하기로 결정했다. 이로 인해 기존의 성과급 제도가 개선되며 보다 투명하고 정보 접근성이 높은 환경이 조성될 예정이다. 일반 직원의 성과급과 은행 경영현황 역시 공개되어 시장과 국민이 은행에 대한 감시와 검증을 할 수 있게 된다. 이러한 자율공개 방안은 올해 3분기부터 시작되며 내년 4월부터 본격적으로 시행될 예정이다.
605907,3,OK배정장학재단, 11기 배정장학생, 장학금, 대학생, 대학원생,"다음 뉴스 기사를  3문장으로 요약해, 총 답변의 길이는 150자 이내로 제한한다. + content",gpt-3.5-turbo-16k,1,,1,0,0,OK배정장학재단은 '11기 OK배정장학생'을 모집한다. 대학생과 대학원생을 대상으로 매월 최대 200만원을 지원하며 성적과 소득 조건을 충족해야 한다. 접수는 24일까지이며 장학생들은 다양한 프로그램을 통해 글로벌 리더로 성장할 수 있는 기회를 갖게 된다.
605885,2,새 시중은행, 금융당국, 대구은행, 지방은행, 중소기업대출비율,"다음 뉴스 기사를  3문장으로 요약해, 총 답변의 길이는 150자 이내로 제한한다. + content",gpt-3.5-turbo-16k,1,,1,0,0,금융당국은 지방은행의 시중은행 전환을 허용하고 이미 대구은행의 전환 의사를 긍정적으로 평가했다. 이로 인해 약 30년 만에 새로운 플레이어가 시중은행으로 진입할 예정이다. 금융감독원은 지방은행과 저축은행 등의 전환을 심사하여 결정할 계획이다.
605826,4,우리은행, KB국민은행, 신한은행, 원금상환 지원, 외화 관련 이벤트,"다음 뉴스 기사를  3문장으로 요약해, 총 답변의 길이는 150자 이내로 제한한다. + content",gpt-3.5-turbo-16k,1,,1,0,0,우리은행은 연체고객을 위한 원금상환 지원 프로그램을 내달부터 1년간 진행하며 연체이자를 상환해줄 예정이다. KB국민은행은 환전 신청한 고객을 대상으로 추첨을 통해 총 1000명에게 스타벅스 커피 쿠폰을 지급할 계획이다. 또한 신한은행은 외화 예·적금 가입 고객에게 3% 할인 쿠폰을 제공하는 이벤트를 12월 31일까지 진행할 예정이다.
605822,3,동양생명, 보험계약대출, 금리 인하, 금리 확정형 상품, 이자 상환 부담,"다음 뉴스 기사를  3문장으로 요약해, 총 답변의 길이는 150자 이내로 제한한다. + content",gpt-3.5-turbo-16k,1,,1,0,0,동양생명은 보험계약대출 이용 고객들의 이자 부담을 줄이기 위해 금리 확정형 상품의 최고금리를 5.95%로 인하했다. 이 인하 금리는 신규 및 기존 고객에게 적용되며 가산금리를 적용받지 않아 기존 예정이율 이자만 부담하면 된다. 동양생명은 이로써 고객들의 이자상환 부담을 덜어줄 것이라고 밝혔다.
605808,4,금융감독원, 이권 카르텔, 워크숍, 반부패, 이복현 금감원장,"다음 뉴스 기사를  3문장으로 요약해, 총 답변의 길이는 150자 이내로 제한한다. + content",gpt-3.5-turbo-16k,1,,1,0,0,금융감독원장 이복현이 이권 카르텔과 관련해 간부들에게 원칙 중심의 감독·검사 업무를 지시했다. 금감원은 반부패·청렴 워크숍을 개최하여 반부패 의지를 고취하고 청렴 시책을 추진하기 위한 동력을 확보했다. 워크숍에는 참석자 전원이 전사적 참여와 실전 다짐을 외친 후 마무리되었다.
605803,1,한화생명, ESG경영, 지배구조 선진화, 탄소중립, 사회 공헌,"다음 뉴스 기사를  3문장으로 요약해, 총 답변의 길이는 150자 이내로 제한한다. + content",gpt-3.5-turbo-16k,1,,1,0,0,한화생명은 ESG 경영 성과와 향후 계획을 담은 '2023 지속가능경영보고서'를 발간했다. 환경 경영으로는 종이 사용량을 줄이는 등의 조치를 실시하였으며 사회 경영으로는 장애인 채용률을 100%로 실현하였고 지배구조 개선 및 정보보안경영시스템 국제표준 인증을 획득하였다. 한화생명은 ESG 경영을 통해 더 나은 환경과 사회를 만드는데 앞장설 것을 약속하였다. 
605775,3,손해보험 사회공헌협의회, 집중호우, 관악구, 침수방지 시설, 사회공헌사업,"다음 뉴스 기사를  3문장으로 요약해, 총 답변의 길이는 150자 이내로 제한한다. + content",gpt-3.5-turbo-16k,1,,1,0,0,손해보험 사회공헌협의회가 여름철 장마와 집중호우에 대비하기 위한 사회공헌사업을 시작한다.While the support project targets residents living in flood-prone areas and welfare institutions it plans to install water-blocking panels and anti-backflow facilities worth KRW 3 billion over a span of three years.The initial installation of water-blocking panels has already begun in community welfare institutions in Gwanak-gu and there are plans to expand the installation to basement homes and regular households in the future.
605770,2,보이스피싱, 일괄지급정지, 금융당국, 오프라인 채널, 디지털 소외계층,"다음 뉴스 기사를  3문장으로 요약해, 총 답변의 길이는 150자 이내로 제한한다. + content",gpt-3.5-turbo-16k,1,,1,0,0,디지털 소외계층을 위해 은행 영업점과 고객센터에서 보이스피싱 피해 시 본인명의 계좌 지급정지 서비스를 제공하게 됐다. 이를 통해 피해 예방과 빠른 대응이 가능해질 것으로 기대된다. 서비스는 온라인 채널에서 오프라인 채널로 확대되며 지급정지 신청과 해제는 영업점 방문이나 고객센터 전화로 가능하다.
605762,2,공정위, 국고채 담합, 시중은행, 윤석열 대통령, 금융분야 과점폐,"다음 뉴스 기사를  3문장으로 요약해, 총 답변의 길이는 150자 이내로 제한한다. + content",gpt-3.5-turbo-16k,1,,1,0,0,공정거래위원회가 시중은행들의 국고채 입찰 담합 여부를 조사하였다. 조사는 국고채 입찰과정에서의 정보 교환 또는 담합 여부를 확인하기 위해 이루어진 것이며 이전에도 금융 분야 과점폐해를 언급한 윤석열 대통령의 발언 이후에 이미 금융업계 전반에 대한 조사가 착수되었다. 이번 조사는 증권사와 함께 은행권으로도 확대되었다.
605729,3,한국은행, 김웅 부총재보, 소비자물가 상승률, 근원물가,  통계청,"다음 뉴스 기사를  3문장으로 요약해, 총 답변의 길이는 150자 이내로 제한한다. + content",gpt-3.5-turbo-16k,1,,1,0,0,한국은행은 소비자물가 상승률이 다시 증가할 것으로 예상하고 근원물가 상승률은 연간 전망치인 3.3%를 상회할 것으로 전망하고 있다. 김웅 부총재는 6월 소비자물가가 2%대로 둔화했다고 밝히며 근원물가도 완만한 둔화 흐름이 이어질 것이라고 분석했다. 이후 물가 상승률은 3% 안팎에서 등락할 것으로 예상될 뿐 아니라 국제유가 경기흐름 공공요금 조정 등과 관련해 불확실성이 높은 상황이 있다고 덧붙였다.
605717,3,SC제일은행, 투자전략 보고서, C.A.L.M, 포트폴리오, 주식 투자,"다음 뉴스 기사를  3문장으로 요약해, 총 답변의 길이는 150자 이내로 제한한다. + content",gpt-3.5-turbo-16k,1,,1,0,0,SC제일은행이 '2023년 하반기 글로벌 금융시장 전망 및 투자전략 보고서'를 발표했다. 보고서에 따르면 상반기 금융시장은 투자심리 위축이 발생했으나 양호한 흐름을 이어갔고 하반기에는 주식시장의 강세가 지속될 것으로 전망된다. SC제일은행은 'C.A.L.M: 시장에 머무는 힘'이라는 핵심 투자테마를 제시했으며 포트폴리오 다각화와 균형 잡힌 투자에 집중하는 것이 중요하다고 입장을 밝혔다.
605692,1,금융감독원, DB생명, 상표권료, 경영유의, 지주사 몰아주기,"다음 뉴스 기사를  3문장으로 요약해, 총 답변의 길이는 150자 이내로 제한한다. + content",gpt-3.5-turbo-16k,1,,1,0,0,DB생명은 지주사 DB Inc에 과도한 상표권 사용료를 지급해 '지주사 몰아주기' 논란에 휩싸였다. DB그룹 내 계열사인 DB손해보험도 비슷한 이유로 금감원에서 비판을 받았다. 상표권료는 매출에서 광고선전비를 제외한 나머지 금액에 적용되는데 투자영업수익 등 상표 사용과 무관한 수익 항목을 매출에서 제외하는 방안을 마련해야 한다는 금감원의 지적이 제기되었다.
605699,3,우리금융캐피탈, 정연기 대표이사, 취임식, 사업다각화, 선제적 리스크 관리,"다음 뉴스 기사를  3문장으로 요약해, 총 답변의 길이는 150자 이내로 제한한다. + content",gpt-3.5-turbo-16k,1,,1,0,0,우리금융캐피탈은 정연기 신임 대표이사의 취임식을 개최했다. 정 대표이사는 2023년을 목표로 경영목표 달성과 사업다각화 선제적 리스크관리를 강조했다. 또한 기업 및 투자금융 비중 확대와 리스크관리에 대한 역량 강화를 통해 사업다각화를 추진할 것을 약속했다.
605653,2,진옥동 회장, 신한 금융, 내부통제 책무구조도, 신한컬쳐위크, 견제와 검증,"다음 뉴스 기사를  3문장으로 요약해, 총 답변의 길이는 150자 이내로 제한한다. + content",gpt-3.5-turbo-16k,1,,1,0,0,신한금융그룹 진옥동 회장은 법률 통과 후 조기에 '내부통제 책무구조도'를 도입할 예정이라고 밝혔다. 이에 대해 그는 그룹의 지속성장을 위해 업무의 모든 과정이 철저히 견제와 검증되어야 한다고 강조했다. 이와 함께 최근 금융당국은 경영문화 개선과 소비자 보호를 위한 건전한 체계 정착을 목표로 추진하고 있다고 전했다.
605634,2,우리은행, 조병규 우리은행장, 기업 금융, 조직개편, 현장경영,"다음 뉴스 기사를  3문장으로 요약해, 총 답변의 길이는 150자 이내로 제한한다. + content",gpt-3.5-turbo-16k,1,,1,0,0,우리은행 신임 은행장 조병규가 공식 취임 후 영업 중심의 조직개편을 예고했다. 조 은행장은 조직의 인사와 조직문화를 개선하고 성과를 직원들에게 돌려주기 위해 노력할 것을 강조했다. 또한 기업금융 역량 강화를 통해 우리은행의 역할을 잘 수행하고 신성장 산업에 기여할 것이라 밝혔다.
605628,3,카카오뱅크, 주택담보대출, 이자 절감, 중도상환해약금 면제, 낮은 금리,"다음 뉴스 기사를  3문장으로 요약해, 총 답변의 길이는 150자 이내로 제한한다. + content",gpt-3.5-turbo-16k,1,,1,0,0,카카오뱅크 대출자들의 주택담보대출 대환으로 인해 개인당 평균 321만원의 이자를 절감했다고 밝혀졌다. 대환 고객 비중이 작년 4분기에 비해 올해 2분기에 두 배로 증가한 것으로 나타났으며 대환 고객 중 90%는 카카오뱅크를 선택한 이유로 '금리가 저렴하다'고 응답했다. 앞으로 카카오뱅크는 중도상환해약금 면제를 연말까지 연장하고 다른 대출 상품에도 실질적인 혜택을 제공할 예정이다.
605610,0,은행권 연체율, 금융감독원, 기업 연체율, 추세 유지, 가계대출 연체율,"다음 뉴스 기사를  3문장으로 요약해, 총 답변의 길이는 150자 이내로 제한한다. + content",gpt-3.5-turbo-16k,1,,1,0,0,국내 은행 연체율이 4월말 기준 0.37%로 32개월만에 최고 수준을 기록했다. 기업대출과 가계대출의 연체율이 상승한 것이 원인이다. 금감원은 이러한 추세가 계속될 수 있으며 건전성 관리와 손실흡수능력을 강화할 것을 약속했다. (147자)
605603,3,해외여행, 신용카드, 비현금 결제, 여행지, 엔데믹,"다음 뉴스 기사를  3문장으로 요약해, 총 답변의 길이는 150자 이내로 제한한다. + content",gpt-3.5-turbo-16k,1,,1,0,0,코로나19로 인해 억눌렸던 해외 여행 수요가 폭발하여 1년 이내에 해외여행을 떠날 계획이 있는 사람은 전체 응답자의 55.1%로 이전보다 8.7% 증가한 것으로 나타났다. 이에 따라 해외여행 시 결제 수단으로는 신용카드가 77.7% 현지 화폐도 61.6%로 많이 선택되었다. 또한 모바일 페이의 사용률도 증가함과 함께 여행지로는 일본 호주 베트남이 선호되는 것으로 조사되었다.
605589,1,보험시장, 마케팅, 프로모션, 보험 출시, 입지 확보,"다음 뉴스 기사를  3문장으로 요약해, 총 답변의 길이는 150자 이내로 제한한다. + content",gpt-3.5-turbo-16k,1,,1,0,0,보험사는 치열한 경쟁을 통해 보험 시장 내 입지를 확보하기 위해 새로운 상품과 마케팅을 쏟아내고 있다. NH농협생명은 병원비든든NH의료비보장보험 369뉴테크NH암보험 하나로든든NH연금보험을 출시했고 동양생명은 유병자 가입문턱을 낮춘 종합간편보험을 출시했다. 교보생명은 모바일 보험 가입 채널을 오픈하고 3040세대를 위한 e보험 상품 7종을 출시했다. 한화손해보험은 여성 전용보험 '한화 시그니처 여성 건강보험'을 출시하고 AXA손해보험은 운전자 할인 특약을 강화했다.
605520,3,새마을금고, 대출 연체율, 비은행권 금융기관, 저신용자, 부실 리스크,"다음 뉴스 기사를  3문장으로 요약해, 총 답변의 길이는 150자 이내로 제한한다. + content",gpt-3.5-turbo-16k,1,,1,0,0,새마을금고 등 비은행권이 대출 연체율 상승으로 인한 부실을 막기 위해 대출 문턱을 높이는데 이로 인해 저신용자들이 불법 사금융으로 이동하는 문제가 발생하고 있다. 새마을금고는 담보대출 부실로 인해 폐업하였고 대출 연체율은 지난해말 대비 1.75%p나 폭증하여 대출 문턱을 높이고 있다는 주장이 나오고 있다. 또한 대부업에서도 저신용자들이 외면받고 있는 실정이 나타나고 있어 이들을 보호할 방안이 필요하다는 주장이 제기되고 있다.
605496,5,KB국민은행, IBK기업은행, NH농협은행, 사회공헌백서, 이벤트,"다음 뉴스 기사를  3문장으로 요약해, 총 답변의 길이는 150자 이내로 제한한다. + content",gpt-3.5-turbo-16k,1,,1,0,0,KB국민은행이 '2022 KB국민은행 사회공헌백서'를 발간했고 NH농협은행은 11번가 할인쿠폰 이벤트를 실시하며 IBK기업은행은 주택청약종합저축 청년 대상으로 금융바우처를 제공한다고 발표했다.  KB국민은행의 '백서'에는 학습·진로·지원 분야 프로그램 지원 친환경 사회공헌 활동 상생금융 실천 등이 기록되었으며 NH농협은행은 11번가에서 농협계좌로 SK페이 결제 시 30% 할인 이벤트를 실시하며 IBK기업은행은 주택청약종합저축에 신규 가입하는 청년을 대상으로 금융바우처와 경품을 제공하는 이벤트를 진행한다.
605490,2,금융위원회, 이윤수 자본시장국장, 신임 FIU 원장, 행정고시, 금융정보분석원장,"다음 뉴스 기사를  3문장으로 요약해, 총 답변의 길이는 150자 이내로 제한한다. + content",gpt-3.5-turbo-16k,1,,1,0,0,금융위원회는 이윤수 자본시장국장을 FIU 원장으로 임명했으며 그의 임기는 내달 3일부터 시작된다. 이윤수 원장은 서울대와 미국 플로리다대를 졸업하고 공직에 입문한 후 금융 분야에서 다양한 직책을 역임하며 최고 전문가로 평가받았다. (145자)
