570774,아라가야 성곽유적 '함안 안곡산성' 경상남도 문화재 지정,강경우 기자,2022.06.16 14:23:39,"[프라임경제] 아라가야를 대표하는 성곽유적인 함안 안곡산성(咸安 安谷山城)이 경상남도 문화재(기념물)로 16일 지정됐다.함안 안곡산성 전경. ⓒ 함안군함안 안곡산성은 함안군 칠서면과 대산면 경계에 위치한 안국산(해발 343m) 정상부를 따라 축조된 좁고 긴 형태의 테뫼식 산성(鉢卷式 山城, 둘레 1231m)으로 내성(둘레 821m)과 외성(둘레 410m)이 있는 복곽성(複郭城)이다.안곡산성은 낙동강과 창녕지역까지 모두 가시권에 들어오는 곳에 입지하고 있어, 아라가야가 신라 등 주변세력의 침입을 대비해 군사적 요충지에 쌓은 산성으로 알려져 왔다.함안군은 '가야문화권 조사연구 및 정비'의 일환으로 2017~2018년 군 자체사업으로 안곡산성에 대한 첫 발굴조사를 실시했고, 2021년, 2022년 두 차례 '경상남도 가야문화재 조사연구 지원사업'에 선정돼 내성 구간에 대한 발굴조사 실시했다. 현재는 성곽의 정확한 범위를 확인하기 위한 측량과 시굴조사가 진행 중이다.조사결과, 안곡산성은 아라가야의 전성기인 5세기 후반 흙과 돌로 함께 쌓아 올린 토석혼축(土石混築)의 산성임이 밝혀졌다. 특히 성벽 내부에서는 나무기둥과 석축을 함께 활용해 상부의 수직압력을 분산하고 붕괴를 방지하는 토목공법도 확인된다.안곡산성의 토석혼축 공법은 아라가야 최고 지배층의 묘역인 '함안 말이산 고분군'의 대형봉토분에서도 확인되는데, 지형적 불리함을 극복하고 견고한 구조물을 세우기 위한 아라가야 특유의 토목기술이다.이에 안곡산성은 고분 축조기술을 성곽 축조에 접목한 특별한 사례로서 고대 성곽 연구에 중요한 자료라는 점에서 문화재적 가치를 높게 평가받아 경상남도 문화재로 지정됐다.함안군 관계자는 ""안곡산성의 도 기념물 지정으로 입체적인 아라가야사 복원에 한 걸음 더 다가섰다""며 ""향후 추가적인 조사와 결과를 바탕으로 성곽의 체계적인 보존 및 정비계획 수립을 할 수 있도록 최선을 다하겠다""고 말했다."
599655,함안군 풍물패 '청음' 지역문화 국제교류 공모사업 선정,강경우 기자,2023.04.25 13:13:58,"[프라임경제] 문화체육관광부와 한국국제문화교류진흥원이 시행하는 2023 지역문화 국제교류 기획지원 사업에 함안군 '풍물패 청음'이 최종 선정됐다.함안군 풍물패 청음. ⓒ 함안군'지역문화 국제교류 지원사업'은 지역차원의 국제문화교류 활성화를 위해 기초지자체 내 민간 문화예술 기관·단체의 국제문화교류 사업추진 및 기획역량 강화를 지원하는 사업이다.이번 공모사업은 지난 3~4월 전국 기초지자체 내 민간 문화예술기관·단체를 대상으로 신청 받아 심사를 거쳐 최종 선정됐다.올해는 지역문화 국제교류를 위한 전문가 자문, 컨설팅 및 워크숍을 지원하고 내년도 국제교류 사업추진을 준비한다.이에 따라 풍물패 청음은 경남문화예술진흥원에서 주관하는 2023년 공연장 상주단체 육성지원사업 공모에 이어 두 번째 공모사업에 선정되는 쾌거를 이뤘다.함안군 관계자는 ""함안청년이 주도하는 전통문화 예술단체의 유·무형 자원을 활용한 국제교류사업 발굴과 지원을 통해 지역의 문화예술 콘텐츠의 가치를 국내·외로 확산시키는데 노력하겠다""고 말했다.한편, 함안군은 몽골 울란바토르시 항올구와 지난 2011년부터 우호교류를 이어오고 있으며, 이번 공모사업 선정을 계기로 교류 분야를 확대해 다양한 분야의 교류를 추진할 예정이다."
607402,"함양군, 29일 상림 문화놀이장날 여름편 개최",강경우 기자,2023.07.19 11:29:16,"[프라임경제] 함양군이 빈둥협동조합과 함께 7월29일 함양군문화예술회관 옆 고운광장에서 문화축제인 '상림 문화놀이장날' 야시장을 개최한다. .상림 문화놀이장날. ⓒ 함양군여름편인 이번 상림 문화놀이장날은 문화·놀이·마켓으로 운영되며, 마켓은 '상림 밤도깨비장터'와 '어린이 돗자리 벼룩시장'으로 운영한다.놀이는 '여름아 놀자! 물놀이터'라는 주제로 △페트병 물총 만들기 △물싸움 △맨발놀이 등 어린이들이 물과 함께 시원한 여름을 보낼 수 있도록 준비하고 있다.뿐만 아니라 밤 9시부터는 '모기장 영화제'로 아일랜드 영화인 '말없는 소녀'를 상영할 계획이며, 이 영화는 2023년 개봉된 작품으로 올해 런던비평가협회상을 수상하기도 했다.이번 행사는 당일 오후 6시부터 10시40분까지 열릴 계획이며, 누구나 참여가 가능하고 영화를 보기 위해서는 모기장 텐트, 돗자리, 캠핑의자 등을 준비해야 한다.특별이벤트로 어른들에게는 어릴 적 추억을 소환하고, 아이들에게는 새로운 경험과 조상들의 지혜를 배울 수 있도록 광장주변 곳곳에 모깃불을 피우는 체험도 마련했다.우천시에는 함양군문화예술회관으로 자리를 옮겨 개최하며, 참가신청 및 문의는 페이스북, 네이버밴드 '#문화놀이장날'로 하면 된다."
537748,남해군 '국립한국섬진흥원' 유치 총력…동‧서‧남해안 중심,강경우 기자,2021.03.23 14:33:46,"한국 섬 진흥원 포스터. ⓒ 남해군[프라임경제] 남해군이 '국립 한국 섬 진흥원' 유치를 위해 총력전을 펼치고 있다.남해군은 코로나19 방역지침을 준수하며, 전 군민과 향우들의 염원을 집결하기 위해 공모 결과가 발표되는 4월까지 사회관계망서비스(SNS)와 유튜브 등 을 활용한 언택트 홍보에 집중한다.특히 남해군이 왜 '한국 섬 진흥원'의 최적 입지인지를 적극 알리고 공감대를 형성한다는 방침이다.행정안전부는 '도서개발촉진법' 일부개정을 통해 전국 섬 정책 종합컨트롤 타워 역할을 할 한국섬진흥원의 설립근거를 마련하고 4월까지 공모를 통해 설립지역을 선정‧발표한다는 계획이다.'한국 섬 진흥원'은 섬에 대한 종합적이고 체계적인 조사·연구·정책수립을 하는 기관으로 국가 균형발전 가치를 실현하는 데 목적을 두고 있다.남해군은 사면이 바다로 둘러싸인 '섬 지자체'로 청정한 자연 환경을 보존하고 있어 그 어느 곳보다 한국 섬 진흥원의 설립 취지와 부합한다는 평가다.남해군 조도 전경. ⓒ 남해군특히 서해안과 동해안의 중심인 남해안, 그 남해안 중에서도 중심지가 남해군이라는 점도 큰 매력이다.지정학적 조건이나 국가 균형발전 측면에서도 남해군의 입지 여건이 뛰어날 뿐만 아니라 살기좋은 섬 만들기 사업을 선도적으로 추진하고 있는 남해군의 역량과 한국 섬 진흥원의 전문성이 시너지 효과를 발휘할 것으로 기대된다.남해군은 한국섬진흥원 유치와 동시에 살기좋은 섬 만들기를 위한 표준 모델을 만들어간다는 계획이다.남해군은 살기좋은 섬 만들기 표준 모델로 △청년이 일하고 싶은 '돌아오는 섬' △주민의 일상이 섬의 역사가 되는 '살기좋은 섬' △생태 자연을 활용한 '예술의 섬' 등 세가지를 제시하고 있다.남해군은 지난 3월4일 경상남도를 통해 행정안전부에 한국섬진흥원 설립지역 공모 신청서를 제출했으며, 4월경 최종결과가 발표될 예정이다.장충남 남해군수는 ""청정 자연을 보존하고 있는 보물섬 남해군은 그 자체로 섬 진흥원의 설립 요건에 부합할 뿐만 아니라, 국토균형발전 가치를 더욱 극대화할 수 있는 입지""라며 ""대한민국 전역을 관할할 수 있는 동서남해안의 중심인 남해군에서 대한민국 섬 발전 정책을 일궈 나가길 기대한다""고 말했다."
597551,김천시 '거미·백아연 스탠딩에그' 콘서트 개최,나영혜 기자,2023.04.03 11:09:04,"[프라임경제] 김천시 문화예술회관(관장 배정화)에서는 오는 4월14일 오후 7시30분에 '거미 & 백아연 & 스탠딩에그 콘서트'를 문화예술회관 대공연장에서 개최한다.대한민국 대표 감성 보컬리스트 거미는 호소력 짙은 목소리와 다채로운 음악으로 발라드의 진수를 보여주며 감동의 여운을 전달한다. R&B, 발라드, 댄스 등 어떤 장르도 소화하며 발표하는 앨범마다 히트 쳤으며, 대표곡으로는 'You Are My Everything', '그대 돌아오면', '기억상실' 등이 있다.맑고 청아한 음색의 소유자 백아연은 SBS의 K팝스타 시즌 1의 주역으로 2015년 발매한 자작곡 '이럴거면 그러지말지'가 멜론차트 연간 4위라는 역주행 열풍의 신화를 이끌며 현재까지도 큰 인기를 얻고 있고 이후 '쏘쏘', '달콤한 빈말'로 연속 대히트를 치며 공감형 싱어송라이터라는 별명을 얻었다.인디밴드의 대표주자 스탠딩에그는 2010년 결성된 음악 그룹으로, '오래된 노래', '너만 예뻐' 등 다수의 곡을 히트시키며 제7회 멜론뮤직어워드 인디부문 수상, 제11회 가온차트 뮤직 어워즈 올해의 파퓰러 싱어상 등을 수상했다. 그 외 드라마 '역도요정 김복주'와 '힘쎈여자 도봉순' 등 다수의 OST에 참여하는 등 활발한 활동을 이어가고 있다."
555034,"보령 무창포미술관, 중견작가 10인의 설치미술전 개최",오영태 기자,2021.10.28 10:35:34,"[프라임경제] 중견작가 10인의 설치미술전이 무창포미술관(충남 보령 무창포 호텔테라마르내) 주관과 보령시 후원으로 지난 26일 개최했다.보령내 사립미술관이 주최하는 대규모 설치미술전은 최초라 지자체에서도 관심과 기대가 크다. 지난 10월26일 개최된 오픈식에 김동일 보령시장과 많은 유관기관 인사들이 참석해 성황을 이뤘다.지난 26일 무창포미술관 설치미술전 개막식에 참석한 김동일 보령시장 및 관계자들이 기념촬영을 하고 있다. ⓒ 프라임경제'현대 이후 현대미술의 이해: 비상구를 찾아라'를 전시의 주제로 삼았다. 현대미술의 한계를 뛰어넘는 대안 모색을 위한 화두다.사실 영역을 넓혀보면 이 번 전시기획은 지역사회에도 여러 시사점을 갖는다. 코로나 속 지역 관광산업의 위기, 경기의 양극화, 지방소도시의 인구감소 및 쇠락 문제에 대한 문제의식을 내포하고 있다. 하나 같이 근본적으로 타개해야 할 난제들이 수두룩한 상황이다.뭔가 시급히 활로를 찾지 않으면 위태로울 정도로 위축된 전반적 사회분위기 속에 개최되는 전시회는 예술의 공공성을 의식한 메세지를 동시에 던져주고 있다.김동일 보령시장이 지난 26일 무창포미술관 설치미술전 개막식에 참석해 작품을 감상하고 있다. ⓒ 프라임경제기획단계부터 보령시의 협조를 얻어 무창포해변 공용구조물을 작품의 플랫폼으로 활용해 더 많은 사람들이 작품에 다가가고 즐길 수 있도록 했다. 작가들은 수개월간 무창포와 인근 도시들,호텔내 다양한 공간(지하실, 수영장 등)을 재해석해 다채로운 작품들을 탄생시켰다.전시 기간도 휴양지의 특성상 사람이 점점 찾지 않는 비수기를 일부러 택하고 연중 태반 사람의 발길이 닿지 않던 방치된 공간을 활용했다. 덕분에 죽어있던 공간에 벌써부터 사람들의 방문으로 온기가 돌기 시작하고 누구나 다시 찾고 싶은 예술의 명소로 변신해가는 모습이 그려진다.이 번 전시를 통해 시도된 극적인 공간재해석의 성공적 실험이 도시재생 프로젝트에 관심이 큰 지역사회에 신선한 충격을 주고 있다. 코로나 상황에 위축된 지역 관광산업에 새로운 활력을 주고 지속적인 변화의 물결로 파급돼 나갈 수 있을지 귀추가 주목된다."
537151,"경주엑스포, 홍보조형물 디자인 공모전 개최",권영대 기자,2021.03.17 17:28:27,"경주엑스포대공원 홍보조형물이 세워질 정문의 야간 전경. ⓒ 경주엑스포대공원[프라임경제] 경주엑스포대공원이 대학생과 대학원생을 대상으로 하는 홍보조형물 디자인 공모전을 개최하고 참신한 아이디어를 모집한다.(재)문화엑스포(이사장 이철우 경북도지사)는 경주엑스포대공원 정문광장에 들어설 홍보조형물에 대한 디자인 공모전을 개최한다고 17일 밝혔다.경주엑스포대공원은 올해 명칭변경과 콘텐츠 혁신에 맞춰 관광객에게 친근하고 인상을 제공하고 정문광장에서 포토존의 역할을 수행할 새로운 홍보조형물 설치를 추진한다.관광객의 눈높이로 가까이 다가갈 수 있는 참신한 홍보조형물을 설치하기 위한 것으로 전국에 소재한 모든 대학의 학부생 및 대학원생이면 참가가 가능하다. 접수는 다음달 12일부터 16일까지다.참가를 원하는 대학생 및 대학원생은 신청서와 작품 디자인 등 필요서류를 해당 기간 내에 이메일로 접수하면 접수된 작품 가운데 최우수상(1명), 우수상(1명), 장려상(2명) 등 수상자를 선정해 시상한다.작품 선정 기준은 출품된 디자인이 '문화엑스포의 상징성을 담고 있는가', '경주엑스포대공원 홍보 및 관광활성화에 기여할 수 있는가', '대중의 흥미를 유발하고 예술성을 갖추고 있는가' 등이다.상금은 전체 500만원 규모로 각각 최우수상 300만원, 우수상 100만원, 장려상 각 50만원이다. 최종수상자는 5월 중 발표될 예정이며 6월 작품이 설치될 예정이다.공고문과 접수방법, 참가신청서, 서약서 등 공모전과 관련된 자세한 내용은 경주엑스포대공원 홈페이지와 SNS채널, 경북도 ․ 경주시 홈페이지 등을 통해 확인할 수 있다.류희림 경주엑스포대공원 사무총장은 ""경주엑스포대공원의 첫인상을 좌우할 정문광장에 설치될 상징 홍보조형물이 학생들의 톡톡 튀는 아이디어로 탄생하길 기대한다""며, ""많은 분들의 참여와 관심을 부탁한다""고 말했다."
603946,예산군 제16회 예산삼베길쌈마을 전통문화체험 행사 개최,오영태 기자,2023.06.15 10:40:29,"[프라임경제] 충남 예산군농업기술센터는 오는 17일 체험객, 마을민, 출향인 등을 대상으로 마을 역사인물의 나라사랑 정신과 점차 잊히고 있는 삼베길쌈의 전통문화를 계승하고자 광시면 신흥리에서 제16회 예산삼베길쌈마을 전통문화체험행사를 개최한다.지난해 삼베길쌈마을 전통문화체험행사 모습(삼베짜기 체험). ⓒ 예산군군에 따르면, 삼 수확시기에 맞춰 열리는 이번 행사는 전통방식으로 삼베를 만드는 예산삼베길쌈 마을을 일반인들에게 홍보 및 체험 할 수 있도록 진행되며, 다양한 즐길거리와 볼거리도 마련된다.주 행사인 삼굿개방체험, 삼껍질 벗기기 체험과 함께 마을주민들로 구성된 신흥리 나라사랑 풍물패의 축하공연을 시작으로 다양한 문화공연과 테마 체험도 운영된다.또한 문화예술공연으로 △나라사랑 퓨전 음악극 △부채춤 △강강술래 전통문화 공연이 진행되며, △미니 삼베짜기 △삼나무 드림캐처 만들기 △나라사랑 신바람 부채만들기 체험 행사 등 다양한 즐길거리가 제공된다.특히 야간에 진행되는 삼베마을 '추억의 극장' 영화 상영은 출향민들과 함께 고향의 향수를 느끼는 기회를 제공하고 나라사랑 연등 퍼레이드가 행사의 흥겨움을 더할 전망이다.마을주민이 주인공이자 중심이 되는 예산삼베길쌈마을 전통문화체험행사는 올해로 16회를 맞이하며, 사라져가는 삼베길쌈전통의 맥을 잇는 행사로 자리매김하고 있다.농업기술센터 관계자는 ""잊혀져 가는 삼베길쌈의 전통이 행사를 통해 현대인들에게 친근하게 다가갈 수 있는 계기가 되길 바란다""며 ""앞으로도 농촌 전통문화 계승을 위해 노력하겠다""고 말했다."
583599,"김석 시인, 세번 째 시집 '괜찮다는 말 참, 슬프다' 출간",김강석 기자,2022.10.30 19:15:42,"김석 시인. =김강석 기자[프라임경제] 대구에서 작품 활동하고 있는 김석(65) 시인이 세번 째 시집 '괜찮다는 말 참, 슬프다'를 출간했다.김석 시인은 지난 2004년 '시인정신'과 '문학청춘'으로 등단, 시집 '거꾸로 사는 삶' '침묵이라는 말을 갖고 싶다' 등이 있으며, 계명대학교 대학원 문예창작과를 졸업했다.호병탁 문학평론가는 ""작품의 어휘들 배치와 구조가 정말 독특하다""며 ""시인이 견인한 토착어들과 언어조형 능력으로 서정적 문장을 구조화시켰다""고 평가했다. 또 ""시적 대상을 선연한 감각으로 인식하고 거역할 수 없는 그리움의 정서를 잘 표현했다""고 덧붙였다.김석 시인은 대구문인협회 사무국장·편집국장·감사, 대구예술가총연합회 감사를 역임했으며, 대구예술상 문학부문을 수상했다."
602497,"진주시 ""소중한 역사를 기증해 주세요""",강경우 기자,2023.05.30 10:17:37,"[프라임경제] 진주시립이성자미술관 제2전시실에서 진주역사관 기증유물 특별전 '아버지의 물건'을 전시 중이다.조규일 시장이 진주시립이성자미술관 진주역사관 기증유물 특별전을 관람하고 있다. ⓒ 진주시이번 특별전은 진주역사관 건립을 위해 기증받은 유물을 대중에게 공개하는 기획 전시로, 개천예술제를 창시한 파성 설창수 선생의 유품 17건 200여점을 전시하고 있다.진주시는 진주의 역사를 정리하고 후손들에게 전달하기 위해 진주역사관 건립을 추진하고 있다. 2020년부터 기증받은 소장품은 현재 300여건으로, 올해는 설창수 선생의 유품을 기증받았으며, 진주 남악서원이 소장했던 김유신·최치원 초상을 영구기탁 받았다.기증받은 유물은 2021년 2월 첫 기증유물 특별전을 시작으로 꾸준한 전시를 통해 시민들에게 공개하고 있다. 미술관은 앞으로도 다양한 후속 전시를 선보일 예정이다.조규일 진주시장은 ""소장자료 기증은 우리의 소중한 문화자산을 꽃피우고 진주시 역사를 완성하는 일에 중요한 밑거름""이라며 ""시민들의 많은 관심과 참여 바란다""고 말했다.특별전 '아버지의 물건'에 공개된 파성 설창수 유품을 기증한 자녀들은 ""집에서 보관하고 있을 때는 이렇게 값지게 느껴지지 않았다""며 ""좋은 환경에서 관리받고, 전시를 통해 여러 사람에게 보일 수 있어 기쁘다""고 전했다.리영달 진주역사관 건립추진위원회 위원장은 ""진주는 유구한 역사와 찬란한 문화자산을 보유한 도시이다. 이를 한데 모아 전시할 역사관이 꼭 필요하다""며 ""시민들의 적극적인 기증을 통해 역사관 건립에 힘을 보태주길 희망한다""고 말했다.한편, 진주시는 진주의 흔적을 미래에 전해 줄 다양한 자료를 수집하고 있으며, 유물 기증에 관한 문의는 진주시 문화예술과로 하면 된다."
591936,제1회 포항국제사진제 화려한 폐막,김진호 기자,2023.02.01 17:54:22,"지난 27일 포항문회예술회관에서 포항국제사진제 시상식을 마치고 수상자, 초청작가, 관계자들이 기념 촬영을 하고 있다. = 김진호 기자[프라임경제] 제1회 포항국제사진제가 30일 화려하게 폐막했다.포항문화재단은 포항시와 포항문화재단 주관으로 포항문화예술회관, 포항문화예술팩토리, 갤러리포항에서 개최된 제1회 포항국제사진제가 27일 시상식과 함께 30일 마지막 전시회를 마치고 폐막했다.이번 사진제는 1년간 준비 속에 사진전과 함께 포항시민사진대학, 세미나 등 다양한 프로그램이 함께 진행됐으며 공모사진전에는 한국, 일본, 인도, 중국, 캐나다, 미국 총 6개국에서 4000여점이 접수돼 입상작 112점, 초청작가 작품 등이 11일 동안 전시됐다.포항국제사진제 전시장에서 초청작가가 작품 설명을 하고 있다. = 김진호 기자국제 공모전 출품작은 다른 지역 보다 4배 가까운 작품이 접수돼 높은 관심을 보였다.27일 열린 시상식에는 '삶과 문화' 분야에서 김범수 작가, '도시풍경'  부분에서는 장호식 작가, '환경다큐'부분에서 백창원작가, 'before2022' 김대일작가, '동영상 드론' 부분에서 김춘길작가가 각각 금상을 '옛사진전' 부분에서 박명실 작가가, '청소년전'에서 이은서 학생이 각각 대상을 수상했다.특히, 시상식에서는 지역 작가들의 수상이 두드러져 지역 사진작가들의 수준이 국제수준에 도달했음을 증명하는 계기가 됐으며 포항에서 활동중인 이정철, 김진호 작가 등은 여러 부분에서 수상작을 선보이며 지역작가들의 수준을 드높였다.포항국제사진제에서 프랑스 폴 교수가 주제 발표를 하고 있다. = 김진호 기자행사 기간 동안 포항문화예술회관 2층 컨퍼런스룸에서는 '사진과 사진축제를 통한 포항의 도시마케팅' 주제로 전국 단위의  학술심포지엄이 있었고 도시브랜딩 전문가 교수 7편의 논문이 발표됐다. 또한 이명호, 진동선, 정봉채, 케이채 등 국내작가와 마친(폴란드), 스와푼일(인도), 폴(프랑스) 교수등 초대 작가들과의 아티스트 토크를 통해 포항국제사진제  출품작에 대한 스토리와 그들의 사진세계를 탐하는 시간을 가졌다.지난 1월30일 포항국제사진제 폐막 후 초청작가, 봉사자, 관계자들이 기념 촬영을 하고 있다. = 김진호 기자또한, 지역 작가들이 초청작가 촬영장 안내와 행사장에 포토존을 설치해 관람객에게 사진을 찍어 즉석에서 인화해 주는 등 직접 행사진행에 도움을 줘 성공적 행사를 만들었다.총예술감독 구승회 교수는 ""사진축제를 통한 도시브랜딩을 새롭게 하고 국제 공모전과 작가 초대전시라는 투 트랙으로, 이전의 사진축제에서 보지 못한 참신한 기획과 디테일한 실행으로 성공적인 축제가 이뤄졌다""며 ""이제 남은 것은 포항시민 사진계의 일치단결과 1회 축제에 대한 평가를 통해 2회 준비가 필요하다""고 말했다."
