574462,"[행복 함안] ""22일 아라가야 문화제, 함안으로 오세요""",강경우 기자,2022.07.22 17:01:31,"[프라임경제] 함안군이 7월22일부터 24일까지 박물관·말이산고분군·아라길 일원에서 '제34회 아라가야문화제'를 개최한다.제34회 아라가야 문화제 포스터. ⓒ 함안군올해는 찬란한 아라가야의 문화를 기리기 위한 역사문화제로 단독 개최하며, 아라가야의 우수한 역사성과 높은 문화 수준을 널리 알리고 말이산고분군의 유네스코 세계유산 등재를 기원하는 풍성하고 다채로운 행사가 마련됐다.22일은 식전행사로 아라초등학교에서 함안박물관까지 아라대왕 행렬이 진행된다.이어 함안박물관에서 열리는 개막식은 아라가야의 우수한 문화를 나팔·대평소·칼춤 등을 활용해 왕의 행차를 표현한 아라가야대군물(大軍物) 공연이 열리고, 말이산고분군의 밤하늘을 드론으로 화려하게 수놓는 말이산고분군 세계유산 등재 기원 드론라이트쇼와 미디어파사드를 선보인다.또 22일부터~24일까지 아라가야문화제 기간 동안 말이산고분군에는 경관조명을 설치하고 고분군 곳곳에는 사슴모양뿔잔과 별자리덮개석, 미늘쇠 등 출토 유물을 형상화한 조형물이 환한 빛을 밝히며 방문객을 맞는다.뿐만 아니라 말이산고분군 1호‧10호‧45호분에서는 1인 힐링공연이 열려 여름밤의 정취를 더한다.아라길 광장에서는 군민 힐링 축제분위기 조성을 위해 각종 체험·홍보행사·음악회·버스킹 등 다양한 프로그램을 마련했다. 23일은 국가무형문화제 제58호 줄타기 보존회의 제6회 유네스코 세계무형유산 축제(줄타기)가 열린다.이와 함께 아라길 음악회(유네스코 등재기원 음악회, 힐링라인댄스 등), 아라길 버스킹(감사랑 태권도 퍼포먼스, 키즈, 청소년 댄스 퍼포먼스 등), 아라길 체험(아라홍련 LED 아크릴 아트 체험, 나무 오카리나 원목 소품 만들기 등)과 함안 농특산물 홍보 및 시식 등 풍성한 부대행사도 마련했다.한편, 군은 코로나19로 중단된지 3년 만의 축제만큼 국민과 방문객을 맞이하기 위한 축제 준비에 만전을 기하고 있다. 자세한 사항은 함안군청 홈페이지에서 확인하면 된다."
565073,[부강 진주] 월아산 자연휴양림 15일 운영…주말 예약 100%,강경우 기자,2022.04.13 15:39:23,"[프라임경제] 진주시가 지난 3월 준공한 월아산 자연휴양림의 시설점검을 마치고 4월15일부터 본격 운영에 들어간다.15일 개장하는 월아산 자연휴양림. ⓒ 프라임경제진성면 소재 월아산 자연휴양림은 숲속의집 4동, 콘도형 산림휴양관 1동, 글램핑 8동과 야영데크 5개소로 구성돼 있다.또 잔디광장과 월아산 계곡을 가로지르는 보행교를 설치해 야외활동과 함께 주변 경관을 조망하며 즐길 수 있도록 조성했다.전국 자연휴양림 소개 사이트인 '숲나들e' 홈페이지를 통해 4월8일부터 사전예약을 실시한 결과, 지난 11일 기준 4월15일부터 5월16일까지 객실 85%(주말 100%, 주중 75%)의 예약률을 보였다.예약은 매주 수요일 오전 9시에 '숲나들e'에서 가능하며, 5월부터는 매월 1일부터 5일까지 진주시민과 장애인을 대상으로 한 우선예약도 시작한다.우선예약은 진주시민 대상 숲속의집 2동, 산림휴양관 4실, 글림핑 2동이며, 장애인 대상은 장애인 편익시설이 설치된 산림휴양관 2실이다.월아산 자연휴양림 글램핑 야경. ⓒ 프라임경제시설 사용료는 숙박동 7만5000원~24만원, 글램핑 10만5000원~12만5000원, 야영데크 2만원~2만4000원이다. 진주시민과 장애인, 기초수급자, 한부모가족, 다문화가족, 국가보훈대상자, 다자녀가정은 비수기 주중 사용료 30% 감면한다.자세한 사항은 월아산 숲속의 진주 홈페이지, 인스타그램, 유튜브 채널 '숲속의 진주TV'에서 확인하면 된다.월아산 자연휴양림은 경남진주혁신도시와 문산IC, 진성IC, 진마대로(국도2호선) 등을 통한 접근성이 좋아 진주시민 뿐만 아니라 타 지역에서도 쉽게 방문해 일상 속 휴식을 즐길 수 있는 장점이 있다.또한 자연휴양림을 품고 있는 월아산 숲속의 진주에서 목공체험, 숲해설과 유아숲체험, 숲속어린이도서관 프로그램 등 체험활동을 병행할 수 있다.5월부터는 산림레포츠 시설을 개장할 예정이며, 휴양과 체험, 레포츠를 한자리에서 즐길 수 있는 도심 속 명소가 될 것으로 기대된다.진주시 관계자는 ""월아산 숲속의 진주에 오면 먼 곳으로 떠나지 않아도 일상생활 속에서 휴양과 체험을 마음껏 즐길 수 있다""며 ""산림 치유와 관광의 명소로 성장할 수 있도록 지속적으로 노력할 것""이라고 말했다."
600585,[포토] 포항 죽장면 '제3회 두마리 산나물잔치' 개최,김진호 기자,2023.05.08 01:54:02,"= 김진호 기자= 김진호 기자= 김진호 기자[프라임경제] 포항 죽장면 두마리 산나물잔치위원회(위원장 이종발)는 6일 죽장면 두마산촌문화회관에서 한창화·연규식 도의원, 이상범경제산업위원장, 김상백 시의원, 금창섭 죽장면장, 김주락 서포항농협장, 이동율 포항시읍면동체육회장, 박희자 포항시지속가능발전협의회 대표 등 내빈과 주민들이 참석한 가운데 '제3회 두마리 산나물잔치'를 개최했다.이날 행사에서는 지역에서 생산된 산나물을 관광객들에게 소개하고 직접 먹어보고 구매하는 시간 등을 가졌으며 영광문화예술단(단장 나보라)이 진행하는 재능기부 공연과 노래자랑이 펼쳐져 이곳을 찾은 사람들에게 즐거운 시간을 선사했다."
588295,제37회 가요창작인 공로대상 및 2022 가요대상 시상식 개최,최성필 기자,2022.12.20 16:49:34,"작사작곡상을 수상한 이영만, 박보근, 김승우(왼쪽부터), 김진호,박연서, 인윤하 씨(오른쪽부터). = 최성필 기자[프라임경제] 제37회 가요창작인 공로대상 및 2022 가요대상 시상이 19일 일산 쇼킹스튜디어에서 개최됐다.이번 시상식은 사)한국가요창작협회(회장 김상욱) 주관으로 올해 대한민국 가요 발전에 기여한 가수들과 관계자들의 노고를 치하하기 위해 마련됐다.특히, 포항출신으로 지역에서 활동중인 김진호씨가 가요창작인이 선정한 작사·작곡가상을 수상해 의미가 더했다.가요창작인 최고 공로대상 정주희 작곡가(우측) 수상 후 기념 촬영을 하고 있다. = 김진호 기자이날 시상식에서 가요창작인 최고 공로대상에는 정주희 연주자·작곡가, 가요창작인이 선정한 작품상에는 이동훈 작곡가, 가요창작인이 선정한 작사·작곡가상에는 김진호, 박연서, 이윤하, 김승우, 박보근, 이영만 작사·작곡가가 수상했으며 많은 작곡가, 작사가, 가수, 방송언론인이 이번 행사에서 상을 받는 영광을 안았다.10대 가수상을 받은 김국환, 이혜리,(좌로부터), 우연이씨(우측 첫번째). = 김진호 기자이외에도 제2회 김영광가요제를 추진하고 문화예술 발전에 기여한 최경조, 최유수, 태란, 전유솔, 박미정, 최은성, 성준, 김정화 가수도 가수상을 수상했다.작사·작곡가상을 수상한 김진호씨는 노블리스 오브리제를 실천한 '경주 최부자'란 노래를 직접 작사해 좋은 평가를 받았다.인기가수상을 수상한  유성호, 유미(좌로부터) 견우와직녀(우측 맨끝). = 김진호 기자이번 행사를 마련한 김상욱 사)한국가요창작협회 회장은 ""이번 시상식은 2022년도 한국 가요발전에 기여한 분들을 위해 마련된 행사로 수상한 모든 분들께 축하의 인사를 드린다""며 ""내년에는 더욱 알찬 행사가 이어질수 있도록 문화예술인들과 함께 더욱 노력해 나가겠다""고 말했다."
596673,"남해 관광창업 지원사업, 예비 창업자 모집",강경우 기자,2023.03.23 14:06:15,"[프라임경제] 관광 창업자의 역량강화와 건강한 관광생태계 구축을 위한 관광 창업 지원사업이 남해에서 진행한다.남해 관광창업 지원사업 예비 창업자 모집 포스터. ⓒ 남해군남해관광문화재단은 남해 관광을 선도하고 참신한 관광사업 아이디어를 제시하는 예비 창업자 육성을 위해 3월부터 '남해 관광창업 지원사업'을 추진한다.이에 따라 남해 관광자원을 활용한 창의적이고 우수한 관광사업 아이템을 보유한 예비창업자를 모집해 △창업 소양교육 △전문가 컨설팅 △디자인 지원을 통해 실제 창업이 이뤄질 수 있도록 지원한다.신청은 3월20일부터 4월7일까지며, 심사·평가를 거쳐 대상 300만원, 우수상 200만원, 장려상 100만원을 지급한다. 관광창업 지원사업에 선정된 예비창업자는 9월까지 실행 사업계획서를 확정해 실제 창업을 돕는다.사업 참여는 남해관광문화재단 홈페이지 고시·공고 게시판에 신청서식을 다운받아 이메일로 제출하면 되고, 모집기간은 4월7일까지다."
579703,제2회 김영광가요제 예선전 개최,김진호 기자,2022.09.18 20:27:09,"17일 포항 문화극장에서 한 출연자가 김영광가요제 예선경연에 참가해 열창하고 있다. =김진호 기자[프라임경제] 제2회 김영광가요제 예선전이 포항시민들의 뜨거운 관심속에 열렸다.영광문화예술진흥회(회장 김상욱)는 17일 포항시 북구 장성동 문화극장에서 제2회 김영광가요제 예선전을 개최했다고 밝혔다.코로나19 준칙을 철저히 지키며 비대면으로 진행된 예선전에서는 작곡가 문병초·김병걸·김상욱, 가수 최대성씨가 심사를 맡았으며 전국에서 참가한 64명이 노래실력을 겨뤄 14명이 본선에 진출했다.이번 가요제 예선은 참가신청일이 지난 이후에도 30여 명이 추가로 예심 신청해 다음을 기약해야할 정도로 가수지망생들의 관심이 높았다.김상욱 예선 심사위원장은 ""지난 1회 대회에 비해 실력이 뛰어난 참가자가 점점 늘어나 심사하는데 상당한 어려움을 겪었다""고 말했다.이번 대회는 영광문화예술진흥회, 경북매일, 아이실버TV가 주최하고 김영광가요제 추진위원회가 주관하고 있으며 시민, 지역근로자들의 자발적 참여와 함께 어린 학생들이 용돈을 아껴 후원을 하는 등 해가 갈수록 후원자들이 늘어나고 있다.17일 포항 문화극장에서 김영광가요제 예선경연을 마치고 심사위원, 추진위원과 운영위원이 기념사진 찍고 있다. =김진호 기자예선전에서는 김영광가요제 추진위원회와 운영위원, 자원봉사자 등 100여명도 함께 행사진행을 도왔다.김영광가요제는 우리나라 대표 작곡가인 지역출신 김영광 작곡가의 업적을 기리고 가요제를 통해 포항시민에게 문화 향유의 공간을 마련하고 대한민국 전통 트로트 꿈나무를 발굴하며 지역의 인적자원을 이용한 전국가요제 콘텐츠 개발과 지역 문화산업 발전 및 포항 경제에도 도움이 될 것으로 기대된다.이번 대회 본선은 10월1일 포항산림조합 야외특별무대에서 열리며 입상자에게는 신곡과 앨범 취임까지 특전이 주어진다."
585048,포항시 장기면 뇌성산 '뇌록' 다룬 소설 '처마 밑에 핀 꽃' 인기,최성필 기자,2022.11.14 20:35:34,"ⓒ 프라임경제[프라임경제] 포항출신 소설가 김경엽씨(60)가 쓴 장기면 뇌성산 뇌록을 소재로 한 소설이 지역민들은 물론 전국의 문화재 관련 종사자들에게 관심을 불러 일으키고 있다.지난 10월 발간된 김작가의 '쇠꼬챙이를 든 도둑'에 수록된 11편의 단편 소설 중  '처마 밑에 핀 꽃'은 뇌록의 중요성 뿐 만아니라 여러 문헌에 수록 된 역사적 근거를 제시하고 있으며 뇌성산 뇌록 광산의 보존 중요성에 대해서도 일깨우고 있다.이 소설은 조선후기 당쟁에 휘말린 한 젊은 관리가 귀향지인 장기현 뇌성산에서 겪게 되는 고초를 담담하게 그리고 있을 뿐 아니라, 자칫 지루해지기 쉬운 역사적 사실 전개를 사랑이라는 소재로 감싸면서 흥미를 더 하고 있다.또한 이 소설은 뇌록채취에 대한 역사적인 자료와 근거를 제시함으로서 뇌록산지로서의 중요성과 향후 활용방안에 대해서도 지역사회에 숙제를 던져주고 있다.효자동 박모씨(58)는 ""포항에 이런 귀한 광물질이 있는 줄 처음 알았다""며 ""이 작품을 통해 많이 알려져 시민들이 자긍심을 가졌으면 좋겠다""고 말했다.김 작가는 ""뇌성산 뇌록으로 칠한 목조문화재는 일본과 중국의 그것과 비교할 수 없을 만큼 은은한 옥색을 띠고 목재문화재의 가장 천적인 흰개미 등 해충을 막아주는 기능이 있다""며 ""수요도 많아질 것으로 전망되는 만큼, 실제로 채취를 재개해 포항의 새로운 특산품으로 개발할 필요가 있다""고 말했다."
565738,[방문 남해] 마늘한우 축제 6월10~12일 개최,강경우 기자,2022.04.21 11:51:21,"[프라임경제] 남해군의 대표 축제 중 하나인 '남해 마늘한우 축제'가 2년 만에 대면 행사로 펼쳐진다.남해군청. ⓒ 프라임경제군은 오는 6월10일부터 12일까지 유배문학관 광장에서 '제17회 남해마늘한우 축제'를 개최할 계획이다.2년 만에 열리는 대면 행사인 만큼 남해군의 특산품인 마늘과 한우의 우수성을 널리 알려 판매량을 극대화하는 데 축제의 초점을 맞출 방침이다.특히 코로나19 사회적 거리두기와 방역수칙을 모범적으로 준수한 남해군민들에게 즐거움을 선사함은 물론 관광객들도 함께 즐길 수 있는 다양한 공연·문화 프로그램을 꽉꽉 채웠다.이에 따라 유배문학관 광장에 '지역민 먹거리 판매존'을 비롯해 특산품 판매장·피크닉존(쉼터)·체험존·푸드트럭·홍보관 등을 배치해 다양한 체험·문화 행사를 선보일 계획이다.황금마늘 가래떡 뽑기 등 체험 행사를 비롯해 특별 판매 이벤트가 펼쳐지게 되며, 버스킹과 예술단 공연 등도 함께 한다.10일 저녁 개최하는 개막식에는 'i-net tv 성인가요 콘서트'가 열리며, 11일에는 '어게인 1973 남해 나이트 클럽' 공연 프로그램이 준비돼 있다.12일 저녁 메인무대에서는 '마늘이랑 한우랑 듀엣 가요제'와 함께 인기 가수 초청 축하공연이 펼쳐진다. 축제 기간에는 불꽃과 조명이 어우러지는 멀티쇼도 펼쳐질 예정이다.장충남 군수는 ""고생하신 농민들에게 즐거움을 선사하고 관광객들에게는 남해군 방문의 해를 더욱 매력적으로 선보일 기회가 될 것""이라며 ""무엇보다도 마늘과 한우를 포함해 우수한 남해군 특산품이 많이 판매될 수 있는 축제가 됐으면 한다""고 말했다."
566890,"그린닥터스 정근 이사장, 세계한인교류협력기구 평화메달 수상",서경수 기자,2022.05.04 15:46:28,"(왼쪽부터 네번째) 정근 그린닥터스 이사장. ⓒ 프라임경제[프라임경제] 그린닥터스 재단 정근 이사장이 최근 세계한인교류협력기구(W-KICA)로부터 평화메달을 수상했다.세계한인교류협력기구(W-KICA·공동회장 황우여 전 사회부총리)와 세계성시화운동본부가 공동 공동으로 주최했다. 이날 시상식에서 정근 이사장은 한반도 평화와 한인사회 위상 제고에 이바지 한 공로로 'W-KICA 평화 메달'을 수상했다.정 이사장은 그간 한반도 평화와 통일에 많은 관심을 보여왔고, 정치·경제·문화 사업의 증진을 위한 활동에 적극 참여했다. 특히 동남아 국가 등 재난지역 의료 지원 등을 통해 한인사회의 발전과 성장을 위해 기여해온 점을 높이 평가 받았다.그는 2005년 1월부터 북한 개성공단에서 남북협력병원을 설립해 8년 동안 남북한 근로자 35만여 명을 무로 진료했다. 아울러 파키스탄 대지진·스리랑카 쓰나미·인도네시아 아체 지진·중국 쓰촨 대지진 등 재난지역에서 긴급 의료지원 활동을 펼쳐왔다.세계한인교류협력기구(W-KICA)는 175개국에서 한민족의 긍지를 갖고 살아가고 있는 750만 해외동포들의 권익신장과 지구촌 한인사회의 발전을 위해 종교계·정계·시민·사회단체 등이 뜻을 모아 2007년 2월 출범한 국제기구다.상임고문으로는 김수환 추기경(고인), 조비오신부(몬시뇰신부·고인) 김범일 가나안농군학교 총재, 신호범 미국 워싱턴주 하원 부의장 등이고, 김영진 전 농림부장관과 황우여 전 사회부총리가 현재 각각 상임대표와 공동대표를 맡고 있다.이날 정근 이사장 외에 △드미트로 포노마렌코(Dnmytro Ponomarenko) 주한 우크라이나 대사 △안드리아 니콜라엔코(Andria Nikolaienko) 우크라이나 국회의원 △이양구 경상대 교수(전 우크라이나 대사) 등이 W-KICA의 평화메달을 수상했다.역대 수상자로는 △미 연방하원에서 한·미 한인의 날을 제정하는데 기여한 미 하원 토니홀 의원 △반기문 UN사무총장 △데이비스 헵번 유네스코 의장 △이만섭 전 국회의장 △박경서 남북적십자사 총재 △아드리안 더브 마틴루터킹 퍼레이드 재단 총재 등이 있다."
547081,"포항시, 도심 속 ""해양레포츠 체험"" 성료",김진호 기자,2021.06.20 19:59:23,"20일 포항해상공원 일원에서 시민들이 해양레포츠를 체험하고 있다. = 김진호 기자[프라임경제] 경북 포항시(시장 이강덕)는 20일 포항해상공원 일원에서 시민을 위한 2021 도심속 해양레포츠 체험교실을 성공리에 마쳤다.초보자도 쉽게 접근할수 있는 카약, 패달보트, 파워보트 종목을 체험 프로그램으로 구성하고 도심 속에서 체험을 진행해 해양스포츠 접근성을 높여 참가자들 뿐만 아니라 인근을 지나가는 시민들에게도 볼거리 제공해 큰 호응을 얻었다.이번 체험은 해양수산부와 대한민국 국제해양레위크와 포항시 주관으로 6월3일부터 6월20일까지 진행됐으며 해상체험 외에도 독도 사진전, 모형 요트만들기, 응급처치 등 다양한 육상 체험도 운영했다.조철호 해양산업과장은 ""이번 해양레저 체험을 통해 포항시가 해양레저스포츠의 위상을 보여 주었으며, 많은 시민이 해양레저에 관심을 두는 계기가 되었고 해양문화관광도시로 거듭나게 됐다""고 말했다."
542291,"의령 친환경골프장, 군민 건강증진 기여",강경우 기자,2021.04.29 12:37:41,"의령 친환경골프장 전경. ⓒ 프라임경제[프라임경제] 의령군이 직접 운영하는 친환경골프장의 의령군민 이용률이 2019년 대비 44.7% 증가해 군민의 여가 스포츠 활동과 건강증진에 크게 기여한 것으로 나타났다.2008년 개장한 의령친환경골프장은 아름다운 남강변에 위치해 총 9홀 규모로 전체 면적 23만5000㎡, 코스 길이 2.9km의 대중 골프장이다. 개장 이후부터 지난해까지 53만7000명의 고객이 다녀갔다.골프장 이용요금은 18홀 기준 평일 4만5000원(군민 2만3000원), 휴일 6만원(군민 3만원)으로 전국에서 가장 저렴하게 이용이 가능하다. 의령군민에게는 50% 할인혜택이 있어 지난해 약 3억원이 군민에게 할인됐다.특히 2018년과 2019년에는 화학농약을 사용하지 않은 친환경골프장을 운영해  '대한민국 녹색에너지 우수기업 대상'을 연속 수상하는 영광을 안았다.무엇보다 연 4000명의 인근 지역 주민을 고용해 사람이 직접 제초함으로써 친환경 이미지 제고는 물론 코스 관리와 경기 진행, 프런트 등 운영에 필요한 인력까지 25명의 정규직원을 채용해 지역의 일자리 창출에도 기여하고 있다.의령친환경골프장은 '대한민국의 가장 살고 싶은 도시 의령, 슬로시티 건설'과 연계해 휴식과 힐링의 공간, 사계절 관광객이 찾아오는 사업 추진을 위해 현재 9홀 코스를 18홀로 확장하는 오태완 신임군수의 역점사업이 진행중이다."
566775,하동야생차문화축제 4일 개막…세계로 茶 오르다!,강경우 기자,2022.05.03 13:40:50,"[프라임경제] 하동군이 '왕의 차, 천년을 넘어 세계로 차(茶)오르다!'를 슬로건으로 제25회 하동야생차문화축제를 4일∼8일까지 우리나라 차 시배지 화개·악양면 일원에서 개최한다.어린이들이 전통차 만들기 체험을 하고 있다. ⓒ 하동군이번 하동야생차문화축제는 코로나19 여파로 2019년 축제 이후 3년 만에 대면 축제로 개최하며, 다양한 공연과 체험 프로그램 등으로 코로나로 지친 사람들에게 휴식과 치유의 시공간을 제공한다.군은 이번 축제를 차후 2023년 하동세계차엑스포를 준비하는 사전행사 의미로 엑스포의 성공적인 개최를 위한 기반을 마련하는 등 25년째 이어온 야생차문화축제의 위상을 드높일 계획이다.뿐만 아니라 수출 300만달러를 달성한 하동녹차가 세계적 명품 반열에 올랐음을 알리고, 전통적인 차 문화를 축제와 연계해 세계축제도시의 명성에 걸맞은 글로벌 문화관광축제로 성장하는 토대를 구축한다.특히 이번 축제는 3년만에 대면축제로 개최되는 만큼 차의 특성을 살릴 수 있는 체험과 시식 프로그램을 진행하고, 녹차와 지역 농·특산물 판매증진을 통해 농가 소득증대에 기여한다.축제는 △시배지 헌다래를 비롯한 공식 및 공연 프로그램 6개 △올해의 차 품평회 등 경연 프로그램 10개 △엑스포 홍보관 등 전시·체험 프로그램 24개 △차시장 등 판매 프로그램 4개 등 총 44개 프로그램으로 구성했다.축제는 4일 개막식을 시작으로 5일 효 콘서트, 7일 딩동댕 군민화합 노래자랑을 통해 유명 트로트 가수를 현장에서 볼수 있다.개막식에는 주제공연과 하동세계차엑스포 기념 퍼포먼스, 정동원·김다현의 축하공연이 마련되며, 전통 음악과 전통차를 함께 즐기는 다악(茶樂)한마당, 청소년 K-POP 댄스 경연대회 등 많은 볼거리를 제공한다.또 이번 축제의 대표프로그램으로 5일 △다례 경연대회, 7일 △대한민국 찻자리 최고대회. 8일 △티 블렌딩 대회가 주행사장에서 열린다.이와 함께 세계 차문화 체험, 차음식·도구전시 및 체험, 제다 체험, 나만의 차 만들기 체험 등 20여가지의 체험부스가 축제기간 운영돼 축제장을 찾은 관광객들에게 체험 기회와 볼거리를 제공한다.강태진 축제조직위원장은 ""3년 만에 대면으로 개최되는 축제인 만큼 많은 볼거리를 제공하고, 축제를 통해 지역 농·특산물 판매증진과 차 농가 소득 증대의 기반을 구축할 것""이라고 말했다.한편, 이번 축제와 대한 자세한 내용은 제25회 하동야생차문화축제 홈페이지를 확인하면 된다."
