545890,[브리핑 진주] 10일 이상 집합금지 업종 100만원 지급 외,강경우 기자,2021.06.03 17:23:52,"■ 10일 이상 집합금지 업종 100만원 지급■ 하대동 남강둔치 야외무대·운동시설 준공■ 사회적 약자 권리·보호 앞장, 다 함께 잘사는 행복도시 추진■ 진양호 동물원 단봉낙타, 다람쥐원숭이, 보아 염소 새 식구 맞아■ 실내 공공체육시설 4일부터 개방 수용인원 50% 이내[프라임경제] 진주시가 지난 4월 발생한 코로나 집단감염사태로 장기간 집합금지 명령을 받고 어려움에 처한 소상공인에게 집합금지 10일 이상 업종은 100만원, 10일 미만은 50만원의 생활안정지원금을 지급한다.시는 지금까지 5차례, 1639억원 규모의 지역경제 긴급지원 대책을 통해 정부의 지원과는 차별화된 진주형 맞춤 경제지원대책을 추진해 왔다.진주시청. ⓒ 프라임경제지난 4월부터 10일 이상 집합금지 명령이 내려진 △유흥 5종 및 홀덤펍 385개소 △노래연습장 238개소 △실내체육시설 5종, 221개소 △라이브카페 22개소에는 업소당 100만원을 지원한다.10일 이하 집합금지 된 △실내체육시설 362개소에는 50만원을 지원하는 등 866개소에 10억5000만원의 긴급재정을 투입해 소상공인들이 어려움을 이겨낼 수 있도록 든든한 버팀목 역할이 기대된다.오는 7일부터 18일까지 온라인(문서24)또는 현장 접수를 업종별 소관부서를 통해 신청하면 된다.지원금 관련 문의는 업종별 담당 부서(유흥5종 및 라이브카페-위생과로, 노래연습장-문화예술과로, 실내체육시설-체육진흥과) 또는 일자리경제과 콜센터로 문의하면 된다.한편, 진주시가 1인당 10만원을 지급하는 '행복지원금'은 지난달 17일부터 6월6일까지 연장해 온라인 신청을 받고 있다. 현장 방문 신청은 6월7일부터 7월16일까지 신청하면 된다.■ 하대동 남강둔치 야외무대·운동시설 준공진주시는 3일 하대동 남강 둔치에서 야외무대와 운동시설 준공식을 가졌다.이날 준공식은 조규일 진주시장을 비롯한 지역 국회의원, 도·시의원, 문화체육 단체장, 지역주민 등이 참석한 가운데 간소하게 치러졌다.이번에 설치된 하대동 남강둔치 야외무대와 운동시설은 평거동·칠암동·신안동 등 진주 서부지역에 비해 상대적으로 부족한 문화·체육 시설을 동부지역에 설치해 지역 간 균형 있는 문화적 혜택을 제공하기 위해 지난해 약 20억원의 사업비를 투입했다.진주시가 하대동 남강둔치 야외무대 준공식을 개최하고 있다. ⓒ 진주시지난해 3월 조규일 시장의 특별지시로 사업을 착수해 사업비 확보와 부산지방국토관리청의 하천점용 허가를 받아 지난해 11월 착공했다.특히 조규일 시장은 지난해 6월 부산지방국토관리청을 방문해 구헌상 청장을 만나 하대동 둔치 야외무대 설치사업 등 현안사업을 직접 설명하고 부산 지방국토관리청의 적극적인 관심과 지원을 요청한 바 있다.하대동 남강둔치 야외무대는 남강변의 수려한 자연풍광에 어울리는 자유로운 곡선의 막 구조물, 따뜻한 감성의 소재로 만들어진 무대와 제방을 이용한 800석 규모의 계단식 관람석이 조성됐다.또 자연스러움이 묻어나는 굴곡진 9홀의 마운드형 파크골프장과 2500㎡의 탄성포장 인라인스케이트장을 갖추고 눈높이에서 강물을 느낄 수 있는 친수형 운동시설로 조성돼 지역주민들의 여가선용과 건강증진에 크게 기여할 것으로 기대된다.한편, 하대동, 초전동 등 동부지역 주민들은 서부지역에 비해 문화·체육시설이 부족하다며 지속적으로 문화·체육 시설 확충을 요구해 왔다.이에 시는 상평교와 금산교에 이르는 남강 둔치 구간에 내년까지 76억원을 투입해 자전거와 보행도로 개설·휴게쉼터·생태체험·문화시설 등의 친수형 문화·레저시설을 연차적으로 설치할 계획이다.또 상평동 학생실내체육관에서 하대동 상평배수장 구간까지 중앙 배수로를 '도동샛강'이라는 새로운 생활밀착형 친수 정원형 공간으로 조성하기 위해 지난해부터 올해까지 55억원을 투입해 동부지역의 새로운 랜드마크로 탈바꿈시킬 계획이다.조규일 시장은 준공식에서 ""우리나라 수도권과 지방의 문화 균형발전 뿐만 아니라 지역의 동·서부 문화균형 발전차원에서 하대동 야외무대와 운동시설 준공은 큰 의미를 갖는다""고 설명했다.그러면서 ""진주시가 이건희 미술관을 유치하는 것도 같은 맥락""이라며 ""문화 균형발전을 도모하는 도동 지역 주민들의 휴식과 힐링의 대표적인 공간이 될 것""이라고 기대했다.■ 사회적 약자 권리·보호 앞장, 다 함께 잘사는 행복도시 추진진주시가 노인·장애인·아동을 포함한 모든 시민이 행복한 복지도시를 만들기 위해 다양한 시책을 추진하고 있다.모든 아동의 권리 보장을 위해 유니세프아동친화도시 인증을 추진중이며, 장애인과 그 가족의 안정된 삶을 위한 장애인가족지원센터 운영과 사례관리사업을 시행하는 등 사회적 약자의 권리와 보호에 앞장 서고 있다.진주시가 유니세프 아동친화도시 조성 업무협약을 하고 있다. ⓒ 진주시진주시는 2021년 유니세프한국위원회가 인증하는 '유니세프아동친화도시' 지정 준비에 박차를 가하고 있다.유니세프아동친화도시는 유엔아동권리협약의 기본정신을 실천해 불평등과 차별을 없애고 모든 아동의 권리를 온전히 보장하는 지역사회를 말한다.올해 10월 인증을 목표로 상반기 중 아동친화도시 추진위원회, 아동권리옹호관 옴부즈퍼슨, 아동참여기구를 구성하고 아동친화도시 조성을 위한 4개년 계획을 수립해 아동 권리를 보장하는 다양한 시책을 시행하는 등 유니세프아동친화도시 조성을 위한 준비를 단계적으로 추진하고 있다.앞서 지난해 5월 아동친화도시 기본계획 수립을 시작으로 진주시 아동친화도시 조성을 위한 연구 용역을 실시해 진주시 아동친화도시 조성에 관한 조례를 제정했다.올해 1월에는 유니세프 아동친화도시 추진 지방정부협의회에 가입해 유니세프한국위원회와 업무협약을 추진하는 등 '아이 낳고 키우기 좋은 도시'에서 나아가 '아이가 행복한 아동친화도시'를 조성해 아동의 권리를 실질적으로 보장하기 위해 노력하고 있다.아울러 진주시는 지난해 6월부터 진주시장애인가족지원센터를 통해 위기 장애인 세대를 발굴·지원해 장애인과 그 가족의 삶의 질을 향상시키는 장애인 사례관리사업을 실시하고 있다.진주시장애인가족지원센터는 공개모집을 통해 선정된 (사)진주시느티나무장애인부모회에 위탁 운영하고 장애인과 장애인 가족의 권리보장, 사회참여 증진과 가족 전체의 삶의 질 향상 도모를 목적으로 사례관리사업, 가족역량강화사업, 지역사회 인식개선사업 등을 추진하고 있다.특히 코로나19로 모두가 어렵고 힘든 시기에 사회적·정서적 취약계층인 장애인들에게 전화, 인터넷, SNS를 통한 가족 상담을 1304건 실시하는 등 위기 장애인 95가구를 선정해 자택 방역과 방역물품 등을 지원했다.또한 독거 장애인 36가구를 대상으로 도시락배달과 찾아가는 이·미용서비스를 제공하는 등 맞춤형 서비스도 실시했다.진주시 관계자는 ""요즘 장애인을 위한 서비스 뿐만 아니라 장애인의 가족 전체를 위한 서비스의 비중이 점점 증가하고 있다""며 ""앞으로도 장애인가족지원센터를 통해 장애인과 그 가족에게 지속적인 맞춤형 서비스를 제공하고 삶의 질 향상과 안정적인 가정생활을 도모해 장애인에 대한 가족 친화적 환경조성에 힘쓰겠다""고 밝혔다.■ 진양호 동물원 단봉낙타, 다람쥐원숭이, 보아염소 새 식구 맞아진양호동물원에 최근 셔틀랜드 포니와 토끼·라쿤 등 새 생명이 잇따라 태어난 가운데, 서울대공원 서울동물원에서 온 새로운 동물 친구들이 비어있던 공간을 채우며 활기를 띠고 있다.진양호동물원 단봉낙타. ⓒ 진주시서울대공원과 진주시는 지난 2월부터 관련 협의를 진행하고 단봉낙타 1마리(수컷), 다람쥐원숭이 5마리(수컷), 보아염소 3마리(수컷 1, 암컷 2)를 무상 임대하기로 합의했다.단봉낙타는 등에 한 개의 혹이 나 있어 단봉이라 불리며, 다람쥐원숭이는 흰 얼굴에 주둥이만 마스크를 쓴 듯한 귀여운 모습에 머리가 몸에 비해 큰 편이다.보아 염소는 남아프리카 토착종과 유럽 앙고라종과의 교배 개량종으로 보통 흰색의 몸과 특유의 갈색머리에 강아지처럼 축 처진 긴 귀, 짧고 단단하며 머리 뒤쪽으로 휘어진 뿔을 가진 것이 특징이다.지난해 진양호 동물원은 동물원 환경 개선과 동물행동 풍부화를 위해 서울대공원 서울동물원과 KAZA(한국동물원수족관협회)의 자문을 받은 바 있으며, 이번 동물교환을 통해 상호교류를 이어 가고 있다.또 경상대학교 수의과대학과 업무협약을 체결하는 등 다양한 시도를 해왔으며, 새 식구 탄생과 도입에 따라 동물들의 스트레스를 최소화하기 위해 사육환경개선은 물론 동물복지 실현에 한 걸음 더 다가갈 수 있도록 노력하고 있다.진주시 관계자는 ""향후 진양호 르네상스 프로젝트와 연계해 생태 정원, 동물 환경 개선을 위한 이전과 특화단지 조성 등을 구상 중""이라며 ""단순한 전시 위주의 동물원이 아닌 종 보호와 보존의 역할 또한 수행할 수 있는 동물원이 되도록 노력하겠다""고 밝혔다.한편, 코로나19로 인해 임시휴장했던 진양호동물원은 지난 5월20일부터 재개장하여 관람객들을 다시 맞이하고 있다.■ 실내 공공체육시설 4일부터 개방 수용인원 50% 이내진주시가 코로나19 확산 방지를 위해 지난해 11월25일부터 6개월간 임시휴관 했던 실내 공공체육시설을 4일부터 수용인원의 50% 이내로 개방한다.진주생활체육관. ⓒ 진주시시는 지난 2월 실외 공공체육시설을 단계적으로 개방한 데 이어 문산실내체육관, 진주생활체육관, 진주탁구광장, 진주국민체육센터 등 4곳의 실내체육시설을 개방하고 현재 진주시 백신예방접종센터로 운영중인 진주실내체육관은 시민들의 안전한 백신예방접종을 위해 개방하지 않기로 결정했다.현재 시설점검과 대청소를 실시하고 있는 진주국민체육센터(실내수영장)와 시설보수 중인 진주생활체육관은 6월25일부터 정상운영에 들어간다.개방되는 실내 공공체육시설 4곳에는 관리자 1명 이상이 출입구에 배치돼 발열체크, 손소독제 비치, 출입자 명부 작성, 운동 시 마스크 착용, 거리두기 등 방역수칙을 철저히 확인 관리한다.진주시 관계자는 ""그동안 실내 공공체육시설 휴관으로 체육활동에 어려움을 겪은 시민들이 운동을 통해 건강한 삶을 누릴 수 있도록 단계적 개방과 함께 방역관리에 최선을 다할 것""이라고 밝혔다."
536414,"대전시립청소년합창단, 해설이 있는 찐 콘서트 기획연주회 개최",오영태 기자,2021.03.11 14:21:22,"[프라임경제] 대전시립청소년합창단은 올해 첫 번째 기획연주회 '해설이 있는 찐 콘서트'를 오는 20일 오후 5시 대전예술의전당 앙상블홀 무대에 올린다.대전시립청소년합창단 기획연주회 개최 포스터. ⓒ 대전시이번 연주는 프로그램 선정을 시작으로, 솔로·앙상블 구성과 순서까지 모두 단원들이 직접 참여해 구성했기에 곳곳에 애정이 담긴 의미 있는 공연이다.더불어 가곡, 아리아 그리고 영화음악까지 다양한 프로그램과 함께 성악계의 음유시인 바리톤 최현수, 대전시립청소년합창단 예술감독 겸 상임지휘자 천경필의 재미있고 전문적인 해설로 공연장을 찾은 관객들에게 공연의 이해와 높은 만족도를 선사하는 찐한 연주가 될 것이다. 이번 무대는 우리에게 익숙한 가곡부터 아리아까지 펼쳐진다.첫 번째 무대는 경쟁을 통해 뽑힌 단원들의 기량을 들려주는 독창으로 사랑하는 사람과의 떨리는 첫 입맞춤의 순간을 노래한 이태리 가곡 '입맞춤', 드라마 '스카이캐슬'에 삽입돼 화제가 된 슈베르트의 '마왕', 아름다운 가사와 선율을 느낄 수 있는 '사랑하는 이를 멀리 떠나' 그리고 봄의 따뜻하고 화사함을 느낄 수 있는 '꽃피는 날'로  포문을 연다.이어 단원들이 들려주고 싶은 다양한 앙상블로 가곡, 모차르트 앙상블까지 싱그러운 봄을 채워 줄 수 있는 무대를 준비했다.또한, 끊임없는 열정을 보여주는 지휘자 천경필, 세계적인 천재 성악가바리톤 최현수가 음악회의 품격을 높일 것으로 기대된다.또한 동양인 최초 차이콥스키 콩쿠르 1등, 이탈리아 베르디 콩쿠르 대상, 파바로티 콩쿠르 우승 등으로 세계 음악인을 놀라게 했던 정상 '바리톤의 시인' 최현수가 특별 출연해 연주회를 더욱 빛내줄 예정이다.천경필 대전시립청소년합창단 지휘자는 ""입학과 개학이 있어 설렘을 느낄 수 있는 3월, 따뜻한 봄날의 감성을 채워줄 프로그램으로 그동안 코로나19로 인해 답답하고 우울했던 마음을 대전시립청소년합창단 연주를 통해 위로받았으면 좋겠다""라고 말했다.대전시립청소년합창단 홈페이지, 대전예술의전당, 인터파크 홈페이지에서 예약 가능하며, 또한 전화예매는 아르스노바와 인터파크 에서 할 수 있다. 기타 공연문의는 대전시립청소년합창단으로 하면 된다."
601536,"신병주 교수 초청 '대왕 세종에서 배우는 공존, 공생' 아카데미 특강 개최",오영태 기자,2023.05.16 17:49:03,"[프라임경제] 충남 아산시(시장 박경귀)는 오는 23일 오후 7시 아산시평생학습관 아산아트홀(구 공연장)에서 역사학자 신병주 교수의 '대왕 세종에서 배우는 공존, 공생' 주제의 행복아산 시민 아카데미 특강을 개최한다.신병주 교수 초청 행복아산 시민 아카데미 홍보물. ⓒ 아산시현재 건국대학교 교수이자 외교통상부 외규장각 도서 자문포럼 위원으로 활동 중인 신병주 교수는 KBS '역사저널 그날', '역사추리', '차이나는 클라스' 등 다수의 방송에 출연했으며, 저서로는 '조선 후기를 움직인 사건들', '왕비로 산다는 것', '우리 역사 속 전염병' 등이 있다.신병주 교수는 다양한 활동과 우수한 강의로 우리 역사를 쉽고 재미있게 풀어내고 있는 것으로 유명하며, 이번 강연에서는 조선시대 왕의 삶을 현대적 관점에서 재조명하고 우리 시대에 주는 교훈을 고민해 보며, 역사를 통해 현대를 살아가는 지혜와 통찰력을 찾는 시간이 이어질 예정이다.또한, 본 강연에 앞서 시민 강사 박종철의 '마음 근육, 행복한 삶'이라는 '시민강연 36.5℃'가 15분간 진행되며, 아산시민 누구나 당일 참석해 강연을 들을 수 있으며, YouTube(아산시)로도 실시간 송출된다.오효근 평생학습과장은 ""이번 강연은 세종대왕의 소통과 포용의 지도력을 통해 우리가 본받아야 할 가치를 재조명하는 시간이 될 것""이라고 말했다."
547313,의령군 '이건희 미술관' 유치추진위 출범식 개최,강경우 기자,2021.06.23 15:27:21,"의령군이 이건희 미술관 유치추진위 출범식을 개최하고 있다. ⓒ 프라임경제[프라임경제] 경남 의령군은 23일 '이건희 미술관' 유치를 위한 추진위원회 출범식을 갖고 문화분권, 국가 균형발전 등 건립 최적지인 의령 유치를 촉구했다.이날 출범식에는 관내 기관·단체장, 도·군의원, 향우·예술전문가 등 유치위원 대다수가 참석한 가운데 위촉장 수여, 경과보고, 결의문 낭독 순으로 진행됐다.유치 추진위원회(공동위원장 오태완·문봉도·정판덕)는 '이건희 미술관' 의령 유치의 당위성과 지금까지 유치를 위해 노력한 사항을 공유하며, 앞으로 미술관 유치에 적극 노력할 것을 다짐했다.특히 결의문 낭독을 통해 ""이건희 미술관 수도권 건립은 문화 불균형을 심화시키고, 수도권만이 문화를 독점하게 만드는 잘못된 정책""이라며 ""故 이건희 회장이 미술품을 기증한 큰 뜻을 받들기 위해서는 유치 당위성과 문화분권, 국가 균형발전, 삼성과 유가족의 응원 등 모든 유치조건을 갖춘 의령이 미술관 건립의 최적지""라고 주장했다.출범식 마지막 기념촬영에서는 △이건희 미술관 고향 의령으로 △미술관 의령건립은 이건희 회장의 큰 뜻이다 △균형발전 미술관 의령건립으로 응답하라 등의 손 피켓으로 미술관 의령 유치를 촉구했다.오태완 의령군수가 이건희 미술관 의령유치 당위성을 설명하고 있다. ⓒ 프라임경제유치 추진위원회 공동위원장인 오태완 의령군수는 ""미술관 의령 유치는 의령과 삼성, 이건희 회장과의 특별한 인연 뿐만 아니라 문화분권, 지역 균형발전이라는 가치를 실현하기 위한 첫걸음""이라고 강조했다.그러면서 ""매년 10월 개최될 호암문화예술제와 삼성의 성장과정, 사업보국, 기업가 정신, 사회공헌 등을 전시하는 삼성특별관과 연계한 명품문화 관광도시를 만들기 위해 이건희 미술관 의령 유치를 꼭 성사시키겠다""고 다짐했다.한편, 이건희 미술관 유치 추진위원회는 오태완 의령군수, 문봉도 군의회 의장, 정판덕 전국향우연합회장 3인의 공동위원장 체제로 운영된다.군은 앞으로 미술관 유치 대응방안과 전략수립 자문, 인적네트워크 구축 및 대정부 설득, 의령 건립의 당위성 발굴, 홍보, 유치서명, 결의대회 등 미술관 유치 분위기 확산에 주력할 계획이다."
580770,[해양머드 보령] '2022 보령 영보정 음악회' 충청수영성 특설무대에서 개최,오영태 기자,2022.09.28 10:40:30,"[프라임경제] 충남 보령시가 오는 30일 오후 7시 오천면 충청수영성 영보정 특설무대에서 '2022 보령 영보정 음악회'를 개최한다고 밝혔다.2022 보령 영정보 음악회 포스터. ⓒ 보령시한국예술문화단체총연합회 보령지회(지회장 한기정)가 주관하는 이번 행사는 코로나19로 어려움을 겪은 시민들을 위로하고 평소 문화예술 기반 불균형으로 인해 문화 향유 기회가 부족했던 시민들에게 고품격 음악회를 제공하기 위해 마련됐다.이날 음악회는 피아니스트 임동창과 타타랑, 가수 알리, 대금연주가 이생강, 보령시립합창단, 보령국악협회 등이 출연한다.특히 이날 공연에서는 임동창 피아니스트가 보령시를 위해서 만든 2곡의 아리랑 가운데 보령의 전래 설화를 스토리로 구성한 '영보정 아리랑'을 처음으로 선보일 예정이다.김성환 문화새마을과장은 ""천하절경 영보정에서 시민들의 눈과 귀를 즐겁게 할 수 있는 공연을 마련했다""라며 ""시민들의 많은 관심과 참여를 바라며 앞으로 크고 작은 문화행사를 개최해 나가도록 하겠다""고 말했다."
539145,경주보문관광단지 활성화 사업 추진 '순항',권영대 기자,2021.04.02 09:37:54,"경주 보문관광단지 전경. ⓒ 경북문화관광공사[프라임경제] 경주 보문관광단지 활성화를 위한 후속사업이 속도를 내고 있다.경북문화관광공사는 지난해 경주시와 공동으로 진행한 보문관광단지 활성화 용역의 후속 사업으로 진행한 '보문관광단지 조성계획 변경 용역'을 통해 민간투자 활성화를 위한 기틀을 마련했다고 밝혔다.관광단지 내 6개 시설지구 중 운동·오락시설지구와 휴양·문화시설지구간 벽을 허물어 그동안 복합시설 투자에 있어 많은 제약을 받았던 사업자들의 대규모 투자를 이끌어 낼 것으로 보인다.이에 시설지구 통합은 관광진흥법 개정과 연계하해 공사에서는 보문관광단지가 전국 45개 관광단지 최초로 통합된 관광휴양·오락시설지구 내 운동·오락시설지구와 휴양·문화시설지구 구분을 두지 않아 자유로운 복합시설 설치가 가능해졌다.이를 통해 사업비 500억원 규모의 가족형 체험놀이 시설인 루지월드 조성사업을 비롯한 기타 민간 리모델링 사업이 탄력을 받을 예정이다.또 '밤이 있는 보문관광단지'를 위한 사업들도 착착 진행되고 있다.특히 라한호텔에서 호반광장 구간에 비해 야간조명이 부족했던 명활산성 방면의 보문 호반길 내 야간경관 조명 보강 및 빛을 활용한 조형물을 설치할 국비사업이 진행되고 있다.또한 보문 물너울교에 대형 미디어 파사드를 설치하여 지역 정체성을 담은 미디어 영상을 송출해 경상북도를 홍보하며, 보문관광단지 내 야간 볼거리를 강화하여 관광객 유치에 힘 쏟을 예정이다.가족 관광지로 유명한 약 14만평의 제주조각공원과 조각품 장기임대 업무협약을 체결해 제주조각공원에서만 볼 수 있던 유명 조각품을 이제 올 봄이면 보문 호반길 곳곳에서 만나 볼 수 있다. 이를 통해 예술이 깃든 보문관광단지로서 품격이 한껏 높아질 것으로 보인다.또한 재작년 보문상가를 매입한 모다아울렛은 야외공연장 보문탑을 비롯한 기존 보문상가의 한옥 형태를 유지하면서 입점시설에 따른 리모델링만을 통해 젊은이들이 많이 찾을 수 있는 식음료(F&B/Food&Beverage) 중심의 특화된 공간으로 탈바꿈할 예정이다.한편 민간사업자를 공모하고 있는 보문관광단지 상징형 짚라인 조성사업이 연말 마무리되면 경주의 새로운 랜드마크 타워와 체험시설을 경험할 수 있다.경북문화관광공사 사장은 이를 통해 먹거리와 볼거리, 놀거리가 확실한 보문관광단지로 탈바꿈해 포스트 코로나 시대에 다른 지역보다 관광경쟁력 우위 및 폭발적인 관광수요를 선점해 지역경제 활성화와 일자리 창출에 최선을 다하겠다""고 말했다."
582395,"김경엽 작가 첫 소설, '쇠꼬챙이를 든 도둑' 출판 기념회 개최",최성필 기자,2022.10.18 10:14:18,"지난 14일 김경엽 작가가 첫 출판기념회에서 토크 콘서트를 열고 있다. =최성필 기자[프라임경제] 김경엽 작가의 첫소설 '쇠꼬챙이를 든 도둑' 출판 기념회가 지난 14일 포항 송도여행시작 카페에서 개최됐다.이 자리에는 김순견 전 경북도 경제부지사를 비롯해 박이득 전 예총회장, 김상일 전 대경대 교수, 김일광 작가 등과 평소 김작가를 사랑하는 팬들이 찾아 자리를 빛냈다.이번 소설은 김 작가가 30여년간 기자생활을 하며 경험한 것들을 단편소설로 각색한 작품으로, 대부분의 이아기가 포항과 경주를 중심으로 전개된다는 특징을 갖고 있다. 또한, 10여년 간 혈액투석을 받으며 느낀 고뇌들을 고스란히 책 속에 담아냈다.김경엽 작가는 출판 기념회에서 ""아직 많이 부족한 작품에 많은 관심을 기울여주고 읽어 주신 독자분들께 감사드린다""며 ""몇 편의 소설과 수필집을 구상하고 있는 만큼 독자들이 실망하지 않도록 더 발전하는 모습을 보여드리겠다""고 말했다."
