405648,"키움증권, KOSPI200·삼성전자 기초자산 ELS 출시",백유진 기자,2018.02.07 11:29:29,"ⓒ 키움증권[프라임경제] 키움증권은 KOSPI200지수와 삼성전자 보통주를 기초자산으로 하는 세전 수익률 연 7%의 주가연계증권(ELS)을 출시한다고 7일 알렸다.키움 제757회 ELS는 만기 3년 상품으로 6개월 주기의 조기상환평가일에 두 기초자산의 평가가격이 모두 기준가격의 90%(6개월·12개월), 85%(18개월·24개월), 80%(30개월) 이상이면 자동 조기상환되고 세전 연 7%의 수익을 지급한다.만기 시 두 기초자산의 평가가격이 모두 기준가격의 80% 이상이면 세전 21%, 연 7%의 수익을 얻게 된다. 다만 투자기간 동안 기초자산 중 하나가 최초기준가격의 60% 미만으로 떨어진 적이 있다면 원금손실이 발생할 수 있다.청약 마감은 오는 9일 오후 1시다. 자세한 내용은 키움증권 자산관리 홈페이지나 키움금융센터로 문의 가능하다."
318577,삼성카드 셀렉트 32 '차이콥스키의 Winter Dream' 1+1 혜택,이지숙 기자,2015.10.15 18:16:25,"[프라임경제] 삼성카드는 셀렉트의 서른두 번째 공연으로 클래식 콘서트인 '차이콥스키의 Winter Dream' 을 선보인다고 15일 밝혔다.이번 '차이콥스키의 Winter Dream'은 겨울을 맞아 세계적 거장 요엘 레비가 지휘하는 KBS교향악단과 피아니스트 손열음의 협연으로 차이콥스키의 발레모음곡과 교향곡 제4번, 피아노 협주곡 제1번을 연주한다.삼성카드 셀렉트는 공연 예매 때 동반자 티켓을 무료로 제공하는 1+1 혜택을 시행한다. © 삼성카드이번 콘서트는 차이콥스키 콩쿠르에서 입상한 천재 피아니스트 손열음의 정통한 연주와 관객들에게 친숙한 차이콥스키의 대표곡들을 통해 더 쉽고 편하게 클래식을 즐길 수 있는 기회를 제공할 것으로 기대된다.삼성카드는 특별한 공연을 소중한 사람과 함께할 수 있도록 삼성카드로 공연 예매 때 동반자 티켓을 무료로 제공하는 1+1 혜택을 시행한다.또한 클래식의 이해를 돕는 프로그램북 제공은 물론 연주 시작 전 간략한 해설을 통해 공연의 감동을 업그레이드할 수 있도록 준비했다.공연은 오는 12월3일 오후 8시 예술의전당 콘서트홀에서 진행되며, 예매는 15일부터 인터파크 티켓과 예술의 전당 홈페이지를 통해 1인당 2매까지 구매가 가능하다.삼성카드 관계자는 ""소중한 사람과 특별한 추억을 만들 수 있도록 명품 클래식 콘서트를 준비했다""며 ""클래식을 선호하는 고객들이 삼성카드의 즐거운 실용을 경험할 수 있는 기회가 될 것""이라고 말했다."
399724,"현대차투자증권, 연 5.0% 수익 ELS 1종 공모",백유진 기자,2017.12.20 10:08:11,[프라임경제] 현대차투자증권(사장 이용배)은 오는 22일 오후 1시까지 총 527억5000만원 규모의 원금비보장형 ELS 상품 1종을 공모한다고 20일 알렸다.ⓒ 현대차투자증권'현대차투자증권 ELS 1767호'는 △홍콩항셍 중국기업지수(HSCEI) △유로스탁스50지수(EuroStoxx50) △니케이225지수(Nikkei225)를 기초자산으로 하는 3년 만기원금 비보장형 상품이다.발행 후 6개월 마다 조기 상환기회가 주어지며 최고 연 5.0%의 수익을 지급한다.이번 공모상품은 금융투자상품 분류 중 고위험에 속하며 최소가입금액은 100만원이다. 현대차투자증권 각 지점과 홈페이지에서 가입 가능하다. 문의사항은 현대차투자증권 스마트금융센터를 통해 할 수 있다.
591250,"[백세금융] 올해 재테크, AI와 함께 투자 편의성·효율성↑",박기훈 기자,2023.01.25 11:46:35,"AI 기술의 발달로 인해 어렵고 복잡하게만 느껴졌던 재테크 진입 장벽도 낮아지고 있는 상황이다 = 박기훈 기자[프라임경제] 글로벌 경제위기 속에 재테크는 필수인 시대가 됐습니다. 특히 새해를 맞으면서 '재테크의 달인이 되겠다'는 목표를 세운 분들이 많으신데요. 최근엔 AI(인공지능) 기술의 발달로 인해 어렵고 복잡하게만 느껴졌던 재테크 진입 장벽도 낮아지고 있는 상황입니다.디셈버앤컴퍼니자산운용이 운영하는 AI 일임 투자 서비스 핀트(fint)의 경우, AI가 고객의 투자 성향에 따라 맞춤형 글로벌 ETF 포트폴리오를 구성해주는 것은 물론, 세계 시장 상황을 분석해 종목 매매부터 리밸런싱까지 자동으로 운용해주는 것으로 잘 알려져있는데요.핀트의 장점은 언제 어디서든 모바일 앱을 통해 누구나 최소 20만원이라는 소액으로도 투자 일임 서비스를 경험해 볼 수 있다는 것입니다. 또한 AI 엔진인 '아이작'이 알아서 투자를 수행해주기 때문에 투자를 위해 별도의 시간을 할애하거나 사전 지식이 없어도 최적의 맞춤형 재테크 서비스를 누릴 수 있도록 도와줍니다.목돈 투자가 부담스러운 대학생이나 사회 초년생들을 위해 매일·매주·매월 원하는 주기를 설정해 소액부터 꾸준히 차곡차곡 쌓아가거나, 뚜렷한 목표 금액을 정하면 자동으로 투자금을 계산해 AI가 알아서 운용해주는 목표달성 방식의 적립식 투자 서비스도 제공중이죠.또한 핀트 앱에서는 AI가 고객 맞춤형으로 운용해주는 연금저축 서비스도 경험해 볼 수 있는데요. 디셈버앤컴퍼니가 KB증권과 제휴를 맺고 2021년분터 선보인 연금저축 서비스는 가입자 본인의 자산 상황에 따라 자유롭게 연금저축 납입이 가능하고, 납입된 연금저축액은 '아이작'이 고객의 투자 성향에 따라 전세계 ETF 상품에 분산투자하며 알아서 리밸런싱하고 운용해주죠.가입고객은 언제 어디서든 자신의 연금저축이 어떻게 운용되는지 핀트 앱을 통해 손쉽게 확인 가능하고, 투자 수익 역시 실시간으로 볼 수 있습니다. 납입된 연금저축액은 모두 KB증권에 연금저축계좌에 안전하게 보관되고요.AI 일임 투자 서비스 핀트는 AI가 고객의 투자 성향에 따라 맞춤형 글로벌 ETF 포트폴리오를 구성해준다 ⓒ 디셈버앤컴퍼니자산운용상업용 부동산 투자를 계획 중인 기업·개인 투자자들을 위해 AI가 예상 거래가를 분석해 알려주는 서비스도 있습니다. 빅데이터 및 AI 기반 상업용 부동산 전문기업인 부동산플래닛은 사옥·오피스 이전이나 투자를 고려하고 있는 기업 및 개인투자자들을 위한 'AI 추정가' 서비스를 제공 중에 있습니다.'AI 추정가'는 부동산플래닛이 자체 개발한 AI 기반 알고리즘 및 예측 모델을 토대로 만든 자동분석 시스템인데요. 과거에 거래했던 실거래가 이력이나 주변 건물의 시세 데이터를 AI 분석을 기반으로 추산해 알려주는 것이 특징입니다.추정가는 토지와 건물 가격을 각각 예측해 합산하며 △건물 가격이 포함되지 않은 추정 토지가격 △토지가격이 포함되지 않은 추정 건물가격까지 확인 가능한데요. 상업용 부동산 관련 투자를 고민하고 정보를 얻는데 어려움을 겪고 있는 기업이나 개인투자자 누구나 부동산플래닛 앱과 홈페이지를 통해 해당 서비스를 이용할 수 있습니다.부동산플래닛은 'AI 추정가' 외에도 다양한 상업용 부동산 정보를 제공하고 있는데요. 공공데이터는 물론 자체적으로 보유한 빅데이터, 딥데이터를 기반으로 전국의 건물, 토지 등에 걸쳐 약 3000만건의 실거래가를 모바일 및 공식 사이트를 통해 제공하며, 3940만건의 토지대장 및 791만동의 상세 건축물 정보를 다루고 있습니다.'AI 추정가' 이미지컷 ⓒ 부동산플래닛'AI 추정가'는 실거래가 조회, 노후도 지도 확인 등 기타 다양한 기능과 더불어 무료로 이용 가능합니다. 프리미엄 멤버십 서비스 '탐색 플러스'를 활용하면 △재개발 재건축 충족 요건 분석이 가능한 '영역 그리기' △보다 정교해진 '건물 탐색' 기능 △개별공시지가 지도 확인 등의 서비스도 이용해 볼 수 있습니다.투자에 관심은 있지만 정보를 찾기 어렵고 종목 분석이 힘든 투자자들을 위해 제공되는 AI 기술 기반 리서치 보고서 서비스도 눈 여겨 볼 만 합니다. 한국투자증권은 지난 2020년부터 자체 계량 분석 기술과 AI 뉴스 엔진을 활용한 AI 리서치 보고서 '에어(AIR: AI Research)'를 발간하고 있는데요.'에어'는 매일 아침 쏟아지는 3만여건의 뉴스 콘텐츠를 분석하고 투자자가 주목할 만한 경제 뉴스와 기업 정보를 정리해 데일리 리포트 형태로 제공해 주는 것이 특징입니다.실제 미국 주식을 분석하는 '에어US'는 948개 종목을 대상으로 한 보고서를 내고 있으며, 한국투자증권은 이를 바탕으로 해외 주식 커버리지를 확대하는 것은 물론, 기존 리서치 보고서 콘텐츠를 고도화는 데 집중하고 있습니다.한국투자증권은 이례적으로 비상장 기업을 분석하는 보고서도 발간 중인데요. 비상장 기업 투자에 관심 있는 개인투자자들의 정보 접근성을 높이고 올바른 투자를 돕기 위한 목적으로 리포트를 제공하고 있습니다.2021년 11월 당근마켓을 분석한 보고서를 내며 시장의 관심을 끈 한국투자증권은 지난해 2월부터는 'V시리즈'라고 이름 붙인 정기 보고서를 통해 △두나무 △직방 △케이뱅크 △카사 등 유망한 비상장 기업을 분석한 바 있습니다.지난해 12월에는 국내 최초로 가상 인간을 활용한 리서치 보고서 콘텐츠 '쇼미더 리포트'를 선보이기도 했는데요. 가상 인간 한지아가 시의성 있는 리서치 보고서를 선별해 3~4분 길이로 짧게 요약해 영상으로 설명해 주는 방식으로, 모바일에 최적화된 숏폼 콘텐츠 형태로 만들어 투자자들이 접근하기 쉽고 언제 어디서든 시장 전망을 볼 수 있도록 하고 있습니다.지금까지 개인과 법인 투자자들의 손발이 되어주며 편의성과 효율성을 높여주는 AI 기반 재테크 서비스를 몇 가지 알아봤는데요. 더욱 다양화되고 발전해가는 AI기반 재테크 플랫폼과 함께 올해는 목표한 바를 꼭 이루는 한 해가 되셨으면 좋겠습니다."
500966,[백세금융] 계속되는 위기 속 한국 증시 생존법,설소영 기자,2020.04.13 14:22:18,"기사와 관련 없는 사진. ⓒ 픽사베이[프라임경제] 과연 워런 버핏이 한국에 태어났다면 지금과 같은 세계 최고 투자가가 될 수 있었을까요? 물론 많은 돈을 벌었을 수도 있지만, 오늘날 그가 일군 부(富) 규모에는 미치지 못했을 것입니다.사실 한국 증시 상황은 미국과 많은 차이가 있습니다.축구 경기에 있어 장소는 물론, 날씨나 선수들 컨디션 등 다양한 조건들이 갖춰져야 이길 수 있을 듯 증권 시장 역시 다양한 상황이나 변수들을 고려해야 하죠. 제아무리 버핏이라도 한국에서의 성공을 위해선 국내 상황을 정확히 알고 있어야 합니다.한국은 수출을 통해 먹고 사는 나라인데요. 특히 경제성장에서 수출이 차지하는 기여도가 2000년대 들어 더욱 심화되고 있습니다. 실제 1990년대 당시 40%에 그쳤던 수출 GDP 기여율은 2000년대 70%대로 크게 상승했죠.다만 수출은 상대 측 주머니 사정에 따라 희비가 엇갈리기 쉽습니다. 상대 측이 물건을 사주지 않으면 수출을 하고 싶어도 할 수가 없기 때문이죠. 이 때문에 미국이나 중국 등 주요 수출국 상황이 좋지 않다면 국내 상황도 함께 힘들어집니다.더욱 중요한 점은 국내 증시가 외환과 그물처럼 단단히 엮여 있다는 점이죠.국내 증권시장은 외국인 주식 보유 비중(시가총액 기준)이 40%에 육박할 만큼 외국인 투자자 비중이 높습니다. 외국인들이 자유롭게 유가증권을 사고, 팔 수 있는 소규모 개방 경제 시스템을 갖고 있기 때문입니다.이로 인해 외환시장과 환율이 외국인들 움직임에 따라 민감하게 반응할 수밖에 없는 구조인 셈이죠.이런 구조가 나쁘다곤 할 수 없지만, 금융위기와 같은 상황시 엄청난 피해를 피할 수 없다는 단점을 가지고 있습니다.실제 2008년 글로벌 금융위기 당시 미국 경제가 어려워지자 펀드 가입자들은 유동성 확보 차원에서 갑작스런 '환매 돌풍'이 발생했습니다. 당연히 환매를 위해선 주식을 팔아야 했죠.이때 '매도 1순위'가 바로 우리나라 주식시장이었죠. 삼성전자나 현대차처럼 유동성이 풍부한 글로벌 기업들을 갖고 있는 나라가 아시아태평양 지역에는 많지 않기 때문입니다.물론 조금씩 주식을 팔면 아무런 영향이 없었겠지만, 문제는 단시간 내 많은 물량이 매도됐다는 점입니다.외국인 투자가들이 주식 매도 자금(원화)을 일시에 달러로 바꿀 경우 원화 공급량은 늘어나는 반면, 달러 수요 증가로 결국 환율이 갑작스레 급증하기 됩니다.실제 2008년 금융위기를 비롯해 △1997년 외환위기 △코로나19 사태로 미국 증시 폭락 등 주요 고비 때마다 주가 하락 및 환율 급등 현상이 매번 나타났죠.이런 우리나라와는 달리 미국·일본·독일 등은 사정이 다릅니다. 환율이 출렁거릴 때도 있지만, 변동폭이 가파를 경우는 상대적으로 적은 편이죠. 이는 이들 국가 통화가 '기축통화'이자 '안전자산'으로 분류되기 때문이죠.특히 미국이 발행하는 달러는 일명 '세계 대표 통화'입니다. 미국 내 위기가 발생하더라도 다른 통화와 비교해 상대적으로 '안전자산'인 달러 가치는 오르는 만큼 추가 발행만으로도 어느 정도 경제 위기는 넘길 수 있는 셈이죠.'한국 주식시장'이라는 경기장에서는 반드시 몇 가지를 명심해야 합니다.우선 '작고 개방된 체제'는 외부 충격시 충격을 버티는 것 외에 달리 방법이 없다는 것을 주지할 필요가 있습니다. 우리가 아무리 잘해도 미국이나 중국이 잘못되면 그 여파를 뒤집어써야 하는 상황인거죠.'주가 폭락과 환율 폭등이 동시에 닥칠 수 있다'는 비관적인 시나리오에도 대비해야 합니다.만일 달러 자산을 확보했다면 자연스레 국내 증시 하락으로 인한 손실을 환율 변동으로 상쇄할 수 있습니다. 해외 주식이든 채권이든 달러 베이스 자산을 가지고 있는 것만으로도 분산투자 효과를 얻을 수 있죠.또 다른 대비책으로는 외국인들에 비해 국내 투자자들이 국내 주식을 많이 보유하는 것이죠. 최근 퍼지고 있는 '동학개미운동'처럼 말이죠. 이는 외국인들에 대항해 국내 주식을 우리가 사들이자는 현상을 역사적 사실에 비유해 만든 신조어입니다.국내 투자자들이 국내 주식을 보다 많이 가질수록 주식 및 외환 시장은 안전해집니다. 외국인들이 매도하더라도 국내 투자자들이 보유한 주식만으로도 버티면 되기 때문입니다.정부도 보다 많은 국민들이 국내 주식을 가질 수 있도록 세제 혜택과 같은 전략적 인센티브를 제공하는 것은 어떨까요?"
331979,"PHC업계 선도 동양파일, 호전망 탄력받아 코스닥 도전",이지숙 기자,2016.03.22 13:55:24,"[프라임경제] 김시년 동양파일 대표는 22일 기자간담회를 통해 ""이번 코스닥시장 상장은 동양파일이 국내 PHC(고강도 콘크리트) 파일 선도기업으로 지위를 확고히 하는 계기가 될 것""이라며 ""2020년 매출 2000억원 달성, 파일업계 1위 도약을 목표로 성장하겠다""고 말했다.동양파일은 22일 서울 여의도에서 기자간담회를 열어 코스닥시장 상장에 따른 향후 사업 계획과 포부를 밝혔다.동양파일은 지난 1992년 설립된 PHC 파일 생산 전문기업으로 끊임없는 연구 개발과 설비 개선 및 철저한 관리를 통해 고강도, 초고강도, 대구경, 선단확장형, 스마트 파일 제품을 생산하고 있다.PHC 파일은 건축물, 구조물 등의 상부 하중을 지반 내 암반에 전달해 기초의 안정성을 확보하는데 필요한 핵심 자재로 아파트, 초고층 건축물, 플랜트 설비 등 다양한 기초 공사에 사용된다.김시년 동양파일 대표. ⓒ 동양파일지난 2013년 13.2%, 2014년과 2015년 각각 13.1%의 PHC 파일시장점유율로 업계 2위를 차지하는 등 업계 내에서 선도적 지위를 갖고 있다. 2014년 한림건설 자회사로 편입됐으며 2015년 매출액은 1156억원, 영업이익은 348억9700만원, 당기순이익 247억6400만원을 기록했다.PHC 파일시장 전망도 밝다. 한국원심력콘크리트 협동조합 자료에 따르면 지난 2010년 412만톤 규모였던 PHC 파일 시장은 2015년 650만톤까지 커졌고 올해는 680만톤에 도달할 것으로 전망된다.최근에는 대구경, 초고강도, 선단확장형 파일 등 고수익성 제품 판매가 증가하는 추세를 보이고 있다. 동양파일도 이에 맞춰 고수익 제품 비중을 늘리는 중이다.김 대표는 ""지난 2012년 아산공장의 대구경 파일 생산을 상용화시켰고 함안공장도 대구경 파일에 대한 KS마크를 취득하며 양산체재를 구축했다""고 말했다.이어 ""2013년부터는 모든 공장에서 초고강도 파일 생산도 상용화하기 시작해 2015년 동양파일의 고수익성 제품 비중은 전체 38%까지 늘어났다""고 설명했다.호남지역 파일 수요를 선점해 향후 대규모 국가 사업 추진에 따른 수혜도 예상되고 있다.동양파일은 충남 아산의 본사 공장을 비롯해 전북 익산과 경남 함안에 파일공장을 설립해 전국의 콘크리트 파일 수요에 유기적으로 대응할 수 있는 체계를 만들었다. 주요 경쟁사가 진입하지 않은 호남지역의 파일 수요를 익산과 함안 공장을 활용해 선점함으로써 경쟁력에서도 우위를 확보했다.그는 ""새만금지구개발사업은 지반 강화를 위한 대규모 기초 공사가 필수적이기 때문에 많은 파일 수요가 발생할 것으로 예상되며 이에 대처하기 위해 동양파일은 익산공장을 거점으로 아산과 함안공장의 파일 공급력을 모두 집중시킬 계획""이라고 부연했다.향후 동양파일은 PHC 파일 수요 선점을 위한 설계영업팀 운용 및 생산 능력 증대를 통해 시장점유율을 확대하고 신규 건자재 시장 진출을 통해 건자재 주력 기업의 포지션을 확보할 계획이다.동양파일의 총 공모 주식수는 800만주로 주당 공모 희망 밴드가는 1만~1만1600원이다. 이번 공모를 통해 800억에서 928억원 사이의 자금을 조달할 예정이다.오는 23~24일 양일간 수요예측을 실시하고 28~29일 이틀 동안 청약을 진행할 계획이다. 상장 예정일은 4월6일이며 주관사는 대신증권이다."
568665,[백세금융] '종합소득세' 신고의 달…5월31일까지,황현욱 기자,2022.05.24 17:57:10,"[프라임경제] 최근 코로나 팬데믹으로 재택근무가 늘어나면서 부업을 겸하게 된 분들이 많아졌습니다. 이처럼 직장에 다니면서 부가적인 소득을 벌기위해 소위 '투잡', '쓰리잡'을 겸하는 분들도 심심찮게 볼 수 있는데요. 이러한 분들은 이번 달 중요한 연례행사인 종합소득세 신고가 있음을 유념해야겠습니다.종합소득세는 △근로 △사업 △연금 △이자 △배당 △기타소득에 대한 세금입니다. 정기적인 근로소득이 있는 근로소득자가 연말정산을 한다면, 프리랜서이거나 사업소득 또는 기타소득이 있는 근로자는 종합소득세 신고를 하는 것이죠.종합소득세 신고 대상자는 △사업소득이 있는 경우 △두 군데 이상에서 근로소득이 발생했지만, 합산해서 연말정산을 하지 않은 경우 △금융소득(이자‧배당) 합계액이 2000만원을 넘는 경우 △사적연금 연간 합계액이 1200만원을 초과하는 경우 △기타소득금액 합계액이 300만원을 초과하는 경우 △사업소득과 근로소득이 함께 있는 경우 등으로 이 중 해당되는 부분이 있다면 오는 31일까지 종합소득세를 신고‧납부해야 합니다.지난해 종합소득이 있는 납세자는 이달 31일까지 종합소득세를 신고‧납부해야 합니다. ⓒ 연합뉴스소득의 종류는 △근로소득 △사업소득 △기타소득 크게 3가지로 나뉩니다. 위 세 가지를 나누는 기준은 출퇴근시간의 유무와 주업인지 아닌지로 구분됩니다.근로소득에는 흔히 월급이 있으며, 근로소득의 경우 매년 연말정산 대상이 되죠.사업소득은 정기적으로 발생하는 △원고료 △강의료 △출연료 △배달대행료입니다. 보통 우리가 생각하는 프리랜서는 사업소득에 속하며, 코로나 시대 인기였던 배달 아르바이트는 사업소득으로 분류된다는 것을 알아야 할 것입니다. 사업소득은 매년 5월 종합소득세 신고 대상입니다.또 사업소득은 총 수입금액에 따라 △단순경비율 △기준경비율이 구분되죠. 예를 들어 지난해 사업소득이 2400만원 미만일 경우에는 단순경비율이 적용돼, 국세청 홈택스 안내대로 간단하게 신고가 가능합니다. 하지만 2400만원 이상에서 7500만원 미만일 경우에는 기본경비율이 적용되기 때문에 관련 경비를 인정받기 위한 증빙자료가 필수입니다. 증빙자료는 △교통비 △비품 △소모품 등의 영수증을 말하죠.기타소득은 △강연료 △책 인세 △원고료 △당첨 상금 등으로 300만원이 초과되는 경우에만 5월 종합소득세 신고·납부하면 됩니다.만약 기타소득이 연간 3000만원을 넘는다면 부수입이 아닌 사업적인 성격으로 봐 사업소득으로 분류될 수 있습니다. 만약 위 사유를 기타소득에 분류해 신고를 할 경우에는 종합소득세 신고를 허위 기재한 것으로 간주해 10%의 '신고불성실가산세'를 물 수 있으니 조심해야합니다.만약 두 곳 이상의 직장에서 '근로소득'을 받는 근로자라면 두 근로소득의 합산금액을 한 직장에서 연말정산 할 수 있습니다. 그러나 근로소득과 사업소득 또는 기타소득이 있는 '투잡' 유형일 경우라면 모든 소득을 합산해 이달에 종합소득세 신고를 필수적으로 해야 합니다. 종합소득세는 한 사람이 벌어들인 모든 소득을 합산해 누진세율을 적용하기 때문이죠.만약 위에 서술했듯이 본인이 '투잡' 유형에 해당되는지 모르겠다면 국세청 홈택스에서 본인이 종합소득세 신고 대상인지 조회가 가능합니다. 아울러 근로소득 외에 추가로 사업소득이나 기타소득이 발생했을 경우 해당 사업체에서 발급한 원천징수 자료가 자동 등록됩니다.해당 자료를 통해 본인에게 맞는 '신고유형'을 알았다면 그에 따라 사업소득금액을 산출하고, 기존 연말정산분과 합산해 소득 신고를 하면 됩니다. 지난해 종합소득이 있는 납세자는 오는 5월31일까지, 성실신고확인이 필요한 납세자의 경우에는 6월30일까지 신고‧납부해야 합니다.또한 △코로나 손실보상 대상자 △동해안 산불 특별재난지역(울진‧삼척‧강릉‧동해) 거주자, 영세자영업자 등 534만명의 종합소득세 납부기한은 오는 8월31일까지 연장되었습니다.만약 이달내로 종합소득세 신고‧납부를 하지 않을 경우에는 각종 세액공제 및 감면을 받을 수 없으며, 무신고가산세 20%가 추가로 부과된다는 사실도 유념해야겠습니다. 우리가 내야 할 세금을 현명하게 챙겨 납부하는 것도 또 다른 세테크가 아닐까 생각해 봅니다."
