405648,"키움증권, KOSPI200·삼성전자 기초자산 ELS 출시",백유진 기자,2018.02.07 11:29:29,"ⓒ 키움증권[프라임경제] 키움증권은 KOSPI200지수와 삼성전자 보통주를 기초자산으로 하는 세전 수익률 연 7%의 주가연계증권(ELS)을 출시한다고 7일 알렸다.키움 제757회 ELS는 만기 3년 상품으로 6개월 주기의 조기상환평가일에 두 기초자산의 평가가격이 모두 기준가격의 90%(6개월·12개월), 85%(18개월·24개월), 80%(30개월) 이상이면 자동 조기상환되고 세전 연 7%의 수익을 지급한다.만기 시 두 기초자산의 평가가격이 모두 기준가격의 80% 이상이면 세전 21%, 연 7%의 수익을 얻게 된다. 다만 투자기간 동안 기초자산 중 하나가 최초기준가격의 60% 미만으로 떨어진 적이 있다면 원금손실이 발생할 수 있다.청약 마감은 오는 9일 오후 1시다. 자세한 내용은 키움증권 자산관리 홈페이지나 키움금융센터로 문의 가능하다."
575643,"[백세금융] 예금운용·수익 지급하는 CMA ""은행보다 이자 높다""",장민태 기자,2022.08.03 18:21:14,"[프라임경제] 예금보호가 되지 않는다는 특징 때문에 외면받던 CMA(종합자산관리계좌)가 최근 금융소비자들 사이에서 주목을 받고 있습니다. CMA는 은행 수시입출금 통장보다 높은 이율을 제공할 뿐만 아니라 한국은행 기준금리 인상 기조와 함께 더욱 매력이 높아질 것이라 전망되고 있습니다.◆RP·종금형 등 운용대상 따라 달라지는 4가지 CMACMA는 금융사가 고객이 넣어둔 예금을 어음·채무증서 등에 운용하고, 그 수익을 다시 지급하는 금융상품을 뜻합니다. 원래는 종합금융사가 판매하는 상품을 뜻했지만, 예금자보호가 되지 않는 증권사 CMA가 출시되면서 구분 없이 사용되고 있죠.CMA는 금융사가 고객이 넣어둔 예금을 어음·채무증서 등에 운용하고, 그 수익을 다시 지급하는 금융상품이다. = 장민태 기자CMA는 운용대상에 따라 △RP형 △종금형 △MMF형 △MMW형 등 4가지 유형으로 나뉩니다. 각 유형마다 특징이 달라 금융소비자는 이를 알아두는 것이 좋습니다.가장 대표적인 RP형은 국공채·우량회사채 등 다소 안전성이 높은 곳에 투자해 고객에게 약정된 이자를 지급합니다. 종금형은 종합금융사가 운용하는 상품으로 CMA 중 유일하게 예금자보호법이 적용되며, 가입자는 상품을 판매한 금융사가 망하더라도 예금보험공사로부터 원리금 5000만원까지 보호받을 수 있습니다.MMF형은 자산운용사가 고객 자산을 단기국공채·CP 등으로 운용해 얼마큼 성과에 내느냐에 따라 수익률이 달라지는 상품입니다. 다른 CMA 상품들과 동일하게 수시입출금이 가능하고 하루만 돈을 예치해도 운용실적에 따른 이익금을 받을 수 있죠.마지막으로 MMW형은 증권사가 고객이 납입한 돈을 한국증권금융에 위탁해 운용하는 상품입니다. 특히 매일 수익을 정산해 원금과 이자를 합한 원리금을 다시 투자하는 복리 구조로 다른 유형과 차이가 있습니다.◆높은 이율·수시입출금 장점, 원금손실 우려 존재이처럼 CMA 상품들은 수시입출금이 가능하단 장점과 종금형을 제외하면 예금자보호가 안 된다는 치명적인 단점이 공존합니다. 그럼에도 은행이 판매하는 수시입출금 상품대비 높은 이자율을 제공한다는 점이 매력으로 꼽히죠.아울러 최근 증권시장이 침체된 가운데 한국은행이 추가 기준금리 인상을 꾸준히 예고하고 있어 더욱 인기가 늘고 있죠.금융투자협회 통계에 따르면 개인이 가입한 CMA 계좌잔액은 7월 기준 56조7728억원으로 집계됐습니다. 이는 한국은행이 기준금리 인상을 시작하기 직전인 지난해 7월 잔액(50조6709억원)과 비교하면 1년 사이 6조1019억원이나 늘어난 것이죠.네이버파이낸셜 순위에서는 3일 기준 우리종합금융이 판매하는 종금형 상품의 이자가 2.30%로 가장 높게 조사됐습니다. 기간별로 확정금리를 제공하는 상품으로 가입자는 돈을 넣어둔 기간이 29일 이내일 경우 2.30%, 90일 이상부터는 2.55%의 이자를 받을 수 있습니다.그다음으로 이자율이 높은 곳은 확정금리 2.25%를 제공 중인 SK증권입니다. 이들이 취급하는 RP형 상품은 운용 과정에서 발생한 수익 0.1%p를 고객이 지정한 장애인재단·노인복지협회·아동구호단체 등으로 자동 기부한다는 점이 특징이죠.SK증권 관계자는 ""CMA상품은 법인의 경우 이야기가 다르지만 개인 고객은 수시입출금이 가능하다고 보면 된다""며 ""CMA의 가장 큰 메리트는 금리로 은행 수시입출금 통장은 금리가 인상됐더라도 1% 이상 나오는 경우가 거의 없다""고 말했다.금융권 관계자는 ""우량 채권을 가지고 운용하기 때문에 위험성이 높진 않지만 그래도 예금자보호가 되지 않기 때문에 원금 손실이 발생할 수 있다""며 ""은행과 달리 리스크가 분명히 존재한다는 걸 금융소비자도 이해해야 한다""고 경고했다.금융사들이 내놓은 CMA 상품들은 과거와 달리 지점 방문 없이 가입 가능하며, 은행 계좌와 동일하게 체크카드도 발급받을 수 있어 활용도가 더욱 넓어졌습니다. 금리인상기인 지금 상품의 장단점을 이해하고 CMA에 가입한다면 자금을 현명하게 불려나갈 수 있을 것입니다."
402043,"현대차투자증권, 연 수익 5.0% ELS 1종 공모",백유진 기자,2018.01.10 11:19:50,"[프라임경제] 현대차투자증권(사장 이용배)은 오는 12일 오후 1시까지 총 50억원 규모의 원금비보장형 ELS 상품 1종을 공모한다.ⓒ 현대차투자증권현대차투자증권 ELS 1783호는 홍콩항셍 중국기업지수(HSCEI), 유로스탁스50지수(EuroStoxx50)와 스탠더드앤드푸어스500지수(S&P500)를 기초자산으로 하는 3년 만기 원금비보장형 상품이다. 발행 후 6개월마다 돌아오는 조기상환일에 최대 연 5.0%의 수익을 지급한다.이번 공모상품은 고위험 금융투자상품으로 최소 가입금액은 100만원이다. 현대차투자증권 전국 각 지점과 홈페이지에서 가입이 가능하다."
586227,"[백세금융] 주식투자, 용어 알면 돈이 보인다…증권사 리포트 이해하기",박기훈 기자,2022.11.28 14:23:45,"많은 개인투자자분이 장 시작 전 혹은 장 마감 후 올라오는 수많은 증권사 리포트를 참고하고 있지만 낯선 용어에 난색을 표하는 경우가 많다. = 박기훈 기자[프라임경제] 많은 개인투자자분들이 장 시작 전 혹은 장 마감 후 올라오는 수많은 증권사 리포트를 참고하고 있습니다. 리포트를 통해 시장 흐름을 파악하고 전문가들의 분석을 참고하면서 본인의 투자를 준비하는 것이죠.하지만 증권사 리포트에서 쓰이는 낯선 용어들로 인해 난색을 표하는 분들도 많은데요. 기본적으로 기관투자자를 대상으로 작성하기에 외래어와 한자어, 전문용어가 빈번하게 등장합니다. 따라서 리포트를 통해 단번에 기업 현황을 이해하는 것은 솔직히 어려운 일입니다.이에 증권사 리포트, 그중에서도 기업 분석 리포트에서 자주 쓰이는 용어들 중 매우 기초적인 부분을 파악해보고자 합니다.기업 분석 리포트에서 가장 먼저 보게 되는 것은 투자의견과 목표주가일텐데요. 가끔 영어로TP, CP로 적힌 리포트도 있습니다. TP(Target Price)는 목표 주가를, CP(Current Price)는 현재 주가를 의미합니다.최근엔 'Not rated'로 명시된 리포트들을 자주 찾아 볼 수 있는데요. 이는 '매수(Buy), 중립(Hold), 매도(Sell) 중 어떠한 투자의견을 내야 할지 모른다'라고 생각하시면 됩니다.기업 분석 리포트에서 영업실적을 비롯한 재무정보는 가장 중요한 부분인데요. 해당 부분을 보다보면 '2021A' '2022E' '2023F'과 같이 연도 뒤에 알파벳이 붙은 것을 확인할 수 있습니다.'A'는 'Actual', 실제 데이터를 의미하는데요. 과거 연도로 이미 확정된 데이터라는 것입니다. 이에 이미 지난 연도나 분기에 붙게 됩니다. 'F'는 'Forecasted'로, 추정치를 의미합니다. 미래에 대한 추정 데이터로써 다가오는 연도나 붙기에 사용됩니다. E역시 F와 같은 뜻으로 사용됩니다.증권사 리포트를 읽다보면 가장 많이 보이는 용어가 'QoQ'와 'YoY' 일텐데요. 이 둘은 이전 실적과 비교할 때 사용하는 용어로써 'QoQ(Quarter on Quarter)'는 직전 분기 대비, 'YoY(Year on Year)'는 전년 동기 대비를 의미합니다.만약 '4분기 매출액 300억원(YoY -10.0%, QoQ +20.0%)'이라면, 지난해 4분기 대비 10% 감소했지만 3분기 대비 20% 증가했다는 의미죠. 자주 사용되진 않지만 'MOM(Month on Month)'은 전월 대비 증감율을 말합니다.실적을 발표하거나 혹은 예상하면서 '컨센서스(Consensus)를 상회 혹은 부합·하회했다'는 표현들도 자주 접할 수 있는데요. 컨센서스는 시장 전망치 혹은 평균이라고 생각하면 쉽습니다. 특정 기업의 실적을 추정할 때 여러 곳에서 하는데, 애널리스트들이 내는 기업의 실적이나 주가에 대한 의견의 평균치를 뜻합니다.또한 '모멘텀을 보유하고 있다', '모멘텀으로 작용할 것'이라는 표현도 흔히 접하게 되는데요. 모멘텀(Momentum)은 원래 물리학 용어로써 운동량, 추진력 등을 말합니다. 이를 리포트에 대입해 생각해본다면 주가의 상승 추세를 더욱 가속화해 얼마나 더 상승할 것인가, 혹은 반대로 주가 하락 추세가 얼마나 더 이어질 것인가에 대한 흐름을 나타낸다고 할 수 있죠.더 쉽게 말하자면, '주가 상승의 모멘텀이 강하다'면 특정 이유로 주가 상승 여력이 충분한 것이고, '주가 상승 모멘텀이 부족하다'면 특정 이슈에 따른 주가 상승이 바닥을 드러냈다고 해석하면 될 것 같습니다.리포트를 읽다보면 '밸류에이션이 매력적이다', '밸류에이션 정상화가 어렵다'라는 말도 흔히 볼 수 있는데요. 사전적 의미로 '물건의 금전적 가치 판단'을 의미하는 '밸류에이션(Valueation)'은 간단히 '기업의 가치'로 설명할 수 있습니다. 예를 들어 기업의 자본이나 순이익 등 가치가 크지만 시장가치, 즉 주가가 낮다면 기업이 저평가된 상황인데요. 이러한 상황을 '밸류에이션이 매력적이다'라고 표현하곤 합니다.한 기업의 목표주가를 설정함에 있어 관련 이유를 설명할 때 많이 나오는 용어 중 PER(P/E), PER(P/B), EPS가 있는데요. PBR은 해당 기업이 가지고 있는 자산 대비 주가입니다. PER은 얼마나 버는지, 즉 이익을 내는 것 대비 주가를 뜻합니다. EPS는 주당 얼마의 순이익을 내는지를 알려주는 지표입니다.PER은 이익을 얼마나 내는지에 대비한 주가 흐름을 측정하는 지표이다 보니 여전히 중요하게 쓰이는 지표입니다. 이와 달리 PBR은 예전과 달리 최근에는 힘을 못 쓰는 지표 중 하나인데요. 이는 공장이나 기자재 등에 대비한 주가 가격을 보는 게 대부분이었지만 이제는 무형 자산이 워낙 중요해졌기 때문입니다. 무형자산은 자산 가치를 매길 수 없는 존재이기 때문이죠.지금까지 증권가 리포트, 그 중에서도 기업 관련 리포트에서 자주 나오는 기본적 용어들을 몇 가지 소개해봤는데요. 소개한 용어 외에도 증권가 리포트를 읽다보면 자주 나오지만 이해하기엔 어려운 용어들이 발목을 잡곤 할 것입니다.투자를 하려면 많은 시간과 노력이 필요한 법입니다. 지금 당장은 머리가 복잡하고, 모르는 단어가 나올 때마다 검색해보고 찾아보는 것이 번거로울 수 있습니다. 하지만 '반복학습'에 의해 하나 하나 알아가다 보면 자신도 모르는 사이 용어에 대한 이해는 순조로울 것입니다.그리고 이것 하나만 머리에 새기면 됩니다. 투자는 본인의 자본이 들어가는, 소홀히 해선 안 된다는 것이라는 사실을 말입니다. 그렇다면 잠시의 공부가 그리 귀찮은 일만은 아닐 것입니다."
558906,"[백세금융] '포테크' 카드포인트 통한, 합리적 소비까지",황현욱 기자,2022.01.05 17:40:36,"[프라임경제] 검은 호랑이 해인 임인년 새해가 밝았습니다. 올해도 여전히 남녀노소 재테크에 대한 열기가 끊이지 않고 있는데요. 최근에는 숨겨진 카드 포인트를 이용해 재테크하는 포테크(카드 포인트·재테크)가 MZ세대에게 인기를 끌며 주목받고 있습니다.소비자들은 신용카드나 체크카드 등을 사용하고 있지만, 이에 동반되는 '카드 포인트'에는 무심하기 마련이죠. 카드 포인트는 현금 못지않게 활용도가 높지만, 관심이 없거나 활용법을 몰라 사용하지 않는 사람들이 많습니다.금융감독원 '전업카드사 포인트 현황'에 따르면 지난해 상반기 기준 잠들어 있는 신용카드 포인트는 무려 2조원, 대부분 카드 포인트 유효기간은 '5년'에 해당되기 때문에 매년 약 1000억원의 포인트가 사용되지 못하고 소멸되고 있다고 전했습니다.카드 포인트가 어디에, 얼마나 있는지 모르신다면 여신금융협회 '카드 포인트 통합조회&계좌 입금 서비스'를 이용해 숨어있는 포인트를 편리하게 관리할 수도 있습니다.포테크 대표주자인 (왼쪽부터) 신한 더모아카드, 하나멤버스 센골드, 롯데 로카머니카드, 국민 KB금융포인트리 카드. ⓒ 각사 합성카드사들은 포테크를 겨냥해 포인트 적립률이 높은 카드나, 적립된 포인트 사용을 함께 사용할 수 있는 상품·서비스를 너도나도 선보이고 있습니다.대표적으로 신한카드에 '더모아 카드'가 있었지만, 아쉽게도 최근 카드 수수료가 인하되면서 지난달 31일 신규 발급이 중단됐습니다. 흔히 '혜자카드'로 소문이 나며, 단종 소식으로 단종 직전에 카드 발급 막차를 탄 사람도 많았다고 알려졌죠.현재 이용자들을 위해 설명을 더하자면 더모아 카드는 전월 이용실적 30만원만 충족하면 월 적립 한도와 횟수 제한 없이 5000원 이상 결제 시 건당 1000원 미만 자투리 금액을 그대로 포인트에 적립해줍니다.예를 들어 5900원을 더모아 카드로 결제 시 900포인트가 적립되고, 11500원 결제 시 500포인트가 적립되는 셈입니다. △배달의 민족 △요기요 △넷플릭스 △유튜브 프리미엄 △멜론 △이동통신요금 등 특별 적립 가맹점에서 더모아 카드로 결제하면 더블 적립 혜택을 제공하는 것이죠. 1만900원을 배달의 민족에서 더모아 카드로 결제했다면 1800포인트가 적립되는 방식입니다.이러한 적립 포인트는 신한은행 달러 예금계좌 혹은 신한금융투자 해외 투자 가능 계좌에 달러로 전환된 후 입금되며, 투자 계좌 미지정 시 현금처럼 사용할 수 있는 마이신한포인트로 자동전환 됩니다. 이때 환전수수료는 면제됩니다.마이신한포인트는 신한금융투자의 '스탁백 서비스'로 해외주식 소수점 투자가 가능합니다. 마이신한포인트 1포인트는 1원의 가치로 거래되죠. 원하는 해외 주식을 선택, 매수하기를 누른 뒤 '스탁백 서비스 사용하기'에 체크하면 마이신한포인트로 해외주식 매수가 가능합니다. 스타백 서비스는 금융위원회의 혁신금융서비스에 지정돼 오는 3월17일까지 한시적으로 이용할 수 있습니다.하나카드의 경우 하나카드 포인트인 '하나머니'를 통해 금과 은을 구매할 수 있습니다. 하나멤버스 앱 '센골드' 코너를 통해 금은 최소 0.0001g 단위, 은은 최소 0.01g 단위부터 구매 가능하죠. 또한 환전지갑 코너에서 '환테크', 해외주식 코너에선 해외주식 거래도 가능합니다.롯데카드는 지난해 '로카머니 카드'를 출시해 국내외 이용 시 이용요금의 1%를 로카코인이라고 불리는 포인트로 적립 해줍니다. 적립된 로카코인은 △단기·장기카드대출 이자 △롯데카드 결제 대금 납부가 가능합니다.증권사 매매수수료 일부를 적립해주는 카드도 등장했죠. KB국민카드는 KB증권 매매수수료를 최대 5% 금융포인트로 적립해주는 'KB금융포인트리 카드'를 출시했습니다. 카드 당월 실적에 따라 최소 0.5%~최대 5% 금융 포인트 적립 혜택을 제공하며, 적립된 포인트는 △대출이자 자동 납부 △보험료 자동 차감 △통신 요금 자동 차감 등 다양한 활용할 수 있습니다.이처럼 카드사들은 포테크 관련 다양한 상품과 서비스들을 출시하고 있습니다. 하지만 카드 포인트로만 재테크가 가능하다 보니, 포인트에 집중하다보면 계획적인 소비를 못하게 된다는 단점이 존재하기도 합니다. 잘만 활용하면 카드 포인트는 '덤'이 되지만, 무분별하게 카드 사용하면 '해'가 되는 것이죠.카드 포인트는 카드 사용할 때 덤으로 따라오는 '선물'이라고 생각해야 좋겠죠. 구체적인 계획과 합리적인 소비, '포테크' 기본이 지켜질 때 가장 빛이 나는 재테크 방법이 될 수 있을 것입니다."
311208,"HMC투자증권, 16일까지 30억 규모 ELS 1종 공모",정수지 기자,2015.07.14 14:24:25,ⓒ HMC투자증권[프라임경제] HMC투자증권은 15일부터 이틀간 원금 비보장형 ELS(주가연계증권) 상품 1종을 30억원 규모로 공모한다고 14일 밝혔다.'HMC투자증권 ELS 1422호'는 홍콩항셍중국기업(HSCEI)지수와 유로스탁스50(EuroStoxx50)지수를 기초자산으로 하는 3년 만기 원금비보장형 상품이다. 발행 후 6개월마다 조기상환할 수 있으며 최고 연 7.02% 수익을 보장한다.이 상품은 월 지급식 상품으로 매월 수익지급 평가일에 두 기초자산 종가가 모두 최초기준가격의 60% 이상이면 0.585%(연 7.02%)를 지급한다. 최소 가입금액은 100만원이다.
248243,"동양증권, 최고 연 13.5% 포함 파생결합증권  8종 공모",이정하 기자,2012.09.18 11:25:43,"[프라임경제] 동양증권(003470)은 21일까지 나흘간 KOSPI200, S&P500, 엔씨소프트, 현대차, SK텔레콤을 기초자산으로 하는 원금보장형 ELS 1종과 고수익 조기 상환이 가능한 원금비보장형 ELS 4종 및 쿠폰지급형 ELS 1종 그리고 런던금가격지수와 런던은가격지수를 기초자산으로 하는 쿠폰지급형 DLS 2종 등 총 8종의 ELS, DLS 상품을 650억원 규모로 공모한다고 밝혔다.DLS 109호는 만기 3년에 매 1개월마다 런던금가격지수, 런던은가격지수 두 평가가격이 최초기준가격(100%)의 55% 이상이기만 하면 0.835%(연 10.02%)의 절대수익을 지급하는 쿠폰지급식 뉴 스텝다운 원금비보장형 상품이다.또한 발행 6개월부터 매 3개월마다 런던금가격지수와 런던은가격지수 두 평가가격이 각 최초기준가격(100%)의 100%(6개월), 95%(9·12·15개월), 90%(18·21·24개월), 85%(27·30·33개월), 55%(36개월) 이상인 경우 조기상환도 가능하다.DLS 110호는 만기 5년에 매 1개월마다 런던금가격지수, 런던은가격지수 두 평가가격이 최초기준가격(100%)의 55% 이상이기만 하면 0.96%(연 11.52%)의 절대수익을 지급하는 쿠폰지급식 뉴 스텝다운 원금비보장형이다.또 발행 6개월부터 매 3개월마다 런던금가격지수와 런던은가격지수 두 평가가격이 각 최초기준가격(100%)의 100%(6·9·12개월), 95%(15·18·21개월), 90%(24·27·30개월), 85%(33·36·39개월), 80%(42·45·48개월), 75%(51·54·57개월), 55%(60개월) 이상인 경우 조기상환도 기대할 수 있다.ELS 2629호는 만기 1년의 원금보장형 상품이다. KOSPI200이 만기평가일까지 최초기준가격(100%)의 115%를 초과해 상승한 적이 있는 경우 연 3.5%의 수익을 지급하고, 상승한 적이 없는 경우는 상승률의 75%의 수익을 지급한다.ELS 2630~2633호는 만기 3년에 조건에 따라 고수익 조기상환이 가능한 스텝다운 원금비보장형 상품이다. KOSPI200, S&P500, 엔씨소프트, 현대차, SK텔레콤을 기초자산으로 하며 연 7.1~13.5%의 수익률로 조기상환이 가능하다.특히 ELS 2632호는 만기 3년에 매 6개월마다 KOSPI200, 엔씨소프트 두 평가가격이 각 최초기준가격(100%)의 90%(6·12개월), 85%(18·24개월), 80%(30·36개월) 이상인 경우 연 13.5%의 수익률로 조기상환된다. 투자기간동안 최초기준가격의 40% 미만으로 한 번이라도 하락한 적이 없는 경우 연 13.5%의 수익률로 만기상환된다.ELS 2634호는 만기 3년에 매 1개월마다 KOSPI200, S&P500 두 평가가격이 최초기준가격(100%)의 50% 이상이기만 하면 0.585%(연 7.02%)의 절대수익을 지급하는 쿠폰지급식 스텝다운 원금비보장형 상품이다. 또한 매 6개월마다 KOSPI200, S&P500 두 평가가격이 각 최초기준가격(100%)의 95%(6·12개월), 90%(18·24개월), 85%(30·36개월) 이상인 경우 조기상환할 수 있다.한편 최소가입금액은 100만원(100만원 단위)으로 동양증권 전국 지점에서 청약할 수 있다."
353700,"HMC투자증권, 연 5.3%  'ELS 1종' 공모",추민선 기자,2016.11.08 09:54:50,"[프라임경제] HMC투자증권(사장 김흥제)은 9일부터 10일 오후 4시까지 총 100억원 규모의 원금비보장형 ELS 상품 1종을 공모한다고 8일 밝혔다.HMC투자증권은 10일 오후 4시까지 원금비보장형 ELS 상품 1종을 공모한다. ⓒ HMC투자증권'HMC투자증권 ELS 1584호'는 코스피200지수(KOSPI 200), 홍콩항셍 중국기업지수(HSCEI)와 유로스탁스50지수(EuroStoxx50)를 기초자산으로 하는 3년 만기 원금비보장형 상품이다. 발행 후 6개월 마다 조기 상환기회가 주어지며 최고 연 5.3%의 수익을 지급한다.이번 공모상품은 금융투자상품 분리에 따라 고위험으로 분류된다. 최소 가입금액은 100만원으로, HMC투자증권 전국 각 지점 및 홈페이지에서 가입할 수 있다.자세한 투자문의사항은 HMC투자증권 스마트금융센터로 하면 된다."
311229,"삼성카드, 셀렉트 29번째 공연 뮤지컬 '아리랑'",이지숙 기자,2015.07.14 14:46:07,"[프라임경제] 삼성카드는 '삼성카드 셀렉트' 29번째 공연으로 뮤지컬 '아리랑'을 선보인다고 14일 밝혔다.뮤지컬 '아리랑'은 조정래 작가의 대하소설 ‘아리랑’을 원작 삼은 국내 창작 뮤지컬로 일제강점기 민초들의 삶과 사랑, 그리고 투쟁의 역사를 담은 작품이다.이번 공연에는 서범석, 안재욱, 카이, 윤공주 등 스타급 뮤지컬 배우 및 김성녀, 이소연 등 전문 국악인들이 출연해 판소리와 뮤지컬 음악의 독특하고 절묘한 조합을 이끌 예정이다.삼성카드 셀렉트 29번째 공연 '아리랑'은 조정래 작가 소설을 원작으로 한 국내 창작뮤지컬이다. © 삼성카드삼성카드는 특별한 공연을 소중한 사람과 함께 할 수 있도록 삼성카드로 공연 예매 때 동반자 티켓을 무료로 제공하는 1+1 혜택을 제공하며 관람객 전원에게 미니 프로그램북을 증정해 공연의 이해를 도울 예정이다.삼성카드 셀렉트는 지난 2011년 이후 삼성카드가 선보이는 문화 공연 콘텐츠로 문화 공연 관람 때 꼭 필요한 혜택들을 제공해 고객들에게 수준 높은 문화 공연 컨텐츠를 보다 쉽고 편하게 즐길 수 있도록 한 것이 특징이다.공연은 오는 △7월24일 오후 8시 △25일 오후 3시, 7시30분 △26일 오후 2시, 6시30분까지 총 5회차로 LG아트센터에서 진행되며 예매는 인터파크 및 삼성카드 홈페이지 이벤트 페이지를 통해 1인당 2매까지(총 4매) 구매 가능하다.삼성카드 관계자는 ""창작 뮤지컬의 활성화를 위해 2015년 최고 기대작을 삼성카드 회원들에게 셀렉트로 제공하게 됐다""며 ""좋은 공연을 실용적 가격에 즐길 수 있는 기회가 되는 동시에 침체된 국내 공연계를 활성화시키는 데에도 도움이 될 것으로 기대한다""고 말했다."
