405648,"키움증권, KOSPI200·삼성전자 기초자산 ELS 출시",백유진 기자,2018.02.07 11:29:29,"ⓒ 키움증권[프라임경제] 키움증권은 KOSPI200지수와 삼성전자 보통주를 기초자산으로 하는 세전 수익률 연 7%의 주가연계증권(ELS)을 출시한다고 7일 알렸다.키움 제757회 ELS는 만기 3년 상품으로 6개월 주기의 조기상환평가일에 두 기초자산의 평가가격이 모두 기준가격의 90%(6개월·12개월), 85%(18개월·24개월), 80%(30개월) 이상이면 자동 조기상환되고 세전 연 7%의 수익을 지급한다.만기 시 두 기초자산의 평가가격이 모두 기준가격의 80% 이상이면 세전 21%, 연 7%의 수익을 얻게 된다. 다만 투자기간 동안 기초자산 중 하나가 최초기준가격의 60% 미만으로 떨어진 적이 있다면 원금손실이 발생할 수 있다.청약 마감은 오는 9일 오후 1시다. 자세한 내용은 키움증권 자산관리 홈페이지나 키움금융센터로 문의 가능하다."
606034,[백세금융] 4세대 실손보험 전환 통해 '반값 할인' 받아볼까?,조송원 기자,2023.07.06 11:48:30,"[프라임경제] 보험업계가 기존 1·2·3세대에서 '4세대 실손보험'으로 전환할 경우 1년간 보험료 50% 할인 혜택을 제공합니다.오는 12월까지 시행되는 4세대 실손보험은 보험료를 합리적으로 낮추고 비급여 의료 이용량에 따라 보험료가 차등 적용됩니다. 이는 기존 1·2·3세대 실손보험의 일부 비급여 과잉 의료로 인해 보험금 누수 등의 손실이 지속된 영향입니다. 손해율 상승으로 보험료가 인상되면서 운용상의 어려움이 발생했기 때문이죠.실손의료보험. ⓒ 연합뉴스◆4세대 실손보험 주요 개편사항생명·손해보험협회(이하 생보협회·손보협회)에 따르면 4세대 실손보험의 개편사항은 보험료가 기존 △1세대 대비 75% △2세대 대비 60% △3세대 대비 10% 인하됩니다. 보장범위와 한도는 기존과 비슷합니다.자기부담비율은 급여와 비급여가 각각 20%, 30%로 합리화됩니다. 이는 과도한 의료 이용과 같은 도덕적 문제를 예방하기 위함입니다. 가입자간 보험료 부담의 형평성을 유지하기 위해 비급여 의료 이용량에 따라 보험료를 차등 지급하기도 합니다.건강보험정책과 같은 의료 환경 변화에 적절히 대응하기위해 재가입 주기를 15년에서 5년으로 단축합니다.◆4세대 실손보험 전환 시 확인사항4세대 실손보험을 전환하기 앞서 하루 통원 한도를 확인해야합니다. 기존 1세대는 하루 통원 한도가 10만원인 상품이 대부분입니다. 4세대의 경우 20만원으로 인상 됐기에 조건이 충족된다면 전환이 유리할 수 있습니다.2·3세대 통원 한도는 상품에 따라 20만원에서 50만원까지 다양합니다. 이에 보험업계는 금액이 크면 유지하는 것이 낫다고 추천합니다.입원 한도는 4세대가 유리합니다. 1·2·3세대 입원 한도는 모든 질환을 합쳐 3000만원에서 5000만원인데요. 4세대는 급여와 비급여인 질병과 상해에 각각 5000만원이 적용돼 보장 범위가 넓어졌습니다.다음으로는 면책 기간을 확인해야합니다. 실비 보험은 상품마다 365일 보장 후 90·180일간 보장 받을 수 없는 면책 기간이 존재합니다. 일반적으로 1·2·3세대가 4세대 대비 면책 기간 조건이 복잡하고 회사별 조건도 다릅니다.보장하지 않는 질환도 확인해야합니다. 1세대는 척추 질환과 선천성 질환 등을 보장하지 않지만, 4세대는 1세대가 보장하지 않는 일부 질병도 보장합니다. 예를 들어 △선천성 뇌질환 △난임 불임 인공 수정 관련 치료비 △외모 개선을 위한 여드름·사마귀 등 피부 질환 △비만 치료 등을 급여 한도 내에서 보장받을 수 있습니다.4세대 전환이 손해인 경우도 있어 각별한 주의가 요구됩니다. 사전에 생보협회와 손보협회가 운영하는 '보험다모아' 사이트에서 '실손의료보험 계약전환 간편계산기'를 이용해 비교해보거나 가입한 보험사 설계사 또는 고객센터에서 상담해보는 것을 권유합니다.전환 후 6개월 내에 기존 계약으로 돌아갈 수 있지만, 불완전 판매 입증과 같이 번거로운 과정을 거쳐야 하기 때문이죠.A보험사 관계자는 ""기존 실손을 유지하는 것이 여러모로 유리하지만 앞으로도 계속 보험료가 많이 오를 것이라는 게 문제""라며 ""선량한 가입자가 일부 과다 이용자들의 부담까지 떠안으면서 정작 보험이 필요한 시기에 보험료를 감당 못해 해지해야하는 경우가 생길 수 있어 대책이 필요하다""고 조언했습니다.이처럼 사전에 적합성을 꼼꼼히 따져본 후 4세대 실손보험 전환을 통해 보험료 반값 할인 혜택을 받아보는 것은 어떨까요."
314085,KB국민카드 '뮤지컬 로미오 앤 줄리엣' 1+1 예매 이벤트,이지숙 기자,2015.08.20 12:53:30,"[프라임경제] KB국민카드가 '뮤지컬 로미오 앤 줄리엣' 프렌치 오리지널 내한공연 예매 때 동반자 티켓 1매를 무료로 제공하는 원 플러스 원(1+1) 예매 이벤트를 진행한다고 20일 밝혔다.이번 행사는 10월3일 오후 7시부터 서울시 한남동 블루스퀘어에서 펼쳐지는 1600여석 규모의 공연을 대상으로 하며 티켓은 21일 오후 2시부터 KB국민카드 홈페이지에서 선착순으로 판매된다.티켓은 1인 최대 2매까지 예매 가능하고, KB국민카드로 결제하면 예매 좌석과 동일한 등급의 동반자 티켓 1매가 무료로 제공된다.KB국민카드는 10월3일 오후 7시 열리는 '뮤지컬 로미오 앤 줄리엣' 공연 예매 대 1+1 예매 이벤트를 진행한다. © KB국민카드뮤지컬 로미오 앤 줄리엣은 로미오와 줄리엣의 비극적인 사랑 이야기를 다룬 세익스피어의 희곡을 프랑스 특유의 예술적 감성을 더해 뮤지컬로 재탄생시킨 것으로 감미로운 샹송을 바탕으로 강력한 비트의 록 음악 변주가 인상적인 작품이다.특히, 이번 공연은 한국에서 6년 만에 열리는 프랑스 오리지널팀의 공연으로 씨릴 니꼴라이(로미오 역), 조이 에스뗄(줄리엣 역) 등이 출연해 현대무용, 힙합, 아크로바틱 등 다양한 장르의 안무를 극적이고 역동적으로 선보일 예정이다.이번 행사 관련 자세한 사항은 KB국민카드 홈페이지 또는 KB국민카드 고객센터에서 확인 가능하다.KB국민카드 관계자는 ""지난해 9월부터 매월 엄선된 대작 뮤지컬을 알뜰하게 즐길 수 있도록 진행하고 있는 '1+1 예매 이벤트'에 대한 고객들의 관심과 만족도가 회를 거듭할수록 높아지고 있다""며 ""지속적인 양질의 문화 콘텐츠 발굴을 통해 고객들이 보다 다양한 문화적 혜택을 누릴 수 있도록 할 것""이라고 말했다."
256991,KDB대우증권 '해외유전 투자하고 분리과세는 덤',이수영 기자,2013.01.30 10:36:32,"[프라임경제] KDB대우증권(사장 김기범)은 해외자원개발 특별자산투자회사(이하 유전펀드)에 투자하는 'KDB대우 유전펀드랩'을 30일 시장에 선보였다.ⓒKDB대우증권상품은 공모청약을 거쳐 발행된 후 유가증권시장에 상장된 유전펀드를 시장해서 매수하는 방식으로 운영되며 분리과세혜택을 누릴 수 있다는 장점이 있다. 투자처는 한국투자신탁운용의 앵커(Ankor) 유전펀드(상장)와 패러렐(Parallel) 유전펀드(상장예정)로 각각 50%씩 투자한다.유전펀드랩은 유전펀드와 같이 액면 3억원 이상은 5.5%, 3억원 초과분은 15.4%로 저율분리과세 혜택을 누릴 수 있다. 일정 수준의 원금이 보험으로 보장되며 내부수익률(IRR)기준 약 10% 수준의 목표 수익률을 추구하는 점도 같다.다만 시장에서 공모가격보다 저가 매수하는 것을 목표로 운용되므로 공모청약투자 대비 높은 수익률을 기대할 수 있다는 게 특징이다.김희주 KDB대우증권 상품개발부 이사는 ""기존 유전펀드 청약 때는 공모금액 이상 가격으로 청약이 밀려 투자하고 싶어도 돌아서는 고객이 많았다""며 ""KDB대우 유전펀드랩은 좋은 대안이 될 것""이라고 말했다.상품 최소 가입금액은 1000만원이며 오는 6월28일까지 가입할 수 있다. 자세한 문의는 스마트상담센터(1644-3322)로 하면 된다."
558477,[백세금융] 물가상승 공포 '인플레이션'…내 월급만 그대로?,장민태 기자,2021.12.29 14:30:31,"최근 경기회복보다 빠르게 물가 상승률이 높아질 것으로 전망되면서, 인플레이션을 우려하는 목소리가 높아지고 있습니다. ⓒ 연합뉴스[프라임경제] 전 세계 물가가 급등하면서 인플레이션(inflation)에 대한 우려의 목소리가 커지고 있습니다. '인플레이션'은 경제 각 분야에 영향을 미치는 악영향으로 인해 '악성 암'이라고 표현하기도 하죠.평균 기대수명 100세 시대, 인플레이션이 우리의 미래에 어떤 영향을 미치는지 주목할 필요가 있습니다.'인플레이션'이란 화폐가치가 하락해 물가가 전반적으로 꾸준히 상승하는 경제현상을 뜻합니다. 여러 가지 요인으로 발생할 수 있지만, 대표적으로 △수요가 공급을 초과 △생산비용 상승 △통화 공급량 급증 등을 꼽을 수 있죠. 이들의 공통점은 통화 가치 하락에 있습니다. 쉽게 풀이하면 500원에 살 수 있던 상품이 같은 물건임에도 불구하고 어느 날 갑자기 500원 이상을 지불해야 살 수 있게 되는 것이죠.예를 들어 시중에 유통되는 통화량이 많아지면 통화 가치는 떨어지게 되고, 이로 인한 물가 상승률이 높아집니다. 인플레이션이 심화되면 소비자는 물가상승에 대비해 생필품 등을 비축하면서 물자부족 현상이 발생하기도 하죠. 이는 인플레이션을 더욱 심화시키는 악순환으로 이어집니다.일례로 신종 코로나바이러스 감염증(코로나19)으로 각국 경제가 휘청거리면서 세계 중앙은행들이 돈을 풀어 통화량이 증가했습니다. 생산은 줄어든 상황에서 수요만 증가한 결과, 수십 년 만에 상승 폭을 보이는 인플레이션이 나타나고 있습니다.미국 연방준비제도가 인플레이션 추이를 관찰할 때 기준으로 삼는 개인소비지출(PCE) 가격지수도 지난 11월 기준 지난해 동월대비 5.7% 올랐죠. 이는 지난 1982년 7월 이후 가장 큰 상승폭이기도 합니다.세계 경제는 코로나19 영향으로 최악의 경기침체를 지나, 올해 들어 빠른 경기회복과 물가상승률을 기록했습니다. 유로존 역시 4.9%로 30년 만에 최고치를 기록했으며, 한국도 11월 소비자물가가 지난해 동월대비 3.7% 오른 가운데 생활물가와 신선식품 물가는 각각 5.2%, 6.3% 상승했습니다.IMF는 올해 세계경제성장률이 5.9%에 이를 것으로 전망했는데요. 경기회복보다 빠르게 물가 상승률이 높아질 것으로 전망되면서, 인플레이션을 우려하는 목소리가 높은 상황이죠.이러한 상황에서 오미크론 변이가 회복세를 보이는 세계 경제의 발목을 잡을 수도 있는 상황입니다. 경기는 침체되는데 물가는 오르는 '스태그플레이션(stagflation)'에 대한 전망이 나오는 이유죠.최근 국제 공급망 위기가 이슈로 부상한 적이 있었습니다. 국내에서도 요소수 공급문제가 사회이슈로 떠올랐고, 햄버거 속 기본 식자재였던 양상추가 빠진 채 제공되는 등의 일이 있었습니다.이는 국내뿐 아니라 전 세계가 겪는 문제로 부상했는데요. 물류대란의 원인은 복합적입니다. 신종 코로나바이러스 감염증(코로나19)로 각국이 항만을 폐쇄하기도 했죠. 여기에 인력난과 국제유가와 천연가스 가격까지 치솟고 있어 세계적인 물류대란이 발생하고 있습니다. 이 물류대란이 물가상승의 주요 원인으로 지목되고 있죠.이에 대해 한국은행도 지난 23일 '금융안정보고서'를 통해 우려를 표했습니다. 한은 관계자는 ""유가 등 국제 원자재 가격 상승세가 지속되고 글로벌 공급병목 현상이 상당기간 해소되지 않을 경우 수입물가와 기대인플레이션이 크게 상승해 극단의 경우 물가가 4.6%까지 오를 가능성이 있다""고 말했습니다.이처럼 인플레이션이 발생하면 고정소득을 받는 근로소득자들은 원화가치가 떨어져 손해를 볼 수밖에 없죠. ""내 월급 빼고 다 올랐다""라는 말이 이런 경우 해당되는 것이죠. 반면 부동산과 미술품 등 실물자산을 갖고 있는 사람들은 점점 부자가 되는 부의 편중 현상이 심화되기도 합니다.정부는 재정지출을 줄이고 공공요금을 올려 물가상승률을 억제합니다. 한국은행과 같은 중앙은행은 금리를 인상해 유통되는 통화량을 줄이려고 하죠. 이는 채권시장이나 은행 예·적금 등으로 돈을 몰리게 해 주가하락 상황으로 이어지기도 합니다. 또는 금과 같은 안전자산에 투자하는 이들도 늘어나지요.물론 성장성이 높은 기업의 주식은 이런 상황에도 꾸준히 성장하는 경우가 많습니다. 인플레이션이 지나간 후 올라간 상품가격은 쉽게 떨어지지 않기 때문에 결국 기업들은 돈을 더 버는 상황으로 이어지기도 합니다. 특히 이들은 가격 인상을 고스란히 소비자에게 전가하기 때문에, 기업에게 인플레이션은 기회로도 작용합니다.인플레이션이 재테크에 미치는 영향을 이해하고 장기적인 전략을 수립하는 투자자가 혜택을 볼 수 있습니다. 또한 국내외 경제가 향후 어떻게 변화될지 장담할 수 없는 만큼 리스크를 언제나 유념하고 신중한 재테크 계획을 세워야 할 것입니다."
287131,"교보증권, 우체국서 신규계좌 개설하면 상품권",정수지 기자,2014.08.28 13:53:59,"ⓒ 교보증권[프라임경제] 교보증권은 10월31일까지 '우체국과 함께하는 계좌개설 이벤트'를 진행한다고 28일 밝혔다.이번 이벤트는 우체국 고객이 교보증권 신규계좌를 개설할 경우 모바일상품권(5000원)을 선착순 200명에게 증정하며 은행연계 계좌로 100만원 이상 MTS 거래하면 모바일상품권(5000원)을 선착순 500명에게 추가로 지급한다.또한 은행연계 고객은 업계 최저 수준인 0.014% 주식거래 수수료를 적용, 30일 이내 4.95%의 저렴한 신용융자 이자율을 이용할 수 있으며 은행연계 계좌 개설 후 입금액에 따라 상품권을 받을 수 있다.김종민 교보증권 온라인영업팀장은 ""우체국과 제휴 이벤트를 통해 많은 고객들이 저렴한 수수료로 주식거래도 하고 상품권 혜택을 누리길 바란다""며 ""지난 6월에 출시한 '선택수수료 창조1호서비스' 이용기간 및 수수료가 변경돼 많은 고객들이 쉽고 편리하게 이용할 수 있게 됐다""고 말했다."
592755,"[백세금융] 고금리 시대, 금융소비자 권리 '개인신용평가대응권'",장민태 기자,2023.02.10 10:47:30,"[프라임경제] 금융소비자는 대출받을 때 은행 신용평가에 대해 이의를 제기할 수 있습니다. 금융소비자 권리 중 하나인 '개인신용평가대응권'이 있기 때문인데요. 이의를 제기해 대출 금리와 한도를 뒤바꿀 수 있음에도 이를 모르는 금융소비자가 많습니다.은행은 대출을 실행할 때 신용정보회사 신용점수 외에도 자체적으로 금융소비자에 대한 신용평가를 진행합니다. 이를 통해 은행은 적용할 대출 금리와 한도 등을 정하죠. 금융소비자는 이렇게 정해진 금리·한도가 납득할 수 없을 경우 개인신용평가대응권을 사용할 수 있습니다.금융소비자는 은행 신용평가에 대해 설명요청과 이의제기를 할 수 있다. ⓒ 연합뉴스개인신용평가대응권은 지난 2020년 8월 도입된 제도입니다. 덕분에 금융소비자가 은행 등을 상대로 신용평가 결과에 대한 설명을 요구하고 이의를 제기할 수 있게 됐죠. 개인신용평가대응권은 신용정보법 제36조3항에서 권리로 명시하고 있습니다.금융소비자는 신용정보업감독규정에 따라 신용평가 결과와 △신용거래 능력 판단정보 △신용도 판단정보 △거래내역 판단정보 등의 설명을 요구할 수 있습니다. 평가에 이용된 정보가 부정확하거나 최신이 아니라고 판단될 경우 정정 및 재산출을 요청할 수 있죠.하지만 이러한 권리를 아는 이들이 드물죠. 결국 금융당국이 개인신용평가대응권 알리기에 나섰습니다. 금융감독원이 지난달 16일 은행연합회와 함께 은행 대출상품설명서를 개정하기로 했습니다. 개정에 따라 은행은 대출계약을 체결하려는 모든 금융소비자에게 개인신용평가대응권을 알려야 합니다.이미 대출받은 금융소비자는 은행 영업점을 방문해 개인신용평가대응권을 행사할 수 있습니다. 영업점이 존재하지 않는 인터넷전문은행의 경우 고객센터를 통해 접수할 수 있죠. 금융감독원에 따르면 향후 은행 홈페이지·모바일 애플리케이션 등에서도 개인신용평가대응권 행사가 가능해질 예정입니다.다만 모든 금융소비자 요구가 받아들여지는 것은 아닙니다. 은행은 △정당한 사유 없이 3회 이상 대응권을 행사할 경우 △상거래관계 설정·유지가 곤란한 경우 △정정·삭제 요청받은 내용이 사실과 다른 경우 등에 한해 금융소비자 요구를 거절할 수 있습니다.특히 은행에 금리 인하를 요구할 대출자는 먼저 개인신용평가대응권을 사용하면 좋습니다. 금리인하요구권은 대출자의 신용상태가 개선됐을 경우에 받아들여지기 때문입니다. 개인신용평가대응권을 이용해 신용상태를 개선한 뒤 금리 인하를 요구하면, 은행에서 받아들일 확률이 높다는 게 금융권의 중론입니다.이런 의견에 처참한 금리인하요구권 수용률이 힘을 실어줍니다. 금융위원회에 따르면 금리인하요구권 신청건수는 지난해 상반기 119만1000건입니다. 이는 지난 2019년(75만4000건)에 비해 대폭 늘어난 수준이죠. 반면 이에 대한 수용률은 2019년 48.6%에서 지난해 상반기 28.8%로 쪼그라들었습니다.이에 따라 금융위원회가 지난 9일 금리인하요구권 실효성 제고방안을 마련해 발표했습니다. 하지만 방안은 대상·거절사유 등의 안내를 강화하는 것에 초점이 맞춰져 있을 뿐 은행의 수용기준은 그대로 유지되고 있습니다. 결국 신용상태 개선이 선행돼야 금리인하요구권을 이용할 수 있다는 점은 변함없죠.시중은행 관계자는 ""신용평가 기준은 내부기준이기 때문에 은행마다 다른데, 외부기관의 신용점수만 믿고 금리인하를 요구할 경우 낭패를 볼 수 있다""며 ""직접 거래한 은행에 신용평가 설명을 요구하고 잘못 이용된 정보는 수정해 금리 인하를 신청하는 게 좋다""고 조언했습니다.올해도 주요국 중앙은행들이 물가 잡기 위한 기준금리 인상을 예고했습니다. 이에 따라 금융소비자 금리부담은 더욱 늘어날 전망이죠. 개인신용평가대응권과 금리인하요구권 등 주어진 권리를 활용해보는 것이 중요해진 한해입니다."
